株式会社日本キャスト,WEBエンジニア 年間休日120日以上／メーカー直請け／受託案件増加中,東京都 千代田区,年収381万円～531万円,2日前,リクルートエージェント
株式会社バイタリフィ,WEBエンジニア,東京都 渋谷区 恵比寿駅 徒歩5分,年収250万円～400万円,公開していません,キャリコネ転職
株式会社アローズ・システムズ,WEBエンジニア～楽天・ぐるなび等のtoC案件に参画／平均残業7h・年間休日126日～,東京都,年収300万円～550万円,公開していません,doda
株式会社ROI,在宅勤務可／Webエンジニア／会員120万人を誇る自社サービスファンくる,東京都 千代田区 飯田橋駅,年収700万円～900万円,公開していません,doda
株式会社エニグモ,言語不問Webエンジニア:自社サービス「BUYMA」の開発エンジニア,東京都,年収400万円～600万円,公開していません,Spring転職エージェント
株式会社トリプルアイズ,web開発エンジニア,東京都 千代田区,年収350万円～500万円,公開していません,doda
株式会社bloom,Webデザイン／Webデザイナー、インフラエンジニア／ネットワークエンジニア・運用,東京都 新宿区 新宿駅,月給20万円～50万円,公開していません,バイトル
株式会社フィーリスト,Webエンジニア@東京勤務,東京都 千代田区 秋葉原駅 徒歩5分,年収370万円～600万円,2日前,Green
株式会社tenkai,Webエンジニア,東京都 台東区 浅草橋駅,年収385万円～630万円,公開していません,doda
株式会社イーヴン,Webエンジニア,東京都,年収280万円～490万円,公開していません,TalentHub
株式会社オンマックス,Webアプリケーションエンジニア,東京都 板橋区 板橋駅 徒歩5分,年収350万円～650万円,19日前,Green
株式会社ウエディングパーク,Webエンジニア 婚約・結婚指輪のクチコミ情報サイト「Ringraph」,東京都 港区 表参道駅,年収408万円～708万円,11日前,doda
ライフスタイルアクセント株式会社,WEBエンジニア メイドインジャパン専門の工場直販EC「Factelier」／自社開発,東京都 港区 新橋駅,年収400万円～600万円,1日前,doda
株式会社SEI CORPORATION,制御・組み込み系システムエンジニア／Web／IT,東京都 渋谷区 渋谷駅                                                                                                                                                                その他 (43),月給30万円～,3日前,バイトルPRO
株式会社ルーシッドテック,Webサービス系エンジニア・プログラマ,東京都 渋谷区                                                                                                                                                                その他 (15),年収400万円～600万円,3日前,株式会社ルーシッドテック
ミュージックセキュリティーズ株式会社,Webエンジニア／自社開発 社会課題解決・投資型クラウドファンディング運営のFinTech企業,東京都 港区 広尾駅 徒歩3分,"月給41万6,700円～",12日前,en ミドルの転職
株式会社LIFULL senior,Webエンジニア,東京都 千代田区 半蔵門駅,年収460万円～700万円,25日前,doda
株式会社スタジオーネ63,WEBエンジニア 年収400万～ カーディーラーサイトを中心に担当,東京都 江東区 潮見駅 徒歩1分,年収400万円～,20日前,マイナビ転職エージェントサーチ
CCCマーケティング株式会社,Webエンジニア,東京都 渋谷区,年収500万円～800万円,公開していません,paiza転職
株式会社DAP,Webエンジニア フロントエンド／バックエンド／サーバーサイド,東京都 新宿区 新宿駅,年収480万円～800万円,7日前,Green
webshop株式会社,経験を活かして活躍できるWEBエンジニア,東京都 東村山市 秋津駅 徒歩2分,月給20万円～,公開していません,U29JOB
株式会社ドリームキャリア,システムエンジニア／Webエンジニア,東京都 渋谷区,公開していません,公開していません,マイナビAGENT
ペイトナー株式会社,Webエンジニア,東京都 港区 赤羽橋駅 徒歩5分,年収500万円～800万円,16日前,Green
ワイズアンドパートナーズ・ジャパン株式会社,Webエンジニア,東京都 千代田区 内幸町駅 徒歩6分,公開していません,公開していません,Green
株式会社grabss,三軒茶屋 Webエンジニア／リーダー 100%自社内開発!／フルフレックス,東京都 世田谷区,年収504万円～800万円,10日前,リクルートエージェント
株式会社DRIVE LINE,WEBエンジニア 未経験から6ヶ月のカリキュラムでプロのエンジニアに,東京都 足立区                                                                                                                                                                その他 (31),"月給20万5,500円～",26日前,株式会社DRIVE LINE
手間いらず株式会社,自社SaaSサービス「TEMAIRAZU」のWebエンジニア,東京都 渋谷区 恵比寿駅 徒歩5分,年収450万円～600万円,12日前,en ミドルの転職
株式会社エムティーアイ,WEBエンジニア,東京都 渋谷区 初台駅,年収450万円～600万円,公開していません,doda
株式会社ルックアップ,Webエンジニア 穏やかにコツコツと。 よりも誰とやるか!を大切にしています,東京都 台東区,年収360万円～720万円,4日前,ふれツリ求人なび
株式会社ナターシャ,Webエンジニア,東京都 渋谷区 原宿駅 徒歩7分,年収400万円～600万円,12時間前,Green
バヅクリ株式会社,WEBエンジニア,東京都 港区 外苑前駅 徒歩4分,年収450万円～950万円,1日前,Green
株式会社オープングルーヴ,Webアプリケーションエンジニア,東京都 千代田区 秋葉原駅,年収350万円～700万円,5日前,Green
株式会社リクルート,WEBエンジニア,東京都 品川区 目黒駅 徒歩3分,"年収659万円～1,095万円",公開していません,U29JOB
株式会社ギガ,Web系ソフト開発エンジニア,東京都 世田谷区,年収250万円～500万円,公開していません,キャリコネ転職
株式会社分析屋,Webエンジニア スクール出身者歓迎／実務未経験可／研修充実／東証一部上場企業グループ,東京都,年収216万円～500万円,6日前,キャリフレ
株式会社Pacing,PHPから始めるWEBエンジニア,東京都 あきる野市                                                                                                                                                                その他 (303),月給23万円～80万円,13日前,株式会社Pacing
株式会社サービシンク,Webエンジニア,東京都 新宿区 新宿御苑前駅 徒歩5分,年収300万円～350万円,公開していません,paiza転職
株式会社ネクステージ,東京 Webエンジニア 積極採用 裁量権大 残業月平均20時間,東京都 中央区,年収450万円～600万円,12日前,リクルートエージェント
楽天グループ株式会社,楽天市場店舗様向けサービス／データ分析管理システム:Webアプリケーションエンジニア,東京都 世田谷区,"年収500万円～1,000万円",3時間前,マイナビAGENT
テモナ株式会社,Webエンジニア／SaaSプロダクト,東京都 渋谷区 渋谷駅,年収400万円～500万円,公開していません,Geekly
株式会社センシンロボティクス,Webアプリケーションエンジニア ドローン・ロボット,東京都 渋谷区,年収500万円～900万円,13日前,株式会社センシンロボティクス
株式会社ミツモア,Webエンジニア,東京都 中央区 東銀座駅 徒歩5分,年収500万円～900万円,公開していません,paiza転職
株式会社こだわり,Web開発エンジニア～直請け比率80%／昨年比150%成長／スキルアップを叶えたい方へ／リモート可～,東京都 品川区 目黒駅,年収360万円～780万円,公開していません,doda
株式会社メディカルフロンティア,WEBアプリケーションエンジニア,東京都 港区 御成門駅 徒歩4分,年収400万円～600万円,4日前,paiza転職
株式会社GROW,Webエンジニア 少人数制、個人のペースで学べます／実務を経験してからデビュー!／年120日休み,東京都 渋谷区 渋谷駅 徒歩3分,月給20万円～,公開していません,エン転職
株式会社ゼネテック,WEBアプリエンジニア,東京都,年収500万円～649万円,公開していません,U29JOB
MiddleField株式会社,WEBフロントエンド開発エンジニア,東京都 世田谷区,公開していません,公開していません,TalentHub
株式会社モード・プランニング・ジャパン,web開発エンジニア,東京都 中央区 築地市場駅 徒歩3分,年収400万円～600万円,公開していません,U29JOB
株式会社イントロダクション,Web・オープン系システムエンジニア／通信・インターネット・ソフトウェア,東京都 墨田区 押上駅 徒歩5分,"月給25万1,200円～43万7,400円",公開していません,バイトルPRO
FacePeer株式会社,Webアプリケーションエンジニア,東京都 港区,年収350万円～900万円,公開していません,マイナビAGENT
ジェミー株式会社,WEBエンジニア,東京都 世田谷区 用賀駅 徒歩7分,年収450万円～660万円,公開していません,U29JOB
東京カメラ部株式会社,Webエンジニア,東京都 渋谷区 明治神宮前駅 徒歩1分,年収600万円～,公開していません,paiza転職
株式会社テクノコア,Webエンジニア、DBスペシャリストを目指したい方におすすめ／教育制度も充実,東京都 中央区,年収400万円～650万円,公開していません,doda
株式会社AppBrew,Webグロースリードエンジニア,東京都 千代田区 水道橋駅 徒歩2分,"年収720万円～1,440万円",24日前,U29JOB
Meetscom株式会社,Webエンジニア／スマートフォンアプリエンジニア,東京都 新宿区 神楽坂駅 徒歩3分,年収400万円～,公開していません,paiza転職
株式会社オープンドア,WEB開発エンジニア 自社サービス,東京都 港区 赤坂駅 徒歩4分,年収400万円～600万円,5日前,Green
株式会社スペースマーケット,Webエンジニア,東京都 渋谷区 明治神宮前駅 徒歩5分,年収500万円～750万円,公開していません,U29JOB
株式会社iRup,ポテンシャル採用!0からWEBエンジニアへ,東京都 港区 白金高輪駅 徒歩5分,月給20万円～60万円,公開していません,かんたん応募
KIYOラーニング株式会社,Webエンジニア,東京都 千代田区 溜池山王駅 徒歩2分,年収500万円～800万円,公開していません,U29JOB
株式会社メンバーズ,Webエンジニア／顧客のDX、IT改革支援やシステム開発,東京都 中央区 勝どき駅,"年収500万円～1,000万円",公開していません,doda
株式会社ウチダ人材開発センタ,自社ECサイトWebエンジニア,東京都 江東区 東陽町駅,"時給3,500円～",10日前,株式会社ウチダ人材開発センタ
アクトインディ株式会社,webエンジニア Ruby on Rails経験者 親子お出かけ情報メディア「いこーよ」の開発・運用,東京都 品川区 大崎広小路駅 徒歩6分,年収408万円～700万円,5日前,Green
エボラニ株式会社,Webエンジニア職 ～「LINE」から出資を受けるITベンチャー企業～,神奈川県 横浜市 新横浜駅,年収268万円～396万円,公開していません,doda
株式会社パソナテック,Webアプリ開発エンジニア,東京都 千代田区,年収400万円～800万円,11日前,マイナビAGENT
株式会社Gizumo,Webエンジニア,東京都 渋谷区 渋谷駅,"月給21万1,633円～",4日前,株式会社Gizumo
KURO HOLDINGS株式会社,宮崎／webエンジニア、アプリエンジニア,東京都 港区 六本木駅 徒歩5分,年収350万円～600万円,10時間前,Green
株式会社メガリンク,webエンジニア 100%自社開発／サポート体制／大手ECサイト開発,東京都 港区 表参道駅,年収400万円～720万円,公開していません,doda
JAZYブランディング株式会社,SE／システムエンジニア、Webエンジニア,東京都 千代田区 霞ケ関駅,年収500万円～600万円,25日前,Green
株式会社Blue Star,Web開発エンジニア プライム案件にこだわり!残業10時間以下,東京都 品川区 目黒駅,年収450万円～700万円,公開していません,doda
iYell株式会社,Webエンジニア,東京都 渋谷区 渋谷駅 徒歩5分,年収400万円～,公開していません,paiza転職
株式会社サイバーセキュリティクラウド,Webエンジニア,東京都 品川区 目黒駅,年収500万円～800万円,公開していません,paiza転職
株式会社プロジェクト・モード,Webエンジニア SaaSナレッジ共有ツール「NotePM」／100%自社／基本残業ゼロ,神奈川県 川崎市 新丸子駅,年収350万円～600万円,11日前,doda
株式会社NTTデータ・スマートソーシング,WEBシステムエンジニア 都内勤務・意欲重視・プロジェクトリーダー候補,東京都 江東区 豊洲駅 徒歩1分,年収400万円～750万円,19日前,Green
株式会社ノーマーク,PHPエンジニア／スポーツ×WEBメディア開発,東京都 港区 六本木一丁目駅,年収360万円～600万円,1日前,doda
株式会社Sportip,WEBエンジニア 筑波大発のSaaSベンチャー! フルリモート可,東京都 文京区,"年収600万円～1,000万円",1日前,リクルートエージェント
株式会社エヌ・ティ・ティ・データCCS,PL候補 フルスタックWebエンジニア,東京都 品川区 品川シーサイド駅,年収500万円～800万円,公開していません,doda
株式会社オーパス,プログラマ／AIエンジニア／WEBエンジニア,東京都 新宿区,月給17万円～25万円,公開していません,専門学校の就活 Career Map
株式会社オールアバウト,Webアプリケーションエンジニア／拡大期の新規事業に企画から携わりたいエンジニア募集,東京都 渋谷区 恵比寿駅,年収500万円～800万円,21日前,doda
CREW株式会社,Webアプリケーションエンジニア,東京都 渋谷区,"年収618万1,656円～929万8,200円",8日前,ふれツリ求人なび
スパイダープラス株式会社,Webエンジニア,東京都 港区,"年収450万円～1,200万円",4日前,doda
KY開発,SE Webエンジニア,東京都 板橋区                                                                                                                                                                その他 (6),"時給1,500円～4,000円",10日前,KY開発
株式会社ライナフ,Webエンジニア,東京都 文京区 本郷三丁目駅 徒歩8分,年収400万円～600万円,公開していません,U29JOB
株式会社iimon,WEBエンジニア,東京都 中央区 馬喰横山駅 徒歩3分,年収360万円～500万円,公開していません,Green
MOSAアーキテクト株式会社,Webエンジニア ITコンサルタント候補,東京都 中央区 水天宮前駅 徒歩3分,年収450万円～600万円,2日前,Green
株式会社アソウ・アルファ,Webエンジニア・PG 未経験、第二新卒歓迎! 年休123日,東京都,月給20万円～46万円,10日前,リクナビNEXT
株式会社ookami,webエンジニア,東京都 世田谷区 東松原駅 徒歩5分,年収400万円～650万円,14日前,Green
株式会社RoseauPensant,フロントエンジニア／Webエンジニア,東京都,年収400万円～600万円,公開していません,フォーピープル
丸栄情報システム株式会社,Webエンジニア、ネットワークエンジニア、開発エンジニア、プログラマー,東京都 港区 六本木駅 徒歩0分,年収300万円～720万円,公開していません,Green
株式会社shiftkey,WEBエンジニア,東京都 新宿区 曙橋駅 徒歩1分,年収300万円～500万円,2日前,Green
株式会社クラス,バックエンドエンジニア／Webエンジニア枠,東京都 目黒区,年収400万円～900万円,公開していません,フォーピープル
株式会社TEAMZ,Webアプリ開発エンジニア,東京都 港区,"年収500万円～1,000万円",20日前,マイナビ転職エージェントサーチ
株式会社キッズライン,WEBエンジニア 登録者数12万人以上／日本にベビーシッターの文化を創る,東京都 港区 六本木駅,年収500万円～600万円,1日前,doda
ハンズラボ株式会社,Webアプリケーションエンジニア ～東急ハンズグループ～,東京都 新宿区,年収400万円～600万円,公開していません,doda
株式会社アクセル・モード,Webエンジニア,東京都 中央区 八丁堀駅 徒歩1分,年収400万円～600万円,公開していません,U29JOB
株式会社エコログ,Webエンジニア 社長直下／成長環境／光通信グループ内ベンチャー,東京都 豊島区,年収400万円～700万円,公開していません,リクルートエージェント
株式会社イースト・コースト・ワン,WEB開発エンジニア リモート割合85%・自社開発や組織作りにも関われる,東京都,年収350万円～450万円,公開していません,doda
BASE株式会社,A-1.Pay ID Webアプリケーションエンジニア,東京都 港区 六本木一丁目駅,"年収500万円～1,000万円",1日前,Green
株式会社コウェル,WEBエンジニア ラボ型開発／大手企業と直契約の取引多数／フレックス／土日祝休み,東京都 品川区 天王洲アイル駅,年収450万円～900万円,公開していません,doda
株式会社ピー・アール・オー,WEBエンジニア・スマホアプリエンジニア・インフラエンジニア,神奈川県 横浜市 中区,月給19万円,公開していません,専門学校の就活 Career Map
エンワールド・ジャパン株式会社,在宅勤務メイン!Webエンジニア／時給2500円～,東京都 渋谷区,"時給2,500円～",公開していません,エン派遣
株式会社ワンダーラスト,Webエンジニア／CTO候補,東京都 品川区 五反田駅 徒歩10分,年収500万円～850万円,公開していません,キャリコネ転職
株式会社エボリューションネット,Web・オープン系エンジニア,東京都 新宿区 高田馬場駅 徒歩2分,年収350万円～550万円,5日前,マイベストジョブ
株式会社アスペア,AI、ビッグデータなどに興味のあるWebシステムエンジニア,東京都 港区,年収400万円～700万円,公開していません,TalentHub
株式会社アクシス,Webエンジニア,東京都 渋谷区 渋谷駅 徒歩5分,年収350万円～600万円,公開していません,paiza転職
Grow Group株式会社,Webエンジニア,東京都 品川区,年収450万円～600万円,12日前,Green
サークレイス株式会社,Webアプリケーションエンジニア ～自社プロダクト開発チーム～WLB,東京都 千代田区,年収600万円～800万円,15日前,リクルートエージェント
株式会社HHUUDD,未経験から始めるWebエンジニア リモートワークあり／新しい制度も増加中,東京都 千代田区 秋葉原駅 徒歩3分,月給18万円～,公開していません,エン転職
Supership株式会社 ～KDDIグループ～,Webアプリケーションエンジニア／自社広告関連システムなどの開発,東京都 港区 虎ノ門ヒルズ駅,年収500万円～900万円,公開していません,doda
株式会社ジークス,WEBシステムエンジニア,東京都 千代田区 神保町駅 徒歩5分,年収400万円～600万円,公開していません,paiza転職
株式会社サンマリエ,Webエンジニア,東京都 渋谷区 初台駅 徒歩1分,年収450万円～700万円,6時間前,paiza転職
株式会社Y's,Webエンジニア 未経験OK 同期と一緒にスタート 入社前のチュートリアルあり,東京都 新宿区 新宿御苑前駅 徒歩1分,月給25万円,4日前,女の転職type
オルビット株式会社,Web開発エンジニア 企業安定性／定年／役職定年無で長期勤務OK／現年収考慮,東京都,年収500万円～650万円,公開していません,リクルートエージェント
株式会社ドリームホップ,WEBエンジニア,東京都 千代田区 飯田橋駅 徒歩5分,"月給28万5,000円～",18日前,U29JOB
株式会社カイユウ,Webエンジニア,東京都 渋谷区 渋谷駅 徒歩1分,年収400万円～600万円,公開していません,paiza転職
バークリー・ジャパン株式会社,Webサービスエンジニア,東京都 新宿区 新宿三丁目駅 徒歩8分,年収400万円～600万円,公開していません,paiza転職
表示灯株式会社,広告制作会社でWEBエンジニアの求人 年収400万～,東京都 港区 表参道駅 徒歩5分,年収400万円～,20日前,マイナビ転職エージェントサーチ
セカイエ株式会社,Webエンジニア～完全内製の自社サービスサイト～,東京都 港区 赤羽橋駅,年収350万円～700万円,公開していません,doda
株式会社プレート,Webエンジニア WordPressのプロ集団 言語や技術の縛りが少ない自由な開発環境 リモート可,東京都 中央区,年収360万円～600万円,3日前,doda
freee株式会社,Webアプリケーションエンジニア,東京都 品川区,"年収400万円～1,000万円",公開していません,TalentHub
株式会社Live2D,Webエンジニア nizima担当,東京都 新宿区 新宿御苑前駅 徒歩1分,公開していません,11時間前,Green
株式会社Ansel Technologies,SE 実践カリキュラムが特徴です!WEBエンジニア,東京都 渋谷区,月給20万円～60万円,1日前,株式会社Ansel Technologies
アイムファクトリー株式会社,自社WEBサービス・開発エンジニア募集,東京都 千代田区 麹町駅,年収500万円～750万円,5日前,Green
株式会社SmartHR,ウェブアプリケーションエンジニア,東京都,"年収500万円～1,000万円",公開していません,Spring転職エージェント
jinjer株式会社,Webアプリケーションエンジニア～バックオフィス業務自社サービス「jinjer」～,東京都 新宿区,年収400万円～800万円,29日前,doda
株式会社アジアピクチャーズエンタテインメント,Webエンジニア,東京都 港区 田町駅 徒歩4分,"年収420万円～1,000万円",9日前,Green
株式会社オープントーン,フルスタックエンジニア 候補 Webエンジニアとして幅広い技術を身につけてサービス開発エンジニアへ,東京都 千代田区 秋葉原駅 徒歩4分,年収400万円～700万円,1日前,Green
株式会社イング,WEBエンジニア~Shopifyを利用し大手クライアントをEC化～,東京都,年収350万円～600万円,14日前,doda
株式会社USEN Media,Webエンジニアマネージャー,東京都,年収500万円～800万円,公開していません,Spring転職エージェント
SBIホールディングス株式会社,WEBエンジニア,東京都 港区,年収400万円～480万円,20日前,doda
株式会社コーボー,Webエンジニア ECサイト開発／C#、NET Framework、SQL,東京都 渋谷区 恵比寿駅 徒歩5分,年収400万円～720万円,10日前,Green
株式会社エヌリンクス,自社サービス開発か自社システム開発か選べるWebエンジニア,東京都 豊島区 池袋駅 徒歩5分,年収400万円～700万円,4時間前,マイナビ転職エージェントサーチ
シーサー株式会社,WEBエンジニア 急募!／自社オンラインサロンプラットフォーム／フルリモート,東京都 千代田区,年収500万円～800万円,2日前,リクルートエージェント
株式会社ミンカブ・ジ・インフォノイド,Webアプリケーションエンジニア 自社サービス「MINKABU」／リモート可,東京都 千代田区 神保町駅,"年収450万円～1,000万円",29日前,doda
株式会社アクシスウェア,Webアプリエンジニア プライム案件9割!月残業平均20hでライフワークバランス,東京都,年収364万円～600万円,6日前,キャリフレ
株式会社アイスタイル,Webエンジニア 日本最大のコスメ・美容の総合サイト、@cosmeの開発,東京都 港区,年収500万円～700万円,1日前,リクルートエージェント
株式会社アベイル,WEBエンジニア 自社開発 アパレル業界向けサービス開発 残業3H程度 在宅勤務可,神奈川県 横浜市 センター南駅,年収420万円～600万円,公開していません,doda
ビットキャッシュ株式会社,Webアプリケーションエンジニア 電子マネー事業のリーディングカンパニー／働きやすさ,東京都 港区 虎ノ門駅,年収600万円～800万円,11日前,doda
NRIネットコム株式会社,Web系システムエンジニア／幅広い業種の顧客を支援,東京都 港区 新橋駅,年収500万円～700万円,21日前,doda
サインポストオフィス株式会社,WEBエンジニア,東京都,"月給22万5,000円～",18日前,U29JOB
