株式会社コアコンセプト・テクノロジー,HG Webエンジニア／テックリード フルフレックス／リモート／21年マザーズ上場,東京都 豊島区,"年収800万円～1,500万円",1日前,リクルートエージェント
株式会社E-Grant,自社WEBサービスエンジニア,東京都 品川区 五反田駅,年収400万円～700万円,公開していません,doda
DXHR株式会社,Webエンジニア／全国・フルリモート,東京都 中央区 小伝馬町駅 徒歩3分,年収500万円～650万円,6日前,Green
株式会社ヘルスベイシス,「経験者歓迎／フリーランス」フロントエンドエンジニア Webアプリケーション開発,東京都 中央区 水天宮前駅,月給70万円～90万円,21時間前,かんたん応募
オルターボ株式会社,Webエンジニア,東京都 渋谷区 渋谷駅 徒歩7分,年収560万円～700万円,7日前,type
株式会社TechFirst Leaders,Web開発エンジニア,東京都 千代田区,年収400万円～650万円,公開していません,paiza転職
株式会社クルービット,Webエンジニア,東京都 豊島区,年収450万円～550万円,公開していません,paiza転職
株式会社ナイトレイ,Webエンジニア,東京都 渋谷区 渋谷駅 徒歩10分,年収300万円～600万円,1日前,Green
株式会社クインテット,Webアプリケーションエンジニア,東京都 千代田区 市ケ谷駅 徒歩7分,年収400万円～800万円,公開していません,paiza転職
株式会社ユニエイム,Webアプリエンジニア,東京都 港区 白金高輪駅,年収450万円～750万円,2日前,Green
株式会社コーテッグ,Webエンジニア,東京都 文京区 湯島駅 徒歩3分,年収360万円～600万円,公開していません,paiza転職
株式会社ジソーズ,未経験からの挑戦大歓迎 Webエンジニア・社内システム開発,東京都 品川区 五反田駅 徒歩8分,月給23万880円～,19日前,リクナビNEXT
株式会社ヘッドジャパン,webエンジニア,東京都 新宿区,"月給17万9,375円～",公開していません,専門学校の就活 Career Map
株式会社ピーエスシー,Web開発エンジニア ～自社サービス「Coo Kai」／月平均残業10時間～,東京都 港区 御成門駅,年収360万円～600万円,7日前,doda
株式会社Link Sports,Webエンジニア／スポーツ×ITの自社サービス,東京都 千代田区 神保町駅,年収500万円～700万円,公開していません,Geekly
株式会社IIJプロテック,Webエンジニア AWS環境でのLinuxサーバエンジニア,東京都 千代田区 飯田橋駅 徒歩1分,年収500万円～800万円,17日前,Green
株式会社法学館,自社内Webエンジニア,東京都 渋谷区 渋谷駅 徒歩5分,月給25万円～35万円,公開していません,doda
アイ・ティ・リアライズ株式会社,Webエンジニア 就業環境良好・平均残業20h,東京都 品川区 五反田駅,年収400万円～700万円,18日前,doda
株式会社おてつだいネットワークス,Webエンジニア 新規事業に注力!アプリ開発や新規開発に興味があるエンジニア,東京都 品川区,年収400万円～600万円,公開していません,TalentHub
株式会社ADWIN,WEBエンジニア 大手企業と直接関わる案件多数／転動なし／年間休日120日以上／土日祝休み,東京都,年収300万円～550万円,6日前,キャリフレ
ユアマイスター株式会社,Webエンジニア シニア,東京都 世田谷区 三軒茶屋駅,"年収600万円～1,440万円",3日前,Green
株式会社オズビジョン,Webエンジニア,東京都 千代田区,年収510万円～600万円,7日前,paiza転職
バリューアークコンサルティング株式会社,"Java,大手派遣系サービスWebエンジニア",東京都 千代田区,月給60万円～80万円,3日前,バリューアークコンサルティング株式会社
株式会社ワークポート,株式会社カカクコム／WEBエンジニア／403251825,東京都 品川区 大崎駅 徒歩5分,年収473万円～600万円,5日前,Find Job!
SCSK Minoriソリューションズ株式会社,Web系エンジニア,東京都 江東区 豊洲駅,年収400万円～650万円,公開していません,doda
株式会社メディアドゥ,シニアWebエンジニア,東京都 千代田区,年収500万円～800万円,25日前,paiza転職
株式会社曙題工業 KKS Staffing Se...,Web系エンジニア,神奈川県 横浜市 中区,年収350万円～600万円,19時間前,Workin.jp
株式会社ルーター,WEBエンジニア,東京都 渋谷区 参宮橋駅 徒歩6分,"月給27万5,000円～",25日前,U29JOB
株式会社エイシル,WEB・オープン系エンジニア,東京都,年収300万円～500万円,公開していません,キャリコネ転職
株式会社CaSy,webエンジニア,東京都 品川区 目黒駅,年収600万円～750万円,6日前,paiza転職
レバレジーズ株式会社,Webエンジニア,東京都 渋谷区 渋谷駅,年収450万円～700万円,13日前,paiza転職
朝日インタラクティブ株式会社,Webエンジニア／朝日新聞社グループ,東京都 千代田区 神保町駅,年収400万円～600万円,公開していません,Geekly
株式会社CyberKnot,Webエンジニア,東京都 港区 白金高輪駅 徒歩10分,年収400万円～500万円,公開していません,paiza転職
Tres Innovation株式会社,組み込み Webエンジニア 副業／リモート・在宅OK,東京都 世田谷区 池尻大橋駅 徒歩8分,年収400万円～700万円,1日前,Green
株式会社アライバルクオリティー,WEBエンジニア,東京都 渋谷区 代官山駅 徒歩3分,年収300万円～744万円,20日前,U29JOB
株式会社フェーズワン,WEBアプリエンジニア,東京都 文京区 湯島駅 徒歩1分,年収300万円～650万円,公開していません,キャリコネ転職
株式会社駅探,システムエンジニア／Webアプリケーション・スマホアプリの開発,東京都 新宿区 四ツ谷駅 徒歩3分,年収600万円～,公開していません,キャリコネ転職
株式会社AGEST,Webエンジニア,東京都 渋谷区 初台駅 徒歩1分,年収500万円～800万円,公開していません,paiza転職
株式会社オリゾ,フロントエンドエンジニア／WEB広告代理店 残業15H／有給45%／年休122日,東京都 新宿区,年収400万円～800万円,5日前,リクルートエージェント
株式会社マリノ,WEBエンジニア~圧倒的働きやすさ・年間20%残業時間削減～,神奈川県 横浜市 港北区,年収400万円～600万円,公開していません,doda
株式会社フィジオ,Webエンジニア PG,東京都 新宿区 新宿駅 徒歩8分,年収300万円～480万円,11時間前,Green
株式会社SKPromotion,WEBデザイナー／WEBエンジニア 未経験からチャレンジ 好きなことを仕事に,東京都 新宿区 早稲田駅 徒歩2分,月給20万円～50万円,公開していません,かんたん応募
monoAI technology株式会社,リモートワークOK! WEBフロントエンドエンジニア募集中!,東京都 新宿区 新宿御苑前駅 徒歩1分,年収400万円～750万円,24日前,Green
株式会社アッカ・インターナショナル,バックエンドエンジニア／Webエンジニア枠,東京都 港区,年収450万円～,公開していません,フォーピープル
株式会社Eco‐Pork,WEBエンジニア／リーダー候補,東京都 墨田区,年収700万円～900万円,公開していません,doda
株式会社エーム,Webオープン系エンジニア,東京都 豊島区 池袋駅 徒歩5分,年収400万円～,公開していません,paiza転職
株式会社インター・ベル,WEBエンジニア／プログラマーとその他付帯業務,東京都 港区 表参道駅,"年収400万円～1,200万円",20日前,株式会社インター・ベル
レプラホーン株式会社,Web開発エンジニア,東京都,"月給33万3,333円～",26日前,U29JOB
ネクスジェン株式会社,テックリード候補webアプリエンジニア～画像AIを用いた医療革命／日本有数の人材が集結,東京都 品川区 目黒駅,"年収780万円～1,200万円",公開していません,doda
株式会社アイビス,スマホ、Webエンジニア 2億DLのお絵かきアプリ「ibisPaint」をリリース／IPO目前,東京都 中央区 八丁堀駅 徒歩2分,月給30万円～50万円,25日前,エン転職
株式会社ミラボ,Webエンジニア／リーダー候補,東京都 千代田区 御茶ノ水駅,"年収650万円～1,000万円",11日前,doda
株式会社viviON,Webエンジニア エンタメに関わる自社サービスの開発,東京都 千代田区,年収420万円～750万円,4日前,リクルートエージェント
株式会社mofmof,0-1フェーズの開発経験を積みたいWebエンジニア Railsエンジニア,東京都 渋谷区 渋谷駅 徒歩5分,年収450万円～700万円,4日前,Green
株式会社バート,WEBエンジニア 在宅勤務可／残業10h／SAP支援／JASDAQ上場企業のグループ会社,東京都,年収350万円～480万円,25日前,doda
アイ・モバイル株式会社,WEBエンジニア,東京都 港区 外苑前駅 徒歩5分,年収312万円～390万円,17日前,Green
株式会社おいしい健康,Webエンジニア,東京都 中央区 人形町駅 徒歩5分,"月給29万2,000円～66万7,000円",公開していません,U29JOB
株式会社フォトラクション,Webアプリケーションエンジニア／建設業向け生産支援SaaSサービス,東京都 中央区,年収700万円～900万円,公開していません,doda
株式会社エムフロ,Webエンジニア 自社サービスの機能開発・改修,東京都 渋谷区 代官山駅 徒歩6分,年収600万円～780万円,10日前,Green
株式会社GSI,Webアプリケーション開発エンジニア,東京都 新宿区 新宿駅 徒歩10分,年収400万円～700万円,13日前,paiza転職
株式会社TakeFunSystem,Web開発エンジニア,東京都 新宿区 新宿西口駅 徒歩1分,年収600万円～,公開していません,paiza転職
株式会社マインドクオリア,Webエンジニア,東京都 渋谷区,"年収240万円～1,200万円",公開していません,株式会社マインドクオリア
株式会社レバレッジ,Webアプリエンジニア パーソナル業界特化のメディア事業やマッスルブランドを展開,東京都 渋谷区,年収400万円～700万円,18日前,doda
株式会社ミライプロジェクト,Webエンジニア,東京都 渋谷区,公開していません,公開していません,株式会社ミライプロジェクト
ピクスタ株式会社,「fotowa」Webアプリケーションエンジニア,東京都 渋谷区 渋谷駅 徒歩10分,年収500万円～650万円,1日前,Green
ニフティ株式会社,Webアプリケーションエンジニア／顧客基盤システム,東京都 新宿区 西新宿駅,年収470万円～900万円,公開していません,doda
株式会社ネクソン,Webアプリケーションエンジニア～世界中のユーザーへ高品質なゲーム提供企業／フレックス～,東京都 港区 六本木一丁目駅,年収400万円～500万円,1日前,doda
株式会社アビリブ,Webアプリエンジニア,東京都 渋谷区 明治神宮前駅,年収585万円～780万円,7日前,doda
株式会社メガ,Webエンジニア,東京都 渋谷区,年収400万円～700万円,公開していません,paiza転職
SOMPOシステムズ株式会社,WEBアプリケーションエンジニア,東京都 立川市 立川駅,年収441万円～746万円,公開していません,doda
日産自動車株式会社,WEBエンジニア,東京都 目黒区,年収400万円～800万円,12日前,ワークポート
株式会社ティビィシィ・スキヤツト,Webエンジニア,東京都 中央区 三越前駅,年収400万円～800万円,公開していません,doda
VoicePing株式会社,Webアプリ開発エンジニア,東京都 港区 竹芝駅 徒歩2分,年収450万円～650万円,公開していません,paiza転職
株式会社ミスミ,Webエンジニア,東京都 千代田区 飯田橋駅,年収500万円～700万円,公開していません,doda
株式会社SPEC,Webエンジニア,東京都 千代田区,年収400万円～600万円,公開していません,paiza転職
株式会社イクシス,WEBエンジニア,神奈川県 川崎市 新川崎駅,年収400万円～600万円,2日前,doda
株式会社ラクーンホールディングス,自社サービスWEBエンジニア,東京都 中央区 水天宮前駅 徒歩3分,年収412万円～600万円,公開していません,paiza転職
株式会社フリークアウト,Webアプリケーションエンジニア,東京都 港区 六本木駅,"年収600万円～1,000万円",18日前,doda
Nota株式会社,自社FAQシステムのWebアプリケーションエンジニア,東京都 港区 新橋駅,"年収600万円～1,000万円",公開していません,doda
レッドフォース・グループ株式会社,Webオープン系エンジニア,東京都 港区,年収350万円～750万円,9時間前,レッドフォース・グループ株式会社
株式会社ハウテレビジョン,Webエンジニア,東京都 港区 六本木一丁目駅,年収400万円～800万円,14日前,doda
株式会社博報堂,Webアプリケーションエンジニア,東京都 港区,公開していません,公開していません,type 転職エージェント
株式会社サイバーエージェント,Webフロントエンドエンジニア,東京都 渋谷区 渋谷駅,"年収450万円～1,000万円",公開していません,doda
株式会社マックスマウス,フロントエンドエンジニア／Webエンジニア,東京都 港区 赤坂見附駅,年収435万円～700万円,7日前,doda
株式会社カカクコム,Webエンジニア ～国内最大級の購買支援サイト「価格.com」～,東京都 渋谷区 渋谷駅,年収500万円～750万円,21日前,doda
株式会社LOWCAL,Webアプリ開発エンジニア PL・PM候補,東京都 渋谷区 恵比寿駅 徒歩3分,年収420万円～800万円,3日前,株式会社LOWCAL
ノイン株式会社,Webフロントエンドエンジニア 大型資金調達済 業界注目度トップクラス すごいベンチャー100,東京都 渋谷区,年収500万円～700万円,公開していません,マイナビAGENT
株式会社アイオーティー,SE 未経験・独学歓迎!プログラミングができるWEBデザイナーを目指しませんか,東京都 渋谷区,年収240万円～720万円,公開していません,株式会社アイオーティー
アクセルユニバース株式会社,Webアプリケーションエンジニア／最新アーキテクチャを積極採用／フルリモート可,東京都,"年収500万円～1,049万円",7日前,en ミドルの転職
株式会社フェニシス,東京勤務 アニメ・ゲーム・おもちゃPRサイトのWebエンジニア／リーダー候補,東京都 中央区 東日本橋駅,年収420万円～700万円,4日前,Green
株式会社CARTA HOLDINGS,Webアプリケーションエンジニア,東京都 渋谷区 渋谷駅,年収500万円～800万円,公開していません,doda
株式会社ケーエムケーワールド,Web・オープン系エンジニア 1言語開発経験者OK 年間休日123日+Refresh休暇5日,東京都 中央区,年収336万円～600万円,公開していません,TalentHub
Sansan株式会社,WEBアプリ開発エンジニア 東証プライム上場 リモート勤務 自社勤務,東京都 港区 表参道駅 徒歩4分,"年収600万円～1,100万円",19日前,エン エージェント
株式会社グロトム,未経験OK!充実の社内研修でWebエンジニアへ,東京都 渋谷区 渋谷駅 徒歩3分,月給20万円～40万円,4日前,株式会社グロトム
スローガン株式会社,webエンジニア,東京都 港区 青山一丁目駅,年収500万円～700万円,11日前,doda
株式会社LIFULL,Webアプリケーションエンジニア,東京都 千代田区 半蔵門駅 徒歩2分,年収440万円～660万円,18日前,paiza転職
株式会社サンカクカンパニー,Webエンジニア WordPress制作経験者募集／テレワーク・在宅可／東証プライム上場グループ企業,東京都 渋谷区 代々木駅 徒歩6分,月給30万円～60万円,21日前,エン転職
株式会社i-NOS,オープンWeb系開発エンジニア募集,東京都 中央区 三越前駅,年収400万円～600万円,公開していません,doda
株式会社EventHub,Webエンジニア,東京都 千代田区 神田駅,年収550万円～900万円,公開していません,doda
Sasuke Financial Lab株式会社,自社プロダクトのフロントエンジニア／WEB保険で業界変革・完全週休2日制,東京都 千代田区 大手町駅,年収500万円～700万円,公開していません,doda
株式会社ASO,WEBエンジニア 未経験者歓迎,東京都 台東区 御徒町駅 徒歩10分,年収216万円～500万円,12時間前,Green
株式会社identity,フリーランス／要件定義／バックエンド／言語不問／Webアプリケーションエンジニア募集,東京都 港区 青山一丁目駅,月給65万円～75万円,5日前,modis
株式会社top note,0スタートOK!充実な研修でプログラミングを学びWEBエンジニアになりたい方を大募集,東京都 中央区 水天宮前駅,月給20万円～36万円,10日前,株式会社top note
ハイツー株式会社,WEBエンジニア,東京都,"月給33万3,333円～50万円",28日前,U29JOB
株式会社ネグジット総研,Webシステムエンジニア 東京,東京都 世田谷区 下北沢駅 徒歩10分,年収350万円～500万円,7日前,Green
株式会社スマレジ,WEBエンジニア,東京都 渋谷区 恵比寿駅,年収450万円～700万円,25日前,doda
株式会社デイラボ,法人向け自社サイトのwebエンジニア 残業月5h／年休125日,東京都 江東区 亀戸駅,年収500万円～600万円,11日前,doda
株式会社エグゼック,WEBエンジニア,東京都 品川区 目黒駅 徒歩3分,年収320万円～600万円,公開していません,U29JOB
株式会社ジモティー,Webアプリケーションエンジニア Web／開発／エンジニア／Rails,東京都 品川区 五反田駅 徒歩3分,"年収500万円～1,000万円",公開していません,Green
株式会社Tixplus,Webエンジニア,東京都 渋谷区 渋谷駅 徒歩5分,"月給33万3,333円～83万3,333円",公開していません,U29JOB
株式会社スマートチェックアウト,Webエンジニア,東京都 千代田区 大手町駅 徒歩1分,"年収400万円～1,000万円",24日前,U29JOB
株式会社ファンチップ,Webシステム開発エンジニア,東京都,年収500万円～960万円,11日前,Green
株式会社エンジン インキュベーション,ゼロからWebエンジニアを目指す方募集!充実した研修で最短距離でエンジニアデビュー,東京都 渋谷区,月給20万円～,公開していません,株式会社エンジン インキュベーション
業界売上シェア第1位の技術系人材サービス企業,WEBアプリエンジニア,東京都,年収450万円～800万円,公開していません,type 転職エージェント
株式会社スーパーソフトウエア,Webエンジニア,東京都 渋谷区 恵比寿駅,年収500万円～800万円,2日前,doda
Growfit株式会社,Webエンジニア,東京都 中央区 馬喰町駅 徒歩1分,年収400万円～700万円,公開していません,paiza転職
株式会社ブリスウェル,Webシステム開発エンジニア,東京都 港区,年収400万円～600万円,11日前,doda
株式会社ONE WEDGE,Web開発エンジニア,東京都 新宿区 四ツ谷駅 徒歩3分,年収400万円～600万円,8日前,paiza転職
株式会社ジグザグ,Webエンジニア,東京都 渋谷区 渋谷駅,年収500万円～900万円,公開していません,Geekly
NTTセキュリティ・ジャパン株式会社,Webセキュリティエンジニア,東京都 千代田区 秋葉原駅,年収500万円～800万円,公開していません,doda
株式会社テクノロジーズ,WEBアプリケーションエンジニア,東京都 中央区 東日本橋駅,年収550万円～900万円,公開していません,doda
株式会社C&P,WEBエンジニア,東京都 中野区 中野駅 徒歩3分,年収350万円～720万円,18日前,Green
株式会社BONX,シニアウェブバックエンドエンジニア,東京都 渋谷区 渋谷駅,"年収500万円～1,200万円",公開していません,paiza転職
株式会社ネクストスケープ,Web開発エンジニア,東京都 新宿区 都庁前駅,年収375万円～704万円,公開していません,doda
株式会社信興テクノミスト,Webセキュリティ診断エンジニア,東京都 品川区 武蔵小山駅 徒歩11分,年収380万円～550万円,公開していません,U29JOB
株式会社マイクロウェーブ,Webバックエンドエンジニア,東京都 渋谷区 渋谷駅,年収450万円～700万円,公開していません,doda
株式会社イレブンラボ,Webエンジニア,神奈川県 川崎市 京急川崎駅 徒歩1分,年収400万円～480万円,2日前,paiza転職
株式会社もしも,webアプリケーションエンジニア,東京都 品川区 天王洲アイル駅 徒歩7分,年収400万円～800万円,6時間前,paiza転職
株式会社top note 案件により勤務先は異な...,未経験からスタート!WEBデザイナー・WEBエンジニア,東京都 中央区 水天宮前駅,月給20万円～36万円,公開していません,株式会社top note
株式会社コムコシステム,WEB系エンジニア,東京都,年収450万円～640万円,公開していません,doda
株式会社オズ,Web開発エンジニア,東京都 目黒区 中目黒駅 徒歩13分,"月給18万3,333円",公開していません,ジョブアンテナ北海道
株式会社JMDC,WEBエンジニア,東京都 港区 大門駅,年収467万円～902万円,2日前,doda
株式会社ケップル,スタートアップ投資を支援するSaaS「FUNDBOARD」のWebアプリケーションエンジニア,東京都 渋谷区 神泉駅 徒歩5分,"月給33万3,000円～58万3,000円",25日前,エンジニアHubキャリア
コロニー株式会社,デザイナー、WEBエンジニア,東京都 千代田区 有楽町駅,"年収500万円～1,200万円",公開していません,コロニー株式会社
ソニー株式会社,クラウドサービスWEBエンジニア／業務用ディスプレイビジネス事業#SHES069,東京都 品川区 大崎駅,月給25万円～,公開していません,doda
シアトルコンサルティング株式会社,WEBシステムエンジニア／東京,東京都 港区 表参道駅 徒歩7分,年収350万円～700万円,公開していません,キャリコネ転職
ピットデザイン株式会社,Webエンジニア,東京都 千代田区 大手町駅 徒歩1分,年収400万円～720万円,12日前,Green
株式会社Jocy,Webアプリエンジニア／サブスクリプションサービス「MEZON」,東京都 渋谷区,年収500万円～750万円,公開していません,doda
株式会社Roseau Pensant,制作物に命を吹き込むWebエンジニア／有名ブランドや大手企業の自社サイト・ECサイト等,東京都 港区 乃木坂駅,年収400万円～600万円,1日前,doda
株式会社SALTO,WEB開発エンジニア,埼玉県,年収450万円～650万円,公開していません,U29JOB
株式会社ハンモック,Webエンジニア,東京都 新宿区,年収500万円～700万円,公開していません,doda
株式会社イマクリエ,WEBエンジニア／完全在宅,東京都,"時給1,000円",公開していません,株式会社イマクリエ
株式会社メディックメディア,WEBエンジニア,東京都 港区 外苑前駅 徒歩4分,年収600万円～800万円,2日前,Green
VANDDD株式会社,WEBアプリケーション開発エンジニア,東京都 港区 神谷町駅,年収360万円～600万円,11時間前,Green
株式会社タイムデザイン,Webエンジニア／自社サービス 「ツアービルダー」の開発／コロナ渦で業績好調,東京都 渋谷区,年収400万円～600万円,公開していません,doda
東京カレンダー株式会社,WEBエンジニア／リードエンジニア,東京都 品川区 大崎駅 徒歩5分,年収600万円～840万円,16日前,Green
株式会社テンダ,WEB開発エンジニア PHP、Java,東京都 豊島区 池袋駅,年収430万円～650万円,12時間前,Green
ティ・エフ株式会社,未経験歓迎!独自の教育カリキュラムでWebエンジニアに,東京都 渋谷区 恵比寿駅,月給20万円～,13日前,ティ・エフ株式会社
株式会社ゴーガ,Webアプリケーションエンジニア,東京都 渋谷区 渋谷駅 徒歩5分,年収350万円～400万円,公開していません,U29JOB
株式会社アーキベース,WEBエンジニア:266万人が利用するプロダクト／48兆円の巨大市場／モダンな環境,東京都 千代田区,年収500万円～800万円,19日前,リクルートエージェント
株式会社クロス・コミュニケーション,Webエンジニア／SE,東京都 渋谷区 初台駅 徒歩3分,年収400万円～800万円,1日前,Green
SREホールディングス株式会社,Webエンジニア 自社AIシステムの導入～保守／サービス企画から運用まで／ドキュメント作成業務,東京都 港区 外苑前駅,"年収600万円～1,100万円",公開していません,レバテックキャリア
