クラシコ株式会社,webエンジニア リーダー候補／世界が注目する白衣メーカー／5.5億の資金調達済み／リモートワーク可,東京都 港区,年収650万円～950万円,公開していません,doda
株式会社アニマライフ,WEBエンジニア,東京都 新宿区,公開していません,公開していません,マイナビAGENT
株式会社カイテクノロジー,WEBエンジニア,東京都 新宿区 新宿御苑前駅,年収350万円～800万円,公開していません,Geekly
株式会社スピカ,WEBエンジニア,東京都 千代田区 内幸町駅 徒歩1分,"年収600万円～1,000万円",公開していません,paiza転職
リフリード株式会社,webエンジニア,東京都 渋谷区,年収350万円～600万円,公開していません,doda
株式会社SKIYAKI,WEBエンジニア,東京都 渋谷区 渋谷駅,"年収480万円～1,020万円",1日前,doda
株式会社プリンチ,プログラマー WEBエンジニア 第二新卒、独学のみOK,東京都 新宿区,月給20万円,公開していません,株式会社プリンチ
株式会社アイドマ・ホールディングス,webエンジニア、サーバサイドエンジニア,東京都 豊島区 池袋駅,年収350万円～600万円,公開していません,paiza転職
NExT-e Solutions株式会社,Web開発エンジニア,東京都 世田谷区 三軒茶屋駅,年収400万円～650万円,29日前,doda
株式会社ジョブカン会計,C++経験を活かしてwebアプリエンジニアへ／企画フェーズにも参画可,東京都 新宿区,年収420万円～600万円,1日前,doda
Hmcomm株式会社,AI・音声認識を活用した自社商品のWEBエンジニア,東京都 港区 大門駅,年収500万円～700万円,公開していません,doda
Qrio株式会社,webアプリエンジニア,東京都 渋谷区 恵比寿駅 徒歩7分,年収500万円～800万円,3日前,paiza転職
株式会社キャブ,Webエンジニア・フロントエンドエンジニア,東京都 千代田区 麹町駅 徒歩2分,年収400万円～700万円,5日前,Green
株式会社はてな,Webアプリケーションエンジニア マンガビューワの開発／自社内勤務100%,東京都 港区,年収500万円～724万円,8日前,リクルートエージェント
株式会社アクティブ・ワーク,Web開発エンジニア／高い技術力でプライム9割／残業月平均18.3h,東京都 千代田区 岩本町駅,年収500万円～600万円,5日前,doda
株式会社フューチャーショップ,Webアプリケーションエンジニア,東京都 港区,公開していません,公開していません,マイナビAGENT
株式会社ヘッドウォータース,Webアプリ開発エンジニア,東京都 新宿区 新宿三丁目駅,年収300万円～650万円,21日前,doda
株式会社想隆社,Webエンジニア,東京都 千代田区 御茶ノ水駅 徒歩3分,年収450万円～600万円,公開していません,paiza転職
株式会社400F,Webフロントエンドエンジニア ～国内最大級のお金のオンライン相談サービスの運営～,東京都 中央区 茅場町駅,年収600万円～800万円,7日前,doda
株式会社シンクロジック,WEBエンジニア,神奈川県 横浜市 みなとみらい駅,年収300万円～600万円,公開していません,doda
独自のクラウドサービスで成長を続ける東証プライム...,Webアプリケーションエンジニア／01so,東京都 渋谷区,"年収618万1,656円～929万8,200円",11日前,ふれつり転職相談
株式会社コネクティ,Web開発エンジニア 大手企業のWeb戦略パートナー リモートワーク,東京都 新宿区,年収500万円～700万円,1日前,リクルートエージェント
ツクリンク株式会社,"WEBエンジニア／Ruby,PHP,Python,Go",東京都 港区 六本木駅 徒歩6分,年収450万円～650万円,1日前,Green
GNU株式会社,Webエンジニア,東京都 中央区,年収500万円～800万円,公開していません,doda
株式会社アルファポリス,自社サイトのWebエンジニア／月間2億PVの小説漫画投稿サイト／東証グロース市場上場～,東京都 渋谷区 恵比寿駅,年収420万円～630万円,公開していません,doda
株式会社アドベンチャー,WEBフルスタックエンジニア,東京都 渋谷区 渋谷駅 徒歩5分,公開していません,公開していません,マイナビAGENT
株式会社i-Vinci,Webエンジニア・プログラマー,東京都 千代田区 神保町駅 徒歩4分,年収400万円～,10日前,paiza転職
ピクスタ株式会社「グロース市場上場」,Webアプリケーションエンジニア ～出張撮影プラットフォーム「fotowa」～,東京都 渋谷区 渋谷駅,年収500万円～650万円,27日前,doda
株式会社WITS,WEB／オープン系エンジニア,東京都 豊島区 東池袋駅 徒歩6分,月給70万円～80万円,公開していません,株式会社WITS
ディップ株式会社,webエンジニア 自社DXプロダクト「コボット」の開発業務,東京都 渋谷区 渋谷駅,年収400万円～700万円,18日前,doda
株式会社Respawn,Webエンジニア／未経験歓迎!20代～30代活躍中,東京都 世田谷区 駒沢大学駅 徒歩10分,"月給18万2,500円～90万円",公開していません,doda
株式会社マーズフラッグ,Webアプリケーションエンジニア／クラウド型自社Webサービス,東京都 中央区 京橋駅,"年収500万円～1,000万円",公開していません,doda
株式会社MS-Japan,Webエンジニア 東証プライム上場／30年連続黒字&増収増益／リモートワーク可,東京都 千代田区,年収400万円～800万円,公開していません,リクルートエージェント
株式会社ブックウォーカー,Webフロントエンドエンジニア,東京都 千代田区 市ケ谷駅,年収401万円～901万円,公開していません,Geekly
株式会社Relationship Innovat...,Webデザイナー、UIエンジニア,東京都 渋谷区,月給20万円～45万円,13日前,株式会社Relationship Innovation
株式会社アイデアランプ,Webフロントエンジニア IDEA×開発力で顧客体験を設計・開発／リモート可,東京都 渋谷区,年収350万円～600万円,2日前,リクルートエージェント
株式会社クリエイト工房,Webエンジニア 平均2～3年案件多数／月残業10h程／損保会社契約系システム／PHP,東京都 千代田区                                                                                                                                                                その他 (4),年収400万円～500万円,公開していません,doda
KINTOテクノロジーズ株式会社,Webアプリケーションセキュリティエンジニア／脆弱性管理／～自社サービスKINTO～,東京都 港区 新橋駅,"年収490万円～1,300万円",4日前,doda
BUONO株式会社,Webエンジニア,東京都 渋谷区 渋谷駅 徒歩1分,月給25万円～100万円,公開していません,BUONO株式会社
サイトカイン株式会社,Webシステムエンジニア～先進医療の医療のDX開発／年休120日／残業時間20時間以内／土日祝休み～,東京都 渋谷区,年収350万円～500万円,公開していません,doda
株式会社エスティーエーアスト,Web・ゲームエンジニア,東京都 千代田区 秋葉原駅 徒歩2分,月給18万円～,25日前,type
株式会社マインリード クライアント先,実力発揮したい!新規事業を自分でリードしたい!Webエンジニア経験者募集,東京都 江東区 国際展示場駅 徒歩3分,月給32万円～53万円,公開していません,株式会社マインリード
株式会社サクセスストーリー,Webエンジニア,東京都 渋谷区,月給20万円～30万円,2時間前,株式会社サクセスストーリー
アットホーム株式会社,Webエンジニア,東京都 千代田区 内幸町駅,年収400万円～700万円,公開していません,doda
株式会社アイモバイル,Webエンジニア／ふるさと納税ポータルサイト「ふるなび」開発,東京都 渋谷区 渋谷駅,年収500万円～800万円,公開していません,doda
Vリアリゼーション株式会社,WEBエンジニア 分析エンジニア・SE,東京都 港区 青山一丁目駅 徒歩4分,月給18万円～60万円,公開していません,Vリアリゼーション株式会社
株式会社オンラインスクール,Webアプリケーションエンジニア,東京都 千代田区 水道橋駅 徒歩5分,年収450万円～650万円,1日前,Green
株式会社エービーシー・ジャパン,web開発エンジニア 首都圏,東京都 中央区 小伝馬町駅 徒歩1分,年収350万円～750万円,11時間前,Green
株式会社静岡新聞社,Web開発エンジニア～新規事業の立ち上げ業務／リモートワーク相談可能／新しい働き方～,東京都 中央区,年収500万円～800万円,24日前,doda
日本システム技術株式会社,Webアプリケーションエンジニア,東京都 港区 品川駅,年収498万円～658万円,3日前,doda
ビズメイツ株式会社,Webエンジニアリーダー,東京都 千代田区 淡路町駅,年収500万円～700万円,公開していません,doda
インフォサイエンス株式会社,Webアプリケーションエンジニア 即戦力,東京都 港区 田町駅 徒歩7分,年収350万円～420万円,12時間前,Green
株式会社OverTech 東京都 プロジェクトに...,WEBエンジニア、Web・オープンシステム開発運用 給料もらいながら研修できる,東京都 世田谷区 駒沢大学駅 徒歩10分,月給25万円～50万円,公開していません,株式会社OverTech
メディアマックスジャパン株式会社,Webエンジニア,東京都 港区 乃木坂駅,年収400万円～,公開していません,paiza転職
株式会社マーケティングアプリケーションズ,Webエンジニア,東京都 新宿区 新宿御苑前駅 徒歩5分,年収400万円～700万円,公開していません,キャリコネ転職
App Hearts株式会社,Web／モバイルエンジニア FlutterやSwiftで開発,東京都 渋谷区,月給30万円～70万円,10日前,リクナビNEXT
コムテックスソリューションズ株式会社,Webエンジニア,東京都,年収480万円～840万円,17日前,ほくりくFIT転職
株式会社ワイズロジック,Webアプリエンジニア,東京都 台東区 浅草橋駅 徒歩6分,年収450万円～700万円,公開していません,paiza転職
株式会社DNPデジタルソリューションズ,Webエンジニア,東京都 品川区,年収400万円～700万円,28日前,doda
株式会社Tsunagu.AI,Webエンジニア,東京都 港区 虎ノ門駅 徒歩1分,年収450万円～800万円,3日前,Green
株式会社エーアイスクエア,WEBアプリケーションエンジニア,東京都 千代田区 岩本町駅 徒歩1分,"月給37万5,000円～",公開していません,U29JOB
株式会社エキサイト,WEB開発エンジニア,東京都 千代田区 大手町駅,年収380万円～650万円,公開していません,paiza転職
TechMagic株式会社,Webフロントエンジニア,東京都 江東区,年収400万円～800万円,27日前,パソナキャリア
株式会社ウィズパッション,経験者限定 士業向け集客サイトのWEBエンジニア インハウス／横浜,神奈川県 横浜市 馬車道駅 徒歩3分,年収450万円～600万円,3日前,Green
株式会社エーエスエル,WEB／スマホアプリ開発エンジニア,東京都 中央区 勝どき駅 徒歩0分,月給30万円～,公開していません,日経転職版
MicroWorld株式会社,システムエンジニア、プログラムマネージャー、webシステムエンジニア,東京都 港区 虎ノ門駅,年収400万円～800万円,25日前,paiza転職
株式会社シムトップス,自社サービスWebアプリエンジニア～自社開発のペーパーレス化システム／業界シェアトップ,東京都 品川区 目黒駅,年収500万円～800万円,25日前,doda
株式会社パーソンズ,オープン・Web系開発エンジニア,東京都 中野区 中野駅 徒歩5分,月給25万円～,25日前,type
株式会社アイソルート,WEBエンジニア,東京都 渋谷区,年収350万円～600万円,公開していません,doda
株式会社カサレアル,Webエンジニア～プライム案件100%／自社開発／要件定義から可能／残業10h,東京都 港区 泉岳寺駅,年収400万円～700万円,1日前,doda
株式会社マイナビEdge,Web系ソフトウェアエンジニア マイナビの無期雇用派遣!業務未経験歓迎,東京都 港区,年収310万円～500万円,5日前,リクルートエージェント
合同会社NET-R,WEBエンジニア／WEBデザイン,神奈川県 横浜市 西区,月給25万円～40万円,11日前,合同会社NET-R
株式会社クーシー,ブロックチェーン領域のエンジニア職～Web3.0事業の立ち上げ／大手取引多数～,東京都 渋谷区 恵比寿駅,年収450万円～600万円,公開していません,doda
株式会社アイエスエイプラン,Web系エンジニア,東京都 中央区 勝どき駅 徒歩5分,年収300万円～700万円,公開していません,doda
株式会社ランドネット,Webエンジニア 自社WEBサービス開発,東京都 豊島区 池袋駅 徒歩5分,年収400万円～799万円,25日前,Green
株式会社リアルインベント,Webシステム開発エンジニア,東京都 荒川区 西日暮里駅 徒歩2分,月給25万円～40万円,4日前,type
ヤフー株式会社,WEBエンジニア,東京都 千代田区,年収500万円～900万円,18日前,doda
日本コンピュータシステム株式会社,基幹系システムプログラマ／WEBシステムエンジニア,東京都 港区 虎ノ門駅,年収380万円～540万円,公開していません,doda
スターフィールド株式会社,Webエンジニア,東京都 新宿区 高田馬場駅 徒歩5分,年収400万円～770万円,公開していません,paiza転職
株式会社ビザスク,Webエンジニア,東京都 世田谷区 池尻大橋駅                                                                                                                                                                その他 (6),年収500万円～800万円,29日前,doda
株式会社PROFESSY,Web開発エンジニア,東京都 渋谷区 恵比寿駅 徒歩7分,年収400万円～600万円,11時間前,Green
SGフィルダー,WEB系エンジニア,東京都 港区,年収350万円～750万円,13日前,SGフィルダー
亀田医療情報株式会社,WEBエンジニア,東京都 千代田区 麹町駅,年収500万円～700万円,公開していません,doda
株式会社想画,WEB開発エンジニア,東京都 北区 王子神谷駅 徒歩1分,年収350万円～600万円,公開していません,U29JOB
日本ディクス株式会社,Webアプリケーションエンジニア／金融・流通・製造業種向けシステムなど,東京都 港区 田町駅,年収550万円～700万円,25日前,doda
株式会社アピリッツ,Webエンジニア／toC・toBサービス両面を担当／在宅勤務可,東京都 渋谷区 原宿駅,年収384万円～840万円,18日前,doda
アートシステム株式会社,Webアプリケーションエンジニア,東京都 大田区 池上駅 徒歩10分,年収350万円～650万円,公開していません,U29JOB
株式会社キャピタル・アセット・プランニング,Webアプリエンジニア／自社内開発 在宅勤務可 東証一部 再雇用制度有り,東京都 港区 品川駅,年収600万円～900万円,公開していません,doda
株式会社ヒューガン,Javaを用いたWEBアプリケーション開発エンジニア,東京都 世田谷区,年収400万円～700万円,13日前,株式会社ヒューガン
アイティメディア株式会社,Webエンジニア ～国内最大級自社メディアのシステム企画・開発／リモート中心～,東京都 千代田区 麹町駅,年収627万円～896万円,1日前,doda
株式会社シスプライマリー,ITシステム開発会社のwebエンジニア,東京都 千代田区 淡路町駅 徒歩2分,月給27万円～50万円,12日前,株式会社シスプライマリー
株式会社構造計画研究所,Web系ソフトウェアエンジニア ～独立系ITベンダ～,東京都 中野区 新中野駅,年収550万円～900万円,公開していません,doda
株式会社ネクストビート,Webアプリケーションエンジニア 「子育て支援」「地方創生」領域,東京都 渋谷区 恵比寿駅,年収420万円～600万円,29日前,doda
株式会社ケアネット,Webアプリケーションエンジニア,東京都 千代田区 飯田橋駅 徒歩5分,年収400万円～600万円,公開していません,doda
スマートシェア株式会社,Webアプリケーションエンジニア,東京都 港区,公開していません,公開していません,マイナビAGENT
株式会社ネットラーニングホールディングス,Webアプリエンジニア 自社開発／オンライン教育のパイオニア／海外案件に携われる,東京都 新宿区 大久保駅,年収500万円～650万円,23日前,doda
株式会社CureApp,WEBアプリエンジニア 治療アプリ／フルリモート可,東京都 中央区,年収400万円～600万円,1日前,リクルートエージェント
アライドテレシス株式会社,Webアプリ開発エンジニア,神奈川県 横浜市 港北区,年収350万円～650万円,10日前,マイナビAGENT
株式 会社マックス,クオリティエンジニア／Webシステム系／PL・PM,東京都 千代田区 半蔵門駅 徒歩1分,"年収400万円～1,000万円",11日前,株式 会社マックス
株式会社イクスイ,Webアプリエンジニア 新橋勤務,東京都 港区 新橋駅 徒歩8分,年収350万円～600万円,4日前,Green
株式会社URシステムズ,WEB開発エンジニア UR都市機構GROUP会社／平均残業月17h／平均勤続年数13年,東京都 江東区,年収440万円～570万円,2日前,リクルートエージェント
株式会社L is B,Webエンジニア／自社サービス「direct Apps」～リモート中心～,東京都 千代田区,年収400万円～700万円,14日前,doda
株式会社ケアリッツ・テクノロジーズ,WEB開発エンジニア／残業時間10時間未満／豊富なキャリアパス／プライム案件75%,東京都 新宿区,年収502万円～700万円,公開していません,doda
株式会社シライ,Webエンジニア ～自社ECサイト開発・運用／土日休み／残業月平均22時間～,東京都 台東区 浅草橋駅,年収300万円～600万円,21日前,doda
株式会社ジェイエスピー,"Webエンジニア,アプリケーションエンジニア",神奈川県 横浜市,年収350万円～550万円,5日前,株式会社ジェイエスピー
株式会社ブレインパッド,Webエンジニア～自社サービス／レコメンドエンジン搭載プライベートDMPの開発～,東京都 港区 六本木一丁目駅,年収550万円～650万円,11日前,doda
クラスター株式会社,Webフロントエンドエンジニア／メタバーズ ～バーチャルSNS「cluster」展開～,東京都 品川区,"年収500万円～1,000万円",公開していません,doda
株式会社Silbird,Webゲームエンジニア,東京都 千代田区,年収500万円～600万円,公開していません,paiza転職
SMBCグループの大手Sier,Web系システムエンジニア,東京都,年収400万円～620万円,公開していません,type 転職エージェント
株式会社ロイヤリティ マーケティング,WEBエンジニア～PontaWeb関連システムのアプリ開発／会員数1億人越～,東京都 渋谷区 恵比寿駅,年収420万円～700万円,11日前,doda
株式会社JobTechnology,SE 将来はフリーランスとして活躍したい方!Webエンジニア目指しませんか,東京都 渋谷区,月給20万円～40万円,公開していません,株式会社JobTechnology
株式会社からくさ,webエンジニア／有名人コラボあり／少数精鋭,神奈川県 横浜市 横浜駅 徒歩12分,月給25万円～,4日前,株式会社からくさ
コニカミノルタマーケティングサービス株式会社,Webアプリエンジニア／SaaSクラウド／コニカミノルタグループ／最先端技術・リモートワーク,東京都 中央区 水天宮前駅,"年収400万円～1,200万円",公開していません,doda
エヌシーアイ総合システム株式会社,Webエンジニア,東京都 中野区 中野坂上駅,年収440万円～560万円,公開していません,doda
株式会社オーシーエム,Web系エンジニア 豊富な休暇で定着率バツグン,東京都 港区 新橋駅 徒歩5分,"年収420万円～1,200万円",21日前,株式会社オーシーエム
株式会社シーディーアイ,自社WEBアプリ開発エンジニア 裁量を持った業務の進め方が可能,東京都 中央区,年収600万円～900万円,2日前,リクルートエージェント
ソニーグローバルマニュファクチャリング&オペレー...,WEBエンジニア,東京都 品川区 大崎駅,年収500万円～800万円,14日前,doda
株式会社アンリミテッド,業務システム・WEB開発エンジニア ～様々な案件に関わりキャリアアップ／残業20h以下～,東京都 台東区,年収400万円～600万円,公開していません,doda
株式会社GLOBAL-SERVICE,Webエンジニア,東京都 文京区 江戸川橋駅,月給25万円,13日前,株式会社GLOBAL-SERVICE
Guidable株式会社,Webエンジニア,東京都 新宿区 西新宿駅 徒歩6分,年収400万円～600万円,27日前,Green
株式会社ムニー,自社サービス／Webエンジニア／バックエンドエンジニア,東京都 渋谷区 渋谷駅,"年収500万円～1,200万円",3日前,Green
株式会社ダイヤモンドファンタジー,Webエンジニア,東京都 中央区 銀座駅 徒歩2分,年収400万円～700万円,25日前,paiza転職
株式会社hacomono,Webアプリケーションエンジニア,東京都 渋谷区 北参道駅 徒歩6分,"年収500万円～1,200万円",5時間前,CREATIVE JOB
株式会社知恵豆,Web／クラウド系エンジニア〜第二新卒でもOK、一から丁寧に教える教育環境があります,東京都 港区 虎ノ門駅 徒歩10分,"月給21万6,000円～",公開していません,かんたん応募
株式会社TOUCH TO GO,Web系アプリケーションエンジニア ～未来を創る無人決済システム～,東京都 港区,年収400万円～800万円,10日前,リクルートエージェント
株式会社Robot Home,Webフロントエンジニア,東京都 渋谷区 代官山駅,年収450万円～650万円,公開していません,Geekly
ストリートアカデミー株式会社,Webエンジニア,東京都 渋谷区 代官山駅 徒歩3分,年収500万円～750万円,1日前,Green
東京海上日動システムズ株式会社,Webアプリエンジニア,東京都 中央区 銀座駅,"年収480万円～1,100万円",公開していません,paiza転職
株式会社AMG Solution,オープン系Webシステムエンジニア,東京都 中央区 東日本橋駅,年収400万円～600万円,4日前,Green
株式会社三田ホールディングズ,社内WEBエンジニア,神奈川県 横浜市 関内駅,年収308万円～500万円,公開していません,doda
株式会社NDPマーケティング,Webエンジニア,東京都 渋谷区 恵比寿駅 徒歩5分,"年収520万円～1,950万円",公開していません,Green
株式会社ガジュマル,Webエンジニア／リモート可／残業ほぼなし／スキルアップ可,東京都 豊島区 池袋駅 徒歩5分,月給29万円～,7日前,doda
株式会社エス・アイ・エス,WEB系アプリケーションエンジニア,東京都 千代田区 秋葉原駅,年収600万円～800万円,13日前,doda
株式会社キューブシステム,Webアプリエンジニア／フロント開発など,東京都 品川区 大崎駅,年収385万円～550万円,公開していません,doda
株式会社コムニコ,Webエンジニア,東京都 中央区,公開していません,公開していません,マイナビAGENT
株式会社アルネアラボラトリ,Web・オープン系システムエンジニア／製造・メーカー,東京都 品川区 不動前駅 徒歩5分,月給25万円～30万円,公開していません,バイトルPRO
株式会社クーリエ,Webエンジニア 業界No.1のWebメディアやHR事業をはじめとしたプラットフォーム事業のシステム...,東京都,年収400万円～700万円,公開していません,Spring転職エージェント
株式会社学研プロダクツサポート,WEBアプリケーションエンジニア,東京都 品川区,年収600万円～800万円,6日前,doda
合同会社DREAM,自社サービスの開発に携わるWebエンジニア募集,東京都 中央区,月給22万円～45万円,12日前,合同会社DREAM
アデコ株式会社,実務経験不問 Web制作エンジニア 在宅勤務,東京都 渋谷区 渋谷駅 徒歩4分,"時給1,624円～",5日前,Adecco 派遣
株式会社JR東日本情報システム,Webアプリケーションエンジニア／「えきねっと」の開発／要件定義から担当,東京都 新宿区 高田馬場駅,年収440万円～580万円,1日前,doda
