Tryce tech株式会社,WEBエンジニア職,東京都 渋谷区,月給20万円～50万円,4日前,かんたん応募
SBI Africa株式会社,越境ECサイトを発展させる WEBエンジニア リモートワークOK,東京都 港区 六本木一丁目駅,月給25万円～40万円,24日前,マイナビ転職
株式会社ピース,Webエンジニア／コーダー・東京,東京都 豊島区 池袋駅 徒歩3分,年収350万円～500万円,公開していません,キャリコネ転職
ROSCA株式会社,Webエンジニア,東京都 新宿区 新宿御苑前駅 徒歩3分,年収300万円～900万円,11時間前,Green
株式会社イノセント,未経験”超”積極採用! WEBデザイナー／エンジニア,東京都 中央区 築地駅,月給20万円～50万円,25日前,リクナビNEXT
プライム・ストラテジー株式会社,Webエンジニア,東京都 千代田区 大手町駅 徒歩5分,年収500万円～800万円,7日前,Green
REC株式会社,既卒歓迎／Webエンジニア／充実した研修を通して憧れの「クリエイティブ職」として活躍しませんか,東京都 中央区 茅場町駅 徒歩5分,年収250万円～300万円,4日前,Re就活
株式会社レスキューナウ,Webエンジニア,東京都 品川区,"年収500万円～1,000万円",8日前,paiza転職
株式会社AVILEN,フルスタックエンジニア・Webエンジニア,東京都 中央区 馬喰町駅 徒歩3分,年収500万円～600万円,29日前,Green
フィグニー株式会社,Webエンジニア,東京都 新宿区 西新宿五丁目駅 徒歩7分,年収350万円～700万円,11時間前,Green
株式会社スタッフサービス,WEBエンジニア,東京都 品川区 大崎駅 徒歩10分                                                                                                                                                                その他 (2),"時給2,800円～",3日前,エンジニアガイド
株式会社エス・エー・アイ,Webエンジニア 自社内受託開発チームで活躍 前職給与考慮,東京都 新宿区 高田馬場駅 徒歩5分,月給22万円～,10日前,マイナビ転職
株式会社パルコデジタルマーケティング,バックエンドエンジニア／Webエンジニア,東京都 渋谷区,年収360万円～600万円,公開していません,フォーピープル
株式会社サンタエンタテイメント,未経験が楽しく学べるIT研修 WEBデザイナー・エンジニア,東京都 豊島区,月給20万円～50万円,25日前,リクナビNEXT
株式会社リクルートR&Dスタッフィング,システムエンジニア／WEBシステム車検のサービス開発／Java,東京都 世田谷区,月給20万円～44万円,19日前,リクルートR&Dスタッフィング
株式会社共同通信デジタル,スポーツデータの配信を行う Webエンジニア 実務未経験歓迎,東京都 港区 汐留駅 徒歩5分,年収300万円～450万円,7日前,マイナビ転職
株式会社NEXSEED,未経験から Webエンジニアとしてのキャリアを描ける,東京都 品川区,月給23万円～35万円,17日前,マイナビ転職
グロウコミュニティ株式会社,3年目を迎える創業時期の会社 未経験からWebエンジニアへ育成,東京都,月給18万円～30万円,公開していません,かんたん応募
株式会社ビデックス,Webエンジニア 動画コンテンツに携わる／年休120日以上／残業少なめ／第二新卒歓迎,東京都 渋谷区 代々木上原駅,年収350万円～700万円,14時間前,doda
"Weeybrid, LLC",Webエンジニアの募集,東京都 千代田区 秋葉原駅 徒歩3分,年収660万円～,公開していません,かんたん応募
株式会社エーウイング,webエンジニア,東京都 立川市 立川駅 徒歩8分,年収300万円～700万円,16日前,Green
テテマーチ株式会社,Webエンジニア,東京都 品川区 不動前駅 徒歩14分,年収450万円～800万円,24日前,U29JOB
株式会社MediBang,WEBエンジニア,東京都 渋谷区 渋谷駅 徒歩7分,年収350万円～500万円,公開していません,U29JOB
EveLive,webデザイナーおよびHTMLコーダー、web開発エンジニア、webディレクター募集,東京都,月給30万円～,公開していません,かんたん応募
有限会社シム,WEBエンジニア,東京都 千代田区 市ケ谷駅 徒歩1分,年収400万円～650万円,2日前,Green
paiza株式会社,シニアWebエンジニア,東京都 港区 外苑前駅 徒歩3分,年収600万円～840万円,4日前,CREATIVE JOB
株式会社アサーティブ,「WEBエンジニア育成教官」講師経験不問,東京都 新宿区 新宿駅 徒歩3分,公開していません,17日前,株式会社アサーティブ
ヒューマンデジタルコンサルタンツ株式会社,Webエンジニア,東京都 新宿区,"月給17万4,880円",公開していません,専門学校の就活 Career Map
株式会社SK promotion,Webデザイナー・WEBエンジニア なりたい自分を叶える,東京都 新宿区 早稲田駅 徒歩2分,月給20万円～50万円,11日前,リクナビNEXT
株式会社キャリッジリターン,Webエンジニア,東京都 中央区 銀座駅 徒歩1分,年収300万円～600万円,公開していません,paiza転職
ジュピターショップチャンネル株式会社,ウェブエンジニア,東京都 中央区 水天宮前駅,公開していません,2時間前,クリーデンス
株式会社アリス,WEBエンジニア、未経験歓迎,東京都,"月給18万2,500円～50万円",公開していません,かんたん応募
株式会社D.I.Works,未経験から育成／総合職／Webエンジニア・Webデザイナー等,東京都 新宿区 新宿駅 徒歩7分,月給30万円～60万円,公開していません,doda
株式会社日本M&Aセンター,Webエンジニア 企画からお任せ／年休120日・住宅手当有／成長産業,東京都 千代田区 大手町駅,年収600万円～900万円,14日前,doda
株式会社キャリアデザインセンター,Webエンジニア,東京都 新宿区 東新宿駅 徒歩2分                                                                                                                                                                その他 (3),"時給2,500円～2,800円",12日前,株式会社キャリアデザインセンター
Rotoworks株式会社,PHP／Laravel／不動産業界のDXを推進するWebエンジニア募集,東京都 新宿区,月給60万円～80万円,23日前,Rotoworks株式会社
アドバンサー株式会社,Webエンジニア,東京都 渋谷区 渋谷駅 徒歩1分,年収500万円～800万円,公開していません,U29JOB
株式会社OverTech,WEBエンジニア、Web・オープンシステム開発運用、未経験歓迎 給料をもらいながら研修できる,東京都 世田谷区 駒沢大学駅 徒歩15分,月給25万円～,公開していません,かんたん応募
株式会社ティアンドデイ,Webアプリケーションエンジニア,東京都,年収600万円～800万円,2日前,Spring転職エージェント
株式会社QuaLier,ゲーム・Webエンジニア,東京都 中央区,月給18万円～,28日前,doda
株式会社エヴォワークス,ワンコnowaのwebエンジニア,東京都 渋谷区 原宿駅 徒歩3分,年収360万円～480万円,4日前,Green
株式会社オプティム,Webアプリエンジニア,東京都,年収600万円～900万円,公開していません,Spring転職エージェント
レールコンサルティング株式会社,IT／Webエンジニア募集,東京都 中央区 日本橋駅 徒歩1分,"時給2,500円～5,000円",公開していません,かんたん応募
カシオ計算機株式会社,Webエンジニア 年休126日 賞与昨年実績5.4ヶ月分,東京都 八王子市 北八王子駅 徒歩5分,月給25万円～,13日前,エン転職
株式会社BTM,Webエンジニア,埼玉県,年収380万円～550万円,18日前,U29JOB
EGテスティングサービス株式会社,Webエンジニア,東京都 羽村市 小作駅,年収400万円～800万円,公開していません,doda
株式会社ADrim,WEBエンジニア,東京都 中央区 日本橋駅 徒歩6分,年収500万円～800万円,公開していません,U29JOB
プレイネクストラボ株式会社,WEBエンジニア／PM候補,東京都 品川区 五反田駅 徒歩1分,年収300万円～600万円,公開していません,キャリコネ転職
カイロスマーケティング株式会社,webエンジニア,東京都 渋谷区 原宿駅 徒歩8分,年収300万円～,1日前,Green
株式会社ナカテック,WEBエンジニア,東京都 港区 新橋駅 徒歩4分,年収330万円～700万円,公開していません,U29JOB
株式会社ブイキューブ,フルリモート プロジェクトマネージャー／Webエンジニア バーチャル株主総会,東京都 港区,年収660万円～900万円,1日前,リクルートエージェント
Connehito株式会社,Webエンジニア,東京都 港区,公開していません,公開していません,マイナビAGENT
株式会社ブルームテクノロジー,WEB開発エンジニア 東京本社,東京都 世田谷区 池尻大橋駅 徒歩7分,年収400万円～670万円,4日前,Green
チームラボ株式会社,Webアプリエンジニア チームラボエンジニアリング採用枠 第2新卒積極採用中!,東京都,年収300万円～500万円,6日前,キャリフレ
株式会社S’UIMIN,WEBエンジニア,東京都 渋谷区 初台駅 徒歩1分,年収600万円～,公開していません,Green
株式会社コアシンク,WEBエンジニア,東京都 千代田区 末広町駅 徒歩1分,年収300万円～900万円,公開していません,キャリコネ転職
株式会社パソナ,Web業界 システムエンジニア／Web制作,東京都 渋谷区 初台駅 徒歩9分,"時給1,600円",17時間前,パソナJOBサーチ
株式会社カルディオインテリジェンス,WEB開発エンジニア～医療AI・DX開発／要件定義などの上流工程から一貫して携われます～,東京都 港区 赤羽橋駅,年収500万円～700万円,11日前,doda
Evand株式会社,WEBエンジニア・WEB開発担当／tse,東京都 港区 乃木坂駅 徒歩4分,月給21万円～35万円,17日前,リクナビNEXT
株式会社ラクス,"Webアプリケーションエンジニア／Go,Python",東京都 渋谷区,年収620万円～920万円,10日前,マイナビ転職エージェントサーチ
株式会社翔泳社,webエンジニア,東京都 新宿区 四谷三丁目駅 徒歩2分,年収400万円～650万円,公開していません,paiza転職
株式会社Azoop,Webエンジニア／運送業界のITサービス「トラッカーズマネジャー」 急成長ベンチャー,東京都 港区 浜松町駅,年収480万円～900万円,18日前,doda
株式会社トリガー,課題解決のために顧客体験をクリエイティブする Webエンジニア,東京都 港区 表参道駅,年収360万円～900万円,公開していません,DXcareer
NXPジャパン株式会社,WEBエンジニア／車載向け半導体で売上世界トップの企業,東京都 渋谷区,年収464万円～,1日前,リクルートエージェント
株式会社ヒップ,Webエンジニア,神奈川県 横浜市 西区,公開していません,公開していません,マイナビAGENT
株式会社ビスカス,フロントエンドWebエンジニア 税理士紹介業界で屈指のシェア／年間休日125日,東京都 渋谷区 恵比寿駅 徒歩5分,月給28万円～,25日前,エン転職
株式会社CAREER JAPAN,Webデザイナー HTMLエンジニア,東京都 品川区 大崎駅 徒歩3分,月給32万円～,2日前,株式会社CAREER JAPAN
INCLUSIVE株式会社,Webエンジニア,東京都 港区 表参道駅 徒歩5分,年収450万円～800万円,11時間前,Green
H.I.F.株式会社,WEBエンジニア,東京都 新宿区 西新宿駅,年収500万円～700万円,7時間前,Green
株式会社ココロザシ,WEBエンジニア～前給与保証／資格取得全額補助／副業OK～,東京都 港区,年収450万円～800万円,17日前,doda
ニチカレ株式会社,Webエンジニア,東京都 品川区 大崎駅 徒歩6分,年収500万円～800万円,8日前,Green
株式会社イグニシオン,Webエンジニア,東京都 中央区 宝町駅 徒歩3分,月給25万円～,25日前,かんたん応募
GMOメイクショップ株式会社,Webエンジニア,東京都 渋谷区 渋谷駅,年収420万円～600万円,18日前,doda
株式会社レンサ,Web OR スマホアプリケーションエンジニア,東京都 港区 赤坂見附駅 徒歩5分,"月給23万3,500円",15日前,U29JOB
株式会社フレームワークス,Webアプリケーションエンジニア  大和ハウスグループの物流テック企業／退職金有,東京都,年収550万円～750万円,公開していません,Spring転職エージェント
株式会社アジルコア,webエンジニア SS,東京都 渋谷区 代々木駅 徒歩3分,年収350万円～600万円,11時間前,Green
株式会社ウィルオブ・ワーク,自社開発／Webシステムエンジニア,東京都 新宿区 西新宿駅 徒歩2分,年収～800万円,11時間前,Green
株式会社マイナビワークス,「マイナビジョブ20’s」の自社サービスのWebエンジニア,東京都 新宿区,公開していません,10日前,マイナビAGENT
株式会社夢テクノロジー,Webエンジニア 未経験スタートの文系出身者多数活躍中,東京都,月給22万円～,3日前,マイナビ転職
エヌ・ティ・ティ・コミュニケーションズ株式会社,ソフトウエアフレームワーク開発、Webアプリケーションエンジニア,東京都 港区,年収500万円～800万円,公開していません,エヌ・ティ・ティ・コミュニケーションズ株式会社
株式会社チーム・ファクトリー,Web開発エンジニア,東京都 港区 田町駅 徒歩4分,年収400万円～600万円,公開していません,paiza転職
フェンリル株式会社,Webエンジニア／若手層,東京都 品川区,年収450万円～700万円,5日前,Green
株式会社オーバードライブ,WEBエンジニア,東京都 千代田区 市ケ谷駅 徒歩4分,年収356万円～426万円,公開していません,paiza転職
エイムネクスト株式会社,WEBエンジニア,東京都 港区 浜松町駅 徒歩6分,年収400万円～650万円,公開していません,U29JOB
パーソルテクノロジースタッフ株式会社,WEBアプリエンジニア,東京都 新宿区,年収350万円～650万円,4日前,paiza転職
株式会社キュービック,Webエンジニア 企業の成長を加速させるシステム開発／スクラム体制,東京都 新宿区 西新宿駅,年収400万円～600万円,公開していません,レバテックキャリア
REALITY株式会社,WEBエンジニア／ビジネス向けメタバース構築プラットフォームの開発,東京都 港区,"年収500万円～1,000万円",1日前,リクルートエージェント
株式会社ユニラボ,Webエンジニア,東京都 品川区 五反田駅,"年収650万円～1,000万円",7時間前,doda
フルスタック株式会社,webデザイナー、webエンジニア,東京都 豊島区                                                                                                                                                                その他 (2),月給23万円,18時間前,かんたん応募
株式会社インターネットイニシアティブ,WEBエンジニア,東京都 千代田区 飯田橋駅,年収450万円～900万円,公開していません,doda
株式会社フツパー,web／ネットワークエンジニア,東京都,年収500万円～850万円,3日前,Green
株式会社Brushup,Webエンジニア／制作物フィードバッククラウドサービス「Brushup」,東京都 品川区,年収400万円～700万円,公開していません,doda
株式会社カタリストシステム,WEBエンジニア,東京都 渋谷区 恵比寿駅 徒歩6分,年収400万円～700万円,公開していません,U29JOB
株式会社アクロプロモーション,Webサービスエンジニア ～PMクラス・上流工程・在宅勤務メイン～,東京都 中央区 新日本橋駅,年収600万円～800万円,29日前,doda
株式会社AMG International,高収入WEBデザイナー／エンジニア募集,東京都 千代田区 麹町駅,年収300万円～600万円,公開していません,かんたん応募
株式会社ヴァージニア,Webエンジニア,東京都 中央区 東銀座駅,年収400万円～650万円,14日前,doda
株式会社メディクルード,自社サイトWEBエンジニア,東京都 港区 六本木駅,年収350万円～700万円,4日前,Green
株式会社ハイウェル,フリーランス／PHP／設計～開発経験3年以上ある方!WEBエンジニア,東京都 港区,月給60万円～90万円,5日前,株式会社ハイウェル
株式会社デジタルシフト,Webエンジニア,東京都 新宿区 新宿駅,年収400万円～600万円,9日前,doda
株式会社esprot,Webエンジニア,東京都 渋谷区 渋谷駅 徒歩2分,年収300万円～700万円,1日前,Green
PHC株式会社,WEBエンジニア／電子カルテSaaS／ホワイト500認定,東京都 渋谷区,年収500万円～950万円,公開していません,doda
株式会社アドウェイズ,インフラエンジニア Web選考完結! 月平均残業10H フレックス勤務OK,東京都 新宿区 西新宿駅 徒歩3分,年収300万円～,21日前,エン転職
株式会社フォトシンス,Webエンジニア フルリモート可,東京都 港区,年収400万円～800万円,5日前,Green
株式会社エコスマート,webエンジニア,東京都 台東区 上野駅 徒歩5分,年収400万円～600万円,22日前,Green
株式会社ラクスパートナーズ,既卒歓迎／Webエンジニア／ゲーム、アプリ、ECサイトの開発等／未経験スタート歓迎!,東京都 新宿区 新宿駅 徒歩4分,年収350万円～400万円,10時間前,Re就活
株式会社大都テクノロジーズ,WEBエンジニア／自社サービス製品のIoT化,東京都 渋谷区 神泉駅,"年収400万円～1,000万円",11日前,doda
株式会社Free Spark,Webエンジニア,東京都 港区,年収350万円～450万円,公開していません,マイナビAGENT
株式会社キャリアインデックス,23新卒 Webエンジニア／自社開発100%,東京都 港区 白金台駅 徒歩5分,年収330万円～,公開していません,Green
グルーヴ・ギア株式会社,Webエンジニア,東京都 千代田区 九段下駅,年収300万円～500万円,1日前,doda
株式会社ヴァル研究所,Webエンジニア,東京都 杉並区 高円寺駅 徒歩3分,年収430万円～700万円,7日前,doda
株式会社よりそう,Webエンジニア,東京都 品川区 五反田駅,年収500万円～700万円,21日前,doda
SORABITO株式会社,Webエンジニア,東京都 中央区 茅場町駅,年収400万円～700万円,28日前,doda
株式会社ペンマーク,Webエンジニア,東京都 港区,年収480万円～720万円,25日前,doda
株式会社ジェイ・キャスト,WEBエンジニア,東京都 千代田区 麹町駅 徒歩3分,年収400万円～550万円,公開していません,Green
株式会社じげん,Webエンジニア ～フルスタックエンジニアが目指せる環境～,東京都 港区 神谷町駅,年収400万円～700万円,公開していません,doda
アピステクノロジー株式会社,Webサービス開発エンジニア,神奈川県 横浜市 江田駅 徒歩10分,年収300万円～600万円,公開していません,キャリコネ転職
株式会社モリサワ,WEBエンジニア／バックエンドエンジニア,東京都 新宿区,年収500万円～600万円,公開していません,doda
株式会社クリーマ,Webエンジニア,東京都 渋谷区 原宿駅 徒歩8分,年収450万円～750万円,12時間前,Green
株式会社SUPER STUDIO,Webエンジニア／ECプラットフォーム「ecforce」～導入企業数500超／自社サービス～,東京都 品川区 目黒駅,"年収400万円～1,400万円",28日前,doda
株式会社アクリメイト,Webエンジニア ～自社・クライアント案件に携われます／新規開発サービス有～,東京都 渋谷区 渋谷駅,"年収400万円～1,000万円",28日前,doda
株式会社Smallit,WEBアプリケーションエンジニア／支店の立ち上げメンバーとして事業拡大をリード／月残業平均10時間,東京都 渋谷区,年収400万円～900万円,公開していません,doda
株式会社ヴォイエンシー,Webエンジニア,東京都 中央区 小伝馬町駅 徒歩5分,年収350万円～550万円,公開していません,paiza転職
株式会社GFL,人間の無意識に響くマーケティングソリューショWebシステムバックエンドエンジニア,東京都 渋谷区,年収600万円～800万円,8日前,日経転職版
H.R.I株式会社,完全未経験から目指せる! Webデザイナー・エンジニア,東京都 新宿区 大久保駅 徒歩3分,月給22万円～,13日前,リクナビNEXT
株式会社オータム,Webエンジニア,東京都 千代田区 市ケ谷駅 徒歩4分,月給20万円～60万円,7日前,doda
株式会社Cuon,webエンジニア,東京都 千代田区 東京駅 徒歩5分,年収400万円～600万円,公開していません,paiza転職
株式会社リヴィティエ,Webエンジニア,東京都 千代田区 御茶ノ水駅 徒歩7分,年収400万円～800万円,11日前,Green
株式会社wevnal,Web開発エンジニア,東京都 渋谷区 渋谷駅 徒歩3分,年収350万円～500万円,公開していません,U29JOB
株式会社アイミン,ゼロから始めるWebエンジニア 入社後は、最長3ヶ月間の研修に専念 年休125日以上 残業月5h程,東京都 千代田区 岩本町駅 徒歩5分,月給22万円～50万円,17時間前,エン転職
株式会社コントロールテクノロジー,Webエンジニア,東京都 千代田区 溜池山王駅,年収360万円～600万円,公開していません,paiza転職
株式会社リンクバル,WEBエンジニアイベントEC事業部,東京都 中央区 築地駅 徒歩7分,年収500万円～700万円,公開していません,SMBCヒューマン・キャリア
株式会社FreedJob,スタートアップ 未経験OK／WEBデザイナー・ITエンジニア,東京都,月給21万円～50万円,4日前,リクナビNEXT
アライドアーキテクツ株式会社,Webエンジニア,東京都 渋谷区 恵比寿駅,年収551万円～800万円,公開していません,doda
株式会社アットウェア,WEBエンジニア ～WEB・アジャイル専門集団／～,神奈川県 横浜市 西区,年収500万円～800万円,1日前,doda
株式会社サイバーリンクス,WEBエンジニア,東京都 港区,年収400万円～600万円,12日前,ワークポート
ペットゴー株式会社,「ペットゴー」のWEBフロントエンジニア／WEBデザイナー,東京都 中野区 中野坂上駅 徒歩1分,"月給22万3,000円～50万円",公開していません,かんたん応募
株式会社ファームノート,エンジニア／Webエンジニア,東京都 港区,公開していません,公開していません,マイナビAGENT
株式会社 Ridge-i,Webエンジニア,東京都 千代田区 大手町駅 徒歩1分,"年収600万円～1,000万円",4日前,CREATIVE JOB
GROOVE X株式会社,webエンジニア,東京都 中央区 浜町駅 徒歩5分,年収500万円～,14日前,type
株式会社RJC,Webエンジニア,東京都 千代田区,年収350万円～500万円,公開していません,doda
株式会社Photosynth,Webエンジニア,東京都 港区 田町駅 徒歩4分,"月給35万7,143円～",18日前,U29JOB
合同会社DMM.com,Webエンジニア ～全社のデータ戦略の根幹となるトラッキングシステムの開発を推進～,東京都 港区 六本木一丁目駅,年収550万円～800万円,公開していません,doda
イシン株式会社,自社WEBメディアのWebエンジニア,東京都 新宿区 東新宿駅 徒歩5分,"月給32万2,200円",公開していません,イシン株式会社
株式会社ウイサーブ,Webアプリ開発エンジニア,東京都 中央区 八丁堀駅 徒歩3分,年収300万円～700万円,公開していません,キャリコネ転職
株式会社Playing,イチから学べる研修制度あり WEBデザイナー・ITエンジニア,東京都 新宿区,月給21万円～50万円,11日前,リクナビNEXT
株式会社メンバーズエッジ,Webエンジニア,東京都 中央区,年収350万円～750万円,12日前,ワークポート
株式会社シェアコネクト,Webサービス系エンジニア・プログラマ,東京都 新宿区 四谷三丁目駅                                                                                                                                                                その他 (14),年収300万円～700万円,13日前,株式会社シェアコネクト
富士ソフト株式会社,Webフロントエンジニア,東京都 千代田区,年収400万円～800万円,25日前,マイナビAGENT
トレンダーズ株式会社,Webエンジニア,東京都 渋谷区 恵比寿駅,年収330万円～400万円,公開していません,doda
株式会社アガルート,Webエンジニア 未経験歓迎／充実した研修制度有 オンライン予備校の運営会社 在宅可 残業約15h,東京都 千代田区 飯田橋駅,年収324万円～423万円,公開していません,doda
