株式会社Second floor,上流工程に携われるWebエンジニア 賞与年4回,"埼玉県 さいたま市 北浦和駅 徒歩1分                                                                                                                                                                    




北浦和駅の求人
をすべて見る",月給30万円～50万円,19日前,リクナビNEXT
株式会社SALTO,WEB開発エンジニア,埼玉県,年収450万円～650万円,公開していません,U29JOB
株式会社アトラスコンピュータ,既卒歓迎／WEB開発エンジニア／上流工程から開発・テストを担当するプロジェクトまで,埼玉県,年収350万円～700万円,23日前,Re就活
株式会社Beer and Tech,Web開発エンジニア,埼玉県 さいたま市 西区,年収400万円～600万円,公開していません,paiza転職
株式会社セレモニー 管理部,自社Webサービスエンジニア,埼玉県 さいたま市 北浦和駅 徒歩7分,月給25万円～30万円,20日前,type
インターリンク株式会社,Webエンジニア,埼玉県,月給26万円～45万円,1日前,type
バルテス株式会社,クオリティエンジニア Webシステム系 PL・PM,埼玉県 さいたま市 大宮区,"年収400万円～1,000万円",9日前,かんたん応募
パイン株式会社,自社WEBプロダクト開発エンジニア／Laravel,埼玉県 さいたま市 大宮駅 徒歩6分,月給22万円～30万円,公開していません,かんたん応募
あゆわら株式会社,Webシステムエンジニア募集!「未経験歓迎」システム勉強中の方歓迎,埼玉県 白岡市,"時給960円～2,000円",公開していません,楽天仕事紹介
株式会社アサヒコミュニケーションズ,WEBディレクター フロントエンドエンジニア,埼玉県 鴻巣市 鴻巣駅 徒歩2分,年収390万円～550万円,17時間前,Green
株式会社2ftech,上流工程メインのWebエンジニア,埼玉県 さいたま市 北浦和駅 徒歩1分,月給30万円～,公開していません,株式会社2ftech
株式会社Iranoan,社内システムエンジニア web面接・在宅勤務可,埼玉県,月給60万円～,2日前,リクナビNEXT
日新火災情報システム株式会社,システムエンジニア webアプリ開発／残業22時間／福利厚生,埼玉県 さいたま市 浦和区,年収450万円～700万円,21日前,リクルートエージェント
Bizネクストジャパン株式会社 サポート課,WEBエンジニア Webサイトやアプリの動作チェックなどの業務をお任せいたします,埼玉県 さいたま市,月給18万円～,3日前,Bizネクストジャパン株式会社サポート課
株式会社テイクス 大宮オフィス,初級 WEB系システムエンジニア,埼玉県 さいたま市 大宮駅 徒歩3分,月給23万円～30万円,12日前,ハローワーク大宮
マリーシェル合同会社,Webデザイナー、UIエンジニア,埼玉県 さいたま市 大宮駅 徒歩5分,月給20万円～30万円,公開していません,マリーシェル合同会社
株式会社SN JAPAN,プログラマー IT／WEB／アプリ／機械系エンジニア 全国で活躍できるシステムエンジニア大募集,埼玉県 さいたま市 大宮区,月給26万円～37万円,公開していません,株式会社SN JAPAN
クリプトリンク株式会社,Railsエンジニア～仮想通貨の会計ツールを提供する、成長中のベンチャー企業～,埼玉県 さいたま市 浦和区,年収360万円～800万円,公開していません,doda
株式会社グラングレス,ファッションサイトのWebデザイナー,埼玉県 さいたま市,"時給1,400円～2,000円",2日前,タウンワーク
辰巳電子工業株式会社,ゲーム・アミューズメント系開発エンジニア,埼玉県,年収432万円～871万円,6日前,type
株式会社NTTデータフィナンシャルテクノロジー,システム基盤に関する構築・運用・保守サービスSE,埼玉県,公開していません,公開していません,マイナビAGENT
株式会社ブライトスター,ITエンジニア 幅広い技術領域から最適なキャリアをチョイス!仕事もプライベートも自分らしく,埼玉県,年収400万円～900万円,7日前,キャリフレ
イーグル工業株式会社,社内SE 東証プライム上場／グローバル展開企業,埼玉県 坂戸市,年収400万円～800万円,公開していません,マイナビAGENT
株式会社システムネットワーク,エンジニア全般,埼玉県 所沢市,月給20万円～,公開していません,Javaキャリ
誉電気株式会社,ECサイト運営・管理,埼玉県 春日部市 豊春駅 徒歩10分,"時給1,000円～1,200円",1日前,かんたん応募
株式会社FAIR NEXT INNOVATION,オープン系言語経験者,埼玉県,年収420万円～750万円,20日前,Green
エイセル株式会社,RPG SAP移行PJ,埼玉県 さいたま市 さいたま新都心駅,月給46万円～58万円,22日前,かんたん応募
株式会社Bloom,未経験から研修制度でWebデザイナー 年間休日120日以上,埼玉県 さいたま市 加茂宮駅 徒歩9分,月給20万円～50万円,公開していません,株式会社Bloom
株式会社シンクス,上流工程を目指す!「労働市場で必要な人材へ」,埼玉県,月給24万円～,公開していません,doda
株式会社ゲオホールディングス,ゲオグループの自社WEBサイト開発に関わるPHPエンジニア,埼玉県,年収350万円～600万円,公開していません,マイナビAGENT
株式会社サイン,受託開発のシステムエンジニア募集,埼玉県 さいたま市 さいたま新都心駅,月給18万円～25万円,公開していません,かんたん応募
株式会社イデア,システムエンジニア 在宅あり 賞与実績4ヶ月 情報系の有資格者業界未経験歓迎,埼玉県 さいたま市,月給21万円～52万円,52分前,エン転職
株式会社HAL,ITエンジニア／還元率80%／副業OK,埼玉県,月給24万円～80万円,1日前,doda
株式会社ギャラクシィ,2023 新卒採用 ソフトウェア,埼玉県,"月給21万1,000円～23万2,000円",公開していません,リクナビ2023
株式会社パナR&D,PM／オープン・WEB／IT・システム,埼玉県,年収350万円～600万円,公開していません,マイナビAGENT
株式会社トップエンジニアリング,IT／ソフトウェア開発エンジニア 待機時保証が圧倒的／事業拡大フェーズ,埼玉県,公開していません,公開していません,マイナビAGENT
安全自動車株式会社,サービスエンジニア 第二新卒・未経験歓迎／経営安定,埼玉県,年収300万円～350万円,10日前,doda
株式会社アイテックス,SAP導入コンサルタント,埼玉県,月給25万円～65万円,18日前,日経転職版
i.Color株式会社,ITエンジニア,埼玉県,月給24万円～65万円,16日前,type
アルテミス株式会社,初級ITエンジニア 未経験OK リモート可 女性社員100% 研修充実,埼玉県,"月給22万5,000円～",公開していません,女の転職type
株式会社iJbridge,組み込みエンジニア 年俸500万円～700万円／リモート案件あり,埼玉県,年収500万円～700万円,28日前,エン転職
株式会社ライズエクシード,未経験者のための教育・環境を整備 ITエンジニア／PG・事務,埼玉県,月給18万円～80万円,2日前,リクナビNEXT
オムロン エキスパートリンク株式会社,ソフトウェア開発,埼玉県,年収350万円～650万円,19日前,doda
株式会社タスク・ウィルー,正社員未経験可能／サーバーサイドエンジニア,埼玉県 さいたま市 中央区,月給25万円～48万円,2日前,株式会社タスク・ウィルー
アークレイインフィニティ株式会社,フィールドエンジニア 国内シェアトップクラスの医療検査システムメーカー／WEB面接,埼玉県 さいたま市 大宮区,年収400万円～600万円,19日前,doda
株式会社日本技研プロフェッショナルアーキテクト,SE／PG,埼玉県,公開していません,公開していません,マイナビAGENT
株式会社STAND,経験者優遇!未経験可!SE,埼玉県 さいたま市 大宮区,月給25万円～50万円,公開していません,株式会社STAND
APクラスタ株式会社,WEB・オープン系システム中心／お疲れのシステムエンジニア向け／完全在宅可,埼玉県 川越市,月給35万円～40万円,21日前,APクラスタ株式会社
株式会社セキュアインフラストラクチャー,未経験・第二新卒も歓迎／20代・30代が活躍中 PG・事務,埼玉県,月給18万円～50万円,29日前,リクナビNEXT
株式会社ヴィトーリアアルマ,ITサポート事務#8割未経験から#リモート#3ヶ月の充実研修#フリーターもOK,埼玉県,月給18万円～,公開していません,女の転職type
91works株式会社,働き方が選べる ITエンジニア フルリモート!全国から応募OK,埼玉県,月給32万円～84万円,2日前,マイナビ転職
株式会社グローバルシンキング,プログラマー、システムエンジニア、プロジェクトマネージャ,埼玉県,年収350万円～750万円,公開していません,paiza転職
株式会社Vユーアイ,IT系総合職 未経験大歓迎採用,埼玉県,月給20万円～,24日前,マイナビ転職
株式会社ワイヤードパッケージ,スキルもお金も休みもぜ～んぶGET!／IT事務・デザイナー,埼玉県,月給23万円～,26日前,リクナビNEXT
株式会社ファルコ,ホワイト企業認定 ITエンジニア 売上前年比4倍超!／年休126日,埼玉県,月給30万円～70万円,2日前,マイナビ転職
株式会社アペックス,2023 新卒採用 ソフトウェア,埼玉県,"月給18万7,196円～23万円",公開していません,リクナビ2023
株式会社ミアーズ,ITエンジニア 未経験OK マンツーマン研修 女性エンジニアが代表 残業少なめ,埼玉県,月給23万円～,26日前,女の転職type
株式会社MPS,プログラマ,埼玉県 志木市,月給28万円～50万円,公開していません,株式会社MPS
株式会社アスパーク,ITエンジニア アプリ開発／組込制御／NW設計ほか／I001,埼玉県,月給18万円～60万円,2日前,リクナビNEXT
株式会社システムリファレンス,ITエンジニア 残業ほぼなし 年休125日 家族・住宅手当 リモートワーク,埼玉県,月給20万円～,12日前,女の転職type
株式会社セラク,東証プライム上場企業のカスタマーサクセス／デジタルマーケティングツール導入・運用支援,埼玉県,年収320万円～600万円,公開していません,マイナビジョブ20's
株式会社アイフリークモバイル,仕事の自立を助けるポジションで市場価値UP RPA開発・PG,埼玉県,月給25万円～80万円,22日前,リクナビNEXT
関東スターワークス株式会社 大宮テクニカルセンター,採用アシスタント,埼玉県 さいたま市 さいたま新都心駅 徒歩2分,月給28万円～35万円,14日前,ハローワーク大宮
株式会社S-Play,創業メンバー!未経験から楽しく成長 エンジニア／PG・事務,埼玉県,月給18万円～80万円,26日前,リクナビNEXT
株式会社ファンレボ,ゼロから学べるITサポート事務／在宅ワークも可／ほぼ未経験者,埼玉県,月給18万円～50万円,公開していません,doda
株式会社アイズ,Cloudや仮想環境など ITインフラエンジニア 未経験OK,埼玉県,月給25万円～,2日前,リクナビNEXT
株式会社フォーラムエンジニアリング,ITエンジニア そのスキルが、武器になる,埼玉県,"月給20万5,000円～45万5,000円",1日前,リクナビNEXT
株式会社アライブ.com,"前職より""増給保証"" SE／PG 独立支援制度 リモートワークOK",埼玉県,月給35万円～,13日前,マイナビ転職
株式会社アクティブフュージョンズ,SE／PG 高い技術力×チームでモダンな開発に挑戦,埼玉県,月給26万円～,8日前,マイナビ転職
株式会社TACSOL,2023 新卒採用 ソフトウェア,埼玉県,月給22万円,6日前,リクナビ2023
JAPAN ENGINEERs 人事部採用課,資格が取り放題のものづくりエンジニア,埼玉県 本庄市                                                                                                                                                                その他 (8),"月給23万5,000円～30万円",5日前,かんたん応募
キャル株式会社,SE・PG,埼玉県 川口市                                                                                                                                                                その他 (109),月給27万円～,22日前,かんたん応募
株式会社エム・アンド・アイ,ITエンジニア 大手企業のプライム案件多数／年休125日／在宅ワーク可／定着率97%／残業月平均8h,埼玉県 さいたま市,月給30万円～65万円,6日前,エン転職
株式会社カレッジティアンドケイ,残業代全額支給 WEBシステム／車載開発に携わる SE／PG,埼玉県,"月給20万2,400円～40万円",12時間前,リクナビNEXT
日本一株式会社,イチから始めるシステムエンジニア,埼玉県 さいたま市 大宮区,月給21万円～37万円,15日前,日本一株式会社
オープラン株式会社,エンジニア100名採用予定! 9割が未経験スタート／年に何回でも昇給のチャンスあり,埼玉県,月給20万円～,7日前,かんたん応募
JFEシステムズ株式会社,大手製造業向けシステム プロジェクトマネージャ、システムエンジニア、ITアーキテクト、基盤技術者,埼玉県,年収400万円～750万円,公開していません,マイナビAGENT
株式会社ライコン ラダーシステム,ITエンジニア 未経験歓迎／月給30万円～可 残業少 女性活躍,埼玉県,月給30万円～55万円,14日前,女の転職type
サービス&セキュリティ株式会社,w e b 系・ 業務系開発エンジニア,埼玉県,公開していません,公開していません,マイナビAGENT
株式会社GROWTHAS,フルリモ／年休140日／案件自由選択／前給UP／SE・PG,埼玉県,月給26万円～,8日前,リクナビNEXT
株式会社フリーダムランド,Webディレクター,埼玉県,月給25万円～,27日前,type
株式会社パルシス,システムエンジニア／開発エンジニア,埼玉県,年収450万円～750万円,公開していません,マイナビAGENT
株式会社ゼディアロード,経験ゼロから始める ITエンジニア,埼玉県,月給18万円～80万円,2日前,マイナビ転職
スターツコーポレーション株式会社,総合職 研修制度充実・Web面接可,埼玉県,"月給21万5,000円～57万9,000円",公開していません,doda
株式会社リーディング・エッジ社,ITエンジニア 20代・30代活躍中!未経験歓迎,埼玉県,月給21万円～,公開していません,リクナビNEXT
株式会社マクロビジョン,あなたが思い描くキャリアを実現 ITエンジニア 前職給与考慮,埼玉県,月給42万円,14日前,マイナビ転職
株式会社サン・メルクス,未経験OK 月残業10～20時間程度,埼玉県,公開していません,公開していません,マイナビAGENT
R&D ENGINEERs 人事部採用課,未経験から化学系エンジニア,埼玉県 本庄市                                                                                                                                                                その他 (8),"月給23万5,000円～30万円",5日前,かんたん応募
株式会社サントラスト,システム開発／インフラ構築,埼玉県,月給20万円～35万円,5日前,リクナビNEXT
株式会社ボイスアンドビジュアル,ITエンジニア 年収400万円以上も可能／昇給率100%／経験浅めの方でも歓迎／面接は1回,埼玉県,月給25万円～50万円,32分前,エン転職
有限会社関根車輛,ロードサービスエンジニア,埼玉県 東松山市                                                                                                                                                                その他 (2),月給23万円～45万円,3日前,有限会社関根車輛
レイルリンク株式会社,20代活躍中!未経験 個人別研修でエンジニアデビュー,埼玉県,月給22万円～,21日前,リクナビNEXT
株式会社シーエスウェア,未経験可 キャリアを掴むITエンジニア PG,埼玉県,月給22万円～55万円,27日前,リクナビNEXT
株式会社Redo,ITエンジニア リモート・フレックス案件あり 年休120日 定着率90%,埼玉県,月給28万円～50万円,6日前,女の転職type
ユニファ株式会社,開発ディレクター,埼玉県,年収500万円～750万円,公開していません,paiza転職
有限会社ATUMS,テリトリーマネージャー募集／未経験大歓迎／在宅勤務可／キャリアアップ有／人・組織ファーストの会社,埼玉県,月給18万円～50万円,公開していません,かんたん応募
株式会社SAKURUG,システムエンジニア,埼玉県,月給25万円～70万円,1日前,type
Mono ENGINEERs 人事部採用課,日本のものづくりを支える評価エンジニア,埼玉県 さいたま市 大宮区                                                                                                                                                                その他 (8),"月給23万5,000円～30万円",5日前,かんたん応募
マンパワーグループ株式会社,RPA,埼玉県,年収350万円～500万円,公開していません,マイナビAGENT
株式会社アクロビジョン,インフラ／開発エンジニア エンジニアデビューを全力応援,埼玉県 さいたま市 大宮区,月給24万円～50万円,1日前,マイナビ転職
株式会社リアソルマネージメント,ITエンジニア 先輩の9割以上が未経験! 残業月10H,埼玉県,月給25万円～,9日前,マイナビ転職
ランスタッド株式会社,機電系エンジニア～新事業の立ち上げメンバー／世界最大級の総合人材会社～,埼玉県,年収500万円～900万円,11日前,Spring転職エージェント
イノフェックス株式会社,PC・ゲーム好きな先輩活躍中! ITエンジニア 自社内案件多数,埼玉県 さいたま市,月給25万円～40万円,2日前,マイナビ転職
スタディプラス株式会社,若手積極募集／教育×テクノロジー,埼玉県,年収500万円～785万円,公開していません,マイナビAGENT
株式会社G-gen,クラウドエンジニア Googleプレミアパートナー フルリモート 学習環境充実,埼玉県,年収400万円～800万円,29日前,女の転職type
Carpe diem株式会社,案件も働き方も、ワガママ聞きます ITエンジニア フル在宅7割,埼玉県,月給25万円～,公開していません,マイナビ転職
株式会社プレアデスコンサルタント,未経験からゲームやWebの仕事に挑戦! ITエンジニア,埼玉県,月給18万円～80万円,2日前,リクナビNEXT
株式会社RISING 埼玉支部,未経験から成長できるシステムエンジニア,埼玉県 さいたま市 大宮区,月給25万円～40万円,5日前,株式会社RISING
オムロン ソフトウェア株式会社,オムロングループをITで支えるPM・PL グローバルに働く,埼玉県,月給23万円～60万円,29日前,リクナビNEXT
株式会社ラポールスター,ITエンジニア 還元率73%／年休130日／情報開示率99%!単価や働き方を確認して自分で案件選択,埼玉県,月給30万円～70万円,28日前,エン転職
株式会社デザインネットワーク,Web系アプリケーション開発,埼玉県,年収450万円～680万円,6日前,doda
株式会社コラットベース,前給最大限考慮! Web・オープン系開発多数 SE・PG,埼玉県,月給27万円～70万円,26日前,リクナビNEXT
株式会社クルージス,システムエンジニア 在宅勤務でプライベートも充実,埼玉県,月給32万円～60万円,公開していません,株式会社クルージス
セントラルエンジニアリング株式会社,ITエンジニア 日立・東芝・NEC等大手案件&リモート案件多数,埼玉県,月給25万円～60万円,2日前,マイナビ転職
FUJITSUUT株式会社 ITスタッフソリュー...,リモートワーク中心!セキュリティエンジニア,埼玉県 さいたま市 さいたま新都心駅 徒歩3分,"時給2,500円～",公開していません,エン派遣
株式会社ECS,SE／PG ブランクOK 時短／リモートワークOK 産育休取得率100% 月給30万円～,埼玉県,月給30万円～,1日前,女の転職type
株式会社リバイバル,ITエンジニア 前給保証 月給33万円～ フルリモート8割,埼玉県,月給33万円～,2日前,マイナビ転職
株式会社ソフィアテック,開発エンジニア,埼玉県,月給35万円～66万円,13日前,type
アジアクエスト株式会社,PM候補,埼玉県,"年収400万円～1,000万円",13日前,type
株式会社ダイフク,システムエンジニア 世界中の物流・モノづくりを支えるグローバルトップ企業,埼玉県 三郷市,公開していません,公開していません,マイナビAGENT
株式会社タスク・ウィル,SE アルバイト未経験可能／サーバーサイドエンジニア,埼玉県 さいたま市 中央区,"時給1,450円～2,450円",8日前,株式会社タスク・ウィル
カチシステムプロダクツ株式会社,システム開発エンジニア ～福利厚生／住宅手当等あり～,埼玉県,年収360万円～600万円,24日前,doda
株式会社GENTEN,初級エンジニア,埼玉県,月給22万円～,16時間前,type
株式会社Luxy,エンジニア 前給考慮／副業・フルリモートOK／自社内開発あり／残業ほぼなし／土日祝休み,埼玉県,"月給33万円～73万5,000円",7日前,エン転職
サン電通エンジニアリング株式会社,未経験OK インフラエンジニア 前職給与考慮 研修充実,埼玉県,月給21万円～25万円,3日前,マイナビ転職
銀河ソフトウェア株式会社,ITエンジニア 未経験歓迎 充実の研修体制も整っています,埼玉県,"月給22万8,000円～",27日前,マイナビ転職
株式会社Yakudo,ITエンジニア 還元率75%以上／フルリモート可能／副業可／自社サービスあり／残業月10h以内,埼玉県,月給35万円～90万円,3日前,エン転職
Trigger株式会社,人材コーディネータ 向上心高く働く同世代と一緒に人材コーディネーターとして活躍しませんか,埼玉県,年収400万円～799万円,1日前,en ミドルの転職
株式会社システムインテグレータ,埼玉配属／PL・SE／ERPパッケージ,埼玉県 さいたま市 さいたま新都心駅 徒歩1分,公開していません,公開していません,マイナビAGENT
ALH株式会社,本気になれば未経験からでも十分になれます! ITエンジニア,埼玉県,"月給22万5,000円～",27日前,マイナビ転職
パーソルR&D株式会社,アプリケーションエンジニア 最先端ハイスキル開発エンジニア集団 売上9000億を誇る安定企業,埼玉県,年収550万円～750万円,7日前,en ミドルの転職
株式会社第一情報システムズ,アプリエンジニア／プライム案件8割／残業20時間／評価制度／年収高／研修制度,埼玉県,年収400万円～600万円,公開していません,マイナビAGENT
株式会社エスユーエス,システムエンジニア 前給保証あり 受託開発も拡大中 PL・PMにもチャレンジできる リモートワーク可,埼玉県,月給25万円～,17日前,エン転職
エフ・ティ・コム株式会社,エンジニア 前職給保証・完全週休2日,埼玉県,年収330万円～,1日前,リクナビNEXT
株式会社アイリッジ,グロース市場／業界大手と取引多数／残業時間10時間程度,埼玉県,公開していません,公開していません,マイナビAGENT
株式会社キーワードジャパン,ITエンジニア,埼玉県,月給25万円～50万円,7日前,doda
コンピュータ・レスキュー株式会社,ITエンジニア 未経験歓迎!エンジニアって何するのから教えます。年間休日127日!住宅手当最大3万円,埼玉県,月給23万円～,28日前,エン転職
株式会社アースシステムズラボラトリー,システムエンジニア,埼玉県,年収450万円～900万円,11日前,doda
アルユーアイ株式会社,未経験者もゼロから育成 ITエンジニア 資格取得支援充実,埼玉県,月給25万円～50万円,27日前,マイナビ転職
株式会社Room12,Reactエンジニア リモートOK／技術研修あります／ブランク大歓迎／平均残業15h以内,埼玉県,月給30万円～,10日前,かんたん応募
株式会社アベールジャパン,成功の秘訣は? 40代からの転職を徹底検証 ITエンジニア,埼玉県,月給25万円～50万円,2日前,リクナビNEXT
フルウィル株式会社,還元率70%超／上場グループ／94%が前給与UP入社 ITエンジニア,埼玉県,月給32万円～90万円,21日前,マイナビ転職
