株式会社ロフティー,«急募／単発OK»工場内でシステムエンジニア,埼玉県 寄居町 男衾駅 車8分,"時給2,150円～",2日前,ジョブティー
株式会社divx,エンジニア 幅広い技術スタックを短期間で／リモート・残業少,埼玉県,月給30万円～,8日前,マイナビ転職
株式会社フラット,ITエンジニア 業界いちゆる～く自由に働く!社内業務ゼロでリモート案件92%!副業兼業も自由にOK,埼玉県,月給32万円～60万円,1時間前,エン転職
株式会社セブンコード,圧倒的還元率&案件数 会社に囚われたくないエンジニア大歓迎,埼玉県,"月給31万円～78万3,000円",19日前,リクナビNEXT
株式会社テクノウォーカー,開発・インフラエンジニア 社員の7割が未経験。30名弱の小さな会社へ年間応募者1000～2000名以...,埼玉県,月給18万円,1日前,エージェントパーク
株式会社アバンス・エイト,未経験歓迎!第二創業メンバー ITエンジニア／PG、テスター,埼玉県,月給18万円～80万円,8日前,リクナビNEXT
株式会社テクニケーション,ITエンジニア 案件単価ベースで給与還元!平均年収150万円UP フルリモートOK,埼玉県,月給34万円～65万円,公開していません,エン転職
株式会社トイボックス,初級エンジニア,埼玉県,"年収350万円～1,000万円",2日前,type
株式会社レインオンファニー,SE,埼玉県,月給30万円～60万円,20日前,type
ラダーシステム株式会社,在宅勤務可／ITエンジニア／開発／インフラ運用保守,埼玉県,月給30万円～55万円,6日前,リクナビNEXT
株式会社エイチ・エル・シー,未経験・第二新卒歓迎! ITエンジニア 研修充実,埼玉県,"月給17万2,000円～",17日前,マイナビ転職
株式会社shorma,SE・PG・IT技術者,埼玉県,月給20万円～50万円,公開していません,求人Free
株式会社SeeD,高単価×高還元率で働くITエンジニア!平均年収178万円UP ! 最初からフルリモートOK,埼玉県,"月給32万円～84万5,000円",1時間前,エン転職
株式会社エー・エス・エル,ITエンジニア テレワーク率85%以上,埼玉県,月給30万円～,13日前,マイナビ転職
株式会社アウトソーシングテクノロジー エキスパー...,インフラ・クラウドエンジニア,埼玉県,"月給37万5,000円～85万円",23日前,type
株式会社要,開発エンジニア,埼玉県,月給28万円～,9日前,type
フジテコム株式会社,システムエンジニア,埼玉県 新座市,年収310万円～420万円,2日前,doda
gooMet合同会社,上流工程を目指せる!フルリモートOK ITエンジニア 残業月20h,埼玉県,月給30万円～55万円,27日前,マイナビ転職
株式会社ジョブサポート,システムエンジニア 年間休日120日以上／土日祝休み／残業少なめ／家族手当あり,埼玉県,"月給21万5,000円～24万円",51分前,エン転職
セントラルエンジニアリンググループ,ITエンジニア,埼玉県,公開していません,7日前,セントラルエンジニアリンググループ
株式会社Noelith,SE 前給保証 リモート90% 受託案件強化 年休140日取得可能 有給取得100%,埼玉県 さいたま市 西区,"月給35万7,000円～64万2,000円",26日前,女の転職type
株式会社ソアレスト,SE・PG,埼玉県,月給25万円～,20日前,リクナビNEXT
株式会社ヒューマンソリューションズ,ソフトウェア設計・開発,埼玉県,公開していません,公開していません,べティ
ルーテイジ株式会社,9割が未経験入社 知識ゼロからITの世界へ!SE／PG,埼玉県,月給20万円～50万円,21日前,リクナビNEXT
株式会社ESES,現在の還元率70%!2030年までに80%還元が目標 ITエンジニア,埼玉県,月給25万円～70万円,27日前,マイナビ転職
株式会社アーシャルデザイン,未経験者・第二新卒歓迎・残業無 ITエンジニア・サポート事務,埼玉県,月給22万円～,27日前,マイナビ転職
株式会社MUTAN,社内ITエンジニア,埼玉県 所沢市,年収300万円～400万円,1日前,CREATIVE JOB
サイバーコム株式会社,サーバーサイドエンジニア／バックエンドエンジニア 顧客からの要件ヒアリング、見積作成、PM業務,埼玉県,年収380万円～700万円,7時間前,レバテックキャリア
株式会社SEシェア,ITエンジニア フルリモート案件8割!／副業OK／還元率78%!／残業月10h／今年6月法人設立,埼玉県,月給35万円～125万円,21日前,エン転職
株式会社ベータシステム,ITエンジニア 在宅勤務OK ワークライフバランス重視,埼玉県,月給30万円～,6日前,マイナビ転職
LIJ株式会社,エンジニア,埼玉県,月給35万円～50万円,6時間前,イーキャリア
IKTEL株式会社,急募!未経験エンジニア希望／高待遇,埼玉県 さいたま市 大宮駅,月給25万円～60万円,14日前,IKTEL株式会社
株式会社スタッフサービスエンジニアリング事業本部,ITエンジニア オープン系、Web系、インフラ系など,埼玉県,"月給21万5,000円～55万円",公開していません,PROSEEK
株式会社ワーキテクノ,チームで案件を進める ITエンジニア 未経験OK!26.8万円以上,埼玉県,"月給26万8,000円～",8日前,マイナビ転職
株式会社ウェブフロンティア,社内開発&自社サービス強化! Web開発SE 経験者募集,埼玉県,"年収300万円～1,000万円",17日前,マイナビ転職
株式会社ゼディアレーゲン,イチから始めるITエンジニア 年間休日125日以上 残業月20時間以下 10名以上の積極採用,埼玉県,月給18万円～80万円,24日前,エン転職
株式会社八興システムズ,ITエンジニア 副業OK・年休125日以上・残業月10時間程度・待遇充実,埼玉県,月給25万252円～60万440円,45分前,エン転職
株式会社スリー・イー,2023 新卒採用 情報処理,埼玉県,"月給20万897円～23万5,000円",17日前,リクナビ2023
株式会社アドービジネスコンサルタント,2023 新卒採用 ソフトウェア,埼玉県,"月給19万2,500円～21万8,500円",公開していません,リクナビ2023
株式会社シスコム・テクノロジー,平均27歳 20代活躍中 1次面接通過者:内定率97% ITエンジニア,埼玉県,月給22万円～35万円,8日前,マイナビ転職
株式会社クロニクル,未経験歓迎のIT・ゲームエンジニア,埼玉県,月給18万円～,18日前,doda
アルファテクノロジー株式会社,エンジニア,埼玉県,月給23万円～40万円,6日前,doda
株式会社イイネクサス,自由度の高いITエンジニア／未経験歓迎／リモートワーク率7割,埼玉県,月給25万円～50万円,20日前,doda
株式会社ブレイントラスト,初級エンジニア,埼玉県,月給25万円～40万円,16日前,type
株式会社電子工学センター,年齢相応の経験を積みキャリアアップを! ITエンジニア,埼玉県,"月給23万4,000円～",5日前,リクナビNEXT
ベリソフト株式会社,SE・PG 開発エンジニア 月給35万円～／フルリモート,埼玉県,月給35万円～,20日前,リクナビNEXT
株式会社ヴィトーリア,ゲーム企画・開発エンジニア／PS4／5・Switch等ゲーム開発実績多数のIT企業,埼玉県,月給25万円～,9日前,type
アマゾン ウェブ サービス ジャパン合同会社,クラウドサポートエンジニア／在宅勤務可／AWS経験不問／年俸700万以上,埼玉県,年収700万円～,20日前,女の転職type
ネクストフィールド株式会社,開発エンジニア,埼玉県,月給22万円～,6日前,type
株式会社ABI,コンサルティングエンジニア インフラ,埼玉県,年収350万円～550万円,13日前,Green
株式会社レクシス,ITエンジニア 前給以上保証／在宅案件が8割／定着率92.5%,埼玉県 さいたま市,月給30万円～,27日前,マイナビ転職
レバテック株式会社,SES開発部／開発／外勤エンジニア,埼玉県,年収400万円～850万円,8日前,en ミドルの転職
株式会社エイ・クリエイション,初級エンジニア 未経験歓迎／賞与年2回／土日祝休み／年休128日／リモート率85%／定着率93,埼玉県,月給25万円～,7日前,エン転職
ActCom株式会社,WEB開発SE／平均残業10H／テレワーク推奨／休日125日,埼玉県,月給25万円～60万円,20日前,リクナビNEXT
株式会社ENCOM,ITエンジニア／未経験OK,埼玉県,月給23万円～50万円,27日前,type
ハイミン・エンタープライズ株式会社,ネットワークエンジニア#要件定義・設計・構築案件のみ!スキルアップ出来る基盤がここにある,埼玉県,年収400万円～700万円,7日前,キャリフレ
株式会社CAICA,インフラエンジニア 大手金融機関向け案件／有給取得率75%／福利厚生充実,埼玉県,年収370万円～520万円,7日前,キャリフレ
アデコ株式会社 採用受付,一般事務・OA事務／メーカー関連,埼玉県 川口市 東川口駅 徒歩9分,"時給1,400円～",2日前,はたらこねっと
株式会社アクセスネット,システムエンジニア／定着率90%以上・年間休日125日,埼玉県,月給30万円～,公開していません,doda
株式会社LainZ,ITエンジニア 未経験歓迎／充実の研修／年休131日／テレワーク可,埼玉県,月給22万円～40万円,2日前,マイナビ転職
株式会社IRODORI,9割が未経験のITエンジニア／丁寧な研修・充実のサポート体制,埼玉県,月給20万円～,14日前,doda
株式会社セキュアアクシス,未経験者が9割 初級エンジニア,埼玉県,月給18万円～50万円,9日前,マイナビ転職
株式会社安信エンタープライズ,未経験からはじめるITエンジニア／完週休2日／年休128日,埼玉県,"月給21万5,000円～",3日前,doda
株式会社アイフリークスマイルズ,ITエンジニアになる過程、知りたい?／ITサポート・PG,埼玉県,月給18万円～50万円,21日前,リクナビNEXT
有限会社デジタルパイプライン,ストレスフリー宣言 ITエンジニアをもっと自由に楽しむ,埼玉県,月給25万円～,16日前,マイナビ転職
株式会社META GAMES,未経験から挑戦!メタバース・ゲーム関連のITエンジニア,埼玉県,月給18万円～80万円,29日前,リクナビNEXT
株式会社アイザック,新しい技術を経験できる ITエンジニア 1次請け／受託が90%超,埼玉県,月給30万円～60万円,公開していません,マイナビ転職
株式会社S&S,PG,埼玉県,月給24万円～,16日前,type
株式会社エクスマート,在宅勤務／社内SE,埼玉県,月給20万円～50万円,8日前,リクナビNEXT
AI-System株式会社,技術者重視 月給35万～ 前職給保障 面接1回／SE・PG,埼玉県,月給35万円～,20日前,リクナビNEXT
株式会社プラン・アンド・ディー,ITエンジニア／前給保証／基本定時退社,埼玉県,年収350万円～800万円,9時間前,doda
株式会社ビーズワン,プログラマ,埼玉県 川越市 本川越駅 徒歩8分,月給22万円～35万円,公開していません,株式会社ビーズワン
株式会社東北電子計算センター,ワンランク上のシステムエンジニア・プログラマー 在宅勤務可,埼玉県,月給24万円～,2日前,リクナビNEXT
株式会社ITPM,ITエンジニア,埼玉県,"月給22万5,300円～70万円",13日前,type
株式会社エスプリフォート,顧客&エンジニア、両方の満足度をとことん追求! SE・PG,埼玉県,月給24万円～45万円,16日前,マイナビ転職
株式会社ルトラ,フルリモートエンジニア 案件希望100%通ります／9割が年収UP／平均還元率73%／在宅手当有,埼玉県,月給30万円～80万円,10日前,エン転職
株式会社インビリティー,業界未経験から、スクールと実践で学べる! SE・PG,埼玉県,月給20万円～50万円,19日前,マイナビ転職
株式会社ソーシャルコミュニケーションズ,ITエンジニア,埼玉県,年収300万円～600万円,公開していません,キャリコネ転職
株式会社エスティーエーリアタイズ,未経験歓迎のIT・ゲームエンジニア,埼玉県,月給18万円～,公開していません,doda
BOX合同会社 ITs,エンジニアもめざせるITアシスタント事務,埼玉県 加須市                                                                                                                                                                その他 (8),"月給23万5,000円～30万円",5日前,かんたん応募
株式会社ウイングプラス,開発エンジニア,埼玉県,月給26万円～60万円,9日前,type
東和ソリューションエンジニアリング株式会社,インフラエンジニア,埼玉県,公開していません,27日前,type
オブザーブ株式会社,前職給与保証 最新技術に挑戦できる ITエンジニア,埼玉県,月給38万円～,2日前,マイナビ転職
合同会社日本トレイドロフト,プログラマー 未経験OK／マークアップ・フロントエンドエンジニア・大手WEBサイト制作,埼玉県 さいたま市 北区,月給26万円～49万円,9日前,合同会社日本トレイドロフト
株式会社KDDIエボルバ,福利厚生充実 KDDIグループのITエンジニア 未経験歓迎,埼玉県,月給21万円～25万円,17日前,マイナビ転職
E-com株式会社,ITエンジニア,埼玉県,月給33万円～80万円,2日前,type
株式会社アクシス・クリエイト,ITエンジニア,埼玉県,"月給21万7,000円～",16日前,type
株式会社タスネット,インフラエンジニア／年休125日・残業月10時間程・研修充実,埼玉県,"月給23万9,000円～",公開していません,doda
有限会社プレザント,ITエンジニア 直請案件だから高待遇／給与UP実績多数,埼玉県,月給25万円～55万円,8日前,マイナビ転職
株式会社ツリーベル,開発エンジニア／前職給与保証／自社内開発・在宅勤務案件あり,埼玉県,月給25万円～60万円,6日前,doda
カコウ株式会社,ITエンジニア 完休2日 &年休125日／エンジニアへの還元率73%,埼玉県,月給25万円～80万円,公開していません,エン転職
株式会社BrandingEngineer,ITエンジニア／リモート・副業相談OK／カジュアル面談歓迎,埼玉県,年収400万円～,3日前,doda
株式会社フレスタ,開発エンジニア テレワーク可 定着率90% Web面接1回,埼玉県,月給30万円～65万円,公開していません,マイナビ転職
株式会社ブライトターナー,1対1の徹底フォローで成長できる ITエンジニア 年休125日～,埼玉県 さいたま市,月給18万円～60万円,9日前,マイナビ転職
パーソルエクセルHRパートナーズ株式会社 キャリ...,WEB制作・編集／IT・通信関連,埼玉県 さいたま市 北与野駅,"時給2,000円～2,200円",12日前,はたらこねっと
株式会社フォーカスシステムズ,2023 新卒採用 情報処理,埼玉県,"月給19万1,400円～21万円",27日前,リクナビ2023
NEXT株式会社,ITエンジニア／初年度年収450万円～,埼玉県,"月給37万5,000円～83万3,334円",公開していません,doda
フューチャー・スクウェア株式会社,開発エンジニア,埼玉県,公開していません,27日前,type
株式会社アイサット,理想の会社で理想のキャリアを! インフラエンジニア,埼玉県,"月給28万円～47万5,000円",公開していません,マイナビ転職
東毛情報開発株式会社,ソフトウェアエンジニア,埼玉県,年収350万円～450万円,公開していません,キャリコネ転職
株式会社わさび,3年で年収1000万円目指せる 総合職,埼玉県,月給30万円～80万円,17日前,マイナビ転職
株式会社エスティーエークリーフ,未経験入社多数活躍!研修充実 ゲーム開発・ITエンジニア,埼玉県,月給18万円～,8日前,リクナビNEXT
株式会社ドリームアカデミー,2023 新卒採用 ソフトウェア,埼玉県,"月給18万5,000円～20万円",14日前,リクナビ2023
株式会社金融情報サービス,安定企業で業界の最先端へ! システム開発・インフラ設計,埼玉県 さいたま市,年収600万円～,20日前,リクナビNEXT
株式会社アイ・ディ・エイチ,ITエンジニア 還元率83%／年間130日～／副業可／前給保証／昨年入社全員が年収100万以上UP,埼玉県,月給35万円～100万円,7日前,エン転職
マッチスル株式会社,開発エンジニア,埼玉県,公開していません,9日前,type
Modis株式会社 Tech,開発エンジニア,埼玉県,公開していません,23日前,type
株式会社エクサ,製造業アプリ開発 ー埼玉勤務ー,埼玉県 和光市,年収600万円～900万円,公開していません,株式会社エクサ
株式会社Success Holders,開発エンジニア,埼玉県,月給30万円～80万円,6日前,イーキャリア
TKパートナーズ株式会社,ITエンジニア／前職給与保証／残業月10h／フルリモート可,埼玉県,月給30万円～70万円,20日前,doda
TDCフューテック株式会社,SE・PG,埼玉県 さいたま市,年収357万円～400万円,9日前,かんたん応募
株式会社サイバーネーション,自社内開発&フルリモート案件あり ITエンジニア 前給保証,埼玉県 さいたま市,月給35万円～,公開していません,マイナビ転職
株式会社Nautik,プログラマ／システムエンジニア／経験者歓迎!未経験者もOK,埼玉県,"月給30万円～49万8,000円",2日前,type
CLINKS株式会社,未経験歓迎のITエンジニア／採用枠30名以上／導入研修充実,埼玉県,月給21万円～,3日前,doda
クレアニーズ株式会社,開発エンジニア／新規自社サービスを担当／年間休日123日以上,埼玉県,月給35万円～,公開していません,doda
株式会社Second,ゲームテスター／デバッガー 継続的なキャリアアップが築けます,埼玉県 さいたま市 浦和区,月給23万円～41万円,21日前,株式会社Second
AQソリューションズ株式会社,リーダー候補募集! 土日祝休み／年間休日127日,埼玉県,月給23万円～60万円,公開していません,マイナビ転職
ライトアーム株式会社,生保新契約システム保守開発,埼玉県 さいたま市 与野駅,月給～45万円,公開していません,modis
本田技研工業株式会社,スマートシティ実現に向けたV2G システム研究開発,埼玉県 和光市,公開していません,公開していません,マイナビAGENT
株式会社ファンリード,開発エンジニア,埼玉県,月給28万円～,6日前,type
株式会社CROSS ONE,ITエンジニア／未経験者も積極採用!／待機中も給与保障!／リモート・副業OK,埼玉県,"月給23万5,000円～50万円",7日前,エン転職
株式会社EXCEED,SE・PG テレワーク4割×残業月平均20時間以内,埼玉県,"月給22万4,000円～40万円",20日前,リクナビNEXT
株式会社アクセス情報テクノロジー,20代～30代の若手が活躍! ITプログラマー・SE,埼玉県,月給20万円～50万円,8日前,リクナビNEXT
株式会社クリエイティブ 東京支店,組立・組付け／機械・精密機器・金属,埼玉県 川口市 西川口駅 徒歩7分,"時給2,200円～2,500円",5日前,工場ワークス
株式会社KOSMO,倉庫管理・入出荷,埼玉県 草加市 獨協大学前駅 徒歩10分,"時給1,900円～2,000円",公開していません,バイトルPRO
株式会社ソシアス,IT総合職,埼玉県,月給20万円～,2日前,Agre
Yi株式会社,"10,000案件から選べる! ITエンジニア 前給保証 リモート80%",埼玉県,月給25万円～,20日前,マイナビ転職
ラーニンギフト株式会社,インフラエンジニア 案件選択可／昇給有／年休130日／残業少,埼玉県,月給23万円～35万円,6日前,マイナビ転職
株式会社フジソフトラボ,2023 新卒採用 ソフトウェア,埼玉県,"月給17万円～21万5,000円",公開していません,リクナビ2023
株式会社ウォーターウィッシュ,2カ月の自社内研修でITデビュー&資格も取得! ITエンジニア,埼玉県,"月給20万7,000円～25万円",14日前,マイナビ転職
アルテンジャパン株式会社,大規模・グローバル他、人気案件多数! SE・PG,埼玉県,月給27万円～50万円,20日前,リクナビNEXT
株式会社クォンタムリレーション,既卒歓迎／ITエンジニア／エンジニアデビューに最適!基本の「き」から教育します／未経験90%,埼玉県,年収250万円～350万円,19日前,Re就活
株式会社アルトナー,第二新卒／月給23万9000円上／ソフトウェア開発エンジニア,埼玉県,"月給23万9,000円～82万7,000円",6日前,リクナビNEXT
株式会社ブール・ジャパン,テストエンジニア,埼玉県 さいたま市 大宮駅,月給20万円～45万円,6時間前,マイベストジョブ
株式会社クロスゲームズ,業務系SE活躍中!大手メーカーとの協業案件も! ゲームPG,埼玉県,月給35万円～60万円,2日前,リクナビNEXT
株式会社ティーネットジャパン,100%業務決定中 設計・開発スタッフ 研修充実,埼玉県,"月給18万5,500円～33万2,000円",29日前,マイナビ転職
株式会社エジソン マイナビグループ,PM／インフラ,埼玉県,年収300万円～600万円,公開していません,マイナビAGENT
株式会社アライズ,未経験者向けオンライン研修あり／楽しく成長「ITエンジニア」,埼玉県,"月給23万円～33万8,000円",公開していません,doda
株式会社アクセルコミュニケーション,在宅あり ネットワークエンジニア募集,埼玉県 さいたま市 大宮駅 徒歩5分,月給28万円～,公開していません,エン派遣
UTエフサス・クリエ株式会社,フィールドエンジニア・サービスエンジニア／IT・通信関連,埼玉県 さいたま市 大宮駅 徒歩7分,"時給1,600円～",21日前,はたらこねっと
株式会社サンビット,初級エンジニア,埼玉県,月給23万円～35万円,6日前,type
株式会社NetFile,ITエンジニア／最新・トレンド技術に携われる,埼玉県,月給22万円～55万円,27日前,type
CSエコー株式会社,未経験からITエンジニアへ／未経験の仲間と一緒にスタート,埼玉県 さいたま市 浦和駅 徒歩5分,月給20万円～,19日前,doda
株式会社樋口総合研究所,ITエンジニア／在宅勤務多数／ホワイト企業認定プラチナ取得,埼玉県 さいたま市 大宮駅,"月給20万8,125円～75万円",公開していません,doda
新日本テクトス株式会社,開発エンジニア,埼玉県,年収350万円～650万円,27日前,type
株式会社アルス・ウェアー,SE／PL・PM 受託開発&リモートメイン 社員離職率0%,埼玉県,月給35万円～,20日前,リクナビNEXT
株式会社アズテックス,システムエンジニア,埼玉県,月給25万円～50万円,公開していません,U29JOB
株式会社Ka-Noa,システムエンジニア,埼玉県 戸田市                                                                                                                                                                その他 (4),月給50万円～100万円,公開していません,かんたん応募
株式会社トリニアス,Webデザイナー／未経験向けの研修充実／残業月10h以内,埼玉県,月給20万円～50万円,公開していません,doda
株式会社一蔵,プロジェクトリーダー,埼玉県 さいたま市 日進駅,公開していません,29日前,クリーデンス
UT エフサス・クリエ株式会社,未経験可のCE!タブレット等の保守,埼玉県 さいたま市 大宮駅 徒歩10分,"時給1,550円",公開していません,エン派遣
北辰商事株式会社,2023 新卒採用 スーパー,埼玉県 さいたま市 桜区,"月給18万9,000円～21万円",公開していません,キャリタス就活2023
株式会社フューチャーブレイン,土日休み完全週休2日制のシステムエンジニア,埼玉県 川口市,"年収260万円～1,200万円",19日前,株式会社フューチャーブレイン
フォーザウィン株式会社,インフラエンジニア 経験者 前給以上確約 面接保証,埼玉県,月給48万円～,16日前,マイナビ転職
株式会社キー・ステーション21,インフラエンジニア,埼玉県,年収300万円～,13日前,type
株式会社グローバル・インフォメーション・テクノロ...,経験ゼロからスタートできるITエンジニア／残業平均8.4時間,埼玉県,"月給22万2,000円～",6日前,doda
株式会社クルーク,システム開発／ネットワーク・サーバー設計・構築・運用・保守,埼玉県,月給30万円～45万円,公開していません,40～50代の転職 FROM40
恒和システム株式会社,業務系システムエンジニア,埼玉県,年収300万円～450万円,公開していません,キャリコネ転職
