株式会社日本ビジネスデータープロセシングセンター,分岐点で悩んでいるあなたへ インフラエンジニア／設計・構築,埼玉県,月給21万円～45万円,1日前,リクナビNEXT
株式会社インフィニ,初級ITエンジニア,埼玉県,月給23万円～,9日前,type
株式会社WASABI,ITエンジニア 自由すぎ 還元率75%以上 リモート82%超 低残業休み自由,埼玉県,月給35万円～80万円,19日前,女の転職type
株式会社SNSソフト,エンジニア Python資格取得率トップクラス／リモート9割,埼玉県,月給40万円～,20日前,リクナビNEXT
セントランス株式会社,定着率90%!安定して働ける環境が魅力／アプリ等の開発／PG,埼玉県,月給22万円,19日前,リクナビNEXT
株式会社サクヤ,フロントエンドエンジニア,埼玉県,年収350万円～600万円,1日前,Green
株式会社ルピナスファクトリー,インフラエンジニア／将来独立をしたい方も大歓迎,埼玉県 さいたま市 南区,月給23万円～25万円,公開していません,かんたん応募
株式会社クエスト・システム・デザイン,SE,埼玉県,年収300万円～860万円,公開していません,PROSEEK
株式会社スタイル・フリー,アプリ・システム開発／インフラ設計・構築 年収UPの実績多数,埼玉県,月給30万円～,8日前,リクナビNEXT
株式会社クリエイト・マンパワーサービス,インフラ&NWエンジニア,埼玉県 さいたま市 土呂駅 徒歩10分,月給52万円～55万円,28日前,エン派遣
ファイブスターズゲーム株式会社,テレワークも 挑める、試せる、楽しめる ゲームエンジニア,埼玉県,月給23万円～50万円,6日前,リクナビNEXT
株式会社オルベック,「年齢的にこの先不安だな…」  代表「なんとか私が頭を下げてでも仕事を取ってきます!,埼玉県 さいたま市,年収480万円～960万円,公開していません,かんたん応募
株式会社i‐NOS,Salesfoce開発エンジニア募集,埼玉県,年収421万円～518万円,公開していません,doda
株式会社ワクト,開発エンジニア／年間休日125日以上／リモートワーク9割以上,埼玉県,月給30万円～80万円,公開していません,doda
サンライズシステム株式会社,前給保証! ITエンジニア フルリモート可／全国から応募OK,埼玉県,月給40万円～,公開していません,マイナビ転職
ランスタッド株式会社 randstad tech...,事務×ITで理想の将来を 経験ゼロから始めるIT事務／SE,埼玉県,月給23万円～,19日前,リクナビNEXT
株式会社グロース,初級エンジニア／月給25万／IT知識ゼロでもOK／住宅手当あり／20～30代活躍中,埼玉県 さいたま市 西区,月給25万円～,9日前,女の転職type
株式会社C-mind,ITエンジニア／前給保証／フルリモート／自社サービスへ挑戦,埼玉県,月給35万円～70万円,21日前,doda
株式会社ウイルテック,残業12.7h／上場企業／未経験歓迎 アプリ開発・サーバ運用,埼玉県,月給22万円～55万円,20日前,リクナビNEXT
ソリッドコミュニケーション株式会社,2023 新卒採用 ソフトウェア,埼玉県,"月給16万円～33万1,000円",公開していません,リクナビ2023
株式会社アイエム,AI案件に挑戦できる! 開発エンジニア 年休124日／フレックス,埼玉県,月給30万円～50万円,公開していません,マイナビ転職
