株式会社JMDC,WEBエンジニア 副業可能／在宅勤務可能／マザーズ上場,東京都 港区 大門駅,年収467万円～902万円,19日前,doda
ソニーグローバルマニュファクチャリング&オペレー...,WEBエンジニア,東京都 品川区 大崎駅,年収500万円～800万円,公開していません,doda
株式会社スーパーソフトウエア,WEBエンジニア,東京都 渋谷区 恵比寿駅,年収500万円～900万円,公開していません,doda
株式会社ライズウィル,2025年上場目標! Web系エンジニア 100%自社内開発,東京都 中央区 水天宮前駅 徒歩3分,月給25万円～55万円,4時間前,マイナビ転職
株式会社コロプラ,Webエンジニア,東京都 渋谷区 恵比寿駅,公開していません,6日前,マイナビAGENT
株式会社Silbird,Webゲームエンジニア,東京都 千代田区,年収500万円～600万円,公開していません,paiza転職
株式会社アイスタイル,Webエンジニア 東証一部上場／日本最大級の自社美容サイト@...,東京都 港区 六本木一丁目駅,年収500万円～700万円,12日前,doda
クラシコ株式会社,webエンジニア 世界が注目する白衣メーカー／5.5億の資金...,東京都 港区,年収500万円～650万円,26日前,doda
株式会社エムステージ,WEBエンジニア／医療に特化した総合人材会社・医師の求人サイ...,東京都 品川区 大崎駅 徒歩2分,年収540万円～750万円,13日前,doda
株式会社GORACREW,"WEBシステムエンジニア／Ruby,Java／toC向け／フ...",東京都 千代田区 東京駅,公開していません,17日前,株式会社GORACREW
株式会社オープンハウス,Webフロントエンジニア,東京都 千代田区 有楽町駅,"年収800万円～1,500万円",公開していません,doda
ディプロス株式会社,HTML WEBエンジニア,東京都 港区,月給24万円,6日前,ディプロス株式会社
BASE株式会社,BASE Webアプリケーションエンジニア／Pay ID,東京都 港区 六本木駅 徒歩10分,"年収500万円～1,000万円",公開していません,マイナビAGENT
株式会社アンリミテッド,業務システム・WEB開発エンジニア ～様々な案件に関わりキャ...,東京都 台東区,年収400万円～600万円,公開していません,doda
株式会社OKUSYSTEM,Webシステムエンジニア,東京都 台東区 上野駅 徒歩8分,月給21万円～,公開していません,U29JOB
日本システム技術株式会社,Webアプリケーションエンジニア／金融機関向け自社パッケージ...,東京都 港区 品川駅,年収440万円～652万円,5日前,doda
株式会社ヘルスベイシス 案件ごとに勤務場所は、異...,WEBエンジニア PM フリーランス,東京都 渋谷区 恵比寿駅,月給40万円～80万円,15時間前,株式会社ヘルスベイシス
スターフィールド株式会社,Webエンジニア,東京都 新宿区 高田馬場駅 徒歩5分,年収400万円～770万円,公開していません,paiza転職
チームラボ株式会社,チームラボ 2022新卒／大規模開発に携われるWebアプリエ...,東京都 千代田区 小川町駅 徒歩1分,年収300万円～,公開していません,かんたん応募
株式会社エキサイト,WEB開発エンジニア,東京都 中央区 人形町駅 徒歩3分,年収380万円～650万円,27日前,paiza転職
Mikatus株式会社,Webエンジニア,東京都 中央区 馬喰町駅,年収500万円～700万円,公開していません,doda
ビズメイツ株式会社,Webエンジニアリーダー,東京都 千代田区 淡路町駅,年収500万円～700万円,公開していません,doda
株式会社力堂,WEB開発エンジニア,東京都 新宿区 都庁前駅,月給22万円～,公開していません,株式会社力堂
日本ディクス株式会社,Webアプリケーションエンジニア／金融・流通・製造業種向けシ...,東京都 港区 田町駅,年収550万円～700万円,公開していません,doda
株式会社WITS,WEB／オープン系エンジニア,東京都 豊島区 東池袋駅 徒歩6分,月給70万円～80万円,公開していません,株式会社WITS
コムテックスソリューションズ株式会社,Webエンジニア,東京都,年収480万円～840万円,24日前,ほくりくFIT転職
フリー株式会社,Webアプリケーションエンジニア,東京都,"年収500万円～1,200万円",4日前,Spring転職エージェント
ファイナンシャルテクノロジーシステム株式会社,オープン・WEB系エンジニア,東京都 千代田区 日比谷駅,年収400万円～800万円,5日前,doda
株式会社インターワークス,Webエンジニア ～東証1部上場／年間休日125日～,東京都 港区 虎ノ門駅,年収420万円～480万円,16日前,doda
株式会社ヘッドウォータース,最新技術にも挑戦できるWebエンジニア／在宅勤務可／土日祝休,東京都 新宿区 西新宿駅 徒歩2分,月給30万円～54万円,16日前,doda
株式会社もしも,webアプリケーションエンジニア,東京都 品川区 天王洲アイル駅 徒歩7分,年収400万円～800万円,公開していません,paiza転職
朝日インタラクティブ株式会社,Webエンジニア,東京都 千代田区,年収400万円～600万円,5時間前,ワークポート
アイザックヒューマンソリューションズ株式会社,Webシステムエンジニア 2017年設立 創業メンバー,東京都 千代田区 秋葉原駅,月給32万円～80万円,公開していません,アイザックヒューマンソリューションズ株式会社
メディアマックスジャパン株式会社,Webエンジニア,東京都 港区 乃木坂駅,年収400万円～,公開していません,paiza転職
株式会社ケップル,スタートアップ投資を支援するSaaS「FUNDBOARD」の...,東京都 渋谷区 神泉駅 徒歩5分,"月給33万3,000円～58万3,000円",26日前,エンジニアHubキャリア
株式会社キュービック,WEBエンジニア,東京都 新宿区,年収400万円～700万円,公開していません,株式会社キュービック
ニフティライフスタイル株式会社,Webサービスエンジニア,東京都 新宿区,年収400万円～900万円,23日前,パソナキャリア
ディップ株式会社,webエンジニア 自社DXプロダクト「コボット」の開発業務,東京都 渋谷区 渋谷駅,年収400万円～700万円,公開していません,doda
株式会社ビズリーチ,webエンジニア ～SI出身歓迎／キャリアの診断サービス／マ...,東京都 渋谷区 渋谷駅,"年収550万円～1,000万円",公開していません,doda
株式会社シライ,Webエンジニア ～自社ECサイト開発・運用／土日休み／残業...,東京都 台東区 浅草橋駅,年収300万円～600万円,公開していません,doda
株式会社アイシーズ,Webエンジニア,東京都 千代田区 秋葉原駅 徒歩1分,月給25万円～50万円,公開していません,株式会社アイシーズ
日本コンピュータシステム株式会社,上級WEBシステムエンジニア,東京都 港区 虎ノ門駅,年収480万円～700万円,公開していません,doda
スリーワンシステムズ株式会社,Webエンジニア／リーダー ～長期就業したい方／大手企業から...,東京都 中央区 小伝馬町駅,年収400万円～600万円,5日前,doda
株式会社ブレインパッド,Webエンジニア～自社サービス／レコメンドエンジン搭載プライ...,東京都 港区 白金台駅,年収550万円～650万円,公開していません,doda
エスディーテック株式会社,WEBアプリエンジニア 賞与年3回 年間休日127日 自社製...,東京都 港区 品川駅,年収435万円～525万円,19日前,doda
アットホーム株式会社,Webエンジニア,東京都 千代田区 内幸町駅,年収400万円～700万円,公開していません,doda
株式会社D2CR,Webアプリケーション開発エンジニア,東京都 港区,公開していません,5日前,type 転職エージェント
スマートシェア株式会社,Webアプリケーションエンジニア,東京都 港区,公開していません,公開していません,マイナビAGENT
株式会社システムフロンティア,Web系システムエンジニア／大手ISP向けシステム,東京都,年収394万円～685万円,公開していません,doda
株式会社CureApp,WEBアプリエンジニア 治療アプリ／フルリモート可,東京都 中央区,年収400万円～600万円,9日前,リクルートエージェント
株式会社ネクソン,Webアプリケーションエンジニア,東京都 港区 六本木一丁目駅,年収500万円～600万円,公開していません,doda
株式会社オーシーエム,Web系エンジニア 豊富な休暇で定着率バツグン,東京都 港区 新橋駅 徒歩5分,"年収420万円～1,200万円",公開していません,株式会社オーシーエム
エヌシーアイ総合システム株式会社,Webエンジニア,東京都 中野区 中野坂上駅,年収440万円～560万円,公開していません,doda
株式会社イーリバースドットコム,Webエンジニア,東京都 江東区 豊洲駅,年収500万円～850万円,公開していません,doda
株式会社フィジオ,webエンジニア ～大手・プライム案件7割以上／最先端技術も...,東京都 新宿区 新宿駅,"年収600万円～1,200万円",公開していません,doda
GMOリサーチ株式会社,Webエンジニア職,東京都 渋谷区 渋谷駅,年収400万円～700万円,公開していません,doda
株式会社シンクロ・フード,自社サイトのWEB開発エンジニア,東京都 渋谷区 恵比寿駅,年収450万円～900万円,13日前,doda
オーマイグラス株式会社,ウェブエンジニア,東京都 港区 田町駅 徒歩10分,年収500万円～700万円,公開していません,paiza転職
株式会社アライヴテック,SE／PG／IT・クリエイティブ 働きやすさが魅力 WEBエ...,東京都 千代田区,月給30万円～60万円,公開していません,株式会社アライヴテック
株式会社ゲオホールディングス,情報システム課 Webプログラマー・エンジニア,東京都 豊島区 大塚駅 徒歩1分,年収500万円～600万円,公開していません,U29JOB
株式会社feat,Webアプリケーション開発エンジニア ～3年連続130%売上...,東京都,年収360万円～700万円,4日前,Spring転職エージェント
インフォサイエンス株式会社,webアプリケーションエンジニア～国内No.1シェア製品保有...,東京都 港区 田町駅,年収450万円～650万円,15日前,doda
株式会社ネクストスケープ,Webアプリケーションエンジニア,東京都 新宿区 都庁前駅,年収603万円～805万円,公開していません,doda
株式会社システムアイ,WEBエンジニア,東京都 中央区,年収400万円～600万円,公開していません,doda
株式会社カインズテクノロジーズ,WebスクラムGエンジニア,東京都 港区 表参道駅,"年収500万円～1,500万円",16日前,doda
株式会社ガイエ,Webアプリケーションエンジニア,東京都 千代田区 半蔵門駅,年収320万円～600万円,6日前,doda
株式会社エー・アイ・エム スタッフ,Web・オープン系エンジニア,東京都 千代田区 半蔵門駅 徒歩2分,"月給26万5,000円～42万円",公開していません,株式会社エー・アイ・エム スタッフ
SGフィルダー,WEB系エンジニア,東京都 港区,年収350万円～750万円,公開していません,SGフィルダー
株式会社クロスキャット,システムエンジニア／官公庁 Web系システム構築,東京都 港区 品川駅,年収400万円～600万円,26日前,doda
株式会社シーディーアイ,自社WEBアプリ開発エンジニア 裁量を持った業務の進め方が可能,東京都 中央区,年収600万円～900万円,17日前,リクルートエージェント
株式会社一休,Webアプリケーションエンジニア,東京都 港区 赤坂見附駅,"年収440万円～1,500万円",公開していません,doda
株式会社MTG,Webエンジニア ～SIXPAD／ReFa等ヒット製品～,東京都 中央区 茅場町駅,年収600万円～800万円,公開していません,doda
ライフスタイルデザイン株式会社,転勤なし&殆どが自社案件!WEBエンジニア募集,東京都 渋谷区 恵比寿駅 徒歩7分,月給30万円～,公開していません,ライフスタイルデザイン株式会社
ロジックススクエア株式会社,フロントエンドWebエンジニア,東京都 千代田区 神田駅 徒歩6分,月給28万円～40万円,公開していません,ロジックススクエア株式会社
マックシステム株式会社,Webシステム開発エンジニア,東京都 豊島区,"月給20万5,000円～22万円",14時間前,専門学校の就活 Career Map
株式会社ホットファクトリー,WEBアプリケーション開発リーダー・エンジニア募集 PHP／...,東京都 港区 大門駅 徒歩4分,年収450万円～800万円,1日前,Find Job!
株式会社ケアネット,Webエンジニア ～医療従事者間のWebカンファレンスサービ...,東京都 千代田区 飯田橋駅,年収400万円～900万円,16日前,doda
GMOペパボ株式会社,Webアプリケーションエンジニア リモートOK,東京都 渋谷区,年収400万円～650万円,公開していません,パソナキャリア
株式会社セレス,Web開発エンジニア,東京都 世田谷区 用賀駅 徒歩1分,年収400万円～600万円,4日前,paiza転職
株式会社あすフィット,Web・オープン系エンジニア,東京都 千代田区,年収450万円～600万円,公開していません,キャリコネ転職
株式会社リクルート,WEBアプリケーションエンジニア,東京都 千代田区,"年収544万円～1,040万円",12日前,doda
株式会社エンテックス,Web系エンジニア AWS、5Gなど最先端領域で活躍し成長を...,東京都 新宿区 四ツ谷駅 徒歩5分,月給30万円～70万円,9日前,マイナビ転職
Person's株式会社,Web・オープン系システムエンジニア／通信・インターネット・...,東京都 新宿区 新宿御苑前駅                                                                                                                                    その他 (33),月給40万円～46万円,公開していません,バイトルPRO
株式会社bloom,Webデザイナー／インフラエンジニア／IT・クリエイティブ ...,東京都 中央区 茅場町駅,月給20万円～,1日前,株式会社bloom
株式会社グッドワークス,システムエンジニア／WEB、アプリ,東京都,年収420万円～650万円,公開していません,マイナビAGENT
株式会社アイエスエイプラン,Web系エンジニア,東京都 中央区 勝どき駅 徒歩5分,年収300万円～700万円,公開していません,doda
株式会社Jストリーム,Webエンジニア,東京都 港区 芝公園駅,年収370万円～750万円,公開していません,doda
株式会社日本キャスト,Webエンジニア～20期以上連続黒字経営達成／教育制度充実～,東京都 千代田区 水道橋駅,年収406万円～706万円,公開していません,doda
株式会社justInCaseTechnologi...,Webフロントエンドエンジニア,東京都 中央区 茅場町駅 徒歩2分,"年収600万円～1,000万円",26日前,paiza転職
Tres Innovation株式会社,モダン環境のWebエンジニア,東京都 目黒区 中目黒駅 徒歩5分,月給30万円～60万円,1日前,type
株式会社ウィルゲート,Webアプリケーションエンジニア／スクラム開発・アジャイル形式,東京都 港区,年収400万円～600万円,19日前,リクルートエージェント
株式会社アイ・ティ・アール,Webエンジニア,東京都 新宿区 新宿駅 徒歩2分,年収700万円～800万円,12日前,type
株式会社ライテックス,Webエンジニア,東京都 三鷹市 三鷹駅 徒歩3分,年収320万円～600万円,公開していません,paiza転職
株式会社ソリューションウェア,Web開発エンジニア,東京都 千代田区 岩本町駅 徒歩3分,年収400万円～550万円,27日前,paiza転職
株式会社プログデンス,Web開発エンジニア ~開発スキルを活かして新規事業ビジネス...,東京都 千代田区 御茶ノ水駅 徒歩3分,年収450万円～900万円,公開していません,doda
株式会社リンクエッジ,Webアプリケーションエンジニア,東京都 渋谷区 渋谷駅,"年収500万円～1,000万円",公開していません,doda
チームラボエンジニアリング株式会社,fr-ag.エンジニア.Webアプリ .TLE.チームラボエ...,東京都 千代田区,公開していません,8日前,マイナビAGENT
株式会社テレビ朝日メディアプレックス,テクニカル部門を牽引するWebアプリケーションエンジニア／リ...,東京都 港区 六本木駅,年収550万円～700万円,公開していません,doda
株式会社イーゼ,WEB系エンジニア コンシューマー向けサービス開発／有名サイ...,東京都 千代田区 神保町駅,年収450万円～800万円,6日前,doda
パーソルキャリア株式会社,Webサービス企画エンジニア,東京都 千代田区,年収470万円～900万円,17日前,マイナビAGENT
株式会社Crunch Style,WEBエンジニア,東京都 渋谷区 恵比寿駅 徒歩2分,年収400万円～700万円,公開していません,paiza転職
株式会社ベルウクリエイティブ,Webアプリのセキュリティエンジニア,東京都 中央区 人形町駅,年収650万円～,27日前,doda
株式会社はてな,Webアプリケーションエンジニア エンジニアをワクワクさせる...,東京都 港区 表参道駅,年収500万円～724万円,26日前,doda
東京海上日動システムズ株式会社,Webアプリエンジニア,東京都 中央区 銀座駅,"年収480万円～1,100万円",公開していません,paiza転職
株式会社アルファドライブ,WEBアプリケーションエンジニア フルリモート可／フルフレッ...,東京都 千代田区,"年収510万円～1,000万円",17日前,リクルートエージェント
株式会社ボルテージ,Webアプリエンジニア,東京都 渋谷区 恵比寿駅 徒歩5分,"月給35万7,000円～",6日前,U29JOB
株式会社メディカルレビュー社,Web開発エンジニア ～ライター所属数業界1位／転勤なし～,東京都 文京区 湯島駅,年収500万円～800万円,15日前,doda
アイ・モバイル株式会社,WEBアプリエンジニア,東京都 港区 外苑前駅 徒歩4分,月給26万円～,5日前,U29JOB
かんぽシステムソリューションズ株式会社,Webアプリケーションエンジニア,東京都 品川区 大崎駅,年収600万円～800万円,20日前,doda
株式会社アドウェイズ,マーテック リードエンジニア／社内WEBシステム ～フレック...,東京都 新宿区 西新宿駅,年収600万円,公開していません,doda
株式会社KDDIウェブコミュニケーションズ,Webアプリケーションエンジニアマネージャー,東京都 港区,公開していません,公開していません,マイナビAGENT
株式会社灯火,SE Webエンジニア,東京都 渋谷区 恵比寿駅 徒歩8分                                                                                                                                    その他 (6),年収400万円～500万円,公開していません,株式会社灯火
株式会社マーケットプレイス,Webエンジニア,東京都 港区,年収420万円～600万円,公開していません,paiza転職
株式会社GxP,Web開発エンジニア,東京都 新宿区 新宿駅 徒歩8分,年収450万円～,公開していません,paiza転職
ニフティ株式会社,WEBアプリケーションエンジニア／プロバイダサービス「@ni...,東京都 新宿区 西新宿駅,年収470万円～700万円,22日前,doda
レプラホーン株式会社,Webアプリエンジニア「エンジニアにとって最良の職場を」体現...,東京都 豊島区 池袋駅,年収320万円～500万円,19日前,doda
ビットキャッシュ株式会社,Webアプリケーションエンジニア,東京都 港区,年収600万円～800万円,19日前,リクルートエージェント
東京カレンダー株式会社,WEBエンジニア・リードエンジニア,東京都 品川区 大崎駅 徒歩5分,年収600万円～900万円,公開していません,paiza転職
SEモバイル・アンド・オンライン株式会社,WEB開発エンジニア 19時には退社／時短・週4勤務も可,東京都 新宿区,年収400万円～840万円,2日前,doda
株式会社マイナビEdge,WEB系開発エンジニア,東京都 港区,年収300万円～600万円,公開していません,マイナビAGENT
エムスリーキャリア株式会社,テクノロジーによる事業成長と医療従事者の生産性向上を実現する...,東京都 港区 神谷町駅 徒歩5分,"月給35万7,000円～57万1,000円",15日前,エンジニアHubキャリア
株式会社アークシステム,WEBアプリケーション開発エンジニア,東京都 中央区,年収462万円～532万円,公開していません,マイナビAGENT
株式会社eヘルスケア,Web開発エンジニア～最大規模のプラットフォーム「病院なび」...,東京都 千代田区 麹町駅,年収450万円～650万円,5日前,doda
株式会社Amane,Webサービスエンジニア,東京都 品川区,"年収650万円～1,200万円",16日前,doda
株式会社PinT,インフラサービスにおけるwebアプリエンジニア,東京都 千代田区 大手町駅,"年収800万円～1,000万円",公開していません,doda
株式会社ウィナス,Webアプリケーションエンジニア,東京都 豊島区 池袋駅,年収420万円～600万円,5日前,doda
株式会社ゴーガ,Webアプリケーションエンジニア,東京都 渋谷区 渋谷駅 徒歩3分,年収600万円～800万円,10日前,paiza転職
東海ビジネスサービス株式会社,WEB開発エンジニア 希望勤務地・案件を考慮／ITコンサルへ...,東京都,年収400万円～600万円,5日前,doda
ソニーネットワークコミュニケーションズ株式会社,Web開発エンジニア,東京都 品川区 品川シーサイド駅 徒歩6分,"年収480万円～1,000万円",12日前,paiza転職
フラクタルシステムズ株式会社,Web開発エンジニア AI／人口知能／ディープラーニング／機...,東京都 千代田区,公開していません,公開していません,マイナビAGENT
株式会社ビデックス,WEBエンジニア,東京都 渋谷区 代々木上原駅 徒歩2分,"月給37万5,000円～62万5,000円",公開していません,U29JOB
株式会社SmartHR,Webアプリケーションエンジニア／労務管理クラウドシェアNo...,東京都 港区,年収450万円～900万円,8日前,doda
株式会社ブックウォーカー,Webフロントエンドエンジニア,東京都 千代田区,年収400万円～900万円,5日前,パソナキャリア
株式会社WILLCO,WEBアプリケーションエンジニア,東京都 港区 赤坂見附駅 徒歩3分,月給28万円～50万円,公開していません,株式会社WILLCO
株式会社efit,WEBエンジニア,東京都 中央区 茅場町駅 徒歩3分,"年収600万円～1,000万円",公開していません,paiza転職
株式会社ディー・エヌ・エー,Webフロントエンジニア～ヘルスケアスマホアプリ「kenko...,東京都 渋谷区 初台駅,"年収600万円～1,000万円",19日前,doda
千株式会社,Webエンジニア,東京都 千代田区 大手町駅,年収550万円～700万円,公開していません,doda
アスクル株式会社,WEBアプリエンジニア ～年商500億の大規模ECサイト「L...,東京都 江東区 豊洲駅,"年収600万円～1,200万円",15日前,doda
株式会社ネットラーニングホールディングス,IT×教育分野 Webアプリケーションエンジニア／自社Saa...,東京都 新宿区 大久保駅,年収416万円～600万円,公開していません,doda
EGセキュアソリューションズ株式会社,開発エンジニア／Webアプリケーションの脆弱性診断／東証一部...,東京都 港区 虎ノ門駅,年収400万円～800万円,5日前,doda
コンピューターマネージメント株式会社,Webアプリ開発エンジニア,東京都 千代田区 東京駅 徒歩2分,年収400万円～600万円,公開していません,paiza転職
株式会社サンカクカンパニー,Webエンジニア／大手案件多数・完全自社内開発／在宅勤務OK,東京都 渋谷区 代々木駅 徒歩6分,"月給22万5,000円～60万円",公開していません,doda
株式会社Goals,Webアプリエンジニア AI等を用いた外食産業支援SaaSの...,東京都 港区 新橋駅,年収420万円～950万円,15日前,doda
株式会社トッカシステムズ,Web系インフラエンジニア,東京都 千代田区 神保町駅 徒歩3分,年収490万円～980万円,公開していません,paiza転職
株式会社D-design,Webシステムの開発エンジニア,東京都 新宿区,公開していません,公開していません,マイナビAGENT
