株式会社フォトシンス,WEBアプリケーションエンジニア 成長産業であるスマートロッ...,東京都 港区,年収500万円～750万円,17時間前,リクルートエージェント
アイ・ティ・リアライズ株式会社,Webエンジニア 就業環境良好・平均残業20h,東京都 品川区 五反田駅,年収400万円～700万円,公開していません,doda
株式会社キャリアインデックス,Webエンジニア,東京都 港区 白金台駅,年収500万円～800万円,20日前,doda
KYOKYU株式会社,SE 未経験WEBエンジニア／ゼロからエンジニアに挑戦／本気...,東京都 渋谷区,月給20万円～,21日前,KYOKYU株式会社
株式会社オンマックス,リードWebアプリケーションエンジニア,東京都 板橋区 新板橋駅 徒歩5分,年収400万円～450万円,公開していません,paiza転職
株式会社プレート,Webエンジニア WordPressのプロ集団 言語や技術の...,東京都 中央区,年収360万円～600万円,5日前,doda
株式会社ファンコミュニケーションズ,Webアプリエンジニア 残業月10h以内 月間60億アクセス...,東京都 渋谷区 渋谷駅 徒歩6分,"月給28万4,000円～",26日前,エン転職
株式会社こだわり,Web開発エンジニア#リモート可#直請け比率80%#スキルア...,東京都 品川区 目黒駅,年収360万円～780万円,公開していません,doda
株式会社TakeFunSystem,Web開発エンジニア,東京都 新宿区 新宿西口駅 徒歩1分,年収600万円～,公開していません,paiza転職
イシン株式会社,自社WEBメディアのWebエンジニア,東京都 新宿区 東新宿駅 徒歩5分,年収450万円～800万円,公開していません,イシン株式会社
株式会社博報堂,Webアプリケーションエンジニア,東京都 港区,公開していません,公開していません,type 転職エージェント
株式会社駅探,システムエンジニア／Webアプリケーション・スマホアプリの開発,東京都 新宿区 四ツ谷駅 徒歩3分,年収600万円～,公開していません,キャリコネ転職
株式会社信興テクノミスト,Webセキュリティ診断エンジニア,東京都 品川区 武蔵小山駅 徒歩11分,年収380万円～550万円,公開していません,U29JOB
株式会社リザーブリンク,WEBエンジニア,東京都 港区 青山一丁目駅 徒歩2分,年収400万円～600万円,公開していません,U29JOB
レッドフォース・グループ株式会社,Webオープン系エンジニア,東京都 港区,年収350万円～750万円,15時間前,レッドフォース・グループ株式会社
株式会社soeasy,Webエンジニア／サーバーサイド,東京都 千代田区,年収600万円～800万円,5日前,doda
スパイダープラス株式会社,Webエンジニア,東京都 豊島区 池袋駅,"年収450万円～1,200万円",13日前,doda
BUONO株式会社,WEB系システム開発エンジニア募集,東京都 渋谷区 渋谷駅 徒歩1分,月給25万円～100万円,公開していません,かんたん応募
BPS株式会社,WEB面接可 WEBエンジニア 100%自社内開発／残業20...,東京都 新宿区,年収480万円～700万円,10日前,リクルートエージェント
株式会社フリーセンター,Webエンジニア,東京都 渋谷区 渋谷駅,年収300万円～800万円,公開していません,株式会社フリーセンター
株式会社EventHub,Webエンジニア,東京都 千代田区 神田駅,年収550万円～900万円,26日前,doda
Morgan McKinley株式会社,ウェブアプリケーションエンジニア派遣,東京都 世田谷区 二子玉川駅 徒歩5分,"時給3,500円～4,000円",13日前,エン派遣
株式会社ASO,Webエンジニア,東京都 台東区 御徒町駅 徒歩8分,年収300万円～450万円,公開していません,paiza転職
株式会社プリンチ,プログラマー WEBエンジニア 第二新卒、独学のみOK,東京都 新宿区,月給20万円,公開していません,株式会社プリンチ
株式会社マーズフラッグ,Webアプリケーションエンジニア／クラウド型自社Webサービス,東京都 中央区 京橋駅,"年収500万円～1,000万円",9日前,doda
アクトインディ株式会社,Webエンジニア,東京都 品川区 五反田駅 徒歩8分,"年収600万円～1,100万円",公開していません,paiza転職
ユニファイド・サービス株式会社,WEBアプリケーションエンジニア PKG開発および保守担当 ...,東京都 港区,年収400万円～500万円,8日前,doda
株式会社ココロザシ,前給与保証 WEBエンジニア リモート可 副業OK プライム...,東京都 港区,"年収600万円～1,000万円",29日前,doda
株式会社キッズライン,WEBエンジニア 登録者数12万人以上／日本にベビーシッター...,東京都 港区 六本木駅,年収500万円～600万円,公開していません,doda
株式会社マインリード クライアント先,実力発揮したい!新規事業を自分でリードしたい!Webエンジニ...,東京都 江東区 国際展示場駅 徒歩3分,月給32万円～53万円,公開していません,株式会社マインリード
株式会社ノーマーク,PHPエンジニア／スポーツ×WEBメディア開発,東京都 港区 六本木一丁目駅,年収360万円～600万円,公開していません,doda
株式会社ルーター,WEBエンジニア,東京都 渋谷区 参宮橋駅 徒歩6分,"月給27万5,000円～",26日前,U29JOB
株式会社ワンダーラスト,Webエンジニア／CTO候補,東京都 品川区 五反田駅 徒歩10分,年収500万円～850万円,公開していません,キャリコネ転職
ハンズラボ株式会社,Webアプリケーションエンジニア 東急ハンズグループ,東京都 新宿区,年収400万円～600万円,公開していません,doda
株式会社サンマリエ,Webエンジニア,東京都 渋谷区 初台駅 徒歩1分,年収450万円～700万円,公開していません,paiza転職
株式会社アルム,WEBエンジニア 医療業界の課題をITで解決する自社ITサー...,東京都 渋谷区,年収550万円～840万円,5日前,doda
株式会社フィーリスト,Webエンジニア,東京都 千代田区 秋葉原駅 徒歩5分,年収370万円～600万円,8日前,paiza転職
株式会社オノフ,WEBエンジニア,東京都 港区 外苑前駅 徒歩5分,年収450万円～800万円,公開していません,paiza転職
株式会社ミラボ,Webエンジニア／リーダー候補,東京都 千代田区 御茶ノ水駅,"年収650万円～1,000万円",11日前,doda
株式会社JapanTechnology,WEBアプリエンジニア,東京都 港区 浜松町駅 徒歩5分,"月給～49万5,000円",公開していません,株式会社JapanTechnology 本社
ハイディメンション株式会社,Webエンジニア 定着率95%／残業月20h以内／年間休日1...,東京都 中央区 宝町駅 徒歩3分,月給25万円～,29日前,エン転職
ヤマト運輸株式会社,Webサービス開発エンジニア リモート、フレックス勤務OK ...,東京都 中央区 京橋駅,"月給16万4,000円～",1日前,エン転職
株式会社マイクロウェーブ,Webバックエンドエンジニア,東京都 渋谷区 渋谷駅,年収450万円～700万円,2日前,doda
ネクスジェン株式会社,テックリード候補webアプリエンジニア～画像AIを用いた医療...,東京都 品川区 目黒駅,"年収780万円～1,200万円",公開していません,doda
株式会社オールアバウト,"Webアプリケーションエンジニア／月間総利用者数2,100万...",東京都 渋谷区 恵比寿駅,年収500万円～800万円,6日前,doda
Sasuke Financial Lab株式会社,自社プロダクトのフロントエンジニア／WEB保険で業界変革・完...,東京都 千代田区 大手町駅,年収500万円～700万円,15日前,doda
Rotoworks株式会社,Webアプリケーションエンジニア,東京都 港区,月給50万円～70万円,27日前,Rotoworks株式会社
株式会社ティビィシィ・スキヤツト,Webエンジニア,東京都 中央区 三越前駅,年収400万円～800万円,5日前,doda
ソーシャルワイヤー株式会社,Webエンジニア,東京都 港区 田町駅 徒歩5分,年収480万円～700万円,公開していません,paiza転職
Supership株式会社 ～KDDIグループ～,Webアプリケーションエンジニア／自社広告関連システムなどの...,東京都 港区 虎ノ門ヒルズ駅,年収500万円～900万円,公開していません,doda
Vリアリゼーション株式会社,WEBエンジニア 分析エンジニア・SE,東京都 港区 青山一丁目駅 徒歩4分,月給18万円～60万円,公開していません,Vリアリゼーション株式会社
リフリード株式会社,webエンジニア,東京都 渋谷区,年収350万円～600万円,公開していません,doda
株式会社wildidea,Webエンジニア,東京都 新宿区,月給40万円～70万円,2日前,エン転職
株式会社Japan technology,Webエンジニア,東京都 渋谷区 渋谷駅,"月給53万6,000円～63万円",公開していません,株式会社Japan technology
株式会社ウィルオブ・ワーク,WEB開発エンジニア～東証一部上場グループ／残業時間10.4...,東京都,年収350万円～650万円,公開していません,doda
株式会社エーム,Webオープン系エンジニア,東京都 豊島区 池袋駅 徒歩5分,年収400万円～,公開していません,paiza転職
株式会社静岡新聞社,Web開発エンジニア～新規事業の立ち上げ業務／フルリモート可...,東京都 中央区,年収500万円～800万円,19日前,doda
株式会社イング,WEBエンジニア~Shopifyを利用し大手クライアントをE...,東京都,年収350万円～600万円,公開していません,doda
株式会社BEL AIR,WEBアプリケーションエンジニア,東京都 中央区 東日本橋駅,年収550万円～900万円,26日前,doda
株式会社メガ,Webエンジニア,東京都 渋谷区,年収400万円～700万円,公開していません,paiza転職
株式会社共同通信デジタル,Webエンジニア 実務未経験OK／残業少なめ／フレックス,東京都 港区 汐留駅 徒歩1分,年収300万円～400万円,公開していません,エン転職
株式会社構造計画研究所,Web系ソフトウェアエンジニア ～独立系ITベンダ～,東京都 中野区 新中野駅,年収550万円～900万円,10日前,doda
株式会社ぐるなび,Webエンジニア／社内向け営業支援システム・CRM関連システ...,東京都 千代田区 日比谷駅,年収345万円～595万円,公開していません,doda
株式会社エニグモ,世界163国／会員数800万人越えCtoCソーシャルショッピ...,東京都 港区 青山一丁目駅 徒歩3分,"年収450万円～1,000万円",22日前,エンジニアHubキャリア
株式会社ミンカブ・ジ・インフォノイド,Webアプリケーションエンジニア 自社サービス「MINKAB...,東京都 千代田区 九段下駅,"年収450万円～1,000万円",19日前,doda
リンカーズ株式会社,Webエンジニア／金融機関向けマッチングプラットフォームの開発,東京都 千代田区 飯田橋駅,年収500万円～700万円,公開していません,doda
ノイン株式会社,Webフロントエンドエンジニア 大型資金調達済 業界注目度ト...,東京都 渋谷区,年収500万円～700万円,公開していません,マイナビAGENT
株式会社ポピンズホールディングス,Webエンジニア,東京都 港区 広尾駅,年収450万円～800万円,14日前,doda
Growfit株式会社,Webエンジニア,東京都 中央区 馬喰町駅 徒歩1分,年収400万円～700万円,公開していません,paiza転職
株式会社アイドマ・ホールディングス,webエンジニア、サーバサイドエンジニア,東京都 豊島区 池袋駅,年収350万円～600万円,公開していません,paiza転職
株式会社アットウェア,WEBエンジニア~大手クライアントに技術支援／先端Tech企業,東京都,年収400万円～800万円,1日前,doda
ボールドライト株式会社,Webエンジニア,東京都 新宿区,年収400万円～800万円,10日前,リクルートエージェント
株式会社エムフロ,Webエンジニア,東京都 渋谷区 代官山駅 徒歩6分,年収360万円～700万円,4日前,paiza転職
合同会社Weeybrid コワーキングスペース秋...,Webエンジニアの募集,東京都 千代田区 秋葉原駅 徒歩3分,月給55万円～84万円,公開していません,合同会社Weeybrid
株式会社ColorfulSystem,Webエンジニア,東京都 新宿区 新宿御苑前駅 徒歩5分,年収400万円～600万円,公開していません,paiza転職
株式会社カカクコム,WEBエンジニア,東京都 渋谷区 渋谷駅,年収458万円～700万円,9日前,doda
株式会社CyberKnot,Webエンジニア,東京都 港区 白金高輪駅 徒歩10分,年収400万円～500万円,公開していません,paiza転職
エナジー・ソリューションズ株式会社,Webエンジニア,東京都 千代田区,年収300万円～450万円,12時間前,paiza転職
コニカミノルタマーケティングサービス株式会社,Webアプリエンジニア／マーケティング業務DXサービス,東京都 中央区,"年収400万円～1,500万円",公開していません,doda
株式会社ケアクル,Webエンジニア,東京都 港区,年収400万円～600万円,1日前,paiza転職
株式会社マックスマウス,フロントエンドエンジニア／Webエンジニア,東京都 港区 赤坂見附駅,年収435万円～700万円,公開していません,doda
株式会社サックル,Webエンジニア,東京都 千代田区 御茶ノ水駅,年収400万円～700万円,公開していません,doda
株式会社フリークアウト,Webアプリケーションエンジニア,東京都 港区 六本木駅,"年収600万円～1,000万円",公開していません,doda
株式会社エイシル,WEB・オープン系エンジニア,東京都,年収300万円～500万円,公開していません,キャリコネ転職
株式会社i-Vinci,Webエンジニア・プログラマー,東京都 千代田区 神保町駅 徒歩4分,年収350万円～550万円,公開していません,paiza転職
スローガン株式会社,webエンジニア,東京都 港区 青山一丁目駅,年収500万円～700万円,公開していません,doda
AI CROSS株式会社,自社サービスのWebアプリエンジニア,東京都 港区 神谷町駅,年収600万円～900万円,23日前,doda
株式会社レバレッジ,Webアプリエンジニア パーソナル業界特化のメディア事業やマ...,東京都 渋谷区 神泉駅,年収400万円～700万円,16日前,doda
株式会社ビーグリー,webフロントエンドエンジニア,東京都 港区 外苑前駅,年収400万円～800万円,5日前,doda
株式会社知恵豆,Web／クラウド系エンジニア〜新しいことにチャンレンジできます,東京都 港区 虎ノ門駅 徒歩10分,年収350万円～700万円,21日前,かんたん応募
株式会社想隆社,Webエンジニア,東京都 千代田区 御茶ノ水駅 徒歩3分,年収450万円～600万円,公開していません,paiza転職
株式会社HRBrain,Webフロントエンドエンジニア／人事評価クラウド「HRBra...,東京都 渋谷区 渋谷駅,年収400万円～800万円,公開していません,doda
株式会社FP,Webエンジニアデビューをしませんか,東京都 千代田区 市ケ谷駅,月給19万円～,公開していません,株式会社FP
株式会社AVILEN,Webエンジニア 企業のDXをAIで支援,東京都 台東区 浅草橋駅,"年収500万円～1,100万円",公開していません,doda
株式会社ハンモック,Webエンジニア,東京都 新宿区,年収500万円～700万円,5日前,doda
株式会社タイムデザイン,Webエンジニア／自社サービス 「ツアービルダー」の開発／コ...,東京都 渋谷区,年収400万円～600万円,15日前,doda
株式会社フェニシス,Webエンジニア／人気アニメ・ゲームサイト担当,東京都 中央区 馬喰町駅,年収350万円～560万円,公開していません,doda
株式会社Sozi,WEBエンジニア ～クリエイター特化プロダクト／フルリモート～,東京都 千代田区 秋葉原駅,年収600万円～840万円,公開していません,doda
株式会社COMPASS,Webフロントエンジニア,東京都 文京区,年収700万円～950万円,20日前,doda
日本セーフティー株式会社,Web開発エンジニア,東京都 港区,年収312万円～430万円,6日前,paiza転職
株式会社アドベンチャー,WEBフルスタックエンジニア,東京都 渋谷区 渋谷駅 徒歩5分,公開していません,6日前,マイナビAGENT
株式会社エヌツーエスエム,Web開発エンジニア,東京都 千代田区 秋葉原駅 徒歩5分,公開していません,公開していません,株式会社エヌツーエスエム
株式会社サイバーエージェント,Webフロントエンドエンジニア,東京都 渋谷区 渋谷駅,"年収450万円～1,000万円",19日前,doda
株式会社ゼネテック,WEB・サーバ アプリケーション エンジニア,東京都 新宿区,公開していません,公開していません,マイナビAGENT
サイトカイン株式会社,Webシステムエンジニア～先進医療の医療のDX開発／年休12...,東京都 渋谷区,年収350万円～500万円,19日前,doda
Hmcomm株式会社,AI・音声認識を活用した自社商品のWEBエンジニア,東京都 港区 大門駅,年収500万円～700万円,公開していません,doda
株式会社クラベス,Webエンジニア,東京都 墨田区 両国駅 徒歩5分,年収300万円～400万円,12時間前,paiza転職
株式会社Center Force,経験者はもちろん未経験からでも可能 Webエンジニアのお仕事,東京都 千代田区                                                                                                                                    その他 (10),月給18万円～60万円,公開していません,株式会社Center Force
株式会社Brave,本気の方募集しています!0から実践付きの環境でWEBエンジニ...,東京都 千代田区,月給20万円～,公開していません,株式会社Brave
株式会社オプトロニクス社,webエンジニア,東京都 千代田区 飯田橋駅 徒歩10分,"月給21万3,000円～",公開していません,株式会社オプトロニクス社
株式会社レバテック,Ruby／サービス運用改善業務におけるウェブアプリケーション...,東京都 世田谷区 二子玉川駅,公開していません,公開していません,レバテックフリーランス
株式会社ハウテレビジョン,Webエンジニア,東京都 港区 六本木一丁目駅,年収400万円～800万円,公開していません,doda
ナイル株式会社,自動車領域のDXを加速するWebエンジニア,東京都 品川区 五反田駅 徒歩5分,"年収600万円～1,000万円",12日前,エンジニアHubキャリア
株式会社アルファポリス,自社サイトのWebエンジニア／月間2億PVの小説漫画投稿サイ...,東京都 渋谷区 恵比寿駅,年収420万円～630万円,15日前,doda
NTTセキュリティ・ジャパン株式会社,Webセキュリティエンジニア,東京都 千代田区 秋葉原駅,年収500万円～800万円,公開していません,doda
株式会社アスコエパートナーズ,自社サービスのより広域な普及に向け、ウェブアプリケーションエ...,東京都,年収400万円～800万円,4日前,en ミドルの転職
株式会社フェーズワン,WEBアプリエンジニア,東京都 文京区 湯島駅 徒歩1分,年収300万円～650万円,公開していません,キャリコネ転職
株式会社シスプライマリー,ITシステム開発会社のwebエンジニア,東京都 千代田区 淡路町駅 徒歩2分,月給27万円～50万円,5日前,株式会社シスプライマリー
ライブリッツ株式会社,Webエンジニア／一次産業のDX化で地域活性化を支援／社会貢...,東京都 品川区 大崎駅,年収500万円～800万円,公開していません,doda
オープンワーク株式会社,Webエンジニア～国内最大級のジョブマーケットプラットフォー...,東京都 渋谷区 渋谷駅,年収400万円～840万円,公開していません,doda
株式会社オープンドア,Webエンジニア 自社サービス 東証一部上場 旅行比較サイト...,東京都 港区 赤坂駅,年収400万円～600万円,13日前,doda
株式会社ブリスウェル,Webシステム開発エンジニア,東京都 港区,年収400万円～600万円,公開していません,doda
株式会社オプティム,Webアプリケーションエンジニア／AI・IoT関連サービス等,東京都 港区 浜松町駅,年収350万円～900万円,公開していません,doda
株式会社グローマス,WEBエンジニア,東京都 千代田区 神田駅,年収490万円～700万円,公開していません,doda
株式会社テンダ,WEB開発エンジニア,東京都 豊島区,年収450万円～550万円,公開していません,マイナビAGENT
株式会社エーアイスクエア,WEBアプリケーションエンジニア,東京都 千代田区 岩本町駅 徒歩1分,"月給37万5,000円～",12日前,U29JOB
株式会社ラユニオン・パブリケーションズ,Webエンジニア 行政や大手企業がメインクライアントの安定企...,東京都 千代田区 神保町駅,年収500万円～600万円,5日前,doda
株式会社コムコシステム,WEB系エンジニア～,東京都,年収450万円～640万円,9日前,doda
株式会社オーガランドECソリューション事業部,自社開発Webエンジニア,東京都 新宿区,"時給2,500円～3,500円",2日前,かんたん応募
株式会社プライムキャスト,Webエンジニア,東京都 千代田区 水道橋駅 徒歩5分,年収350万円～700万円,20日前,paiza転職
株式会社富士山マガジンサービス,WEBアプリケーションエンジニア,東京都 渋谷区 神泉駅 徒歩6分,年収350万円～600万円,2日前,U29JOB
株式会社シロ,WEBマークアップエンジニア・HTMLコーダー,東京都 港区 表参道駅,年収350万円～700万円,5日前,doda
株式会社CARTA HOLDINGS,Webアプリケーションエンジニア,東京都 渋谷区 渋谷駅,年収500万円～800万円,公開していません,doda
株式会社リンクベリ,Webフロントエンジニア,東京都 杉並区,年収400万円～800万円,28日前,paiza転職
株式会社ビザスク,Webエンジニア,東京都 世田谷区 池尻大橋駅                                                                                                                                    その他 (6),年収500万円～800万円,公開していません,doda
株式会社アイソルート,WEBエンジニア,東京都 渋谷区,年収350万円～600万円,5日前,doda
株式会社アピリッツ,Webエンジニア,東京都 渋谷区 明治神宮前駅 徒歩5分,年収350万円～600万円,公開していません,キャリコネ転職
株式会社センシンロボティクス,ドローンによる社会課題解決を目指す!Webアプリエンジニアを...,東京都 渋谷区,年収516万円～804万円,公開していません,doda
株式会社クリエイト工房,Webエンジニア 平均2～3年案件多数／月残業10h程／損保...,東京都 千代田区                                                                                                                                    その他 (3),年収400万円～500万円,1日前,doda
株式会社クエストホールディングス 株式会社ブラン...,Webエンジニア,東京都 新宿区 新宿駅 徒歩10分,月給25万円～,7日前,株式会社クエストホールディングス
ユアマイスター株式会社,Webエンジニア／新たな領域へ価値を提供／テクノロジーの力で...,東京都 世田谷区,年収504万円～768万円,公開していません,doda
株式会社アイ・エー・アイ,Web・オープン系開発エンジニア,東京都 千代田区 神保町駅 徒歩3分,年収620万円～,公開していません,paiza転職
株式会社シムトップス,自社サービスWebアプリエンジニア～自社開発のペーパーレス化...,東京都 品川区 目黒駅,年収500万円～800万円,公開していません,doda
Intelligence Design株式会社,Webフロントエンジニア／サーバサイドエンジニア,東京都 渋谷区,年収400万円～700万円,8日前,paiza転職
コムテックス ソリューションズ株式会社,Webアプリエンジニア,東京都 千代田区,年収480万円～840万円,18日前,paiza転職
株式会社SPEC,Webエンジニア,東京都 千代田区,年収400万円～600万円,公開していません,paiza転職
株式会社マーケティングアプリケーションズ,Webエンジニア,東京都 新宿区 新宿御苑前駅 徒歩5分,年収400万円～700万円,公開していません,キャリコネ転職
ティ・エフ株式会社,未経験も歓迎!独自の教育カリキュラムでWebエンジニアに,東京都 渋谷区 恵比寿駅,月給20万円～,14日前,ティ・エフ株式会社
