株式会社ライトカフェクリエイション,Webフロントエンドエンジニア,東京都 千代田区 東京駅,年収504万円～684万円,12時間前,paiza転職
アルティマーク株式会社,WEBアプリエンジニア／基本設計以上案件のみ／残業20h以内...,東京都 中央区 新富町駅,年収350万円～708万円,5日前,doda
羽石株式会社,WEBエンジニア,東京都 台東区 浅草橋駅 徒歩5分,年収300万円～800万円,公開していません,キャリコネ転職
株式会社GLUG,Webアプリケーションエンジニア,東京都 港区 麻布十番駅 徒歩7分,年収400万円～700万円,公開していません,paiza転職
株式会社マネーフォワード,Web開発エンジニア／クラウド記帳サービス「STREAMED...,東京都 千代田区,"年収480万円～1,000万円",公開していません,doda
株式会社ユーティル,Webサービス開発エンジニア,東京都 新宿区 早稲田駅 徒歩4分,年収480万円～700万円,公開していません,paiza転職
株式会社パラダイムシフト,Webサービスバックエンドエンジニア,東京都 中央区 東日本橋駅,年収300万円～600万円,公開していません,doda
シンフォニーマーケティング株式会社,自社のマーケティングシステムを開発するWebアプリケーション...,東京都 千代田区 神田駅 徒歩1分,年収550万円～650万円,16日前,エンジニアHubキャリア
株式会社For A-career,インフラエンジニア／SE／Webディレクター インフラエンジ...,東京都 渋谷区 渋谷駅,年収280万円～320万円,公開していません,株式会社For A-career
株式会社ビデオマーケット,Webエンジニア,東京都 渋谷区 初台駅,年収400万円～600万円,公開していません,doda
株式会社リープソフト,Web開発エンジニア 9割自社内受託開発&プライム案件 年間...,東京都 品川区 北品川駅,年収500万円～700万円,27日前,doda
LDJ貿易株式会社,WEBエンジニア・プログラマー,東京都 荒川区 三河島駅,月給20万円～60万円,公開していません,楽天仕事紹介
株式会社hacomono,Webアプリエンジニア フィットネス・スポーツ×IT／自社開...,東京都 豊島区,年収650万円～800万円,公開していません,doda
株式会社アイティートゥモロー,WEB開発エンジニア 大型案件でスキルアップ可能,東京都 新宿区,年収400万円～550万円,公開していません,doda
株式会社キャリアデザインセンター ITソリューシ...,Web開発エンジニア／自社内開発／残業少なめ／月給30.5万...,東京都 港区 赤坂見附駅 徒歩1分,"月給30万5,000円～43万円",1日前,女の転職type
株式会社アイルミッション,web開発エンジニア,東京都,年収400万円～600万円,22日前,doda
マックス株式会社,Web開発エンジニア／月給30万円以上／年間休日128日,東京都,月給30万円～48万円,公開していません,doda
エムスリーデジタルコミュニケーションズ株式会社,Webアプリケーションエンジニア,東京都 中央区,公開していません,公開していません,パソナキャリア
株式会社Olivier,web系開発エンジニア,東京都 中央区 茅場町駅 徒歩1分,年収400万円～840万円,公開していません,doda
株式会社サイシード,インフラエンジニア／Webアプリケーションのインフラ設計・構築,東京都 新宿区 新宿駅,年収600万円～900万円,公開していません,doda
株式会社コネクティ,Web系システムエンジニア／自社製品の顧客折衝担当,東京都 新宿区 西新宿駅,年収500万円～800万円,公開していません,doda
株式会社アクロウェーブネット,Webシステム開発エンジニア／官公庁やNTTなどの上流案件多...,東京都 新宿区 新宿三丁目駅,年収300万円～600万円,公開していません,doda
デロイト トーマツ ファイナンシャルアドバイザリ...,WEBサービス開発エンジニア,東京都 千代田区 二重橋前駅,"年収450万円～2,000万円",26日前,doda
エン・ジャパン株式会社,WEB開発エンジニア,東京都 新宿区 西新宿駅,月給32万円～,19日前,エン転職
ピクスタ株式会社,fotowa Webアプリケーションエンジニア,東京都 渋谷区,年収450万円～650万円,公開していません,マイナビAGENT
プライムソリューションズ株式会社,WEBアプリケーションエンジニア,東京都,年収450万円～800万円,12日前,doda
株式会社ストランザ,Webエンジニア,東京都 港区,年収400万円～600万円,公開していません,paiza転職
デジタル・アドバタイジング・コンソーシアム株式会社,WEBエンジニア,東京都 渋谷区,月給35万円～,公開していません,デジタル・アドバタイジング・コンソーシアム株式会社
株式会社PRAZNA,WEBアプリ開発エンジニア FAQソリューションのパイオニア...,東京都 渋谷区 恵比寿駅 徒歩3分,年収530万円～700万円,20日前,マイナビ転職
株式会社アズテックス,オープン／Web系システム開発エンジニア、モバイルエンジニア,東京都 千代田区 神田駅 徒歩2分,月給24万円～,公開していません,Q-JiN
株式会社アライアンス,WEB系システム開発エンジニア,東京都 千代田区 市ケ谷駅 徒歩7分,月給55万円～65万円,公開していません,株式会社アライアンス
株式会社光ソフトウェア,WEBサイト制作エンジニア,東京都 江東区,年収240万円～400万円,6日前,かんたん応募
株式会社ミスミグループ本社,組織立上げのWebエンジニア,東京都 文京区,年収500万円～700万円,9時間前,ELITE Network.
株式会社ダブルクロップ,Web開発エンジニア ～福利厚生充実・働きやすい社風～,東京都 渋谷区 渋谷駅,年収350万円～450万円,公開していません,doda
伊藤忠インタラクティブ株式会社,Webアプリケーションエンジニア,東京都 港区 白金高輪駅,年収578万円～705万円,21日前,doda
株式会社セルシス,WEBアプリエンジニア クリエイター向けWEBサービスの開発,東京都 新宿区,年収400万円～700万円,12日前,doda
株式会社YUIDEA,フロントエンドエンジニア・Webデザイナー,東京都 文京区 茗荷谷駅,年収400万円～550万円,5日前,doda
Supership株式会社,WEBアプリケーションエンジニア,東京都 港区 表参道駅 徒歩5分,年収350万円,公開していません,マイナビAGENT
株式会社ぶんか社,Webデザイナー・エンジニア,東京都 千代田区 半蔵門駅 徒歩2分,"月給37万5,000円～45万8,000円",公開していません,株式会社ぶんか社
エイラシステム株式会社,Web開発エンジニア,東京都 世田谷区,"月給33万3,333円～54万1,667円",公開していません,エイラシステム株式会社
エンライズテック株式会社,ネットワークエンジニア～WEB面接で選考完結／残業月10時間...,東京都,年収504万円～700万円,公開していません,doda
TechMagic株式会社,WEBサーバサイドエンジニア／食産業の常識を変える調理用ロボ...,東京都 江東区,年収500万円～800万円,公開していません,doda
M-SOLUTIONS株式会社,WEBシステム開発エンジニア、PM候補,東京都 新宿区 東新宿駅,年収480万円～850万円,公開していません,paiza転職
株式会社oliva,Web開発エンジニア,東京都 新宿区 四谷三丁目駅 徒歩6分,年収400万円～600万円,12日前,paiza転職
Nota株式会社,Webインフラ／セキュリティエンジニア,東京都 港区 新橋駅,年収400万円～800万円,公開していません,doda
株式会社情報戦略テクノロジー,Webアプリケーションエンジニア,東京都,"年収474万円～1,300万円",公開していません,doda
株式会社プラスアルファ・コンサルティング,Webアプリケーション開発エンジニア,東京都 港区,年収450万円～700万円,21日前,マイナビAGENT
メディアファイブ株式会社,webアプリ開発エンジニア 上流からお任せ 残業月平均10時間,東京都 中央区,年収650万円～800万円,26日前,doda
株式会社シムックスイニシアティブ,Web開発エンジニア,東京都 港区 大門駅,年収400万円～800万円,公開していません,doda
株式会社コムニコ,WEB開発エンジニア,東京都 中央区 東銀座駅,年収400万円～700万円,公開していません,doda
EGテスティングサービス株式会社 採用情報,Web系エンジニア,東京都 羽村市,公開していません,公開していません,EGテスティングサービス株式会社採用情報
株式会社Renaxia,SE WEBエンジニア 学歴不問 第二新卒歓迎,東京都 中央区,月給20万円～50万円,公開していません,株式会社Renaxia
イーソル株式会社,組込み系WEBシステム開発エンジニア／働き方改革 研修・福利...,東京都 中野区 中野坂上駅,年収498万円～657万円,27日前,doda
ビジネステクノクラフツ株式会社,webシステムエンジニア～プライム案件多数／自分の得意を活か...,東京都 千代田区 内幸町駅,年収450万円～800万円,5日前,doda
リビン・テクノロジーズ株式会社,Webエンジニア／自社メディア開発,東京都 中央区,公開していません,6日前,マイナビAGENT
株式会社Arent,Webアプリケーションエンジニア,東京都 中央区,年収500万円～800万円,公開していません,doda
キッズコネクト株式会社,システムエンジニア／Web開発エンジニア,東京都 港区,公開していません,公開していません,マイナビAGENT
株式会社SALTO,webアプリケーションエンジニア～休暇平均132日／平均残業...,東京都 新宿区,年収650万円～900万円,15日前,doda
株式会社NTTデータ・ニューソン,WEBアプリケーションエンジニア,東京都 千代田区 溜池山王駅,年収336万円～723万円,16日前,doda
株式会社FAIR NEXT INNOVATION,WEB開発エンジニア ～ベストベンチャー100選出企業～,東京都 港区 高輪台駅,年収400万円～480万円,公開していません,doda
株式会社バーティック,Webおよびアプリエンジニア,東京都 港区,年収500万円～700万円,公開していません,paiza転職
株式会社ダイスネクスト,Webシステム開発エンジニア,東京都 千代田区 神田駅 徒歩4分,年収400万円～600万円,公開していません,doda
株式会社メディス,Webアプリ開発エンジニア グループ向けEC開発／残業月平均...,東京都 渋谷区,年収500万円～800万円,公開していません,doda
オルターボ株式会社,WEB開発エンジニア,東京都 渋谷区,年収350万円～500万円,公開していません,doda
スターツ出版株式会社,自社サービス「OZmall」のWebアプリエンジニア 会員数...,東京都 中央区 京橋駅,年収400万円～550万円,公開していません,doda
株式会社AMG Solution,Web・オープン系エンジニア 社内システム開発も関われる 残...,東京都 中央区 東日本橋駅,年収400万円～650万円,22日前,doda
株式会社フィックスターズ,Webサービスインフラエンジニア 東証1部上場／理系エース級...,東京都 港区 田町駅,年収501万円～700万円,14日前,doda
株式会社クリーマ,webアプリエンジニア,東京都 渋谷区 千駄ケ谷駅,年収450万円～750万円,公開していません,doda
株式会社insprout,Webアプリケーションエンジニア～残業10h以内／育休取得率...,東京都 港区 麻布十番駅,年収420万円～960万円,公開していません,doda
株式会社イー・エージェンシー,Web開発エンジニア／Java・PHP活かし自社開発でスキル...,東京都 千代田区 日比谷駅,年収500万円～700万円,公開していません,doda
株式会社WeTec,Webオープン系エンジニア 経験半年の方も大歓迎!10ヵ国の...,東京都 港区 新橋駅,年収350万円～750万円,公開していません,かんたん応募
株式会社フォーサム,Webエンジニア,東京都 千代田区 神田駅 徒歩1分,年収350万円～600万円,公開していません,paiza転職
ライフエンディングテクノロジーズ,Webエンジニア,東京都 港区 御成門駅 徒歩1分,"月給25万円～41万6,000円",公開していません,ライフエンディングテクノロジーズ
株式会社ユイコモンズ,WEBデザイナー、エンジニア,東京都 港区 大門駅 徒歩4分,年収350万円～450万円,公開していません,キャリコネ転職
株式会社MS-Japan,自社webサービスエンジニア 東証一部／WLB／リモート勤務...,東京都 千代田区 飯田橋駅,"年収800万円～1,200万円",27日前,doda
エヌ・ティ・ティレゾナント株式会社,ウェブ開発エンジニア,東京都 千代田区 大手町駅,年収400万円～600万円,公開していません,doda
GMOあおぞらネット銀行株式会社,WEB・フロントエンジニア ～GMOグループのプラットフォー...,東京都 渋谷区 渋谷駅,"年収500万円～1,000万円",22日前,doda
株式会社メクゼス,Webシステムエンジニア AI・IoT等最先端技術／上流工程...,東京都 中央区 京橋駅,年収350万円～600万円,公開していません,doda
株式会社アイ・エス・シー,Webシステム運用エンジニア,東京都 千代田区 市ケ谷駅,年収373万円～560万円,5日前,doda
株式会社ディーカレット,Webエンジニア・テックリード,東京都 千代田区,公開していません,公開していません,マイナビAGENT
株式会社LITALICO,Webエンジニア,東京都 目黒区,年収550万円～700万円,13日前,マイナビAGENT
株式会社シーズ・ラボ,システムエンジニア・プログラマー／WEBアプリケーション,東京都,年収350万円～700万円,公開していません,doda
株式会社光ソフトウェア、他東京都内、神奈川県、埼...,WEBサイト制作エンジニア,東京都 江東区 住吉駅 徒歩1分,"時給1,500円～2,500円",5日前,株式会社光ソフトウェア
スタディプラス株式会社,webアプリケーションエンジニア,東京都 千代田区 御茶ノ水駅,年収420万円～900万円,公開していません,doda
株式会社情報電子他,Webアプリケーションエンジニア,東京都 豊島区 池袋駅 徒歩7分,月給25万円～40万円,公開していません,株式会社情報電子
株式会社エルイズビー,Web開発エンジニア,東京都 千代田区 秋葉原駅 徒歩4分,年収400万円～700万円,公開していません,paiza転職
ジオ・サーチ株式会社,ソフトウエア開発／WEB系エンジニア,東京都 大田区 蒲田駅 徒歩8分,"月給21万2,500円～29万円",1日前,日経転職版
株式会社ジーニー,WEBアプリケーションエンジニア,東京都 新宿区 西新宿駅,年収550万円～900万円,公開していません,doda
株式会社CAMPFIRE,Webエンジニア,東京都 渋谷区,年収400万円～650万円,公開していません,paiza転職
株式会社リベルティ 採用課金,Web・オープン系システムエンジニア／Web／IT,東京都 千代田区 秋葉原駅                                                                                                                                    その他 (9),月給25万円～,21日前,バイトルPRO
株式会社GIFI,WEBアプリケーション・エンジニア,東京都 千代田区 水道橋駅 徒歩3分,公開していません,公開していません,株式会社GIFI
株式会社ビースカイ,WEBシステムエンジニア ～残業月10H程度／年間休日125...,東京都 新宿区 都庁前駅,年収350万円～500万円,公開していません,doda
セントランス株式会社,WEBアプリケーションエンジニア,東京都 府中市 北府中駅,年収350万円～588万円,公開していません,doda
株式会社ユニゾンベックス,Webエンジニア 実務未経験OK 年休124日以上 100%...,東京都 渋谷区 恵比寿駅 徒歩3分,月給28万円～,7日前,マイナビ転職
株式会社アビスト,WEBアプリケーション開発エンジニア,東京都 豊島区 大塚駅,年収400万円～600万円,26日前,doda
株式会社アスペア,WEBエンジニア,東京都 町田市,年収300万円～600万円,公開していません,キャリコネ転職
株式会社ファーンリッジ・ジャパン,オープン系／Web系／モバイル系エンジニア,東京都 渋谷区,年収300万円～600万円,公開していません,マイナビAGENT
SCSK Minoriソリューションズ株式会社,WEB系開発エンジニア,東京都 新宿区 新宿駅,年収380万円～600万円,16日前,doda
ビープラッツ株式会社,WEBアプリケーションエンジニア,東京都 千代田区 秋葉原駅 徒歩2分,年収400万円～850万円,公開していません,マイナビAGENT
CCCマーケティング株式会社,Webエンジニア,東京都 渋谷区,年収500万円～800万円,公開していません,paiza転職
株式会社INFASパブリケーションズ,webサービスエンジニア,東京都 港区 六本木駅,年収350万円～500万円,公開していません,doda
株式会社システムガーデン,Web・オープン系システムエンジニア／通信・インターネット・...,東京都 豊島区 駒込駅 徒歩1分,年収400万円～700万円,公開していません,バイトルPRO
ジオテクノロジーズ株式会社,22003:WEBエンジニア,東京都 文京区,公開していません,24日前,マイナビAGENT
株式会社メドレー,Webサービス開発エンジニア,東京都 港区 六本木一丁目駅,"年収600万円～1,500万円",公開していません,doda
株式会社サクセステクノロジー,Web系エンジニア,東京都 渋谷区,月給20万円～60万円,公開していません,株式会社サクセステクノロジー
サイオステクノロジー株式会社,Webアプリケーション開発エンジニア／自社内開発中心,東京都 港区,年収450万円～700万円,公開していません,マイナビAGENT
株式会社コスモ,Webアプリ開発エンジニア,東京都 江東区 清澄白河駅,年収350万円～600万円,16日前,doda
株式会社デジタルハーツホールディングス,Webエンジニア,東京都 新宿区,年収500万円～800万円,24日前,マイナビAGENT
アイムファクトリー株式会社,Webフロントエンジニアの募集,東京都 千代田区 麹町駅 徒歩2分,月給60万円～100万円,16時間前,Find Job!
オリコン株式会社,webアプリエンジニア／平均残業時間月10～20h／月間2....,東京都 港区 六本木駅,年収500万円～600万円,22日前,doda
株式会社マクロミル,WEBアプリケーションエンジニア／リサーチ・パネルシステム～...,東京都 港区 品川駅,年収500万円～800万円,公開していません,doda
株式会社PTS,WEBシステムエンジニア キャリア支援有,東京都 江東区,年収360万円～720万円,16日前,リクルートエージェント
株式会社エム・フィールド,PMPL候補／Webアプリケーションエンジニア,東京都 品川区,年収400万円～700万円,公開していません,マイナビAGENT
株式会社ミツモア,Webエンジニア,東京都 千代田区,公開していません,公開していません,マイナビAGENT
株式会社Showcase Gig,Webデザイナー・マークアップエンジニア／自社サイトの開発・...,東京都 港区 青山一丁目駅,年収400万円～600万円,公開していません,doda
株式会社ガジュマル,WEBエンジニア,東京都 豊島区 池袋駅 徒歩8分,年収300万円～550万円,公開していません,キャリコネ転職
株式会社Zucks,シニアWebアプリケーションエンジニア,東京都 渋谷区,公開していません,公開していません,マイナビAGENT
GMOグローバルサイン株式会社,Webアプリケーションエンジニア,東京都 渋谷区 渋谷駅 徒歩5分,公開していません,公開していません,マイナビAGENT
株式会社FUNDINNO,Web系アプリエンジニア,東京都 品川区 五反田駅,"年収500万円～1,200万円",8日前,doda
Y&IGroup株式会社,Webエンジニア,東京都 千代田区,年収420万円～700万円,14日前,paiza転職
コグニビジョン株式会社,Webアプリエンジニア,東京都 新宿区 西新宿駅,年収400万円～680万円,20日前,doda
xxx株式会社,Webエンジニア,東京都 新宿区 新宿西口駅 徒歩2分,年収380万円～500万円,公開していません,paiza転職
株式会社パスコ,Web開発エンジニアPM・PL,東京都 目黒区 中目黒駅,年収600万円～800万円,公開していません,doda
技研商事インターナショナル株式会社,WEBアプリ開発エンジニア～リモートワーク可能／フレキシブル...,東京都 新宿区,年収400万円～500万円,公開していません,doda
株式会社ベリサーブ,Webアプリケーション検証エンジニア,東京都 千代田区 水道橋駅,"年収500万円～1,200万円",19日前,doda
株式会社オープンストリーム,Webシステムエンジニア,東京都 新宿区,年収400万円～700万円,公開していません,マイナビAGENT
株式会社デジタルクエスト,Webアプリケーションエンジニア～親会社トレジャー・ファクト...,東京都 千代田区 秋葉原駅,年収500万円～700万円,公開していません,doda
株式会社フォトラクション,Webアプリケーションエンジニア,東京都 中央区 築地市場駅 徒歩6分,年収600万円～900万円,12日前,paiza転職
株式会社アイアンドディハヤト,有料職業紹介要員 Webアプリケーションエンジニア／電子マネ...,東京都 目黒区,"月給24万3,855円～38万2,410円",公開していません,株式会社アイアンドディハヤト
株式会社クルージス,システムエンジニア Web面接可,東京都 千代田区 東京駅,月給26万円～60万円,公開していません,株式会社クルージス
アサヒビジネスソリューションズ株式会社,webアプリケーションエンジニア,東京都 台東区 浅草駅,年収450万円～760万円,15日前,doda
株式会社日立ソリューションズ,SIEMシステムのセキュリティエンジニア ～Web面接・在宅...,東京都 品川区 品川シーサイド駅,年収400万円～700万円,5日前,doda
日産自動車株式会社,コネクテッドカー バックエンド／Webフロントエンジニア,東京都 目黒区 中目黒駅,年収550万円～900万円,公開していません,doda
株式会社フジワーク,SE Web系エンジニア,東京都 中野区 中野駅 徒歩6分,月給20万円～,公開していません,株式会社フジワーク
株式会社LYZON,月給30万円～ 自社内開発×大手案件 Webアプリエンジニア,東京都 千代田区 御茶ノ水駅 徒歩5分,月給30万円～,5日前,マイナビ転職
Zababan株式会社,SE オープン・WEB系開発エンジニア／年間休日125日以上...,東京都 千代田区 秋葉原駅 徒歩1分,月給40万円～80万円,公開していません,Zababan株式会社
株式会社エヌ・ティ・ティ・データ,メガバンク向けWebシステム基盤エンジニア,東京都 新宿区,"年収600万円～1,000万円",公開していません,パソナキャリア
株式会社ランドネット,不動産データを活用／年商223億円不動産Tech／ウェブサー...,東京都,年収600万円～799万円,1日前,en ミドルの転職
アンドロボティクス株式会社,現代社会において必要不可欠!WEBエンジニアになる,東京都 港区 虎ノ門駅 徒歩4分,月給20万円～46万円,公開していません,アンドロボティクス株式会社
株式会社CCG WORKING HEADS,ウェブエンジニア,東京都 品川区 五反田駅 徒歩1分,年収400万円～600万円,公開していません,paiza転職
東日本電信電話株式会社,アプリケーションエンジニア／WebやAP、DBシステム導入が...,東京都 渋谷区 初台駅,年収500万円～900万円,公開していません,doda
石油資源開発株式会社,電気系シニアエンジニア ～WEB面接可／東証一部上場／E&P...,東京都 千代田区 東京駅,"年収700万円～1,000万円",公開していません,doda
株式会社クエスト,Webアプリケーション開発エンジニア,東京都 港区,年収380万円～450万円,公開していません,マイナビAGENT
株式会社ビューン,Webアプリケーションエンジニア,東京都 千代田区 淡路町駅 徒歩3分,年収340万円～600万円,公開していません,マイナビAGENT
ヤマトシステム開発株式会社,Webサービス開発エンジニア,東京都 中央区 勝どき駅,年収435万円～535万円,6日前,doda
