株式会社イノセント,未経験”超”積極採用! WEBデザイナー／エンジニア,"東京都 中央区 築地駅                                                                                                                                                                    




築地駅の求人
をすべて見る",月給20万円～50万円,12日前,リクナビNEXT
株式会社インターファーム,Webエンジニア,"東京都 渋谷区                                                                                                                                                                    




渋谷区の求人
をすべて見る",年収600万円～800万円,2時間前,ワークポート
レールコンサルティング株式会社,IT／Webエンジニア募集,東京都 中央区 日本橋駅 徒歩1分,"時給2,500円～5,000円",公開していません,かんたん応募
EveLive,webデザイナーおよびHTMLコーダー、web開発エンジニア...,東京都,月給30万円～,公開していません,かんたん応募
Heyday株式会社,Webエンジニア,東京都 新宿区 新宿三丁目駅 徒歩2分,年収350万円～600万円,14日前,paiza転職
株式会社ピース,Webエンジニア／コーダー・東京,"東京都 豊島区 池袋駅 徒歩3分                                                                                                                                                                    




株式会社ピースの求人
をすべて見る",年収350万円～500万円,公開していません,キャリコネ転職
グロウコミュニティ株式会社,3年目を迎える創業時期の会社 未経験からWebエンジニアへ育成,東京都,月給18万円～30万円,公開していません,かんたん応募
株式会社パルコデジタルマーケティング,バックエンドエンジニア／Webエンジニア,"東京都 渋谷区                                                                                                                                                                    




株式会社パルコデジタルマーケティングの求人
をすべて見る",年収360万円～600万円,公開していません,フォーピープル
"Weeybrid, LLC",Webエンジニアの募集,東京都 千代田区 秋葉原駅 徒歩3分,年収660万円～,公開していません,かんたん応募
お問合せください,"Webエンジニア,アプリケーションエンジニア",東京都 新宿区,年収350万円～600万円,6日前,お問合せください
ヒューマンデジタルコンサルタンツ株式会社,Webエンジニア,東京都 新宿区,"月給17万4,880円",2日前,専門学校の就活 Career Map
株式会社High Link,WEBエンジニア:「香り」に特化した注目のサブスクサービスを...,東京都 千代田区,年収500万円～800万円,10日前,リクルートエージェント
EGテスティングサービス株式会社,Webエンジニア,東京都 羽村市 小作駅,年収400万円～800万円,26日前,doda
NXPジャパン株式会社,WEBエンジニア／車載向け半導体で売上世界トップの企業,東京都 渋谷区,年収464万円～,16日前,リクルートエージェント
Connehito株式会社,Webエンジニア,東京都 港区,公開していません,公開していません,マイナビAGENT
株式会社エクサウィザーズ,エッジAIシステム: Webエンジニア,東京都 港区 汐留駅 徒歩1分,"年収420万円～1,500万円",公開していません,株式会社エクサウィザーズ
株式会社マイナビワークス,Web エンジニア ～若年層向け人材紹介サービス「マイナビジ...,東京都 新宿区 新宿駅,年収400万円～500万円,2日前,doda
オムロン エキスパートリンク株式会社 エンジニア...,モバイルWEBエンジニア／経験浅くてもOK,東京都 中央区 三越前駅 徒歩2分,"時給2,800円",16日前,エン派遣
株式会社ハル・アド,WEBエンジニア:創業55年／頭脳集団を理念／企画立案提案／...,東京都 千代田区,年収324万円～455万円,10日前,リクルートエージェント
プレイネクストラボ株式会社,WEBエンジニア／PM候補,東京都 品川区 五反田駅 徒歩1分,年収300万円～600万円,公開していません,キャリコネ転職
株式会社D.I.Works,未経験から育成／総合職／Webエンジニア・Webデザイナー等,東京都 新宿区 新宿駅 徒歩7分,月給30万円～60万円,8日前,doda
エヌ・ティ・ティ・コミュニケーションズ株式会社,ソフトウエアフレームワーク開発、Webアプリケーションエンジ...,東京都 港区,年収500万円～800万円,公開していません,エヌ・ティ・ティ・コミュニケーションズ株式会社
株式会社ユニエイム,Webエンジニア,東京都 港区 白金高輪駅,年収450万円～750万円,公開していません,paiza転職
株式会社コアシンク,WEBエンジニア,東京都 千代田区 末広町駅 徒歩1分,年収300万円～900万円,公開していません,キャリコネ転職
株式会社カルディオインテリジェンス,WEB開発エンジニア～医療AI・DX開発／要件定義などの上流...,東京都 港区 赤羽橋駅,年収500万円～700万円,公開していません,doda
株式会社SKpromotion,未経験からチャレンジできるWEBデザイナー・WEBエンジニア,東京都 新宿区 早稲田駅 徒歩2分,月給20万円～50万円,5日前,doda
ジュピターショップチャンネル株式会社,ウェブエンジニア,東京都 中央区 水天宮前駅,公開していません,公開していません,クリーデンス
株式会社翔泳社,webエンジニア,東京都 新宿区 四谷三丁目駅 徒歩2分,年収400万円～650万円,公開していません,paiza転職
ニチカレ株式会社,Webエンジニア,東京都 品川区 大崎駅 徒歩6分,年収400万円～,公開していません,paiza転職
株式会社DREAM TECH,イチから学べる研修制度あり WEBデザイナー・ITエンジニア,東京都 新宿区,月給21万円～50万円,5日前,リクナビNEXT
株式会社コデックス,WEBエンジニア,東京都 港区 外苑前駅 徒歩3分,年収500万円～650万円,公開していません,paiza転職
株式会社レンサ,未経験からエンジニアに WEB／アプリエンジニア,東京都 港区 赤坂見附駅 徒歩5分,"月給23万3,500円～",公開していません,かんたん応募
株式会社キャリッジリターン,Webエンジニア,東京都 中央区 銀座駅 徒歩1分,年収300万円～600万円,公開していません,paiza転職
ミュージックセキュリティーズ株式会社,Webエンジニア／自社開発 社会課題解決・投資型クラウドファ...,東京都 港区 広尾駅 徒歩3分,"月給41万6,700円～",6日前,en ミドルの転職
株式会社チーム・ファクトリー,Web開発エンジニア,東京都 港区 田町駅 徒歩4分,年収400万円～600万円,公開していません,paiza転職
株式会社アイモバイル,ふるさと納税サービスのWebエンジニア 「ふるなび」の開発・...,東京都 渋谷区 渋谷駅 徒歩7分,月給32万円～,1日前,エン転職
株式会社ADrim,Webエンジニア,東京都 千代田区,年収500万円～800万円,12日前,doda
株式会社アガルート,Webエンジニア 未経験歓迎／充実した研修制度有 オンライン...,東京都 千代田区 飯田橋駅,年収300万円～400万円,15日前,doda
ソウルドアウト株式会社,Webエンジニア／店舗集客支援サービス「ライクル」～東証一部...,東京都 千代田区 新御茶ノ水駅,"年収600万円～1,200万円",27日前,doda
株式会社清長,自社サービスのWEBエンジニア,東京都 港区 表参道駅,年収500万円～700万円,公開していません,doda
株式会社トリガー,課題解決のために顧客体験をクリエイティブする Webエンジニア,東京都 港区 表参道駅,年収360万円～900万円,27日前,DXcareer
株式会社カービュー,Webエンジニア,東京都 千代田区 永田町駅,年収600万円～750万円,13日前,paiza転職
GMOメイクショップ株式会社,Webエンジニア,東京都 渋谷区 渋谷駅,年収420万円～600万円,公開していません,doda
グルーヴ・ギア株式会社,Webエンジニア,東京都 千代田区 九段下駅,年収300万円～500万円,公開していません,doda
株式会社Cuon,webエンジニア,東京都 千代田区 東京駅 徒歩5分,年収400万円～600万円,公開していません,paiza転職
株式会社E-Grant,webエンジニア,東京都 品川区 五反田駅 徒歩5分,年収500万円～800万円,6日前,paiza転職
株式会社WAKUWAKU,WEBサイトエンジニア,東京都 渋谷区 恵比寿駅 徒歩5分,年収500万円～800万円,12日前,paiza転職
株式会社メンバーズ メンバーズエッジカンパニー,Webエンジニア,東京都 中央区,"月給22万6,600円～66万3,960円",公開していません,株式会社メンバーズ メンバーズエッジカンパニー
株式会社SKIYAKI,Webエンジニア／アプリケーションエンジニア,東京都 渋谷区 渋谷駅 徒歩5分,年収420万円,1日前,IMAGICA DIGITALSCAPE
株式会社キャリアデザインセンター,WEBエンジニア,東京都 台東区 上野広小路駅 徒歩1分,"時給2,500円～2,550円",公開していません,株式会社キャリアデザインセンター
株式会社Free Spark,Webエンジニア,東京都 港区,年収350万円～450万円,公開していません,マイナビAGENT
ベルフェイス株式会社,自社開発のシステムを用いて営業においてイノベーションを起こし...,東京都 港区 新橋駅,"年収550万円～1,200万円",公開していません,かんたん応募
株式会社ノースサンド,自社SaaSサービスのWebエンジニア リモートワーク積極実...,東京都 千代田区 有楽町駅 徒歩5分,年収500万円～800万円,5日前,エン転職
株式会社Blue Star,Web開発エンジニア プライム案件にこだわり!残業10時間以下,東京都 品川区 目黒駅,年収450万円～700万円,5日前,doda
株式会社Respawn,Webエンジニア 給与をもらいながら充実研修／月収50万円の...,東京都 世田谷区 駒沢大学駅 徒歩10分,月給25万円～50万円,1日前,エン転職
手間いらず株式会社,自社SaaSサービス「TEMAIRAZU」のWebエンジニア,東京都 渋谷区 恵比寿駅 徒歩5分,年収450万円～600万円,6日前,en ミドルの転職
株式会社コントロールテクノロジー,Webエンジニア,東京都 千代田区 溜池山王駅,年収360万円～600万円,公開していません,paiza転職
LocationMind株式会社,IoTデバイスとクラウドのマネジメントをリードするお仕事／I...,東京都 千代田区,"年収600万円～1,000万円",6時間前,エンジニアHubキャリア
株式会社イマプレ,WEBエンジニア ECサイト開発・保守,東京都,月給25万円～60万円,12日前,かんたん応募
株式会社ドリームホップ,Webエンジニア～HRtech／モダンな技術利用／toB向け...,東京都 千代田区,年収450万円～650万円,公開していません,doda
株式会社Photosynth,Webエンジニア,東京都 港区 三田駅,年収500万円～700万円,13日前,doda
株式会社アクシス,Webエンジニア,東京都 渋谷区 渋谷駅 徒歩5分,年収350万円～600万円,4日前,paiza転職
ノマドマーケティング株式会社,WEBエンジニア!テレワーク導入! 人間性重視,東京都 渋谷区,月給20万円～60万円,公開していません,かんたん応募
アライドアーキテクツ株式会社,Webエンジニア,東京都 渋谷区 恵比寿駅,年収551万円～800万円,公開していません,doda
株式会社大都テクノロジーズ,WEBエンジニア／自社サービス製品のIoT化,東京都 渋谷区 神泉駅,"年収400万円～1,000万円",18日前,doda
コネヒト株式会社,新規サービス「家族ノート」をリードするWebエンジニア,東京都 港区 白金高輪駅 徒歩10分,"月給41万5,000円～66万5,000円",15日前,エンジニアHubキャリア
株式会社ヴォイエンシー,Webエンジニア,東京都 中央区 小伝馬町駅 徒歩5分,年収350万円～550万円,公開していません,paiza転職
株式会社Y's,「ブラウザって何?」から始めるWebエンジニア アニメ・ゲー...,東京都 新宿区 新宿御苑前駅 徒歩1分,月給25万円,5日前,エン転職
株式会社ビースタイルホールディングス,WEBエンジニア,東京都 新宿区 都庁前駅,年収500万円～600万円,12日前,doda
株式会社カサレアル,Webエンジニア 100%プライム案件／フルリモート勤務／月...,東京都 港区 泉岳寺駅 徒歩1分,月給30万円～,12日前,エン転職
PHC株式会社,WEBエンジニア／電子カルテSaaS／ホワイト500認定,東京都 渋谷区,年収500万円～950万円,26日前,doda
クリエートシステム開発株式会社,WEBエンジニアの募集 !バックエンド／フロントエンドの開発,東京都 立川市 立川駅 徒歩4分,年収204万円～360万円,1日前,かんたん応募
株式会社ハイウェル,フリーランス／PHP／設計～開発経験3年以上ある方!WEBエ...,東京都 港区,月給60万円～90万円,9日前,株式会社ハイウェル
株式会社USEN Media,Webエンジニアマネージャー,東京都,年収500万円～800万円,7日前,Spring転職エージェント
株式会社Gizumo,Webエンジニア,東京都 渋谷区 渋谷駅,"月給21万1,633円～",公開していません,株式会社Gizumo
株式会社Playing,イチから学べる研修制度あり WEBデザイナー・ITエンジニア,東京都 新宿区,月給21万円～50万円,4日前,リクナビNEXT
株式会社Smallit,WEBアプリケーションエンジニア／支店の立ち上げメンバーとし...,東京都 渋谷区,年収400万円～900万円,9日前,doda
株式会社LIFULL senior,Webエンジニア／老人ホーム検索サイト「LIFULL介護」等...,東京都 千代田区 半蔵門駅,年収460万円～700万円,公開していません,doda
株式会社FreedJob,スタートアップ 未経験OK／WEBデザイナー・ITエンジニア,東京都,月給21万円～50万円,12日前,リクナビNEXT
株式会社エムティーアイ,WEBエンジニア,東京都 渋谷区 初台駅,年収450万円～600万円,8日前,doda
株式会社オズビジョン,WEBエンジニア,東京都 千代田区 神保町駅 徒歩4分,年収380万円～593万円,1日前,U29JOB
株式会社ファームノート,エンジニア／Webエンジニア,東京都 港区,公開していません,公開していません,マイナビAGENT
株式会社LOWCAL,Webアプリ開発エンジニア PL・PM候補の募集 基本情報技...,東京都 渋谷区 恵比寿駅 徒歩4分,月給35万円～,公開していません,資格de就職
株式会社Sportip,WEBエンジニア 筑波大発のSaaSベンチャー! フルリモー...,東京都 文京区,"年収600万円～1,000万円",7日前,リクルートエージェント
トレンダーズ株式会社,Webエンジニア,東京都 渋谷区 恵比寿駅,年収330万円～400万円,13日前,doda
株式会社ギガ,Web系ソフト開発エンジニア,東京都 世田谷区,年収250万円～500万円,公開していません,キャリコネ転職
株式会社ミスミ,Webエンジニア／PM職,東京都 文京区,年収500万円～900万円,5日前,リクルートエージェント
東京カメラ部株式会社,Webエンジニア,東京都 渋谷区 明治神宮前駅 徒歩1分,年収600万円～,公開していません,paiza転職
株式会社マインドクオリア,Webエンジニア,東京都 渋谷区,"年収240万円～1,200万円",公開していません,株式会社マインドクオリア
株式会社ウイサーブ,Webアプリ開発エンジニア,東京都 中央区 八丁堀駅 徒歩3分,年収300万円～700万円,公開していません,キャリコネ転職
株式会社オーパス,プログラマ／AIエンジニア／WEBエンジニア,東京都 新宿区,月給17万円～25万円,2日前,専門学校の就活 Career Map
ペットゴー株式会社,「ペットゴー」のWEBフロントエンジニア／WEBデザイナー,東京都 中野区 中野坂上駅 徒歩1分,"月給22万3,000円～50万円",公開していません,かんたん応募
株式会社テクノコア,Webエンジニア、DBスペシャリストを目指したい方におすすめ...,東京都 中央区,年収400万円～650万円,公開していません,doda
株式会社QHコンサルティング,Webサービスエンジニア :PHP・JS・HTML／CSS,東京都 練馬区,月給23万円～25万円,公開していません,かんたん応募
株式会社バイタリフィ,WEBエンジニア,東京都 渋谷区 恵比寿駅 徒歩5分,年収250万円～400万円,公開していません,キャリコネ転職
富士フイルムシステムサービス株式会社,Webエンジニア,東京都 千代田区 神保町駅,年収450万円～680万円,26日前,doda
ナレッジスイート株式会社,WEBアプリ開発エンジニア,東京都 港区 神谷町駅 徒歩1分,年収360万円～650万円,2日前,U29JOB
株式会社ヴァル研究所,Webエンジニア,東京都 杉並区 高円寺駅 徒歩3分,年収430万円～700万円,公開していません,doda
株式会社TwinBee,経験が活かせるWebエンジニア,東京都 豊島区 大塚駅 徒歩3分,月給30万円～60万円,公開していません,U29JOB
株式会社SUPER STUDIO,Webエンジニア／ECプラットフォーム「ecforce」～導...,東京都 品川区 目黒駅,"年収400万円～1,400万円",公開していません,doda
株式会社TechFirst Leaders,Web開発エンジニア,東京都 千代田区,年収400万円～650万円,公開していません,paiza転職
タウンライフ株式会社,自社メディアのWebエンジニア,東京都 新宿区 新宿駅 徒歩8分,"月給28万5,000円～42万8,000円",10時間前,リクナビNEXT
株式会社エヌ・ティ・ティ・データCCS,PL候補 フルスタックWebエンジニア,東京都 品川区 品川シーサイド駅,年収500万円～800万円,19日前,doda
webshop株式会社,経験を活かして活躍できるWEBエンジニア,東京都 東村山市 秋津駅 徒歩2分,月給20万円～,公開していません,U29JOB
株式会社ドリームキャリア,システムエンジニア／Webエンジニア,東京都 渋谷区,公開していません,公開していません,マイナビAGENT
株式会社メディカルフロンティア,Webエンジニア,東京都 港区 御成門駅 徒歩3分,年収500万円～800万円,22日前,paiza転職
サンクエスト株式会社,Webエンジニア・プログラマー募集,東京都 杉並区 永福町駅 徒歩3分,年収540万円～,公開していません,かんたん応募
株式会社トリプルアイズ,web開発エンジニア,東京都 千代田区,年収350万円～500万円,26日前,doda
フロンティア株式会社,Webエンジニア,東京都 渋谷区 恵比寿駅 徒歩5分,年収560万円～700万円,公開していません,paiza転職
株式会社クロスリンク,Webエンジニア,東京都 港区 新橋駅 徒歩1分,年収480万円～600万円,12日前,paiza転職
株式会社tenkai,Webエンジニア,東京都 台東区 浅草橋駅,年収385万円～630万円,公開していません,doda
株式会社クーレボ,Webエンジニア テレワーク推進中,東京都 新宿区 新宿御苑前駅,年収525万円～675万円,2日前,doda
株式会社ラクーンホールディングス,自社サービスWEBエンジニア,東京都 中央区 水天宮前駅 徒歩3分,年収412万円～600万円,27日前,paiza転職
株式会社USEN‐NEXT HOLDINGS,Webエンジニアマネージャー,東京都 品川区 目黒駅,年収500万円～800万円,公開していません,doda
株式会社HHUUDD,未経験から始めるWebエンジニア リモートワークあり。新しい...,東京都 千代田区 秋葉原駅 徒歩3分,月給18万円～,12日前,エン転職
インヴェンティット株式会社,Webエンジニア,東京都 新宿区 四ツ谷駅 徒歩6分,"年収500万円～1,000万円",公開していません,paiza転職
ジェミー株式会社,WEBエンジニア,東京都 世田谷区 用賀駅 徒歩7分,年収450万円～660万円,公開していません,U29JOB
株式会社クリエート,既卒歓迎 Webシステムエンジニア,東京都 武蔵野市 武蔵境駅,年収250万円～400万円,11日前,Re就活
株式会社PIXEL HEARTS,未経験からWebエンジニアになれる 独自のカリキュラム／サポ...,東京都 渋谷区 恵比寿駅 徒歩2分,月給19万円～,8日前,エン転職
アドバンサー株式会社,未経験歓迎 大人気webエンジニア 完全週休二日制,東京都 渋谷区,月給25万円～35万円,4日前,アドバンサー株式会社
株式会社ラクスパートナーズ,Webエンジニア 内定まで2週間以内／上場企業グループ,東京都 新宿区 新宿三丁目駅 徒歩4分,月給22万円～24万円,26日前,エン転職
合同会社DMM.com,Webエンジニア／業界トップクラスオンラインサロン,東京都 港区 六本木一丁目駅,年収500万円～900万円,17日前,doda
Meetscom株式会社,Webエンジニア／スマートフォンアプリエンジニア,東京都 新宿区 神楽坂駅 徒歩3分,年収400万円～,公開していません,paiza転職
セルプロモート株式会社,WEB系エンジニア／未経験可／01so,東京都 渋谷区,月給25万円～,6日前,ふれつり転職相談
チームラボグループ,Webアプリエンジニア,東京都 千代田区,年収400万円～840万円,1日前,paiza転職
KIYOラーニング株式会社,Webエンジニア,東京都 千代田区,年収500万円～800万円,公開していません,マイナビAGENT
株式会社ワークポート,株式会社カカクコム／WEBエンジニア／403251825,東京都 品川区 大崎駅 徒歩5分,年収450万円～600万円,10日前,Find Job!
株式会社サイバーセキュリティクラウド,Webエンジニア,東京都 渋谷区 恵比寿駅 徒歩4分,年収500万円～800万円,20日前,paiza転職
iYell株式会社,Webエンジニア,東京都 渋谷区 渋谷駅 徒歩5分,年収400万円～,公開していません,paiza転職
コロニー株式会社,デザイナー、WEBエンジニア,東京都 千代田区 有楽町駅,"年収500万円～1,200万円",公開していません,コロニー株式会社
ITコンサル企業,WEB系エンジニア／未経験可／01so,東京都 渋谷区,月給25万円～,6日前,ふれつり転職相談
株式会社リンクバル,WEBエンジニア／イベントEC事業部,東京都 中央区 築地駅 徒歩7分,年収500万円～700万円,5日前,en ミドルの転職
株式会社グッドパワー,Webエンジニア,東京都 江東区,"月給37万円～52万8,000円",21日前,株式会社グッドパワー
LAPRAS,WEBエンジニア,東京都 渋谷区,公開していません,公開していません,Talent Network
株式会社ミライプロジェクト,Webエンジニア,東京都 渋谷区,公開していません,29日前,株式会社ミライプロジェクト
paiza株式会社,Webエンジニア ～エンジニア採用・育成を支援する成長プラッ...,東京都 港区 外苑前駅,年収450万円～600万円,公開していません,doda
株式会社イントロダクション,Web・オープン系システムエンジニア／通信・インターネット・...,東京都 墨田区 押上駅 徒歩5分,"月給25万1,200円～43万7,400円",公開していません,バイトルPRO
株式会社RJC,Webエンジニア,東京都 千代田区,年収350万円～500万円,公開していません,doda
株式会社メディアドゥ,シニアWebエンジニア 東証1部上場／出版業界最大Web系企...,東京都 千代田区 神保町駅,年収600万円～800万円,5日前,doda
バークリー・ジャパン株式会社,Webエンジニア,東京都 新宿区 新宿三丁目駅 徒歩8分,年収500万円～700万円,公開していません,paiza転職
ハイツー株式会社,WEBエンジニア,東京都,"月給33万3,333円～50万円",19日前,U29JOB
株式会社オズ,Web開発エンジニア,東京都 目黒区 中目黒駅 徒歩13分,"月給18万3,333円",公開していません,ジョブアンテナ北海道
株式会社クリアビジョン,WEBエンジニア 未経験大募集,東京都,月給19万円,20日前,イーアイデム
株式会社クインテット,Webアプリケーションエンジニア,東京都 千代田区 市ケ谷駅 徒歩7分,年収400万円～800万円,公開していません,paiza転職
株式会社メガリンク,webエンジニア 100%自社開発／サポート体制／大手ECサ...,東京都 港区 表参道駅,年収400万円～720万円,公開していません,doda
株式会社エボリューションネット,Web・オープン系エンジニア,東京都 新宿区 高田馬場駅 徒歩2分,年収350万円～550万円,1日前,マイベストジョブ
