株式会社プラウドグロリア,最長3カ月の研修であなたも大変身 ITエンジニア 未経験9割,東京都 渋谷区 渋谷駅 徒歩8分,月給18万円～80万円,6日前,マイナビ転職
ネットビジョンシステムズ株式会社,初級ITエンジニア 未経験OK 20代活躍 女性エンジニア3...,東京都 中野区 新井薬師前駅 徒歩1分,月給25万円～,13時間前,女の転職type
合同会社DMM.com,Webエンジニア／サーバーサイドエンジニア ～最先端領域であ...,東京都,年収550万円～800万円,6日前,Spring転職エージェント
株式会社アドウェイズ,サーバーサイドエンジニア プロジェクトマネージャー／エンジニ...,東京都 新宿区 西新宿駅,年収600万円～950万円,2日前,レバテックキャリア
株式会社いえらぶGROUP,エンジニアインターン,東京都 新宿区 都庁前駅,"時給1,050円",公開していません,かんたん応募
株式会社アクティブギア,開発エンジニア 年間休日125日 副業OK リモートあり,東京都 豊島区 要町駅 徒歩3分,年収324万円～600万円,6日前,マイナビ転職
株式会社LegalForce,エンジニアリングパートナー フレックスタイム制／月給58万3...,東京都 江東区 豊洲駅 徒歩1分,"月給58万3,000円～",21日前,エン転職
TDK株式会社,アプリケーションエンジニア・EMC対策,千葉県 市川市,年収470万円～750万円,11日前,ELITE Network.
お問合せください,"アプリケーションエンジニア,インフラエンジニア",東京都 千代田区,年収230万円～350万円,28日前,お問合せください
株式会社MAIASOFT,エンジニアとクライアントを結ぶSES営業／残業少なめ／年間休...,東京都 千代田区 水道橋駅,"年収500万円～1,000万円",6日前,doda
リアステージ,エンジニア特化のコーディネーター職,東京都 港区 赤坂見附駅,年収300万円～600万円,14時間前,リアステージ
株式会社jioworks,ITエンジニア／トップエンジニアと一緒にアサイン!残業「年」...,東京都 新宿区 新宿三丁目駅 徒歩6分,年収250万円～700万円,2日前,Re就活
株式会社ファースト,20～30代活躍中 未経験でも夢のエンジニアへ,神奈川県 横浜市,月給25万円～,3日前,リクナビNEXT
株式会社ディーネット,インフラエンジニア 未経験歓迎 手厚い資格取得支援制度あり ...,東京都 港区 虎ノ門ヒルズ駅 徒歩1分,月給20万円～,13時間前,女の転職type
株式会社ラクーンホールディングス,自社サービスWEBエンジニア,東京都 中央区 水天宮前駅 徒歩3分,年収412万円～600万円,4日前,paiza転職
吉積ホールディングス・クラウドエース,エンジニアリングマネージャー 周りのメンバーとともに成長した...,東京都 千代田区 大手町駅,"年収550万円～1,500万円",公開していません,吉積ホールディングス・クラウドエース
日本開発株式会社,ITエンジニア 完全未経験OK!平均半年でエンジニアデビュー...,東京都 渋谷区 渋谷駅 徒歩3分,年収300万円～,21日前,エン転職
キャディ株式会社,プロジェクトマネージャー／エンジニアリングマネージャー チー...,東京都 台東区 浅草橋駅,"年収500万円～1,000万円",13日前,レバテックキャリア
株式会社イルカ,エンジニア,東京都 新宿区,"月給41万7,000円～66万6,000円",7日前,en ミドルの転職
paiza株式会社,Webエンジニア,東京都 港区 外苑前駅 徒歩4分,年収450万円～600万円,6日前,paiza転職
株式会社トリニアス,エンジニア／6ヶ月の充実研修!ゼロからエンジニアを目指してみ...,東京都 新宿区 西早稲田駅,年収300万円～600万円,2日前,Re就活
株式会社EN,エンジニア教育担当及びキャリアコンサルタントのお仕事,東京都 渋谷区 代々木駅,年収500万円～700万円,14日前,株式会社EN
株式会社クラフト,初級インフラエンジニア 未経験OK!研修充実 賞与4ヶ月分 ...,東京都 新宿区 高田馬場駅 徒歩2分,年収320万円～800万円,3日前,女の転職type
日本システムハウス株式会社,開発エンジニア／社員の成長を大切にする風土／評価制度充実,東京都 港区,年収300万円～540万円,12日前,doda
株式会社エーエスエル,インフラエンジニア,東京都 中央区 勝どき駅 徒歩0分,月給30万円～,公開していません,日経転職版
株式会社Finatextホールディングス,クラウドネイティブな次世代証券システムを支えるDevOpsエ...,東京都,年収350万円～600万円,15日前,Spring転職エージェント
株式会社グローバ,リードエンジニア アプリエンジニア,東京都 渋谷区 渋谷駅 徒歩5分,"年収700万円～1,080万円",4日前,paiza転職
株式会社LIFULL senior,Webエンジニアリーダー／フルスタックエンジニア,東京都 千代田区 半蔵門駅 徒歩2分,月給32万円～49万円,2日前,エンジニアHubキャリア
dSPACE Japan株式会社,アプリケーションエンジニア,東京都 港区 品川駅,年収700万円～900万円,6日前,doda
ヘイズ・スペシャリスト・リクルートメント・ジャパ...,ポストセールス／テクニカルサポートエンジニア,東京都 港区,月給40万円～50万円,11日前,エン派遣
株式会社エーフロンティア,営業・エンジニア教育,東京都 新宿区 新宿駅 徒歩10分,月給27万円～45万円,12日前,U29JOB
株式会社クオーテック,未経験スタート歓迎 ITエンジニア 残業少,東京都 新宿区,月給22万円～,8日前,リクナビNEXT
株式会社ルネサーブ,ITエンジニア,東京都 板橋区 大山駅 徒歩11分,月給28万円～,7日前,type
トレンドワークス株式会社,インフラエンジニア／土日祝休／フルリモート有／未経験歓迎,東京都 渋谷区 恵比寿駅 徒歩3分,"月給22万5,000円～",8日前,doda
株式会社イイネクサス,エンジニア,東京都 千代田区 麹町駅 徒歩1分,月給35万円～70万円,8時間前,type
世界最大級のソーシャルゲームプラットフォーム企業,インフラエンジニア,東京都,年収500万円～850万円,20日前,type 転職エージェント
株式会社ケンツー,未経験からITエンジニアへ転職!／研修充実・若手大歓迎,東京都,"月給22万5,000円～",1日前,ReWorks
ランスタッド株式会社,首都圏 設計・開発エンジニア 技術を活かしたい方を大歓迎!／...,東京都,年収400万円～800万円,4日前,リクルートエージェント
株式会社TKG,ローコード開発も、新技術の環境も! WEB開発エンジニア,東京都,年収350万円～,6日前,リクナビNEXT
株式会社アイティーナビゲート,インフラエンジニア／設計・構築,東京都 中央区,年収300万円～450万円,25日前,キャリコネ転職
レック・テクノロジー・コンサルティング株式会社,クラウドエンジニア,東京都 港区 新橋駅 徒歩5分,"年収500万円～1,000万円",8時間前,type
株式会社荏原エリオット,コンプレッサ、蒸気タービンの基本設計エンジニア,千葉県 袖ケ浦市 長浦駅 車5分,年収450万円～720万円,22日前,U29JOB
株式会社コーボー,Webエンジニア 新規サービス開発,東京都 渋谷区 恵比寿駅 徒歩5分,年収400万円～720万円,11時間前,Green
株式会社アスリート,"アプリケーションエンジニア,プログラマ",東京都 中央区,年収400万円～700万円,28日前,株式会社アスリート
株式会社フィックスターズ,数理最適化のソフトウェア高速化エンジニア,東京都 港区 田町駅 徒歩5分,年収540万円～840万円,1日前,paiza転職
グルーヴ・ギア株式会社,Webサービス開発エンジニア,東京都 新宿区 四ツ谷駅 徒歩1分,年収400万円～800万円,1日前,CREATIVE JOB
株式会社カクシン,エンジニアマネジャー,東京都 港区,年収420万円～800万円,4日前,paiza転職
株式会社カケハシ,フロントエンドエンジニア,東京都 中央区 東銀座駅 徒歩2分,年収750万円～900万円,5時間前,CREATIVE JOB
株式会社リクル,半導体エンジニア,東京都 千代田区 神田駅 徒歩1分,"月給20万5,000円～55万円",2日前,リクナビNEXT
株式会社IIJプロテック,東証一部IIJグループ インフラエンジニア／IIJ関連の大規...,東京都 千代田区,年収380万円～760万円,6日前,リクルートエージェント
清水建設株式会社,機械系プラントエンジニア／日本を代表するスーパーゼネコン／東京,東京都,年収600万円～900万円,23時間前,マイナビ転職エージェントサーチ
Eagle Eye Networks株式会社,バックエンドエンジニア,東京都 渋谷区 代官山駅 徒歩6分,公開していません,10日前,Daijob.com
株式会社グロービス,グロービスAI経営教育研究所バックエンドエンジニア,東京都 千代田区,年収500万円～700万円,11日前,ELITE Network.
セーフィー株式会社,セキュリティエンジニア,東京都 品川区 五反田駅 徒歩5分,年収700万円～900万円,8日前,エン エージェント
株式会社トラストハブ,Webエンジニア,東京都 千代田区 神田駅 徒歩5分,年収600万円～800万円,10時間前,Green
TLZS株式会社,開発エンジニア／自社案件あり／残業月10h程／休暇制度多数／...,東京都 千代田区 秋葉原駅 徒歩1分,月給25万円～80万円,10日前,女の転職type
株式会社ネットサポート,インフラエンジニア ポテンシャル／未経験も可!導入研修も充実...,東京都 渋谷区 渋谷駅,月給22万円～,1日前,レバテックキャリア
ソニーデジタルネットワークアプリケーションズ株式...,ソフトウェア開発エンジニア,東京都,年収650万円～850万円,21日前,日経転職版
株式会社九動,2023 新卒採用 プラント・エンジニアリング,千葉県,"月給18万5,200円～21万570円",21日前,リクナビ2023
コネヒト株式会社,国内No.1ママ向けサービス「ママリ」や新規サービス「家族ノ...,東京都 港区 白金高輪駅 徒歩10分,"月給41万5,000円～66万5,000円",2日前,エンジニアHubキャリア
株式会社スタンバイ,エンジニアリングマネージャー,東京都 渋谷区 渋谷駅 徒歩10分,公開していません,1日前,CREATIVE JOB
株式会社ワークポート,株式会社ナカテック／WEBエンジニア／403803727,東京都 品川区 大崎駅 徒歩5分,月給26万円～70万円,11時間前,Find Job!
株式会社Arent,チーフエンジニア,東京都 中央区,"年収500万円～1,000万円",9日前,paiza転職
株式会社ICT-O,ITエンジニア フルリモートワーク／年収アップ額平均120万...,東京都 豊島区 巣鴨駅 徒歩4分,月給33万円～,21日前,エン転職
株式会社ヴィトーリア,ゲーム企画・開発エンジニア／PS4／5・Switch等ゲーム...,東京都 中央区 八丁堀駅 徒歩4分,月給25万円～,10日前,type
株式会社アイモバイル,Web開発エンジニア,東京都 渋谷区 渋谷駅 徒歩7分,年収500万円～800万円,4日前,paiza転職
エスアイエス・テクノサービス株式会社,未経験からインフラエンジニアへ,神奈川県 大和市 中央林間駅,年収330万円～400万円,6日前,doda
株式会社ユニゾン・テクノロジー,文系・未経験歓迎／ゼロからエンジニアデビュー,東京都 荒川区 日暮里駅 徒歩4分,月給25万円～60万円,16時間前,かんたん応募
ノイン株式会社,エンジニアリングマネージャー,東京都 渋谷区 代官山駅 徒歩4分,"年収800万円～1,200万円",18日前,U29JOB
株式会社フォスターネット,ITエンジニアのフォローに関する幅広いサービスを展開,東京都 新宿区 新宿駅 徒歩5分,年収600万円～700万円,公開していません,日経転職版
株式会社ファルコ,開発エンジニア,東京都 港区 御成門駅 徒歩3分,年収400万円～700万円,8日前,paiza転職
三菱重工業株式会社,システムエンジニア ～陸・海・空・宇宙の製品を手掛ける会社～,神奈川県 横浜市 みなとみらい駅,年収500万円～900万円,5日前,doda
株式会社Grand Journey,女性営業活躍中!エンジニアと企業をマッチング,東京都 渋谷区 恵比寿駅,年収350万円～600万円,公開していません,株式会社Grand Journey
株式会社インゲート,プロジェクト選択可能 サーバーエンジニア,東京都,年収400万円～700万円,20日前,Spring転職エージェント
株式会社サマリー,エンジニアリングマネージャー 自社WEBサービス「サマリーポ...,東京都 渋谷区 原宿駅,"年収800万円～1,200万円",11日前,doda
株式会社フロッグポッド,Microsoft 365 Power Platformエン...,東京都 中央区 人形町駅 徒歩5分,年収300万円～600万円,9日前,paiza転職
エヌ・ティ・ティ・コミュニケーションズ株式会社,エンジニアリングマネージャー／副社長直轄の社内ベンチャー組織,東京都 千代田区 日比谷駅,"年収800万円～1,000万円",8日前,doda
株式会社日立製作所,放射線治療装置の据付、保守サービスエンジニア,千葉県 柏市 柏の葉キャンパス駅,年収597万円～923万円,8日前,doda
株式会社ESP,ゼロから学べる ITエンジニア 独自研修&フォロー体制あり,東京都 中央区 馬喰町駅 徒歩5分,月給22万円～60万円,7日前,マイナビ転職
フォワードソフト株式会社,インフラエンジニア 若手／新潟,東京都 台東区 上野駅 徒歩1分,年収350万円～500万円,10時間前,Green
テックタッチ株式会社,急成長SaaS「Techtouch」のユーザーとエンジニアを...,東京都,月給42万円～70万円,1時間前,エンジニアHubキャリア
ディップ株式会社,商用インフラエンジニアリングマネジャー,東京都 港区,年収600万円～900万円,21日前,ディップ株式会社
note株式会社,データエンジニア データ基盤の刷新／大量に蓄積された行動デー...,東京都 港区 外苑前駅,年収550万円～900万円,1時間前,レバテックキャリア
各種プラント・施設のEPC事業および保全事業を展...,プラント施設の大型圧力容器や熱交換器機械エンジニア 経験者募集,神奈川県 横浜市 磯子区,月給22万円～44万円,10日前,SAN-SUKE
株式会社バードネットワークス,ネットワーク／ITエンジニア 月4万円社宅 年休125日,東京都 港区 新橋駅 徒歩5分,"月給21万5,000円～35万円",9日前,リクナビNEXT
日揮ホールディングス株式会社／日揮グローバル株式...,海外向けOil & Gas Plantに関するタンクエンジニ...,神奈川県 横浜市,"年収600万円～1,100万円",14日前,日経転職版
株式会社Harvest Biz Career,開発エンジニア,東京都 台東区,"月給35万円～70万7,000円",8時間前,type
株式会社トラム,システムエンジニア,東京都 港区 田町駅 徒歩9分,年収450万円～650万円,13日前,paiza転職
株式会社ジーニング,サーバサイドエンジニア,東京都 中央区 馬喰町駅 徒歩5分,年収400万円～600万円,4日前,paiza転職
ペンティオ株式会社,インターンシップ／大手内定獲得多数! クラウドAI分析エンジ...,東京都 千代田区 永田町駅 徒歩3分,"時給1,300円～",6日前,ゼロワンインターン
株式会社イクス,ITエンジニア 上流工程から携われるプライム案件中心,東京都 品川区 五反田駅 徒歩4分,月給30万円～,23時間前,マイナビ転職
株式会社スプラシア,エンジニアリングマネージャー／デジタルメディア領域中心のシス...,東京都 中央区 築地駅,年収550万円～750万円,11日前,doda
株式会社TimeTree,iOSエンジニア,東京都 新宿区 西新宿駅 徒歩5分,年収500万円～800万円,1日前,CREATIVE JOB
株式会社SAMURAI,インターンシップ／フルリモート 理系の学生歓迎!エンジニア採...,東京都 渋谷区 渋谷駅 徒歩8分,"時給1,155円～",6日前,ゼロワンインターン
プレイネクストラボ株式会社,WEBアプリ開発エンジニア,東京都 品川区 目黒駅 徒歩10分,年収300万円～600万円,1日前,Green
株式会社UNBORDER,開発エンジニア 年間休日127日 コスメ手当あり 月給25万...,東京都 渋谷区 渋谷駅 徒歩8分,月給25万円,25日前,女の転職type
株式会社アドリンクス,IT営業／エンジニアコーディネーター,東京都 豊島区 大塚駅 徒歩3分,月給22万円～50万円,17日前,かんたん応募
ミクステンド株式会社,フロントエンドエンジニア,東京都 千代田区 永田町駅 徒歩2分,年収500万円～800万円,6日前,paiza転職
株式会社Be-Groove,空調設計エンジニア,神奈川県 横浜市 みなとみらい駅,月給32万円～,1日前,株式会社Be-Groove
株式会社ビットエー,フロントエンドエンジニアリーダー,東京都 品川区 五反田駅 徒歩1分,年収600万円～800万円,5時間前,CREATIVE JOB
株式会社ビースタイル バリューテクノロジーズ,RPAエンジニア／RPA未経験OK／残業月平均10h以内,東京都 新宿区,"月給28万5,000円～",9日前,doda
株式会社キュービックソリューションズ,ITエンジニア 年間休日125日／残業ほぼなし／入社半年後に...,東京都 豊島区 池袋駅 徒歩3分,月給20万円～,14日前,エン転職
ドリームビジョン株式会社,ネットワークエンジニア,東京都 中央区,年収400万円,6日前,paiza転職
株式会社LIM,未経験／自社教育!フリーランスエンジニア 学歴・経歴不問,東京都 新宿区 東新宿駅 徒歩3分,月給18万円～,公開していません,かんたん応募
コインチェック株式会社,エンジニアリングマネージャー／開発チームのマネージメントを行...,東京都 渋谷区 渋谷駅,"年収804万円～1,500万円",6日前,doda
住友金属鉱山エンジニアリング株式会社,排ガスや水処理等の環境設備のエンジニアリング業務,東京都,年収450万円～700万円,13時間前,Spring転職エージェント
イグニション・ポイント インサイト株式会社,エンジニアPM候補／東京／年収500年～700万円,東京都 渋谷区,年収500万円～700万円,10日前,マイナビ転職エージェントサーチ
株式会社綜合企画,未経験からの挑戦 インフラエンジニア,東京都 港区,"月給20万7,000円～",13日前,かんたん応募
株式会社ココロザシ,WEBエンジニア～前給与保証／プライム案件多数／副業OK～,東京都 港区,年収450万円～800万円,3日前,doda
株式会社大塚商会,プロジェクトマネジメント／社内システムITインフラ構築エンジ...,東京都 千代田区,年収450万円～900万円,公開していません,マイナビAGENT
弥生株式会社,シニアバックエンドエンジニア,東京都 千代田区,"年収700万円～1,030万円",2日前,paiza転職
株式会社リゾーム,社内開発:Web・モバイルアプリエンジニア,東京都 中央区 水天宮前駅 徒歩3分,年収300万円～440万円,11日前,PROSEEK
株式会社アルムアイティー,インフラエンジニア／IT業界未経験可,東京都 品川区,月給25万円～,1日前,株式会社アルムアイティー
株式会社インターセキュア,ワンランク上のSEを目指す! システムエンジニア 経験者募集,神奈川県 横浜市 西区,年収400万円～,3日前,マイナビ転職
株式会社暖,未経験からWEBエンジニア,東京都 渋谷区 渋谷駅,年収380万円～530万円,4日前,かんたん応募
トレンドマイクロ株式会社,未経験からプロになれる! ITエンジニア 1年間の研修で安心,東京都 渋谷区 南新宿駅 徒歩2分,月給30万円,23時間前,マイナビ転職
株式会社ギブリー,バックエンドエンジニア,東京都 渋谷区 渋谷駅 徒歩7分,年収360万円～600万円,2日前,Green
DIエージェント障害者求人／No.13322,世界トップレベルメーカーでのエンジニア採用,神奈川県 横浜市 栄区,年収470万円～800万円,10日前,BABナビ
株式会社アストレア,フロントエンジニア,東京都 新宿区 新宿三丁目駅 徒歩5分,年収420万円～840万円,4日前,paiza転職
イーソル株式会社,車載ソフトウェア製品開発エンジニア 、 品質・機能安全ポジシ,東京都,年収600万円～900万円,公開していません,日経転職版
セレンディップ・テクノロジーズ株式会社,開発エンジニア／「モダンな環境で働きたい」を叶える会社,東京都,年収400万円～750万円,2日前,Re就活
株式会社ふりー,ITエンジニア 「らく～に働く。」／案件は自己選択／副業OK...,東京都 港区 外苑前駅 徒歩1分,月給30万円～70万円,17日前,エン転職
四葉システム開発株式会社,官公庁案件が中心! 自社内開発エンジニア 賞与実績5.5ヶ月,東京都 板橋区 新板橋駅 徒歩3分,月給24万円～38万円,6日前,マイナビ転職
株式会社エブリー,国内最大級のファミリー向け動画メディア「MAMADAYS」の...,東京都 港区 六本木一丁目駅,年収500万円～850万円,2日前,エンジニアHubキャリア
株式会社エンジョイ,ITエンジニア 定着率90%超／自社開発プロダクト展開／9期...,東京都 台東区 御徒町駅 徒歩2分,月給30万円～,21日前,エン転職
株式会社Polaris plus,自社開発の声をデザインするVOCプラットフォームのフロントエ...,神奈川県 鎌倉市 鎌倉駅,月給～80万円,27日前,modis
アバンダント株式会社,エンジニアリングマネージャー,東京都 渋谷区 渋谷駅 徒歩5分                                                                                                                                                                その他 (11),"年収658万円～1,440万円",公開していません,アバンダント株式会社
キリンエンジニアリング株式会社,機械系プロセスエンジニア キリンビール100%子会社／福利厚生,神奈川県,年収450万円～650万円,5日前,リクルートエージェント
株式会社メディカルノート,エンジニアリングマネージャー,東京都 渋谷区 渋谷駅,"年収800万円～1,200万円",5日前,doda
株式会社北國銀行,サーバサイドエンジニア,東京都 中央区,年収600万円～800万円,4日前,paiza転職
株式会社コーソル,データベースエンジニア,東京都 千代田区 麹町駅,年収335万円～400万円,13時間前,doda
株式会社スタイルズ,開発エンジニア,東京都 千代田区 秋葉原駅,年収450万円～600万円,4日前,paiza転職
株式会社セキュアウェアラブル・アイル,未経験歓迎!20代・30代活躍中 ITエンジニア／PG・事務,東京都 渋谷区 渋谷駅 徒歩10分,月給18万円～50万円,21日前,リクナビNEXT
旭化成株式会社,設備診断エンジニア,神奈川県 川崎市 川崎駅,年収580万円～946万円,15時間前,doda
株式会社アクセラゲート,インフラエンジニア,東京都 中央区 新富町駅 徒歩5分,月給30万円～60万円,17日前,type
株式会社タイムインターメディア,システムエンジニア,東京都 新宿区 曙橋駅,年収450万円～700万円,10時間前,doda
伊藤忠テクノソリューションズ株式会社,ITエンジニア／土日祝休み,東京都 港区 神谷町駅,月給23万円～45万円,11日前,doda
Rotoworks株式会社,自社プロダクト開発システムエンジニア,東京都 品川区 目黒駅,月給60万円～80万円,20時間前,Rotoworks株式会社
日本エー・エス・エム株式会社,グローバルプロダクトサポートエンジニア／原子層堆積 装置で世...,東京都 多摩市 小田急永山駅,"年収700万円～1,000万円",4日前,doda
ピクシブ株式会社,コーポレートエンジニア,東京都,月給30万円～60万円,12日前,ピクシブ株式会社
エージェントガレージ株式会社,第二新卒歓迎! SE 社員全員エンジニア!モノづくり志向の強...,東京都 中央区,年収400万円～600万円,4日前,リクルートエージェント
株式会社SHIFT,アプリケーションエンジニア,東京都 港区 神谷町駅 徒歩5分,"年収400万円～1,200万円",17日前,paiza転職
本多エンジニアリング株式会社,プラントエンジニア,神奈川県 横浜市 いずみ中央駅,年収500万円～650万円,11日前,doda
株式会社テクノエージェント,企業とエンジニアを繋ぐ 提案営業 二卒もOK,東京都 千代田区 岩本町駅 徒歩1分,月給23万円～50万円,2日前,マイナビ転職
