株式会社グレフ,フルスタックエンジニア,東京都 新宿区,"年収600万円～1,000万円",8日前,paiza転職
株式会社Progate,サーバサイドエンジニア,東京都 渋谷区 渋谷駅 徒歩3分,"年収700万円～1,000万円",4日前,paiza転職
株式会社spunto,インフラエンジニア／SE／IT・クリエイティブ 未経験歓迎 ...,東京都 千代田区 秋葉原駅 徒歩2分,"月給21万7,000円～",公開していません,株式会社spunto
株式会社アクセルエンターメディア,PHP エンジニア リーダー,東京都 渋谷区 恵比寿駅 徒歩4分,年収400万円～500万円,13時間前,Green
REC株式会社,ゲームエンジニア／あなたの「好き」を仕事に!夢のゲーム業界で...,東京都 中央区 茅場町駅 徒歩5分,年収250万円～300万円,2日前,Re就活
トヨタ自動車株式会社,デジタルコクピットソフトウェア開発:組み込みソフトウェアエン...,東京都 千代田区,年収420万円～861万円,29日前,日経転職版
株式会社Playing,イチから学べる研修制度あり WEBデザイナー・ITエンジニア,東京都 新宿区,月給21万円～50万円,20日前,リクナビNEXT
株式会社エムアイメイズ,Javaエンジニア,東京都 新宿区,年収400万円～800万円,18日前,paiza転職
株式会社FAM,Webエンジニア／完全初心者OK／研修あり／土日祝休／残業少,東京都 新宿区 新宿三丁目駅,月給20万円～,15日前,doda
Securitize Japan株式会社,web開発エンジニア,東京都 中央区,"年収600万円～1,500万円",2日前,paiza転職
大成建設株式会社,IoTを利用した開発プロジェクトのプロジェクトエンジニアリン...,東京都,"年収500万円～1,100万円",14日前,doda
株式会社クオーレ,開発エンジニア、プログラマ,東京都 大田区 蒲田駅 徒歩6分,年収350万円～500万円,21日前,paiza転職
株式会社Jocy,フルスタックエンジニア,東京都 渋谷区,"年収500万円～1,000万円",4日前,paiza転職
株式会社SKYM,ITエンジニア,東京都 新宿区 西新宿五丁目駅 徒歩4分,年収250万円～500万円,26日前,キャリコネ転職
アポロ株式会社,データエンジニア,東京都 渋谷区 渋谷駅 徒歩6分,年収450万円～800万円,3日前,CREATIVE JOB
セルプロモート株式会社,WEBアプリ開発エンジニア 在宅勤務可／残業10h／副業OK...,東京都 新宿区,年収350万円～450万円,6日前,doda
株式会社ライズ,PC初心者から学べる未経験募集 ITエンジニア／PG・事務,東京都 渋谷区,月給18万円～80万円,14日前,リクナビNEXT
株式会社M&Aクラウド,データエンジニア,東京都 新宿区 新宿御苑前駅 徒歩4分,年収700万円～900万円,1日前,paiza転職
アイテックブリッジ株式会社,開発エンジニア 前職の給与保障 完全週休2日制 面接1回,東京都 新宿区 西新宿五丁目駅 徒歩1分,年収420万円～,16日前,マイナビ転職
株式会社T's agency,未経験からはじめるITエンジニア 残業月10h以下／リモート...,東京都 新宿区 新宿駅 徒歩7分,月給23万円～,21日前,エン転職
楽天グループ,クラウド プリセールス・エンジニア,東京都,年収600万円～850万円,10日前,Spring転職エージェント
株式会社エイト,第二新卒OK 開発エンジニア リモート勤務OK／大手企業との...,東京都,年収300万円～400万円,4日前,リクルートエージェント
株式会社GameWith,サービス開発部／サーバサイドエンジニア,東京都 港区 赤羽橋駅 徒歩3分,年収470万円～900万円,12日前,CREATIVE JOB
三松システムコンサルティング株式会社,システムエンジニア 50歳以上も活躍中,東京都,月給28万円～80万円,6日前,マイナビ転職
株式会社三企,空調設備工事の現場エンジニアスタッフ,東京都 荒川区 町屋駅 徒歩12分,月給25万円～,14日前,株式会社三企
楽天グループ株式会社,Webアプリケーションエンジニア コマースカンパニービジネス...,東京都,"年収500万円～1,000万円",21日前,Spring転職エージェント
株式会社SSC,半導体のバックエンド設計エンジニア,神奈川県,年収500万円～999万円,1日前,en ミドルの転職
株式会社クーリエ,エンジニアリングマネージャー,東京都 渋谷区 恵比寿駅,"年収900万円～1,200万円",4時間前,en ミドルの転職
ソルフレア株式会社,フルスタックエンジニア CEO=CTO／新規自社開発サービス...,東京都 千代田区,年収600万円～,5日前,リクルートエージェント
株式会社インタースペース,データエンジニア,東京都 新宿区 都庁前駅 徒歩5分,年収400万円～600万円,4日前,paiza転職
パーソルキャリア株式会社,Java開発エンジニア,東京都 千代田区 大手町駅 徒歩1分,年収580万円～900万円,1日前,CREATIVE JOB
イメージ情報システム株式会社,アプリケーションエンジニア,東京都 千代田区 御茶ノ水駅 徒歩7分,年収300万円～500万円,4日前,paiza転職
サイバーウェーブ株式会社,Ruby on Rails エンジニア,東京都 文京区 江戸川橋駅 徒歩2分,年収370万円～500万円,14日前,Green
株式会社Belong,エンジニアリングマネージャー,東京都 港区 赤坂駅 徒歩3分,"年収600万円～1,000万円",16日前,U29JOB
丸栄情報システム株式会社,Webエンジニア、ネットワークエンジニア、開発エンジニア、プ...,東京都 港区 六本木駅 徒歩0分,年収300万円～720万円,14日前,Green
株式会社WizTech,初級エンジニア,東京都 千代田区 秋葉原駅 徒歩5分,月給26万円,3日前,type
東京エレクトロン株式会社,SDCシステム開発部 or SDC装置開発部／ソフトウェア制...,東京都,"年収790万円～1,070万円",29日前,日経転職版
株式会社すむたす,技術スタックの選定、エンジニア採用・育成、各種イベント参加・...,東京都 港区 青山一丁目駅,"年収600万円～1,200万円",13日前,レバテックキャリア
株式会社mediba,フロントエンドエンジニア 「auスマートパス」運営 リモート...,東京都 港区,"月給29万9,330円～",7日前,エン転職
株式会社マーケティングアプリケーションズ,Webアプリケーションエンジニア,東京都 新宿区 新宿御苑前駅 徒歩5分,年収450万円～650万円,4日前,paiza転職
株式会社テックビーンズ,ホワイトな就業環境でエンジニアの価値を高め市場価値を向上させ...,東京都 新宿区,年収300万円～700万円,公開していません,アイQジョブ
日創工業株式会社,ソフトウェア開発エンジニア,東京都 渋谷区,年収350万円～650万円,1日前,ワークポート
トヨタコネクティッド株式会社,試験研究エンジニア,東京都,"年収500万円～1,000万円",公開していません,Spring転職エージェント
株式会社Pictoria,Unityエンジニア,東京都 千代田区 東京駅,年収550万円～800万円,3日前,paiza転職
武田薬品工業株式会社,機械・空調担当エンジニア,神奈川県 藤沢市 藤沢駅,"年収600万円～1,200万円",12時間前,doda
株式会社Y's,Webエンジニア 未経験歓迎&人柄重視 残業月10h以下 賞...,東京都 新宿区 新宿御苑前駅 徒歩1分,月給25万円,20日前,女の転職type
株式会社リガーレジャパン,システムエンジニア,東京都 墨田区 錦糸町駅 徒歩5分,月給20万円～30万円,29日前,かんたん応募
株式会社ビヨンドワークス,ゲーム&アプリ開発エンジニア 在宅勤務案件8割／残業月20h...,東京都 渋谷区 渋谷駅 徒歩2分,"月給21万1,633円～60万円",21日前,エン転職
三菱ケミカルエンジニアリング株式会社,プロジェクトエンジニア／三菱ケミカル100%出資,東京都 中央区,年収550万円～800万円,公開していません,建設転職ナビ
株式会社ミラティブ,エンジニアリングマネージャー 大規模toCサービスMirra...,東京都 品川区 目黒駅,"年収1,000万円～1,200万円",14日前,レバテックキャリア
株式会社エフ・エフ・エル,フルリモート案件あり! ITエンジニア 前職給与保証,東京都 豊島区 椎名町駅 徒歩5分,年収400万円～800万円,2日前,マイナビ転職
株式会社ESNA,ITエンジニア,東京都 港区 御成門駅 徒歩5分,年収200万円,3日前,type
株式会社日本ファーマテック・システムズ,ITエンジニア／未経験者歓迎・COBOL経験者歓迎,東京都 江東区 豊洲駅,月給23万円～,14日前,doda
アーシェルジャパン株式会社,海外製食品機械のフィールドエンジニアポジション,東京都,年収500万円～750万円,15日前,Spring転職エージェント
アクロスロード株式会社,エンジニアとして成長しよう／AWSエンジニア,東京都 品川区 五反田駅,年収300万円～600万円,10日前,マイナビ転職エージェントサーチ
株式会社ジンズホールディングス,JINS／グローバルITシステムの設計・構築を担うクラウドエ...,東京都 千代田区 飯田橋駅 徒歩2分,年収600万円～900万円,3日前,マイナビ転職エージェントサーチ
アンバソールジャパン株式会社,IoTシステムエンジニア DX推進担当／幅広い経験で技術力向上,東京都 中央区,年収500万円～700万円,6日前,リクルートエージェント
株式会社エーピーコミュニケーションズ,開発からサーバエンジニアへキャリアチェンジ,東京都 千代田区,年収350万円～450万円,公開していません,マイナビAGENT
株式会社ヴァンガード,エンジニアとプロジェクトを繋ぐ 人材営業・コーディネート,東京都 新宿区 新宿駅 徒歩10分,"月給20万6,000円～",23日前,リクナビNEXT
リックソフト株式会社,ソリューションエンジニア,東京都 千代田区 大手町駅 徒歩1分,年収414万円～802万円,26日前,paiza転職
株式会社LIFESYNC,ITエンジニア／未経験歓迎／20代活躍中／3カ月の研修あり,東京都 港区 田町駅,月給22万円～,12日前,doda
株式会社サービシンク,情報収集メインでOK／エンジニアリングマネージャー,東京都,"月給36万7,844円～43万9,438円",6日前,en ミドルの転職
株式会社ルーツ・テクノロジーズ,BIエンジニア 開発未経験OK 残業月20h以内 リモートワ...,東京都 新宿区 四ツ谷駅 徒歩8分,月給28万円～36万円,24日前,女の転職type
株式会社マイベスト,エンジニアリングマネージャー／組織運営の働き方立案～選択体験...,東京都 中央区 築地駅,"年収750万円～1,200万円",5日前,doda
株式会社エリア,フルスタックエンジニア,東京都 豊島区 池袋駅 徒歩6分,年収400万円～700万円,9日前,paiza転職
オシロ株式会社,アプリエンジニア,東京都 渋谷区 渋谷駅 徒歩9分,年収350万円～800万円,4日前,paiza転職
CREW株式会社,「ゼロ次請け」クラウドサービスを使い倒したいインフラエンジニア,東京都,年収450万円～820万円,9時間前,ふれツリ求人なび
ITKエンジニアリングジャパン株式会社,電気設計エンジニア,東京都 港区 浜松町駅,年収500万円～700万円,10日前,doda
株式会社キャリアデザインセンター,開発エンジニア Directtype担当,東京都 港区 赤坂見附駅 徒歩1分                                                                                                                                                                その他 (32),年収420万円～600万円,12時間前,Green
株式会社ディーインクリエイティブ,PHPエンジニア,東京都 品川区 青物横丁駅 徒歩1分,年収350万円～500万円,4日前,paiza転職
株式会社一休,エンジニアリングマネージャー,東京都 港区 赤坂見附駅,"年収800万円～1,700万円",17時間前,doda
株式会社グローバル・ニュークリア・フュエル・ジャ...,炉心・燃料の研究・開発・設計エンジニア 実務未経験歓迎,神奈川県 横須賀市 久里浜駅,月給24万円～,2日前,リクナビNEXT
株式会社ROXX,エンジニアリングマネージャー／開発組織の成果の最大化にコミット,東京都 新宿区 東新宿駅,"年収700万円～1,200万円",5日前,doda
株式会社アミィアクティブ,ITエンジニア／アプリ 未経験から本気の社内研修で成長可能,東京都,年収264万円～300万円,11時間前,リクルートエージェント
ブライシス株式会社,自社サービス自動化エンジニア,東京都 港区,年収450万円～900万円,6日前,paiza転職
株式会社パラダイムシフト,フロントエンドエンジニア,東京都 中央区 東日本橋駅 徒歩3分,年収400万円～600万円,4日前,paiza転職
株式会社情報戦略テクノロジー,一次より0次DX インフラエンジニア クラウド経験者歓迎,東京都 渋谷区 恵比寿駅 徒歩5分,年収450万円～850万円,1日前,Green
Episode Six Japan合同会社,ソフトウェアエンジニア,東京都 渋谷区,"年収500万円～1,200万円",9日前,paiza転職
株式会社アールピーシー,インフラエンジニア～一からエンジニアのキャリアを歩めます～,東京都,年収252万円～600万円,11日前,doda
xxx株式会社,サーバサイドエンジニア,東京都 新宿区 新宿駅 徒歩9分,年収360万円～750万円,22日前,U29JOB
株式会社PRECS,アプリケーションサイドエンジニア,東京都 台東区 御徒町駅 徒歩4分,年収500万円～800万円,8日前,paiza転職
ジョンビーン・テクノロジー株式会社,サービスエンジニア 業界シェアトップクラスの外資系企業 年俸...,東京都 中央区 人形町駅 徒歩1分,年収550万円～750万円,3日前,エン転職
産機エンジニアリング株式会社,VR関連アプリ開発エンジニア VR未経験も大歓迎,東京都 千代田区,年収350万円～500万円,12時間前,リクルートエージェント
株式会社PTS,クラウドエンジニア,東京都 新宿区                                                                                                                                                                その他 (3),年収500万円～800万円,4日前,paiza転職
株式会社アール･エス･アール,開発エンジニア／東京,東京都 千代田区 半蔵門駅 徒歩2分,年収500万円～800万円,1日前,CREATIVE JOB
ココネ株式会社,サーバサイドエンジニア,東京都 世田谷区 三軒茶屋駅 徒歩10分,年収600万円～900万円,4日前,paiza転職
株式会社ガラパゴス,エンジニアリングマネージャー／エンジニアの成長支援をお任せ／...,東京都 千代田区 神保町駅,"年収700万円～1,000万円",10日前,doda
株式会社HES,システムエンジニア,東京都 大田区 大森駅 徒歩3分,月給19万円～40万円,9日前,株式会社HES
DIエージェント障害者求人／No.13614,ご経験・スキルに応じた幅広いエンジニア職で募集中／コアタイム...,神奈川県 厚木市,年収300万円～450万円,10日前,BABナビ
本田技研工業株式会社,ソフトウェアエンジニアリングマネージャー,東京都 港区,年収510万円～900万円,16時間前,doda
株式会社ISS,未経験から3カ月研修で育成 ITエンジニア 年間休日125日,東京都 品川区 五反田駅 徒歩4分,月給18万円～,27日前,マイナビ転職
株式会社PKSHA Technology,エンジニア採用担当 採用戦略・ブランディング～実務まで／東証...,東京都 文京区,年収600万円～,6日前,リクルートエージェント
株式会社スカイウイル,ネットワークエンジニア 取引先は大手企業中心の堅実で安定した...,東京都,年収350万円～600万円,3日前,キャリフレ
デマンドリンク株式会社,システムエンジニア,東京都 千代田区,年収216万円～700万円,4日前,paiza転職
株式会社助太刀,QAエンジニア,東京都 渋谷区 渋谷駅 徒歩7分,"年収500万円～1,000万円",2日前,CREATIVE JOB
株式会社サーベイジシステム,インフラエンジニア 第二新卒歓迎／納得感のある評価制度／平均...,東京都 千代田区,年収350万円～,5日前,リクルートエージェント
dely株式会社,人事／エンジニア採用担当,東京都 港区 田町駅,年収480万円～650万円,13日前,doda
株式会社センシンソフト,開発エンジニア,東京都 品川区 五反田駅 徒歩4分,年収320万円～550万円,8時間前,type
株式会社マノア・リノ,ITエンジニアと企業の架け橋!未経験者歓迎!「人材コーディネ...,東京都 台東区 御徒町駅,月給23万円,公開していません,Office Lady
株式会社IRODORI,第二新卒のリスタートを応援! WEBエンジニア・IT事務,東京都 中央区,年収380万円～530万円,7日前,リクナビNEXT
株式会社セキュアイノベーション,プリセールスエンジニア～セキュリティ分野未経験可～,東京都 渋谷区 恵比寿駅,年収300万円～600万円,10日前,doda
株式会社ディーバ,バックエンド エンジニア,東京都,"年収600万円～1,000万円",17日前,Spring転職エージェント
株式会社エクストリーム,IT系システムエンジニア・プログラマー,東京都,年収280万円～600万円,17日前,Spring転職エージェント
株式会社システム・ロジックス,システムエンジニア,東京都 台東区 新御徒町駅 徒歩3分,月給20万円～24万円,27日前,エン転職
株式会社Room12,ネットワークエンジニア リモートOK／ブランク大歓迎／平均残...,東京都 港区 新橋駅 徒歩3分,月給25万円～,公開していません,かんたん応募
株式会社ウィルオブ・ワーク,インフラエンジニア 東証プライム市場上場G／大手企業との直取...,東京都 新宿区 新宿三丁目駅,年収350万円～700万円,1日前,レバテックキャリア
株式会社ブライセン,業務系アプリ開発エンジニア 年休120日,東京都 中央区 築地駅 徒歩7分,年収450万円～650万円,20日前,リクナビNEXT
株式会社ケーエムケーワールド,エンジニアマネージャー／社内管理職候補,東京都 中央区 新富町駅,年収500万円～900万円,21日前,Geekly
株式会社カカクコム,スマホアプリエンジニア,東京都 渋谷区 渋谷駅,年収550万円～950万円,12日前,doda
マンダイシステムズ株式会社,営業経験不問 IT営業 エンジニアからのキャリアチェンジ歓迎...,東京都 千代田区,年収350万円～450万円,4日前,リクルートエージェント
株式会社CaSy,webエンジニア,東京都 品川区 目黒駅,年収450万円～650万円,7時間前,paiza転職
株式会社万葉,Railsエンジニア,東京都 新宿区 新宿駅,年収350万円～,1日前,Green
エヌシーシーエンジニアリング株式会社,技術者を目指す!経験問わず始められる サービスエンジニア,神奈川県 横浜市 長津田駅 徒歩10分,"月給16万5,000円～24万500円",3日前,リクナビNEXT
株式会社Crane&I,システムエンジニア／「エンジニア教育で日本一」を目指すIT企...,東京都 新宿区,年収250万円～350万円,2日前,Re就活
株式会社BITZ,自社開発エンジニア 受託開発・自社サービス,東京都 渋谷区 幡ケ谷駅 徒歩3分,年収450万円～650万円,10日前,type
i CONTINENT株式会社,ITエンジニア 還元率80%／2022年4月スタートの新事業...,東京都 多摩市 多摩センター駅 徒歩3分,月給32万円～,27日前,エン転職
株式会社エイ・アイ・エス,JAVAエンジニア・プログラマ,東京都 千代田区 岩本町駅 徒歩1分,年収432万円～650万円,4日前,paiza転職
旭化成エンジニアリング株式会社,システムエンジニア,神奈川県 川崎市 川崎駅,年収430万円～750万円,12日前,doda
株式会社OverTech,WEBエンジニア、Web・オープンシステム開発運用、未経験歓...,東京都 世田谷区 駒沢大学駅 徒歩15分,月給25万円～,25日前,かんたん応募
株式会社あすフィット,Web系、オープン系開発エンジニア,東京都 千代田区 麹町駅 徒歩5分,年収360万円～500万円,4日前,paiza転職
株式会社ROGYX,経験者募集 土日祝休み フロントエンジニア・テスター,東京都 千代田区 神保町駅 徒歩3分,月給25万円,5時間前,リクナビNEXT
株式会社エイシル,Webアプリケーション開発エンジニア,神奈川県,年収300万円～450万円,4日前,paiza転職
株式会社SANN,エンジニアリングマネージャー,東京都 渋谷区,"年収658万円～1,440万円",公開していません,株式会社SANN
株式会社チームスピリット,シニアQAエンジニア,東京都 中央区 京橋駅 徒歩1分,年収600万円～840万円,4日前,paiza転職
太平洋エンジニアリング株式会社,深谷 プラントエンジニア 太平洋セメントグループ／福利厚生充実,埼玉県 深谷市,年収440万円～700万円,5日前,リクルートエージェント
株式会社アジル・ラボ,システムエンジニア,東京都 中野区,月給21万円～,11日前,U29JOB
株式会社スカイアーチHRソリューションズ,AWSエンジニア特化／立ち上げフェーズ／日本初のAWS特化型...,東京都 港区,年収360万円～600万円,6日前,doda
ウェルスタイル株式会社,インフラエンジニア,東京都 渋谷区 恵比寿駅 徒歩7分,年収300万円～900万円,14日前,Green
株式会社IACソリューションズ,アプリエンジニア,東京都 新宿区,年収400万円～800万円,公開していません,マイナビAGENT
デジタルアーツコンサルティング株式会社,セキュリティエンジニア Web面接／フルリモートワーク可,東京都 千代田区 大手町駅,年収400万円～900万円,1日前,Green
株式会社日本経済新聞社,Webアプリ開発エンジニア グローバルBtoBサービス,東京都 千代田区 大手町駅,"年収600万円～1,300万円",3日前,doda
オルターボ株式会社,C#エンジニア,東京都 渋谷区 渋谷駅 徒歩5分,年収350万円～750万円,11時間前,Green
株式会社ゴーガ,Web エンジニア,東京都 渋谷区 渋谷駅 徒歩3分,年収450万円～800万円,4日前,paiza転職
株式会社アイフリークモバイル,初級ITエンジニア,東京都 新宿区 新宿御苑前駅 徒歩1分,年収680万円,10日前,type
チームラボ株式会社,チームラボ 2023新卒／フロントエンドエンジニア,東京都 千代田区 小川町駅 徒歩1分,年収300万円～,公開していません,かんたん応募
MicroWorld株式会社,マネージャー／チームリーダー／リードエンジニア,東京都 港区 虎ノ門駅,年収500万円～900万円,公開していません,paiza転職
株式会社リベラルセンス,ITエンジニア,東京都 中央区 茅場町駅 徒歩5分,月給18万円～,7日前,type
株式会社フロンティア・システムソリューションズ,開発エンジニア 希望案件優先／経験者・前給以上保証／残業代全...,東京都 台東区 御徒町駅 徒歩5分,月給25万円～50万円,27日前,エン転職
ティッセンクルップ・ニューセラ株式会社,プロセスエンジニア,東京都,年収450万円～850万円,公開していません,Spring転職エージェント
株式会社Voicy,Androidエンジニア,東京都 渋谷区,年収450万円～880万円,2日前,株式会社Voicy
株式会社システムシェアード,開発エンジニア 自社研修サービス保有／AWS・Java案件メ...,東京都 千代田区,年収350万円～600万円,5日前,doda
株式会社トラストバンク,開発エンジニア／プロジェクトマネージャー,東京都,年収642万円～900万円,23日前,Spring転職エージェント
株式会社リレクチャー,湘南で働くITエンジニア／平均通勤時間30分／在宅勤務もOK,東京都,月給20万円～,7日前,doda
株式会社アースシステムズラボラトリー,システムエンジニア,東京都 新宿区,年収450万円～900万円,11時間前,doda
株式会社NCネットワーク,サーバサイドエンジニア,東京都 台東区 仲御徒町駅 徒歩1分,年収500万円～800万円,6日前,paiza転職
株式会社テクノアーム小松,フルリモート案件有／リモート併用／スタートアップ事業エンジニ...,東京都 千代田区 神田駅 徒歩3分,月給22万円～60万円,11時間前,Find Job!
H.R.I株式会社,完全未経験から目指せる! Webデザイナー・エンジニア,東京都 新宿区 大久保駅 徒歩3分,月給22万円～,5日前,リクナビNEXT
