エンジニアファースト,ITエンジニア募集・開発言語不問・フロントエンドエンジニア・...,東京都 武蔵野市 吉祥寺駅 徒歩2分,年収500万円～,11日前,かんたん応募
株式会社フルスピード,英語を活かせるブリッジエンジニア,東京都 渋谷区,月給50万円,公開していません,やまとごころキャリア
株式会社アコミック,ITエンジニア,東京都 新宿区 新宿御苑前駅 徒歩3分,月給26万円～70万円,23時間前,かんたん応募
スチールプランテック株式会社,2023 新卒採用 プラント・エンジニアリング,神奈川県 横浜市 新横浜駅 徒歩5分,"月給20万1,500円～24万4,500円",21日前,リクナビ2023
株式会社BJIT,ブリッジエンジニア募集,東京都,月給50万円～,27日前,JICA 国際協力キャリア PARTNER
ヒューマンリソシア株式会社,インフラエンジニア,東京都 新宿区,年収300万円～500万円,6日前,Daijob.com
株式会社アプリコット,未経験歓迎! コーディネーター エンジニアのフォローが8割／...,神奈川県 川崎市 川崎駅 徒歩2分,月給27万円～32万円,21日前,エン転職
株式会社EARTH,ITエンジニア,東京都,月給25万円～35万円,3日前,JOBRIDGE
アクロビット株式会社,フルリモート可／SAPコンサルタント ITエンジニア・PG,東京都 港区 赤羽橋駅 徒歩5分,"月給25万4,719円～",2日前,リクナビNEXT
株式会社リブセンス,プロダクト・エンジニア,東京都 品川区 目黒駅 徒歩3分,"年収500万円～1,150万円",1日前,CREATIVE JOB
株式会社アリベル,SE／システムエンジニア,神奈川県 川崎市,年収400万円～600万円,公開していません,ママワークス
株式会社キャンサースキャン,リードエンジニア／エンジニアリングマネージャー,東京都,"年収700万円～1,200万円",公開していません,日経転職版
株式会社リアクトウォール,ITエンジニア 代表との出会いが理想のキャリアの実現へ,東京都 新宿区 西新宿駅 徒歩1分,月給27万円～,2日前,マイナビ転職
ソネオス株式会社,高卒OK!「開発エンジニア」月給25万円～45万円+賞与年2...,東京都 中央区 八丁堀駅,月給25万円～45万円,8日前,Office Lady
株式会社サンタエンタテイメント,未経験が楽しく学べるIT研修 WEBデザイナー・エンジニア,東京都 豊島区,月給20万円～50万円,6日前,リクナビNEXT
株式会社W8SYSTEMS,ITエンジニア,東京都 港区,月給20万円～60万円,9時間前,株式会社W8SYSTEMS
株式会社スタジオアーク,事業拡大に向けて「フロントエンドエンジニア・HTMLコーダー...,東京都 千代田区 神田駅 徒歩5分,月給24万円～50万円,9日前,Find Job!
株式会社グルコース,フルスタックエンジニア,東京都 港区 六本木駅 徒歩8分,年収450万円～700万円,2日前,paiza転職
エムスリー株式会社,モバイルアプリエンジニア,東京都 千代田区 溜池山王駅 徒歩2分,年収500万円～,2時間前,CREATIVE JOB
株式会社イージス,キッティングから始めるエンジニア,東京都 豊島区,月給21万円～30万円,1日前,かんたん応募
株式会社ラクスパートナーズ,AIエンジニア,東京都 新宿区 新宿三丁目駅 徒歩1分,年収351万円～,7日前,type
株式会社ブライトアルファ,アプリ・ゲーム好き多数 エンジニア／PG・事務,東京都 新宿区 新宿御苑前駅,月給18万円～80万円,20日前,リクナビNEXT
株式会社DYMキャリア,大手SIerのインフラエンジニア,東京都 千代田区 飯田橋駅,月給60万円～90万円,1日前,modis
株式会社TechFirst Leaders,Web開発エンジニア,東京都 千代田区,年収400万円～650万円,4日前,paiza転職
THECOO株式会社,エンジニアリングマネージャー,東京都 渋谷区 明治神宮前駅 徒歩7分,"年収800万円～1,200万円",29日前,THECOO株式会社
チームラボエンジニアリング株式会社,スマホアプリエンジニア フルスタックエンジニアへ育成,東京都 千代田区,年収300万円～400万円,5日前,リクルートエージェント
株式会社wevnal,テックリードエンジニア／エンジニアリングマネ,東京都,"年収600万円～1,200万円",公開していません,日経転職版
株式会社precious,エンジニア 未経験大歓迎!約10カ月の独自研修で成長を応援,東京都 新宿区 新宿三丁目駅 徒歩3分,月給20万円～50万円,公開していません,マイナビ転職
株式会社NOM,ITエンジニア／システムエンジニア／40-60代大歓迎／年齢...,東京都 渋谷区,月給45万円～127万円,1日前,かんたん応募
三輝工業株式会社,2023 新卒採用 プラント・エンジニアリング,千葉県 佐倉市 佐倉駅,月給21万円～22万円,3日前,リクナビ2023
株式会社ジェステック,ITエンジニア 研修充実 年休130日 残業10h 同期がい...,東京都 新宿区 新宿駅 徒歩8分,月給22万円～30万円,1日前,女の転職type
株式会社マルコム,未経験歓迎!年休120日 医療機器のメンテナンスエンジニア,東京都 あきる野市,月給20万円～28万円,3日前,リクナビNEXT
株式会社K-WING,未経験から大手で働ける!エンジニア,東京都 練馬区,"月給19万7,000円～",12日前,株式会社K-WING
株式会社フィックスポイント,システム運用の自動化ソフト開発企業でエンジニアリングマネージ...,東京都 渋谷区 渋谷駅 徒歩6分,"年収700万円～1,000万円",3日前,マイナビ転職エージェントサーチ
カイテク株式会社／CaiTech inc.,介護をテクノロジーで変革／社会問題を共に解決するエンジニアを...,東京都 港区,年収720万円～960万円,6日前,en ミドルの転職
ファインディ株式会社,コーポレートエンジニア,東京都 品川区,年収500万円～700万円,公開していません,マイナビAGENT
株式会社ネッツイーテクノロジー,ITエンジニア 年収UP保証 給与還元率75% 在宅勤務率9...,東京都 港区 表参道駅 徒歩2分,月給30万円～,23時間前,マイナビ転職
キヤノン株式会社,WEB説明会 情報、機械、電気、物理、化学系エンジニア,東京都 大田区,月給20万円～52万円,1日前,リクナビNEXT
華為技術日本株式会社,横浜の事業所での人事ポジション・エンジニアポジションの募集,神奈川県 横浜市 神奈川区,年収350万円～800万円,10日前,BABナビ
株式会社アジケ,フロントエンドエンジニア,東京都 世田谷区 池尻大橋駅 徒歩8分,年収500万円～970万円,7時間前,paiza転職
株式会社ギフティ,プロジェクトマネージャー／エンジニアリングマネージャー／gi...,東京都 品川区 五反田駅,"年収500万円～1,000万円",13日前,レバテックキャリア
株式会社講談社,ソフトウェアエンジニア,東京都 文京区 護国寺駅,"月給43万4,400円",19日前,日経転職版
トヨタファイナンス株式会社,エンジニアリングマネージャー:トヨタグループの金融サービスを...,東京都 千代田区,"年収450万円～1,000万円",4日前,リクルートエージェント
株式会社GOOYA,サポートエンジニア,東京都 渋谷区 渋谷駅 徒歩2分,年収350万円～500万円,18日前,U29JOB
株式会社TechBowl,Webフロントエンジニア,東京都 港区 六本木駅 徒歩2分,年収600万円～,12時間前,Green
株式会社レンサ,WEBアプリエンジニア、スマホアプリエンジニア,東京都 港区,年収280万円～480万円,28日前,paiza転職
株式会社マーキュリーリアルテックイノベーター,WEBアプリ開発エンジニア,東京都 新宿区 新宿駅 徒歩8分,月給35万円～50万円,4時間前,リクナビNEXT
株式会社Donuts,中途 「ミクチャ」iOSエンジニア,東京都 新宿区 新宿駅 徒歩1分,年収450万円～800万円,2日前,CREATIVE JOB
株式会社Value,客先常駐なし!プライム8割・フルリモートOK 開発エンジニア,東京都 新宿区 新宿三丁目駅 徒歩2分,月給30万円～80万円,5日前,マイナビ転職
ナレッジビーンズ株式会社,初級エンジニア 年間休日125日 定着率95% リモートワー...,東京都 港区 神谷町駅 徒歩1分,月給18万円～,8日前,女の転職type
株式会社タスネット,インフラエンジニア 残業月10時間程度・年休125日,東京都 千代田区 溜池山王駅 徒歩8分,"月給23万9,000円～",17時間前,エン転職
武蔵エンジニアリング株式会社,フィールドサービスエンジニア,神奈川県,年収450万円～650万円,15日前,Spring転職エージェント
株式会社エムズクリエイティブシステム,ITエンジニア リモート案件9割／9割が年収UP／残業月15...,東京都 品川区 五反田駅 徒歩6分,月給30万円～70万円,17時間前,エン転職
Saze株式会社,給与も働き方も仕事内容も自分で選べる 開発エンジニア,東京都 千代田区 秋葉原駅 徒歩1分,月給25万円～45万円,2日前,マイナビ転職
株式会社スタイル・エッジLABO,Web開発エンジニア,東京都 新宿区 新宿駅 徒歩5分,年収400万円～700万円,4日前,paiza転職
B&B株式会社,1年間はスクールで成長! ITエンジニア 未経験OK 年休1...,東京都 千代田区 永田町駅 徒歩1分,月給20万円～60万円,3日前,マイナビ転職
株式会社バンダイナムコネクサス,インフラエンジニア,東京都 港区 三田駅 徒歩5分,"年収520万円～1,100万円",2日前,CREATIVE JOB
株式会社インタートレード,システムエンジニア,東京都 中央区,"月給21万8,000円",29日前,専門学校の就活 Career Map
株式会社テレビ朝日メディアプレックス,テレビ局を支えるクラウドエンジニア,東京都 港区,年収500万円～700万円,1時間前,エンジニアHubキャリア
チームラボグループ,スマホアプリエンジニア,東京都 千代田区 小川町駅 徒歩1分,年収500万円～800万円,4日前,paiza転職
株式会社ココペリ,エンジニアリングマネージャー 中小企業のDX化に貢献 福利厚...,東京都 千代田区,年収700万円～,4日前,リクルートエージェント
株式会社バンダイナムコスタジオ,QAエンジニア,東京都 江東区,月給30万円,14日前,専門学校の就活 Career Map
株式会社エンテックス,WEB系アプリケーションエンジニア／高収入可,東京都 新宿区 四ツ谷駅 徒歩5分,"月給26万6,000円～69万4,000円",21日前,リクナビNEXT
株式会社スーパーソフトウエア,Pythonエンジニア 38年黒字経営・現年収保証,東京都,年収550万円～800万円,20日前,Spring転職エージェント
株式会社engine Incubation,未経験からスタート! Webエンジニア,東京都 渋谷区 渋谷駅 徒歩3分,月給20万円～30万円,16日前,マイナビ転職
株式会社富士三和総研,インフラエンジニア,東京都 板橋区 中板橋駅 徒歩5分,年収500万円～,8時間前,type
株式会社キャリアデザインセンター ITソリューシ...,Web開発エンジニア／自社内開発／残業少なめ／月給30.5万...,東京都 港区 赤坂見附駅 徒歩1分,"月給30万5,000円～43万円",8日前,女の転職type
株式会社イースト・コースト・ワン,開発・インフラエンジニア フルリモート8割!高卒以上,東京都 港区 御成門駅 徒歩5分,月給25万円～32万円,16日前,マイナビ転職
株式会社GLOBAL SERVICE,Webエンジニア 月給25万〜 未経験OK 女性エンジニア活...,東京都 文京区 江戸川橋駅 徒歩5分,月給25万円～,2日前,女の転職type
株式会社クレイス,SE／PGからのキャリアチェンジ歓迎!ネットワークエンジニア,東京都 千代田区 岩本町駅 徒歩1分,月給23万円～,5時間前,リクナビNEXT
株式会社エー・アイ・エムスタッフ,開発エンジニア,東京都 千代田区 半蔵門駅 徒歩2分,年収300万円～510万円,4日前,paiza転職
株式会社いすゞ中央研究所,自動運転部門 システム設計エンジニア,神奈川県,年収450万円～700万円,2日前,Spring転職エージェント
株式会社ライドコア,SESエンジニア スキル・経験・希望に即した案件に配属,東京都 港区 乃木坂駅,年収300万円～600万円,7日前,doda
株式会社AbemaTV,エンジニア複数ポジション,東京都 渋谷区,"年収450万円～1,002万円",公開していません,マイナビAGENT
QuEST Global Services Pt...,年収:600万円～800万円-ソフトウェア開発ブリッジエンジ...,東京都 港区 赤羽橋駅 徒歩3分,年収600万円～800万円,26日前,日経転職版
株式会社オーパス,最初は誰でも未経験!研修重視で始めるエンジニア PG・SE,東京都,月給18万円～50万円,1日前,リクナビNEXT
株式会社f4samurai,フロントエンドエンジニア,東京都 千代田区 秋葉原駅 徒歩3分,"年収400万円～1,000万円",4日前,paiza転職
株式会社10ANTZ,エンジニアリングマネージャー,東京都 渋谷区 渋谷駅 徒歩3分,月給50万円～72万円,2日前,CREATIVE JOB
株式会社システムクリエイト,データベースエンジニア,東京都,月給25万円～,7日前,type
株式会社計装エンジニアリング,社内研修&フォロー体制充実!未経験から始める ITエンジニア,東京都 大田区,月給23万円～40万円,2日前,マイナビ転職
日揮グローバル株式会社,アンモニアプラントのエンジニアリングマネジャー,神奈川県 横浜市 西区,"年収800万円～1,200万円",5日前,リクルートエージェント
ルームクリップ株式会社,ユーザー数前年比200%増!TypeScriptでAPIを開...,東京都 渋谷区,年収480万円～600万円,2日前,エンジニアHubキャリア
株式会社ブレイブハート,ITエンジニア／エンジニアになりたい思いがあればOK／フリー...,東京都 豊島区 池袋駅,月給25万円～35万円,13時間前,女の転職type
株式会社Amazia,急成長マンガアプリ「マンガBANG!」や新規事業開発を行うR...,東京都 渋谷区,"年収400万円～1,000万円",11日前,エンジニアHubキャリア
Carpe diem株式会社,案件も働き方も、ワガママ聞きます ITエンジニア フル在宅7割,東京都 足立区,月給25万円～,16日前,マイナビ転職
株式会社インキュライズコンサルティング,ITエンジニア 同期と一緒に成長!実践的研修で確実にスキルUP,東京都 目黒区 中目黒駅 徒歩8分,"月給21万5,000円～",16日前,マイナビ転職
株式会社WeTec,Webオープン系エンジニア,東京都 千代田区,年収300万円～600万円,1日前,paiza転職
株式会社グロース,初級エンジニア／月給25万／IT知識ゼロでもOK／住宅手当あ...,東京都 港区 神谷町駅 徒歩5分,月給25万円～,1日前,女の転職type
株式会社信興テクノミスト,2 データエンジニア エンジニアとしてキャリアパスにお悩みの...,東京都 品川区,年収380万円～550万円,5日前,リクルートエージェント
株式会社ステージア,開発エンジニア,東京都 国分寺市 国分寺駅 徒歩7分,月給32万円～,3日前,type
ジェイ・ライン株式会社,機械エンジニア,神奈川県 横浜市,年収258万円～,8日前,ジェイ・ライン株式会社
株式会社フロンティアダイレクト,初級エンジニア 未経験OK IT研修最大6ヶ月 月給25万円...,東京都 渋谷区 渋谷駅 徒歩9分,月給25万円,1日前,女の転職type
株式会社ハイウェル,フリーランス／Linux／経験者歓迎!Linuxサーバエンジ...,東京都 千代田区,月給60万円～90万円,8時間前,株式会社ハイウェル
株式会社ビズリーチ,セキュリティエンジニア,東京都,"年収600万円～1,000万円",23日前,Spring転職エージェント
ネクスト株式会社,ITエンジニア／未経験OK／教育体制充実／リモート案件多数／...,東京都 渋谷区 渋谷駅 徒歩13分,年収300万円～600万円,2日前,Re就活
Marvel株式会社,フルリモートエンジニア 全国から東京の案件に参画 モダンなプ...,東京都 港区 六本木駅,月給35万円～70万円,10日前,エン転職
イチアール株式会社,設立2年で社員数100名急成長DXスタートアップでアプリエン...,東京都,年収400万円～899万円,6日前,en ミドルの転職
株式会社メディアスクエア,自社開発SaaS!WEBエンジニア,東京都 千代田区 小川町駅 徒歩5分,月給25万円～,14日前,リクナビNEXT
金山国際株式会社,開発エンジニア,東京都 千代田区 東京駅 徒歩5分,月給50万円～100万円,9時間前,type
KDDIグループ,インフラエンジニア,東京都,年収450万円～800万円,17日前,Spring転職エージェント
AlienSystem株式会社,インフラエンジニア,東京都 千代田区,年収600万円,9時間前,type
株式会社STEER JAPAN,プラスチック成形機・樹脂等の機械エンジニア／月給30万円～,東京都 千代田区 神田駅,月給30万円～45万円,7日前,リクナビNEXT
BizteX株式会社,エンジニアリングマネージャー エンジニアリング文化の醸成／ク...,東京都 新宿区,年収700万円～900万円,21日前,エンジニアHubキャリア
株式会社ジェンビッド・テクノロジーズ・ジャパン,エンジニアリングマネージャー,東京都 新宿区 新宿駅 徒歩5分,"年収850万円～1,300万円",16日前,Daijob.com
株式会社ザクロ,研修3か月ありで安心して成長できるITエンジニア,東京都,月給25万円～30万円,1日前,かんたん応募
AMBL株式会社,クラウドエンジニア,東京都 品川区 五反田駅 徒歩4分,年収450万円～700万円,1日前,CREATIVE JOB
株式会社LIG,システムエンジニア,東京都 台東区 新御徒町駅 徒歩2分,年収400万円～700万円,2日前,CREATIVE JOB
株式会社スーパーワン,100%自社開発 WEBアプリ開発エンジニア／フルリモート可,東京都 新宿区 西新宿駅 徒歩1分,"月給25万2,000円～40万3,200円",1日前,リクナビNEXT
ラ・ハイナ株式会社,ITエンジニア 残業月平均10時間以内／年間休日125日／リ...,東京都 渋谷区 千駄ケ谷駅 徒歩4分,月給30万円～62万円,14日前,エン転職
株式会社リアステージ,インフラエンジニア 会社創業を一緒に大きくしていくエンジニア...,東京都 港区 新橋駅,年収280万円～500万円,14時間前,株式会社リアステージ
株式会社テクニケーション,ITエンジニア 案件単価ベースで給与還元!平均年収150万円...,東京都 台東区 新御徒町駅 徒歩1分,月給34万円～65万円,7日前,エン転職
SCSK株式会社,インフラプロダクトエンジニア,東京都,"年収500万円～1,200万円",17日前,Spring転職エージェント
株式会社エーム,Webオープン系エンジニア,東京都 豊島区 池袋駅 徒歩5分,年収400万円～,4日前,paiza転職
株式会社Dexall,ITエンジニア／還元率78%／前職給与保証／年間休日125日,東京都 渋谷区 渋谷駅 徒歩5分,月給30万円～,6日前,doda
アミフィアブル株式会社,AIエンジニア,東京都 港区 浜松町駅 徒歩4分,"年収400万円～1,000万円",6日前,paiza転職
株式会社アクロスネット,未経験OKのITエンジニア／研修制度有／残業月平均10H未満,千葉県,年収300万円～,5日前,doda
DIC株式会社,化学工場のプラントエンジニア,埼玉県 伊奈町 丸山駅,月給30万円～40万円,1日前,ビルメン転職ナビ
株式会社データ・エージェンシー,データエンジニア,東京都 品川区 五反田駅 徒歩5分,年収400万円～600万円,8日前,ちばキャリ
株式会社テクノ情報システム,インフラエンジニア／金融・証券大型案件が豊富!退職金制度あり,東京都,年収300万円～600万円,20日前,Spring転職エージェント
株式会社レコチョク,開発エンジニア 残業少なめ フレックス勤務・リモート勤務あり,東京都 渋谷区 渋谷駅 徒歩4分,"月給25万3,615円",17時間前,エン転職
株式会社primeNumber,SaaS開発・QAエンジニア リクルート他、実績多数／自社D...,東京都 目黒区,年収680万円～950万円,3日前,doda
フレックシステムズ株式会社,インフラ・アプリエンジニア,東京都 千代田区,年収400万円～600万円,25日前,キャリコネ転職
インフラデザイン株式会社,ITエンジニア 未経験でも月給28万以上 テレワーク案件あり,東京都 港区 六本木一丁目駅 徒歩1分,"月給28万2,000円～",20日前,マイナビ転職
フィグニー株式会社,熊本 Webエンジニア,東京都 新宿区 西新宿五丁目駅 徒歩7分,年収250万円～650万円,5日前,Green
TKパートナーズ株式会社,ITエンジニア 残業月10h以下・年休124日／Web面接可...,東京都 品川区 五反田駅 徒歩4分,月給30万円～70万円,27日前,エン転職
エーソル株式会社,未経験から始めるITエンジニア テレワーク9割／残業月20h...,東京都 港区 御成門駅 徒歩1分,"年収280万2,000円～",17時間前,エン転職
株式会社ヘルツテック,組み込みエンジニア 年間休日120日以上／賞与年2回／住宅・...,東京都 新宿区 新宿西口駅 徒歩3分,月給35万円～,10日前,エン転職
株式会社アビリティ,開発SE／「主役」はエンジニア!キャリアの希望も働き方へのこ...,東京都 渋谷区,年収300万円～450万円,2日前,Re就活
株式会社ティースクエアラボ,テストエンジニア 経験不問／英語を使用しながら業務にあたります,千葉県 千葉市 美浜区,年収360万円～,2日前,リクルートエージェント
富士テクノロジー株式会社,ITエンジニア,東京都 港区,年収400万円～800万円,4時間前,リクナビNEXT
株式会社SORIGHT,WEBデザイナー・エンジニア／ITスクール研修有 月給23万,東京都,月給23万円～60万円,13日前,リクナビNEXT
コンピュータ・レスキュー株式会社,ITエンジニア／システム開発からインフラ構築まで自分に合った...,東京都 千代田区 飯田橋駅 徒歩3分,年収250万円～350万円,2日前,Re就活
アルユーアイ株式会社,未経験歓迎!／ITエンジニア／資格取得支援充実／年休126日,東京都 中野区 中野坂上駅 徒歩1分,月給25万円～50万円,4日前,doda
ロボテック株式会社,産業用ロボットを動かす面白さを味わえるエンジニア／製造・調整,東京都 足立区 綾瀬駅,月給23万円～,20日前,リクナビNEXT
ファーストアカウンティング株式会社,バックエンドエンジニア,東京都 港区,"年収700万円～1,000万円",9日前,paiza転職
株式会社エム・ワイ・ケー,エンジニア 未経験の方も大歓迎 完全週休2日制 研修制度が充実,東京都 中央区 築地駅 徒歩1分,月給23万円,2日前,女の転職type
株式会社ウエディングパーク,未開拓領域をデジタルの力で革新する!自社サービス開発エンジニア,東京都,年収408万円～708万円,13日前,株式会社ウエディングパーク
株式会社ワイズロジック,Webアプリエンジニア／運用エンジニア,東京都 台東区 浅草橋駅 徒歩6分,年収480万円～700万円,2日前,paiza転職
株式会社メディアドゥ,Webエンジニア,東京都 千代田区 竹橋駅,年収400万円～600万円,3日前,paiza転職
株式会社アイルミッション,プリセールスエンジニア 要件定義～基本設計にも携わります,神奈川県 横浜市 港北区,年収500万円～700万円,2日前,リクルートエージェント
株式会社セブン&アイ・ホールディングス,インフラエンジニア リモート勤務OK,東京都 新宿区 四ツ谷駅 徒歩4分,"月給29万7,750円～",7日前,エン転職
株式会社ブリーズUSER,PCスキルがあればエンジニアになれちゃう ITサポート・事務,東京都 港区 三田駅 徒歩5分,月給21万円～,6日前,リクナビNEXT
アニコム損害保険株式会社,デジタルマーケティングエンジニア,東京都,年収450万円～700万円,17日前,Spring転職エージェント
アクセレイ株式会社,開発エンジニア／インフラエンジニア,東京都,月給24万円～40万円,8日前,マイナビ転職エージェントサーチ
株式会社サクヤ,インフラエンジニア,東京都 渋谷区 渋谷駅 徒歩6分,年収350万円～600万円,2日前,Green
株式会社ミツモア,エンジニアリングマネジャー,東京都 中央区 東銀座駅 徒歩5分,年収700万円～900万円,1日前,paiza転職
