NDSソリューション株式会社,半導体製造装置メンテナンス／整備エンジニア 年間休日126日,神奈川県 横浜市 新横浜駅 徒歩5分,"月給19万6,000円～35万円",2日前,リクナビNEXT
株式会社イノセント,未経験”超”積極採用! WEBデザイナー／エンジニア,東京都 中央区 築地駅,月給20万円～50万円,6日前,リクナビNEXT
A1A株式会社,Webアプリケーションエンジニア,東京都 千代田区 水道橋駅 徒歩4分,"年収600万円～1,000万円",6日前,paiza転職
日本アビオメッド株式会社,補助人工心臓制御装置のサービスエンジニア／臨床工学技士,東京都,年収400万円～600万円,20時間前,かんたん応募
株式会社シムックスイニシアティブ,フロントエンジニア／自社内開発／若手活躍中,東京都 港区 大門駅,年収400万円～600万円,公開していません,Geekly
株式会社コントロールテクノロジー,主席エンジニア,東京都 千代田区 溜池山王駅,年収601万円～904万円,27日前,paiza転職
DIエージェント障害者求人／No.10372,システムエンジニア,東京都 新宿区                                                                                                                                                                その他 (2),年収300万円～400万円,10日前,BABナビ
ロジソーコ,ものづくりエンジニア,東京都 千代田区,年収240万円～350万円,3日前,ロジソーコ
株式会社キャリアジャパン,PC修理保守!未経験からITエンジニア 研修充実,東京都 豊島区 池袋駅 徒歩5分,月給24万円～,1日前,エン派遣
株式会社ストラテジーアンドパートナー,エンジニア ～充実した教育サポート有／自社サービス・受託開発...,東京都 世田谷区,年収360万円～600万円,12日前,doda
株式会社ネットサービス・ソリューションズ,インフラエンジニア,東京都 千代田区,年収320万円～400万円,2時間前,ワークポート
THRIVE株式会社,ものづくりエンジニア,東京都 新宿区,年収360万円～600万円,9日前,THRIVE株式会社
アクトインディ株式会社,アプリエンジニア,東京都 品川区 五反田駅 徒歩10分,年収600万円～800万円,4日前,paiza転職
アイブレインズ株式会社,開発エンジニア 受託案件多数／フルリモート・フレックスOK,東京都 渋谷区 恵比寿駅 徒歩5分,月給21万円～,8日前,マイナビ転職
株式会社メイン,開発SE／リーダー ビジネスセンスをもったエンジニアを生み出...,東京都 渋谷区,年収450万円～600万円,4日前,リクルートエージェント
株式会社エニグモ,会員数960万人越えCtoCソーシャルショッピングサイト「B...,東京都 港区 青山一丁目駅 徒歩3分,"年収600万円～1,000万円",1時間前,エンジニアHubキャリア
株式会社アズテックス,Webアプリケーションエンジニア／プライム案件多数,東京都 千代田区 神田駅,年収335万円～675万円,公開していません,Geekly
株式会社ビースカイ,フルリモート 組み込みエンジニア 残業10h／チーム派遣でフ...,東京都 渋谷区 渋谷駅,年収300万円～500万円,21時間前,doda
Fabeee株式会社,バックエンドエンジニア／フルスタック候補／技術志向の方歓迎,東京都 千代田区 九段下駅,年収400万円～550万円,公開していません,Geekly
株式会社アイエム,アプリケーションエンジニア,東京都 豊島区 池袋駅 徒歩7分,年収420万円～700万円,9日前,doda
株式会社プラウドフロー,知識ゼロの未経験から成長できる ITエンジニア／PG・事務,東京都 渋谷区,月給18万円～80万円,6日前,リクナビNEXT
株式会社SORA,サーバーエンジニアへ 月30万～,東京都 渋谷区 渋谷駅 徒歩8分,"時給2,200円～",1日前,エン派遣
AZURE・PLUS株式会社,アプリケーションエンジニア／売上前年比120% 福利厚生／評...,東京都 千代田区 小川町駅,年収400万円～600万円,7日前,doda
株式会社テラス,AI・IT業界 システムエンジニア、総合営業の求人,東京都,月給25万円～100万円,公開していません,かんたん応募
株式会社トゥレス,在宅勤務可システムエンジニア,東京都 渋谷区,"時給2,000円～",8時間前,株式会社トゥレス
株式会社ビルドイット,インフラエンジニア／残業は月平均10h内／リモートワーク8割,東京都 港区 大門駅,月給30万円～55万円,22時間前,doda
株式会社Empire,1年の育成期間あり ITエンジニア 定着率100% 残業ほぼ...,東京都 港区 田町駅 徒歩6分,月給30万円～90万円,23日前,マイナビ転職
DIエージェント障害者求人／No.13778,エンジニア・テスター・社内SE・開発エンジニアほか,東京都 千代田区,年収350万円～900万円,10日前,BABナビ
Flat Holdings株式会社,QA／テストエンジニア／100%自社開発,神奈川県 横浜市 みなとみらい駅,"年収400万円～1,000万円",13時間前,Green
株式会社サントラスト,プログラマー／ネットワーク・サーバエンジニア,東京都 千代田区 小川町駅,月給20万円～35万円,7日前,リクナビNEXT
株式会社ライズサクセス,創業メンバーとして未経験から成長 ITエンジニア／PG・事務,東京都 渋谷区,月給18万円～80万円,14日前,リクナビNEXT
合同会社EXNOA,サーバサイドエンジニアリーダー,東京都 港区,"年収600万円～1,000万円",公開していません,マイナビクリエイター
株式会社ライコン ラダーシステム,ITエンジニア,東京都 中央区 新富町駅 徒歩5分,月給30万円～55万円,8時間前,type
GITAI Japan株式会社,宇宙機エンジニア 世界から注目される「宇宙ロボットベンチャー」,東京都 大田区,"年収600万円～1,080万円",5日前,リクルートエージェント
アライドアーキテクツ株式会社,webのテックリードエンジニア,東京都 渋谷区 恵比寿駅 徒歩3分,年収500万円～750万円,4日前,paiza転職
株式会社L&F,Webエンジニア,千葉県 千葉市 中央区,年収460万円～600万円,7日前,paiza転職
株式会社ふくおかフィナンシャルグループ,エンジニアリングマネージャー,東京都 中央区,"年収840万円～1,000万円",11日前,doda
株式会社ダイヤモンドファンタジー,Webエンジニア,東京都 中央区 銀座駅 徒歩2分,年収400万円～700万円,9日前,paiza転職
株式会社レガリス,各種エンジニア業務,神奈川県 横浜市,月給23万円～40万円,18時間前,イーキャリアFA
株式会社エスイーアーキテクト,ITエンジニア これからのキャリアに悩んでいる方、将来を一緒...,東京都 千代田区 岩本町駅 徒歩3分,"月給16万8,000円～",27日前,エン転職
株式会社Cuon,webエンジニア,東京都 千代田区 東京駅 徒歩5分,年収400万円～600万円,4日前,paiza転職
信越化学工業株式会社,海外工場建設に向けた自社プラントエンジニア,東京都,年収500万円～900万円,公開していません,Spring転職エージェント
C-HRC株式会社,セキュリティエンジニア,東京都 品川区 五反田駅,月給25万円～100万円,10日前,type
株式会社ブローウィッシュ,インフラエンジニア,東京都 中央区 馬喰町駅 徒歩5分,月給35万円～,24日前,type
ドレーゲルジャパン株式会社,臨床工学技士歓迎! 手厚い研修制度あり。医療機器サービスエン...,東京都 江東区,年収400万円～550万円,2日前,かんたん応募
BPS株式会社,Webエンジニア,東京都 新宿区 都庁前駅 徒歩7分,年収480万円～650万円,4日前,paiza転職
コクー株式会社,未経験から2ヶ月間の研修でITエンジニアへ 月給27万円,東京都 千代田区,月給27万円～,20日前,リクナビNEXT
合同会社アールエンジン,ITエンジニア 還元率最大85%／在宅率9割／待機100%支...,東京都 墨田区 錦糸町駅 徒歩3分,月給30万円～90万円,27日前,エン転職
株式会社ジェニュイン,開発エンジニア,東京都 千代田区 九段下駅 徒歩3分,年収400万円～550万円,4日前,paiza転職
株式会社エスティーエークリーフ／株式会社Vエステ...,ゲームエンジニア,東京都 千代田区 秋葉原駅 徒歩2分,月給18万円～,24日前,type
株式会社ナレッジコミュニケーション,クラウドエンジニア,千葉県 市川市,年収400万円,4日前,paiza転職
LINE Digital Frontier株式会社,フロントエンドエンジニア／LINEマンガ,東京都,"年収600万円～1,000万円",7日前,Spring転職エージェント
DXHR株式会社,Webエンジニア／全国・フルリモート,東京都 中央区 小伝馬町駅 徒歩3分,年収500万円～650万円,5日前,Green
Dahua Technology Japan合同...,プリセールスエンジニア／世界シェア2位のメーカー／土日休み,東京都 中央区 茅場町駅,年収400万円～700万円,9日前,doda
株式会社カーネルジャパン,将来に悩む未経験者にこそオススメ ITエンジニア／PG・事務,東京都,月給18万円～80万円,6日前,リクナビNEXT
アジアクエスト株式会社,AWSエンジニア,東京都 千代田区 飯田橋駅 徒歩5分,"年収400万円～1,000万円",8時間前,type
株式会社シュヴァルベル,ITエンジニア／新卒定着率100%!個別研修から!SEとして...,東京都 新宿区 都庁前駅,年収350万円～700万円,2日前,Re就活
株式会社リンクテクノロジー,開発エンジニア,東京都 大田区 大森駅 徒歩9分,月給22万円～48万円,8時間前,type
パーソルイノベーション株式会社,エンジニアマネージャー,東京都,年収650万円～950万円,29日前,Spring転職エージェント
株式会社豊和ソフト,開発エンジニア,東京都 中央区 浜町駅 徒歩3分,月給30万円～75万円,24日前,type
クラスター株式会社,QAエンジニア,東京都 品川区 大崎広小路駅 徒歩5分,年収360万円～600万円,1日前,CREATIVE JOB
オイシックス・ラ・大地株式会社,iOSアプリエンジニア,東京都 品川区 大崎駅,年収500万円～900万円,7日前,doda
ケイズドットコム株式会社,ITエンジニア 案件の9割がリモートワークOK!／前給UPを...,東京都 中央区 東銀座駅 徒歩4分,年収420万円～600万円,10日前,エン転職
株式会社経営工学研究所,Javaエンジニア,東京都 渋谷区,年収400万円～500万円,4日前,paiza転職
Tres Innovation株式会社,AWSエンジニア 副業／リモート・在宅OK,東京都 世田谷区 池尻大橋駅 徒歩8分,年収400万円～700万円,14日前,Green
