株式会社デジアサ,WEB エンジニア,大阪府 大阪市 福島駅,"月給20万9,500円",11時間前,株式会社デジアサ
株式会社アサーティブ,業務系アプリケーションエンジニア・プログラマ,大阪府 大阪市 淀川区,公開していません,10時間前,株式会社アサーティブ
株式会社DRIVE LINE,WEBエンジニア 未経験から6ヶ月のカリキュラムでプロのエン...,大阪府 大阪市 本町駅 徒歩3分,"月給20万5,500円～24万円",10時間前,株式会社DRIVE LINE
SC-ConsultingLLC,SE Webエンジニア／プログラマー・完全未経験OK・学歴不...,京都府 京都市 下京区,月給28万円～50万円,15時間前,SC-ConsultingLLC
株式会社だんきち,Webエンジニア、アプリエンジニア,大阪府 摂津市,月給25万円～,11時間前,株式会社だんきち
LDG,webエンジニア募集,大阪府 大阪市 北区,年収600万円～,10時間前,LDG
株式会社Ruby,Web系エンジニア,大阪府,月給20万円～35万円,11時間前,株式会社Ruby
株式会社リクルートR&Dスタッフィング,Webエンジニア,大阪府 池田市,"月給20万5,000円～44万円",16時間前,エン転職
アクサス株式会社,汎用系システムエンジニア／Web／IT,大阪府 大阪市 西区                                                                                                                                    その他 (37),月給30万円～,11時間前,バイトルPRO
ノバシステム株式会社,業務系エンジニア,大阪府 大阪市 西区,年収430万円～700万円,14時間前,ワークポート
株式会社シーイーシー,業務系／制御系システムエンジニア 独立系SIer／プライム案...,大阪府 大阪市 新大阪駅,年収400万円～800万円,19時間前,レバテックキャリア
株式会社インクルード,WEBエンジニア,大阪府 大阪市 西区,年収400万円～500万円,13時間前,ワークポート
株式会社フィールドロジック,WEBエンジニア,大阪府 大阪市 北区,年収500万円～550万円,15時間前,ワークポート
アイ・エイ・ジェイ株式会社,Webエンジニア,兵庫県 神戸市 東灘区,公開していません,12時間前,en ミドルの転職
プロシスタ株式会社,Webデザイナー・UIエンジニア,大阪府 大阪市 新大阪駅 徒歩8分,"月給19万775円～43万5,900円",11時間前,プロシスタ株式会社
株式会社キャピタル・アセット・プランニング,Webアプリケーション開発のエンジニア,大阪府 大阪市 西梅田駅 徒歩5分,年収400万円～,11時間前,株式会社キャピタル・アセット・プランニング
フィット産業株式会社,Web系システムエンジニア,大阪府 大阪市 新大阪駅,月給26万円～46万円,17時間前,ハローワーク淀川
株式会社インサイト,web系開発エンジニア,大阪府 豊中市 千里中央駅 徒歩5分,月給20万円～,11時間前,株式会社インサイト
株式会社BLUE,IT、WEBエンジニア,大阪府 大阪市 肥後橋駅 徒歩5分,月給18万円～,11時間前,株式会社BLUE
株式会社トライアンフ 大阪オフィス,サービスエンジニア Web面接可,大阪府 大阪市 西区,月給20万円～,10時間前,株式会社トライアンフ
株式会社トラストシステムソリューションズ,業務系ITエンジニア,大阪府 大阪市 本町駅 徒歩3分,月給20万円～45万円,10時間前,株式会社トラストシステムソリューションズ
日本アシスト株式会社,SE WEB系エンジニア,大阪府 大阪市 西梅田駅 徒歩3分,月給24万円～40万円,15時間前,日本アシスト株式会社
Evand株式会社 転職エージェント,未経験歓迎 業務系アプリケーションエンジニア・プログラマ,大阪府 大阪市 中央区,"月給19万5,000円～27万5,000円",16時間前,Evand株式会社転職エージェント
株式会社SHIFT,ITプロジェクトマネージャー／エンジニア 基本リモートワーク,大阪府 大阪市 北区,"月給35万円～49万5,834円",23時間前,マイナビ転職
株式会社アクターリアリティー,業務系システム開発 PL・PM,大阪府 大阪市 京橋駅 徒歩4分,月給35万円～55万円,10時間前,株式会社アクターリアリティー
株式会社アクティブゲーミングメディア,社内SE,大阪府 大阪市 本町駅 徒歩5分,年収276万円～360万円,1時間前,U29JOB
株式会社スプーキーズ,システムエンジニア,京都府 京都市 烏丸駅,月給20万円～,11時間前,株式会社スプーキーズ
株式会社ブレイカーズ,WEBデザイナー WEBデザイナー,大阪府 大阪市 中央区,月給20万円～60万円,16時間前,株式会社ブレイカーズ
株式会社ソルネットシステム,システムエンジニア,大阪府 大阪市 堺筋本町駅 徒歩1分,年収350万円～700万円,2時間前,U29JOB
株式会社電子工学センター,ITエンジニア キャリアUPも応援,大阪府 大阪市 新大阪駅 徒歩4分,月給20万円～,16時間前,株式会社電子工学センター
株式会社エスユーエス,想像を「創造」していこう WEB開発PG／PL,大阪府 大阪市 北区,月給30万円～,5時間前,リクナビNEXT
株式会社ひなた,ECサイトのWebデザイナー・アートディレクター 残業ほぼ無,大阪府 寝屋川市 萱島駅 徒歩1分,月給25万円～30万円,23時間前,リクナビNEXT
株式会社ウェム,ITエンジニア・PG,大阪府 大阪市 中央区,年収330万円～650万円,5時間前,U29JOB
日本ビジネスアート株式会社,グラフィックデザイナー,大阪府 大阪市 本町駅,月給35万円～60万円,10時間前,日本ビジネスアート株式会社
株式会社システムデバイステクノロジー,01／Web開発,大阪府 大阪市 西大橋駅,月給27万円～32万円,10時間前,株式会社システムデバイステクノロジー
ケイプラス株式会社,システムエンジニア,大阪府 大阪市 谷町四丁目駅 徒歩6分,月給25万円～45万円,11時間前,ケイプラス株式会社
アバナード株式会社,アプリケーションエンジニア:Open系,大阪府 大阪市 港区,"年収400万円～1,000万円",3時間前,マイナビAGENT
クオリカ株式会社,アプリエンジニア,大阪府 枚方市,年収500万円～700万円,7時間前,マイナビAGENT
FPTコンサルティングジャパン株式会社,新規事業／システムエンジニア,大阪府 大阪市 北区,公開していません,4時間前,マイナビAGENT
株式会社トライト,バックエンドエンジニア 自社サイトの要件定義など上流工程をお...,大阪府 大阪市 北区,年収600万円～900万円,21時間前,doda
日揮株式会社,オイル&ガス 定期修理／検査員,大阪府,年収500万円～,2時間前,パソナキャリア
株式会社セットジャパンコーポレーション,システムエンジニア,大阪府 大阪市 北区,月給25万円～,11時間前,株式会社セットジャパンコーポレーション
株式会社アドグローブ,サーバサイドエンジニア,大阪府 大阪市 梅田駅 徒歩10分,年収450万円～900万円,7時間前,paiza転職
ウェッジ株式会社,保守・アフターサービスエンジニア,京都府 京都市 西大路駅 徒歩5分,月給20万32円,4時間前,リクナビNEXT
京セラコミュニケーションシステム株式会社,京セラのデジタル化、基幹システム構築等を担うアプリエンジニア,京都府 京都市 伏見駅 徒歩10分,月給25万円～,4時間前,リクナビNEXT
株式会社日本ビジネスデータープロセシングセンター,年休124日以上 ネットワーク運用管理／構築,大阪府 大阪市,月給35万円～,4時間前,リクナビNEXT
eBASE-PLUS株式会社,賞与年4回／残業ほぼなし テクニカルサポート・サーバ運用,大阪府 大阪市,月給20万円～45万円,4時間前,リクナビNEXT
株式会社あらい,Webデザイナー・HTMLコーダー,大阪府 堺市 上野芝駅 徒歩17分,"月給31万4,000円～36万円",11時間前,Find Job!
大阪安宅機械株式会社,売上に貢献する介在価値を持つ 一般・営業事務,大阪府 大阪市 本町駅 徒歩3分,"月給19万5,000円～",4時間前,リクナビNEXT
株式会社アウトソーシングテクノロジー,事務系総合職 CADで新しいキャリア 土日祝休 残業少なめ ...,大阪府,"月給18万5,000円～30万円",14時間前,女の転職type
株式会社リクルートスタッフィング情報サービス,研修充実!大手正社員 20代8割! 事務／ITサポート事務,大阪府 大阪市 中央区,"月給18万6,000円～",5時間前,リクナビNEXT
株式会社曙題工業,エンジニア,大阪府 大阪市 大阪駅 徒歩1分,月給20万円～,9時間前,Workin.jp
株式会社日立社会情報サービス,上流工程から運用保守まで ITエンジニア,大阪府 大阪市,月給24万円～,23時間前,マイナビ転職
株式会社夢テクノロジー,未経験歓迎! ITエンジニア 身に付けたスキルが評価に繋がる,大阪府,月給22万円～,23時間前,マイナビ転職
株式会社フォーラムエンジニアリング,未経験歓迎! 品質保証 残業少なめ 賞与年2回 土日祝休み,大阪府,"月給20万5,000円～45万5,000円",23時間前,マイナビ転職
株式会社NTTデータMHIシステムズ,日本のモノづくりを支える ITエンジニア,兵庫県 神戸市,月給26万円～45万円,23時間前,マイナビ転職
Quest-Com株式会社,来たれ!熱意ある未経験 システムエンジニア SE／PG,大阪府 大阪市 本町駅 徒歩4分,月給20万円～,5時間前,リクナビNEXT
株式会社セブンスター,輸入車の整備士・エンジニア 残業ほぼ無 20代月収例35万円,兵庫県 神戸市 住吉駅 徒歩5分,"月給22万円～28万5,000円",23時間前,リクナビNEXT
株式会社GSC,ITエンジニア,大阪府 大阪市 淀川区,月給18万円～50万円,10時間前,株式会社GSC
株式会社日本AIコンサルティング,WEB・システム開発／特許取得のAIシステムを活用,大阪府 吹田市 江坂駅 徒歩2分,"月給18万8,000円～51万4,000円",23時間前,リクナビNEXT
株式会社ソフトギア,「PROJECT ACES」新プロジェクト始動! サーバ開発...,大阪府 大阪市 中央区,"月給33万9,500円～85万円",23時間前,マイナビ転職
株式会社システナ,エンジニア ロボット、AI・IoTなど最先端／プライム案件多数,大阪府 大阪市 梅田駅 徒歩6分,"月給23万5,000円～",23時間前,マイナビ転職
ジェイエムシー株式会社,SE・システムエンジニア,大阪府 大阪市 福島駅 徒歩5分,月給25万円～30万円,10時間前,ジェイエムシー株式会社
株式会社ノース・ヒル,構築技術者にとどまらない、提案力や実行力のある方募集,大阪府 大阪市 桜ノ宮駅 徒歩10分,年収450万円～600万円,11時間前,Find Job!
株式会社ビーネックスソリューションズ,脱!未経験を目指してスキルUP ヘルプデスク・サーバ運用,大阪府 大阪市 本町駅 徒歩5分,"月給26万5,000円",5時間前,リクナビNEXT
エドワーズライフサイエンス株式会社,TAVIのクリニカルスペシャリスト／臨床工学技士・看護師・臨...,大阪府 大阪市 淀川区,年収450万円～700万円,17時間前,かんたん応募
株式会社マクロアーク,上流工程のプロジェクトに参加できる SE・PG,大阪府 大阪市 本町駅 徒歩3分,"月給27万円～44万1,000円",21時間前,マイナビ転職
株式会社アビリーブ,未経験OK!資格保持者は”厚待遇”でお迎え! ビル設備管理,大阪府 大阪市,月給21万円～32万円,23時間前,マイナビ転職
パーソルエクセルHRパートナーズ株式会社,キャリアパス充実,大阪府,"月給23万4,500円～39万5,000円",23時間前,マイナビ転職
フォーザウィン株式会社,インフラエンジニア 経験者 前給以上確約 面接保証,大阪府 大阪市 東淀川区,月給35万円～,23時間前,マイナビ転職
メタウォーターサービス株式会社,上下水道施設内の設備保守管理・運転管理担当,京都府 京都市 伏見区,月給18万円～,3時間前,ビルメン転職ナビ
マレルジャパン株式会社,外資系食品加工機器・電機系サービスエンジニア／電気エンジニア,兵庫県 明石市 西明石駅 徒歩10分,年収450万円～700万円,22時間前,リクナビNEXT
スプリングエイトサービス株式会社,最先端の研究を支える、エンジニア・プロセス開発,兵庫県 佐用町,月給20万円～,22時間前,リクナビNEXT
有限会社シーボーン,月給30万円超&土日祝休!船舶のセールスエンジニア・技術営業,兵庫県 神戸市 元町駅 徒歩8分,月給25万円～30万円,23時間前,リクナビNEXT
株式会社トップゲート,ITエンジニア 完全在宅勤務,大阪府 大阪市 北区,月給30万円～65万円,21時間前,PROSEEK
株式会社ケース・ラボ,完全自社製品開発・導入 SE・テクニカルサポート,大阪府 大阪市 長堀橋駅 徒歩3分,月給30万円～40万円,23時間前,リクナビNEXT
日本アビオメッド株式会社,急性心不全治療の注目の医療機器! 経皮的補助人工心臓の営業職,大阪府,年収500万円～800万円,17時間前,かんたん応募
株式会社レタス,Webシステム開発のシステムエンジニア／リモート勤務／賞与4...,大阪府 大阪市 北浜駅,公開していません,10時間前,株式会社レタス
クボタ環境サービス株式会社,ほぼ100%官公庁案件!環境プラントの運転・管理 未経験OK,大阪府 大阪市,月給17万円～29万円,23時間前,マイナビ転職
株式会社スタッフサービス,研究開発 未経験歓迎,大阪府,"月給21万5,000円～",23時間前,マイナビ転職
フェンリル株式会社,品質管理チームマネージャー モバイルやWebアプリなど、多種...,大阪府 大阪市 大阪駅 徒歩5分,年収600万円～799万円,3時間前,en ミドルの転職
アルゴリズム・カーネル株式会社,RTL設計エンジニア,大阪府 大阪市 北浜駅 徒歩2分,月給30万円～,14時間前,Q-JiN
すまいるホーム株式会社,未経験スタート大歓迎!ハウジングアドバイザー,兵庫県 姫路市 姫路駅,"月給18万7,920円～",22時間前,リクナビNEXT
山陽イシダ株式会社,メーカー研修有 食インフラを支えるサービスエンジニア／技術職,兵庫県,月給20万円～,22時間前,リクナビNEXT
日本アイ・ビー・エムデジタルサービス株式会社 I...,ITスペシャリスト／様々な業界かつ国内外のお客様のデジタル変...,大阪府 大阪市 北区,月給27万円～51万円,9時間前,en ミドルの転職
東都フォルダー工業株式会社,業界トップクラスシェアを担う サービスエンジニア,大阪府 守口市 大日駅 徒歩5分,月給22万円～,22時間前,マイナビ転職
株式会社SONO,電気管理技術者,大阪府 大阪市 本町駅 徒歩7分,"月給17万円～25万4,600円",22時間前,株式会社SONO
株式会社関西プラント,電気設備・機械設備の設計アシスタント,大阪府 大阪市 福島駅 徒歩3分,月給22万円～30万円,22時間前,株式会社関西プラント
万佳株式会社,SE IOS、Androidアプリ開発エンジニア,大阪府 大阪市 北区,年収400万円～699万円,12時間前,en ミドルの転職
DIC株式会社,化学工場の製造オペレーター,大阪府 高石市 高石駅,"月給22万5,000円～32万円",3時間前,ビルメン転職ナビ
共栄エンジニアリング株式会社,自社内開発 未経験歓迎 オープン系システムの「SE・PG」,大阪府 吹田市 正雀駅 徒歩2分,月給18万円～,4時間前,リクナビNEXT
トヨタL&F兵庫株式会社,整備／エンジニア 20～30代活躍中 土日祝休 賞与5ヶ月,兵庫県 神戸市,"月給18万3,000円～21万6,000円",23時間前,リクナビNEXT
コスモ電子通信株式会社,無線機器の営業・セールスエンジニア 年休126日・土日祝休み,大阪府 松原市 河内天美駅 徒歩10分,月給25万円～35万円,23時間前,リクナビNEXT
株式会社LUXAS,開発・設計エンジニア,大阪府 枚方市,月給23万円～,8時間前,株式会社LUXAS
オムロン株式会社,MES導入エンジニア,京都府 京都市 京都駅 徒歩5分,年収550万円～750万円,1時間前,U29JOB
株式会社フジワーク,システムエンジニア,兵庫県 明石市 明石駅 バス19分,月給22万円～60万円,2時間前,U29JOB
パーソルテクノロジースタッフ株式会社,機械設計エンジニア,大阪府 豊中市                                                                                                                                    その他 (101),月給23万円～,9時間前,パーソルテクノロジースタッフ株式会社
船井総研ロジ株式会社,物販販路開拓,大阪府 大阪市 中央区,"年収450万円～1,500万円",9時間前,en ミドルの転職
株式会社タクマ,ごみ処理プラントエンジニア,大阪府,年収490万円～770万円,1時間前,パソナキャリア
株式会社メディブレーン,100%自社開発! ITエンジニア 完全週休2日制,大阪府 大阪市 堺筋本町駅 徒歩5分,月給25万円～30万円,22時間前,マイナビ転職
アクセンチュア株式会社,NEWテクノロジーをフル活用!事業変革を支援するアプリケーシ...,大阪府,"年収400万円～1,499万円",11時間前,en ミドルの転職
株式会社アイエヌジー,水処理プラント施設の保守管理,京都府 京都市 伏見区,月給22万円～30万円,22時間前,株式会社アイエヌジー
スタッフサービス・エンジニアリング,研究開発,京都府 京都市 小野駅 徒歩10分,月給23万円～,16時間前,エン転職
CLINKS株式会社,未経験大歓迎! プログラマー 社会人デビューの先輩も活躍中,大阪府 大阪市 北区,月給21万円～,23時間前,マイナビ転職
ラーニンギフト株式会社,PL・PM／入社祝い金／PJ手当月平均21万円／上流工程,大阪府 大阪市 本町駅 徒歩5分,月給52万円～80万円,4時間前,doda
教育×ICT専業メーカーとして自社製品を提案,本社 は全部署合わせて35名、東京以外の営業所は2名から5名...,大阪府 大阪市 新大阪駅 徒歩7分,年収400万円～700万円,9時間前,株式会社アクセス22
ジーアイクラウド株式会社,データエンジニア／伊藤忠商事グループのGoogle Clou...,大阪府,年収500万円～799万円,6時間前,en ミドルの転職
MINO株式会社,企画営業／販売,大阪府 東大阪市,月給25万円～32万円,4時間前,リクナビNEXT
株式会社アクティシステム,ソフトウェア開発エンジニア／賞与2回／住宅手当／リモート実績...,大阪府 大阪市 新大阪駅 徒歩5分,年収400万円～750万円,10時間前,株式会社アクティシステム
株式会社ボールド,開発エンジニア,大阪府,年収300万円～400万円,53分前,イーキャリアFA
Infofuel communications有...,システムコンサル／運用サポート・経営企画管理サポート 副業可,兵庫県 神戸市 摂津本山駅 徒歩1分,"月給13万6,000円～32万円",23時間前,リクナビNEXT
トランスコスモス株式会社,BIMエンジニア+マネジメント 交通費あり 業界経験者歓迎 ...,大阪府 大阪市 肥後橋駅 徒歩7分,"月給28万6,000円～",7時間前,Work it!
株式会社アジャイルウェア,テストエンジニア,大阪府 大阪市 中央区,年収350万円～550万円,8時間前,ワークポート
株式会社羽車,社内システムを開発するSE・PG 月給40万可、年休118日,大阪府 堺市 新金岡駅,月給25万円～,23時間前,リクナビNEXT
株式会社神戸製鋼所,製鉄所設備のエンジニアリング業務,兵庫県 加古川市 浜の宮駅 車11分,年収450万円～900万円,2時間前,U29JOB
サングローブ株式会社,集客&採用の「完全反響Web営業」未経験可,大阪府,月給24万円～52万円,9時間前,サングローブ株式会社
エイビースタッフ株式会社,技術エンジニア職,大阪府 大阪市 北区,月給21万円～,9時間前,エイビースタッフ株式会社
株式会社ヒューマンウェイブ,半導体製造装置・設備メンテナンス／リーダー候補,大阪府 大阪市 北加賀屋駅 バス10分,"月給21万円～23万5,000円",10時間前,株式会社ヒューマンウェイブ 大阪本社
株式会社ヒューマンウェイブ大阪本社,システムエンジニア・プログラマー,兵庫県 伊丹市,月給20万円～40万円,10時間前,株式会社ヒューマンウェイブ大阪本社
株式会社エージェンテック,DX化を推進!自社SaaSサービスのソリューション営業,大阪府 大阪市 本町駅 徒歩3分,年収340万円～480万円,22時間前,マイナビ転職
