株式会社松風,WEBエンジニア 業界唯一の上場企業,"京都府 京都市 東山区                                                                                                                    




株式会社松風の求人
をすべて見る",年収400万円～660万円,5日前,リクルートエージェント
片岡メディアデザイン株式会社,プログラマー HP・ECサイト等のWebエンジニア,京都府 京都市 上京区,月給20万円～40万円,公開していません,片岡メディアデザイン株式会社
株式会社MIRISE,WEBデザイナー又はWEBエンジニア募集,京都府 京都市 円町駅 徒歩3分,"時給980円～1,200円",公開していません,株式会社MIRISE
エクサイト株式会社,Webアプリケーション・エンジニア,京都府 京都市 東野駅,年収400万円～900万円,15日前,CREATIVE JOB
株式会社Atomis,Webエンジニア,京都府 京都市 出町柳駅 徒歩5分,年収500万円～,公開していません,paiza転職
株式会社フォンタァジュ,インフラエンジニア 土日祝休み／自由度の高い働き方／Webアプリケーションエンジニア,京都府 京都市 丹波口駅,月給30万円～,7日前,株式会社フォンタァジュ
スマートキャンプ株式会社,Webアプリケーションエンジニア Saas メディア事業 BPO事業,京都府 京都市 中京区,"年収600万円～1,000万円",4日前,リクルートエージェント
株式会社アルファス,WEBデザイナー兼マークアップエンジニア,京都府 京都市 京都駅,年収320万円～480万円,11日前,doda
株式会社ブリッジコーポレーション,Web開発エンジニア,京都府 京都市 烏丸御池駅 徒歩1分,年収500万円～800万円,公開していません,doda
株式会社FREEMIND,Web系システムエンジニア,京都府 京都市 丸太町駅,年収300万円～400万円,28日前,doda
ワールドビジネスセンター株式会社,ネットワーク・インフラエンジニア～Web面接可／創業55年の安定経営～,京都府 京都市,年収350万円～450万円,4日前,doda
株式会社ハースト・デジタル・ジャパン,ウェブ システム開発エンジニア／Web System Development Engineer,京都府 京都市 下京区,年収500万円～800万円,公開していません,株式会社ハースト・デジタル・ジャパン
株式会社島津ビジネスシステムズ,Webエンジニア 島津グループのマーケティングDX推進／英語力を活かす,京都府 京都市 中京区,年収475万円～625万円,4日前,リクルートエージェント
株式会社エックスポイントワン,Webエンジニア,京都府 京都市 四条駅,年収450万円～830万円,公開していません,paiza転職
株式会社フィーリスト,WEBシステム開発エンジニア 社員の居心地を大切にする環境,京都府 京都市 中京区,年収350万円～550万円,5日前,リクルートエージェント
株式会社DiO,フロントエンドエンジニア、Webコーダー,京都府 京都市 今出川駅 バス12分,月給20万円～34万円,18日前,株式会社DiO
株式会社NTTデータ・ニューソン,Web開発エンジニア 主軸メンバーとして提案～導入まで一貫したサービスを提供,京都府 京都市 伏見駅,年収361万円～619万円,22日前,レバテックキャリア
株式会社アドインテ,Webエンジニア AI×マーケが強みの自社サービス／年休128日,京都府 京都市 下京区,年収360万円～800万円,4日前,リクルートエージェント
井上株式会社,WEB・システムエンジニア,京都府 福知山市 福知山駅 車2分,"月給19万6,500円～30万6,500円",公開していません,ハローワーク福知山
株式会社フィールド,HTMLコーダー、Webエンジニア、フロントエンドエンジニア,京都府 京都市 四条駅,"月給20万1,600円～33万6,000円",公開していません,株式会社フィールド
株式会社Nextat,WEBエンジニア,京都府 京都市 五条駅 徒歩1分,月給18万円～30万円,公開していません,ハローワーク京都七条
株式会社堀場エステック,流体制御機器のサービスエンジニア／WEB面接可能,京都府 京都市 南区,年収400万円～600万円,5日前,リクルートエージェント
株式会社Oz link,"WEBエンジニア 顧客向け及び月商1,500万美容系自社EC制作",京都府 京都市 中京区,年収390万円～580万円,5日前,リクルートエージェント
株式会社村田製作所,セールスエンジニア／WEB面接可,京都府 長岡京市,年収435万円～835万円,5日前,リクルートエージェント
株式会社俄,Webエンジニア・サーバーサイドエンジニア,京都府 京都市 中京区,年収390万円～700万円,5日前,リクルートエージェント
株式会社プラメド,WEBアンケート画面作成エンジニア 医療領域／リモート可／平均残業20H程度,京都府 京都市 下京区,年収400万円～450万円,5日前,リクルートエージェント
株式会社スプーキーズ,アプリケーションエンジニア サーバーサイドエンジニア／Webエンジニア RubyやJava,京都府 京都市 烏丸駅,年収320万円～700万円,22日前,レバテックキャリア
サイバーパテント株式会社,システムエンジニア／Webアプリケーション,京都府 京都市 京都駅,年収550万円～650万円,公開していません,Geekly
株式会社坂ノ途中,Webアプリケーション開発エンジニア,京都府 京都市 西京極駅,年収300万円～600万円,公開していません,Geekly
株式会社サザンウィッシュ,Webエンジニア／自社サービス／Saasアプリケーション,京都府 京都市 京都駅,年収500万円～700万円,公開していません,Geekly
株式会社バトンズ,Webエンジニア／フルスタックエンジニアへのキャリアアップ,京都府 京都市 京都駅,年収400万円～600万円,公開していません,Geekly
株式会社クレアリンクテクノロジー,WEBアプリケーションエンジニア,京都府 精華町,"月給19万8,000円～35万円",15日前,ハローワーク京都田辺
日本電産リード株式会社,WEB面接完結 サービスエンジニア,京都府 京都市 右京区,年収400万円～650万円,6日前,MEITEC NEXT
オムロンヘルスケア株式会社,システムエンジニア／Web・クラウド・アプリ,京都府 京都市 桂川駅 徒歩5分,年収500万円～850万円,公開していません,タイズ
株式会社ハイシンク創研,Web・オープン系システムエンジニア／IT通信インフラ構築事業,京都府 京都市 丹波口駅 徒歩10分,年収580万円～800万円,公開していません,バイトルPRO
株式会社ビジネスポート,SE ーお客様の笑顔と共にステップアップを目指すー 業務システム・Webシステム開発エンジニア,京都府 京都市 京都駅 徒歩5分,月給25万円～,公開していません,株式会社ビジネスポート
総合経営サポートセンター,WEBアプリケーションエンジニア,京都府 京田辺市,月給21万円～44万円,公開していません,総合経営サポートセンター
Cross Group株式会社,SE,京都府 京都市,年収350万円～560万円,14日前,かんたん応募
株式会社アジアンビジネスネットワーク,Webディレクター・Webプロデューサー,京都府 京都市,年収400万円～600万円,14日前,かんたん応募
株式会社エクサウィザーズ,企画開発プランナー 未経験歓迎／UIターン歓迎,京都府 京都市 左京区,"年収420万円～1,000万円",5日前,リクルートエージェント
Happy Elements株式会社,ゲーム開発エンジニア 熱狂的に愛されるゲーム制作へ,京都府 京都市 烏丸御池駅,年収450万円～800万円,6日前,doda
株式会社シーズ,Webプログラマー,京都府 京都市 丹波口駅 徒歩5分,年収350万円～,公開していません,Green
株式会社ワントゥーテン,Webで新しいことにチャレンジしたい方を募集,京都府 京都市 烏丸駅 徒歩2分,"年収449万9,000円～600万7,000円",15時間前,CREATIVE JOB
株式会社エクザム,制作チームと一緒に働きたいインフラエンジニア募集,京都府 京都市 西大路御池駅 徒歩5分,年収250万円～800万円,1日前,CREATIVE JOB
アトモフ株式会社,ソフトウェアエンジニア,京都府 京都市 烏丸御池駅 徒歩7分,公開していません,公開していません,Green
株式会社ピー・アンド・ヴァック,PG,京都府 京都市,年収323万円～433万円,14日前,かんたん応募
株式会社メディアウォーズ,アプリケーションエンジニア,京都府 京都市 丹波口駅,年収350万円～600万円,公開していません,doda
株式会社アクシスウェア,PG,京都府 京都市,年収364万円～600万円,15日前,かんたん応募
エスピーメディアテック株式会社,PHPプログラマー募集,京都府 向日市 向日町駅 徒歩10分,月給25万円～40万円,18日前,CREATIVE JOB
株式会社FUNDINNO,SE,京都府 京都市,"年収500万円～1,200万円",14日前,かんたん応募
株式会社演算工房,システムエンジニア,京都府,年収337万円～700万円,公開していません,Spring転職エージェント
株式会社シェルパ,Webディレクター・烏丸,京都府 京都市 烏丸御池駅 徒歩1分,年収350万円～600万円,2日前,Green
AMBL株式会社,アプリ開発,京都府 京都市,年収400万円～700万円,14日前,かんたん応募
株式会社イーイノベーション,2023 新卒採用 ソフトウェア,京都府,月給19万円～20万円,公開していません,リクナビ2023
株式会社マノア・リノ,サーバー設計・構築,京都府 京都市,年収420万円～840万円,14日前,かんたん応募
株式会社デイアライブ,Webディレクター,京都府 京都市 五条駅 徒歩1分,年収360万円～800万円,16日前,Green
オムロンソフトウエア株式会社,スマートフォンアプリケーション及びWEBシステム開発のプロジェクトマネージャ,京都府,年収450万円～850万円,10日前,Spring転職エージェント
株式会社ラプラス・システム,システム開発職 Webアプリケーション,京都府 京都市 伏見桃山駅 徒歩5分,年収400万円～700万円,11日前,Green
株式会社あすか,システムエンジニア,京都府,年収300万円～550万円,公開していません,paiza転職
SBI FinTech Solutions株式会社,PG,京都府 京都市,"年収400万8,000円～600万円",14日前,かんたん応募
株式会社アンドシステム,勘定系システムリプレースSE・PLポジション,京都府,年収384万円～800万円,公開していません,Spring転職エージェント
アバナード株式会社,フロントエンドエンジニア プロジェクトマネージャー,京都府,"年収600万円～1,200万円",公開していません,Spring転職エージェント
アクロスロード株式会社,SE,京都府 京都市,年収350万円～750万円,14日前,かんたん応募
株式会社テクロス,ゲームUIデザイナー／モバイルコンテンツUIデザイナー,京都府 京都市 烏丸駅 徒歩5分,年収350万円,公開していません,IMAGICA DIGITALSCAPE
株式会社ジェー・ピー・シー,コーディング 職場環境&業績,京都府 京都市 四条駅,月給32万円～,10日前,マイナビ転職
株式会社ユーエムイーネッツ,SE,京都府 京都市,年収420万円～700万円,14日前,かんたん応募
株式会社ウェルアソシエイツ,2023 新卒採用 ソフトウェア,京都府,月給23万円,公開していません,リクナビ2023
京セラコミュニケーションシステム株式会社,京セラGr向けの基幹系・業務系システム構築に携わりたいメンバー募集,京都府,年収550万円～800万円,公開していません,Spring転職エージェント
DX HUB株式会社,開発エンジニア 東京オフィス勤務,京都府 京都市 下京区,年収400万円～700万円,2日前,Green
ふくみっと運営事務局,営業／事務,京都府 京都市 京都市役所前駅,"時給940円～1,200円",17日前,ふくみっと
日本ナレッジスペース株式会社,インフラエンジニア,京都府,月給25万円～,9日前,かんたん応募
TOWN株式会社,アプリ開発,京都府 京都市,年収500万円～700万円,14日前,かんたん応募
株式会社ジーノット,広報・IR,京都府 京都市,年収388万円～540万円,14日前,かんたん応募
株式会社学生情報センター,社内SE,京都府 京都市 下京区,年収380万円～450万円,公開していません,建設・設備求人データベース
株式会社ジェネレーションパス,SE,京都府 京都市,年収300万円～700万円,14日前,かんたん応募
オムロン エキスパートリンク株式会社,ソフトウェア開発,京都府,年収350万円～650万円,公開していません,doda
株式会社80&Company,サーバサイドエンジニア,京都府 京都市 左京区,年収453万円～793万円,13日前,paiza転職
株式会社ネクプロ,AWSエンジニア ウェビナーマーケティング支援プラットフォーム開発／フルリモート,京都府,"年収500万円～1,000万円",11日前,doda
株式会社RISING 京都支部,未経験から成長できるシステムエンジニア,京都府 京都市 下京区,月給25万円～40万円,公開していません,株式会社RISING
アイフル株式会社,システム開発エンジニア システム内製化／大手金融企業／自社サービス開発,京都府 京都市 五条駅,年収400万円～800万円,3日前,レバテックキャリア
ビジネスラリアート株式会社,自社サービス開発エンジニア,京都府 京都市 烏丸駅,月給25万円～60万円,公開していません,ビジネスラリアート株式会社
テックマート株式会社,SE,京都府,年収400万円～600万円,14日前,かんたん応募
株式会社トータルマリアージュサポート,2023 新卒採用 ブライダル・冠婚葬祭,京都府,"月給18万5,000円～22万円",公開していません,リクナビ2023
ギグワークスクロスアイティ株式会社,プロジェクトマネジャー,京都府 京都市 四条駅,年収600万円～800万円,20日前,paiza転職
株式会社Nascom,ITエンジニア,京都府,月給25万円～45万円,14日前,type
大京システム開発株式会社,ITエンジニア／少しの実務経験でOK／東京案件増,京都府 京都市 四条駅,月給22万円～,16日前,doda
フリュー株式会社,サーバサイドエンジニア,京都府 京都市 下京区,年収550万円～700万円,公開していません,paiza転職
株式会社ルピナスファクトリー,PG,京都府 京都市,年収270万円～318万円,14日前,かんたん応募
株式会社イズム,開発エンジニア 全国フルリモート可／残業月7h程度／年休125日／還元率70%以上,京都府,"月給32万円～69万4,000円",公開していません,エン転職
株式会社たきコーポレーション,SE,京都府 京都市,年収350万円～500万円,14日前,かんたん応募
ヴァンテージマネジメント株式会社,SE,京都府 京都市,年収360万円～540万円,14日前,かんたん応募
株式会社日本オーエー研究所,未経験から始めるSE・PG,京都府 京都市,"月給22万3,000円～",10日前,リクナビNEXT
株式会社JO2,IT技術者全般をを募集しております! 現在未経験の方は募集しておりません,京都府,年収300万円～960万円,公開していません,かんたん応募
エスユーエス株式会社,ITエンジニア 8割リモート勤務!／年間休日131日／誕生月に3万円や住宅手当等、充実の待遇,京都府,月給25万円～,18日前,エン転職
株式会社アルメディア・ネットワーク,ITエンジニア 受託案件中心／月給40万～55万円／賞与年2回,京都府,月給40万円～55万円,18日前,マイナビ転職
株式会社コンタクト,Web系・オープン系 プログラマ,京都府 京都市,"月給22万5,000円～38万円",11日前,type
京セラ株式会社,DB推進 社外向けCloudビジネス立上げ,京都府,年収500万円～850万円,4日前,JAC Recruitment
LINE株式会社,フロントエンドエンジニア／LINE MUSIC・LIFF／京都開発室,京都府 京都市 下京区,公開していません,公開していません,LINE株式会社
株式会社MAYA STAFFING,ネットワークエンジニア 大手企業 土日祝休み 在宅勤務有り,京都府 京都市 京都駅 徒歩3分,"時給1,600円～3,000円",公開していません,かんたん応募
パーソルエクセルHRパートナーズ,フルリモート!自動運転システムの環境認識モジュール研究開発,京都府 京都市 五条駅 徒歩7分,"時給2,500円～2,750円",公開していません,エン派遣
株式会社アジャイルジェイピー,2023 新卒採用 ソフトウェア,京都府,"月給20万2,000円～22万6,000円",4日前,リクナビ2023
株式会社ケルク電子システム,防犯システムのフィールドエンジニア,京都府 京都市 山科駅 徒歩5分,年収308万円～392万円,公開していません,doda
パーソルR&D株式会社,制御ソフト開発エンジニア 腰を据えて就業できる環境を備えております 土日休,京都府,年収550万円～750万円,5日前,en ミドルの転職
パーソルエクセルHRパートナーズ株式会社 キャリ...,評価・テスト／メーカー関連,京都府 京都市 淀駅 徒歩15分,"時給1,400円～1,500円",4日前,はたらこねっと
株式会社HNS,ITエンジニア,京都府,月給30万円～45万円,11日前,type
星和電機株式会社,LED照明のシステム開発設計 東証一部／福利厚生,京都府 城陽市,年収425万円～560万円,4日前,リクルートエージェント
株式会社シー・アール・シー,システムエンジニア,京都府 京都市 烏丸駅 徒歩5分,年収350万円～600万円,3日前,U29JOB
株式会社ダイヤモンドパーソネル,三菱電機グループで活躍! 総合職,京都府 長岡京市,月給24万円～30万円,10日前,マイナビ転職
インターマキシス株式会社,Webアナリスト／アクセス解析 Google Analytics4／一味違うWeb会社,京都府 京都市 五条駅 徒歩1分,年収400万円～600万円,1日前,Green
株式会社アイビネット,未経験から始めるITエンジニア 年休127日・土日祝休み／社宅・住宅手当アリ／賞与年3回／面接1回,京都府,月給18万円～40万円,公開していません,エン転職
ラクスル株式会社,PdM／プロダクトマネージャー 既存産業をDXで変革! ユーザー100万人超,京都府 京都市,"年収600万円～1,025万円",8日前,リクルートエージェント
株式会社アイティ・フォレスト,システムコンサルタント,京都府 京都市,年収300万円～800万円,14日前,かんたん応募
AJ・Flat株式会社,PG・SE／約9割が年収120%UP／要望に応じたPJへ配属,京都府,月給30万円～40万円,公開していません,doda
アイデアル株式会社,PG・SE,京都府,月給21万円～45万円,21日前,type
有限会社ケンセイ情報,ITエンジニア 年間休日120日以上／残業月20時間以内,京都府,月給20万円～45万円,公開していません,エン転職
株式会社マネーフォワード,QA・テストエンジニア,京都府 京都市 三条駅 徒歩3分,"年収400万円～1,000万円",2日前,U29JOB
TIPSシステム株式会社,オープン系SE／社員のボトムアップを理想としている会社,京都府,年収350万円～600万円,5日前,リクルートエージェント
アルファテクノロジー株式会社,エンジニア,京都府,月給23万円～40万円,公開していません,doda
ケイプラス株式会社,アプリ開発エンジニア,京都府,年収300万円～500万円,公開していません,doda
株式会社アスマーク,社内SE,京都府 京都市,年収450万円～700万円,14日前,かんたん応募
株式会社イーヴンPLUS,アプリ開発,京都府 京都市,年収280万円～560万円,14日前,かんたん応募
株式会社リ・バース,SE,京都府 京都市,年収400万円～800万円,14日前,かんたん応募
株式会社Sharing Innovations,法人営業,京都府 京都市,年収300万円～500万円,14日前,かんたん応募
サンウェルグループ,ITエンジニア,京都府 京都市 下京区,公開していません,7日前,type
株式会社Wisdom Solution,開発エンジニア／集え!開発エンジニアの仲間たち,京都府,月給40万円～,21日前,type
株式会社イー・シー・アンドエム,未経験活躍中!  社員へ 簡単な機器の設定からスタート,京都府,"時給1,500円～",12日前,エン派遣
株式会社ナノック,ABAPエンジニア,京都府 京都市,年収400万円～800万円,6日前,doda
Baseconnect株式会社,エンジニアマネージャー／営業効率化サービス「Musubu」展開企業,京都府 京都市 二条駅,"年収600万円～1,000万円",公開していません,doda
エコリンクス株式会社,システムエンジニア,京都府 木津川市 木津川台駅,年収420万円～490万円,6日前,doda
株式会社ネクサスウィング,PG,京都府 京都市,年収380万円～450万円,14日前,かんたん応募
株式会社アイシス,PG,京都府 京都市,公開していません,15日前,かんたん応募
株式会社ウェブフロンティア,社内開発&自社サービス強化! Web開発SE 経験者募集,京都府,"年収300万円～1,000万円",公開していません,マイナビ転職
日本システムマネージメント株式会社,システムエンジニア,京都府 京都市,月給22万円～,26日前,U29JOB
株式会社エイジェックスデジタルストラテジーズ 英...,UX設計エンジニア ビジネスの未来を変えるデジタル戦略チームの創業期メンバー,京都府 京都市 京都駅,"年収720万円～1,260万円",2日前,en ミドルの転職
フォーザウィン株式会社,未経験からゲーム・評価・検証!プログラマ・システムエンジニア,京都府 京都市,月給30万円～,17日前,リクナビNEXT
株式会社ホットスタッフ京都,紹介予定派遣でのソフトインストラクターまたはフィールドエンジニア,京都府 向日市 西向日駅,"時給2,100円～2,625円",13日前,HOT犬索
株式会社エムハンド,Webディレクター／Webマーケ リモート勤務・フレックス有,京都府 京都市 下京区,月給26万円～,13日前,リクナビNEXT
株式会社アクシス・クリエイト,ITエンジニア,京都府,"月給21万7,000円～",21日前,type
株式会社エスワイシステム,ITエンジニア 未経験者採用実績率100%,京都府,"月給22万2,000円～",17日前,マイナビ転職
マッチスル株式会社,開発エンジニア,京都府,公開していません,7日前,type
株式会社アクセル,週払いOK データ入力+電話応対,京都府 京都市 西大路駅 徒歩5分,"時給1,350円",公開していません,エン派遣
i株式会社,SAP・ERP導入コンサルタント,京都府 京都市,年収250万円～900万円,14日前,かんたん応募
株式会社アイティーシー,インフラエンジニア,京都府,月給28万円～70万円,21日前,type
株式会社EIGHTIST,開発エンジニア／人と関わりたいエンジニアが集まる会社,京都府,月給27万円～55万円,公開していません,doda
RPAホールディングス株式会社,RoboRoboエンジニアリーダー,京都府,"年収600万円～1,000万円",25日前,Spring転職エージェント
株式会社シスミックインテグレーション,PG,京都府 京都市,年収400万円～600万円,14日前,かんたん応募
株式会社タック,希望のキャリアパスを目指せる ITエンジニア 年間休日125日,京都府 京都市,月給25万円～,20日前,マイナビ転職
株式会社ブレイン・ゲート,2023 新卒採用 ソフトウェア,京都府,"月給19万5,000円～22万円",公開していません,リクナビ2023
株式会社リテールマーケティング,ITエンジニア 還元率70～83%／単価は全て社内に公開／年休120日～／残業月5h以内,京都府,"月給31万5,000円～70万円",4日前,エン転職
エヌアイシィ株式会社,アプリケーションエンジニア,京都府,年収360万円～700万円,公開していません,doda
株式会社ウイルテック,残業12.7h／上場企業／未経験歓迎 アプリ開発・サーバ運用,京都府 京都市,月給22万円～55万円,11日前,リクナビNEXT
ALH株式会社,ITエンジニア～第二新卒歓迎／転勤なし／文系理系活躍中／研修充実～,京都府,年収278万円～400万円,28日前,doda
株式会社スタイル・フリー,アプリ・システム開発／インフラ設計・構築 年収UPの実績多数,京都府 京都市,月給30万円～,6日前,リクナビNEXT
