株式会社ゼネック,SE,京都府 京都市,年収350万円～600万円,14日前,かんたん応募
ポノス株式会社,サーバーサイドエンジニア 世界中で大人気!「にゃんこ大戦争」開発企業,京都府 京都市 下京区,年収450万円～960万円,4日前,リクルートエージェント
株式会社プロトシステム,PG,京都府 京都市,年収370万円～600万円,14日前,かんたん応募
エヌ・ティ・ティ・システム開発株式会社,ITエンジニア,京都府,月給25万円～,18日前,type
株式会社エフエスティ,既卒歓迎／SE・PG／ゼロから成長できて待遇も抜群!「鉄道」や「自動車」関連にも携われる,京都府,年収300万円～650万円,8時間前,Re就活
株式会社クランディム,大手飲料メーカーのシステムを開発! ITエンジニア,京都府 京都市 烏丸御池駅 徒歩1分,年収400万円～900万円,24日前,マイナビ転職
ウィツ株式会社,ERPエンジニア,京都府 京都市,年収420万円～600万円,4日前,en ミドルの転職
株式会社And Doホールディングス,Webディレクター プライム上場 賞与年2回,京都府 京都市 中京区,"月給38万1,700円～58万9,300円",18日前,エン転職
システム・エボリューション株式会社,システムエンジニア,京都府,年収400万円～550万円,9時間前,U29JOB
株式会社Innovation Planning,SE,京都府 京都市 祇園四条駅 徒歩3分,月給30万円～,28日前,株式会社Innovation Planning
株式会社ジェイテック,2023 新卒採用 自動車,京都府,"月給18万1,200円～20万2,760円",25日前,リクナビ2023
株式会社ゼネックコミュニケーション,ITエンジニア,京都府 京都市 烏丸御池駅 徒歩1分,月給30万円～,5時間前,type
GMOサイバーセキュリティ byイエラエ株式会社,SE,京都府 京都市,"年収500万円～1,200万円",14日前,かんたん応募
日本アイ・ビー・エムデジタルサービス株式会社 I...,ITスペシャリスト／様々な業界かつ国内外のお客様のデジタル変革を担うエンジニアを募集,京都府 京都市 下京区,月給27万円～51万円,6日前,en ミドルの転職
AZURE・PLUS株式会社,ITエンジニア 開発もインフラも上流案件が多数／残業月13時間程／土日祝休／年休123日／リモート可,京都府 京都市,月給25万円～50万円,11日前,エン転職
株式会社ゴーリスト,インフラ保守・運用,京都府 京都市,年収480万円～600万円,14日前,かんたん応募
