小林商事株式会社,信頼され進化する成長企業 フロント営業スタッフ,"東京都 江東区 新木場駅 バス5分                                                                                                                                                                    




小林商事株式会社の求人
をすべて見る",月給20万円～23万円,8時間前,リクナビNEXT
ビューローベリタスジャパン株式会社,営業部長,"東京都                                                                                                                                                                    




ビューローベリタスジャパン株式会社の求人
をすべて見る","年収700万円～1,000万円",8時間前,日経転職版
株式会社ビジネスコンサルタント,アソシエイトセールス 既存営業／個人目標なし／創業50年以上,"東京都 千代田区 秋葉原駅 徒歩1分                                                                                                                                                                    




秋葉原駅の求人
をすべて見る","月給21万5,000円～",2日前,エン転職
西関東機材株式会社,未経験者歓迎!ルート&反響営業&テレアポなし 完全週休2日制,東京都 福生市,月給23万円,2日前,リクナビNEXT
富士フイルムメディカル株式会社,日系大手! 超音波診断装置の営業職／臨床検査技師・放射線技師,東京都 江東区,年収500万円～800万円,1日前,かんたん応募
ウメトク株式会社,土日祝休／年間休日123日 ルート営業,"東京都 中央区 馬喰横山駅 徒歩3分                                                                                                                                                                    




馬喰横山駅の求人
をすべて見る",月給21万円～30万円,6日前,リクナビNEXT
新電機材株式会社,商社営業／販促企画 土日祝休み 残業は月10時間ほど,"東京都 千代田区 御茶ノ水駅                                                                                                                                                                    




御茶ノ水駅の求人
をすべて見る","月給24万1,000円～",5日前,リクナビNEXT
株式会社ZEPE,提案営業,東京都 千代田区 御茶ノ水駅 徒歩10分,月給24万円,5日前,かんたん応募
株式会社UKCorporation,年収1000万は“夢”じゃない! 物件仕入れ営業・店舗開発,東京都 千代田区 神田駅 徒歩3分,月給30万円,1日前,リクナビNEXT
モアコスメティックス株式会社,業界未経験歓迎!ヘア／スキンケア用品の 営業,東京都 中央区 東銀座駅,月給25万円～,1日前,マイナビ転職
株式会社吉田東光,ブランド力のルート営業,東京都 府中市,月給24万円～,2日前,マイナビ転職
株式会社エスワン電気,エネルギー商材の営業／直行直帰可!ワークライフバランス充実,東京都 渋谷区 渋谷駅 徒歩8分,月給28万円～,8時間前,リクナビNEXT
株式会社イーヴンPLUS,IT営業職,東京都 千代田区,月給20万円～,17時間前,Q-JiN
株式会社エムイーテック,営業 ライバル社ほぼナシで提案しやすい「無人販売BOX」,東京都 品川区 戸越銀座駅 徒歩5分,月給25万円～,1日前,マイナビ転職
株式会社NOW WORK,オープニング募集 東京限定!自社開発求人サイトの企画提案営業,東京都 中央区 三越前駅 徒歩3分,"月給23万5,000円",5日前,リクナビNEXT
株式会社キャズテック,年間休日125日・土日祝休・賞与年3回／輸入電子部品の営業,東京都 中野区 新井薬師前駅 徒歩2分,月給25万円～35万円,1日前,リクナビNEXT
株式会社NITACO,新規の顧客獲得を行うクローザーを担っていただく、営業担当スタ...,東京都 目黒区 中目黒駅 徒歩12分,"時給2,000円",9日前,ママの求人
株式会社ビースタイル,直行直帰×在宅OK【年収550万】自社RPAツールの提案営業...,東京都 品川区,"時給3,000円",1時間前,スマートキャリア
ナカシン株式会社,経験歓迎!車製品の営業～開発まで 月給30万円以上,東京都 足立区 六町駅 徒歩5分,月給30万円～,6日前,リクナビNEXT
aidea株式会社,営業 未来の当たり前をつくる!環境に優しいEV車両メーカー,東京都 千代田区 溜池山王駅 徒歩3分,年収500万円～,14日前,リクナビNEXT
合同会社DMM.com,営業企画 データ分析・集客施策の立案・営業,東京都 港区 六本木一丁目駅,年収400万円～550万円,5日前,リクナビNEXT
株式会社STEER JAPAN,押出機の技術営業 30代活躍中・年休125日・月給30万円～,東京都 千代田区 神田駅,月給30万円～45万円,1日前,リクナビNEXT
ハウスパートナー株式会社,不動産営業・販売 未経験・第二新卒歓迎 育成に力を入れてます,東京都 目黒区 学芸大学駅 徒歩10分,月給28万円～,1日前,リクナビNEXT
株式会社アミタ製作所,製造現場を支える営業 土日休・残業ほぼナシ 賞与年3回,東京都 江戸川区 船堀駅 徒歩10分,"月給23万円～30万5,000円",8時間前,リクナビNEXT
株式会社03,未経験歓迎 定着率100%が自慢! 申込書回収メインの営業,東京都 千代田区 東京駅,月給25万円,1日前,リクナビNEXT
i CONTINENT株式会社,未経験者入社90%!上京する方への支援有 営業／営業企画,東京都 豊島区 池袋駅 徒歩3分,月給22万円～50万円,15日前,リクナビNEXT
株式会社アクロスタッフ,年収450万～／上場企業で既存法人向け ノルマなし!提案営業,東京都 新宿区 高田馬場駅 徒歩5分,"時給2,000円～",3日前,エン派遣
株式会社日本ドライ,未経験者歓迎!土日休み ルート営業,東京都 荒川区 町屋駅 徒歩5分,"月給23万6,320円",14日前,リクナビNEXT
株式会社プラントピア,東海エリア強化プロジェクト パチマガスロマガの企画営業,東京都 新宿区,年収500万円,2日前,リクナビNEXT
株式会社ジャングルジャム,卸営業,東京都 世田谷区 池尻大橋駅,公開していません,6時間前,クリーデンス
株式会社マルワ,転勤なし 首都圏勤務 完全週休2日 機械部品の法人営業,東京都,月給30万円～45万円,19日前,リクナビNEXT
株式会社ネクストプラス,営業／企画営業 かたい規則やノルマがない風通しのよい社風,東京都 千代田区 秋葉原駅 徒歩8分,月給27万円,12日前,タウンワーク
株式会社ぴのぽむ,賃貸も売買も学べる!やりがいのある不動産営業,東京都 港区 表参道駅 徒歩1分,月給22万円～,19時間前,かんたん応募
株式会社シエロ,ルート営業／自動車・建機業界,東京都 練馬区 地下鉄赤塚駅 徒歩3分,年収350万円～500万円,12時間前,株式会社シエロ
株式会社エリアクエスト,社会人経験3年以上で月給35万円スタート 提案営業／販促企画,東京都 新宿区 西新宿駅,月給35万円～50万円,1日前,リクナビNEXT
株式会社ウイルエー,美容商品の営業 売上より人柄重視 未経験歓迎,東京都 港区 新橋駅 徒歩3分,"月給25万5,000円～",11日前,リクナビNEXT
シンテック株式会社,転勤なし 完週休2日 年間休日119日 法人ルート営業,東京都 文京区 春日駅 徒歩6分,"月給22万4,000円～26万円",5日前,リクナビNEXT
株式会社ジャパンインポートシステム,専門的な洋酒の営業及びマーケティング戦略の立案 実行,東京都 千代田区 神田駅 徒歩2分,月給25万円～,8時間前,リクナビNEXT
伊丹塗料株式会社,創業から62年黒字経営×毎年着実に昇給 長く頑張れる 営業,東京都 大田区,月給27万円～,8時間前,リクナビNEXT
株式会社弁天堂,20～30代活躍中!土日祝休み 広告・販促サポートの提案営業,東京都 渋谷区 渋谷駅 徒歩3分,月給30万円～,5日前,リクナビNEXT
株式会社壮関,法人営業,東京都 千代田区 神田駅 徒歩10分,"月給21万5,000円～28万5,000円",4日前,株式会社壮関
エム・イー株式会社,営業,東京都 昭島市,"月給19万9,400円～27万1,200円",12時間前,エム・イー株式会社
株式会社リィツメディカル,法人営業／眼科向け専門商社として規模はトップクラス,東京都 八王子市 八王子駅,"月給25万6,135円～",2日前,リクナビNEXT
ダータワーズジャパン株式会社,未経験可 営業／企画 月30万～／顧客のグローバル展開の支援,東京都 港区 大門駅 徒歩4分,年収400万円～,7日前,リクナビNEXT
三浦工業株式会社,20代活躍!業界トップクラス機械メーカーのソリューション営業,東京都 港区,"月給20万7,500円～35万円",14日前,リクナビNEXT
GPSSホールディングス株式会社,地熱発電機器を中心とした技術営業,東京都,"年収600万円～1,000万円",8時間前,日経転職版
フジクレスト株式会社,街づくりに貢献 住宅エクステリア法人営業,東京都 大田区,月給24万円～,12日前,リクナビNEXT
株式会社ライブクリエイト,ITサービスの提案営業,東京都 新宿区 新宿駅 徒歩10分,月給25万円～,3日前,かんたん応募
パナソニック サイクルテック株式会社,東京・埼玉募集／営業職／電動アシスト自転車国内大手メーカー,東京都 港区 品川駅 徒歩15分,月給23万円～29万円,5日前,リクナビNEXT
エクセルデバイス株式会社,半導体・電子部品などの提案営業・ルート営業,東京都 新宿区 四ツ谷駅 徒歩8分,月給30万円～,14日前,リクナビNEXT
株式会社UPSTART,ルート営業／未経験でも月給30万円スタート!年間休日120日,東京都 千代田区 秋葉原駅 徒歩9分,月給30万円～,1日前,リクナビNEXT
株式会社ウイル・コーポレーション,顧客の課題を解決する 販促企画・営業 月給28万円以上,東京都 千代田区,月給28万円～35万円,21日前,リクナビNEXT
協栄電子株式会社,成果をしっかり評価してもらえる 営業事務・内勤セールス,東京都 文京区 湯島駅 徒歩3分,月給21万円～,8時間前,リクナビNEXT
ステップ・アソシエイツ株式会社,不動産会社訪問メインのルート営業,東京都 新宿区 新宿駅 徒歩8分,"時給1,700円～1,750円",1日前,STEP ASSOCIATES
ICT・イノベーター株式会社,法人営業／営業サポート 月給35万円以上／転勤無,東京都 豊島区 池袋駅 徒歩1分,月給35万円～50万円,13日前,リクナビNEXT
株式会社住建ハウジング,未経験歓迎／月収200万円も可能! 完全反響の不動産売買営業,東京都 渋谷区 代々木上原駅 徒歩7分,月給30万円,5日前,リクナビNEXT
SNOW Japan株式会社,法人営業 人気のARカメラアプリ「SNOW」などを担当。スケ...,東京都 新宿区 新宿駅 徒歩5分,年収400万円～800万円,19時間前,エン転職
株式会社セレクトスクエア,ファッションECサイト運営の営業,東京都 江東区 潮見駅 徒歩3分,月給30万円～45万円,5日前,リクナビNEXT
株式会社GRoooVE,大手小売店等への新サービス営業 幹部候補は月給40万円以上,東京都 福生市 福生駅 徒歩2分,月給30万円～,2日前,リクナビNEXT
株式会社ニッショク,食品を提案する営業 残業ほぼ無 20代30代活躍 業界不問,東京都,月給22万円～,5日前,リクナビNEXT
株式会社長谷工ジョブクリエイト,受発注業務経験者求む!上場建材商社での営業事務派遣,東京都 港区 大門駅 徒歩5分,"時給1,600円～1,700円",10日前,エン派遣
全研本社株式会社,WEBコンサルティング営業／営業企画 7600超のサイト実績,東京都 新宿区 西新宿駅 徒歩7分,月給25万円～50万円,6日前,リクナビNEXT
アズビル株式会社,産業用装置とシステムの法人営業 創業110年超のリーディング...,東京都 品川区 大崎駅 徒歩5分,月給20万円～,2日前,エン転職
株式会社プランニングエステート,ペア制度で成果が出せる コンサルティング営業,東京都 品川区 目黒駅 徒歩6分,月給30万円～,12日前,リクナビNEXT
興誠産業株式会社,リサイクルの「提案営業」／選べる勤務形態,東京都 江東区 亀戸駅 徒歩3分,月給25万円～,5日前,リクナビNEXT
弘立倉庫株式会社本社,簡単 営業事務 経験者歓迎,東京都 葛飾区 亀有駅,"時給1,200円～",2日前,タウンワーク
ブロードメディア株式会社,営業スタッフ,東京都 港区 青山一丁目駅,月給25万円～45万円,1日前,マイナビ転職エージェントサーチ
株式会社MILLS,明治 特約代理店 MILLSでのルート営業・配達,東京都,月給23万円,8時間前,リクナビNEXT
三澤株式会社,卸営業,東京都 渋谷区 北参道駅,公開していません,6時間前,クリーデンス
株式会社オーエスシーテック,読売新聞グループへギフト・ノベルティの企画提案営業／管理職,東京都 港区 大門駅 徒歩3分,年収400万円～500万円,14日前,リクナビNEXT
株式会社ヒューマントラスト,営業,東京都 渋谷区 初台駅 徒歩5分                                                                                                                                    その他 (9),"時給1,900円",15時間前,ヒューマントラスト
株式会社林企画,月給26万円以上 求人広告の企画営業・営業企画 未経験歓迎,東京都 渋谷区 渋谷駅 徒歩3分,月給26万円～,6日前,リクナビNEXT
株式会社新生商会,難しいPCスキルや知識は不要!自動車部品に関する 営業事務,東京都 港区 神谷町駅 徒歩2分,月給22万円～28万円,12日前,リクナビNEXT
株式会社三枝,法人メインのコンサルティング営業 完全週休2日 +祝日,東京都 千代田区 水道橋駅,"月給27万7,500円～",8日前,リクナビNEXT
ミルテニーバイオテク株式会社,営業,東京都,年収450万円～550万円,6日前,Spring転職エージェント
マイボイスコム株式会社,インターネット調査等の企画営業／伊藤忠グループのリサーチ会社,東京都 千代田区 竹橋駅 徒歩3分,月給27万円～40万円,8日前,リクナビNEXT
株式会社ウメモトマテリアル,国内外の原料や機械用潤滑油 提案営業・ルートセールス,東京都 千代田区 市ケ谷駅 徒歩8分,月給25万円～35万円,8時間前,リクナビNEXT
株式会社山菊,"紙からWEBまで""メディア""のルート営業",東京都 港区 三田駅 徒歩3分,月給25万円,9日前,とらばーゆ
株式会社スマートパワーシステム,土日祝休み 20代・30代が活躍中!太陽光発電事業の営業,東京都 新宿区,月給22万円～50万円,8日前,リクナビNEXT
株式会社NTTデータ・スマートソーシング,NTTデータグループ 内勤営業 営業経験者歓迎・業界不問,東京都,"時給1,700円",5日前,リクナビNEXT
岡三証券株式会社,証券営業職,東京都,"年収500万円～1,200万円",19日前,日経転職版
武蔵野産業株式会社,企画営業 既存顧客中心 未経験歓迎 20代活躍中 土日祝休み,東京都 渋谷区 笹塚駅 徒歩3分,月給23万円～,6日前,マイナビ転職
株式会社椿本マシナリー,世界シェアを誇るグループ企業の営業年間休日125日,東京都 千代田区,"月給22万1,100円～",5日前,リクナビNEXT
東京サラヤ株式会社,消毒剤などの衛生用品から立位補助器まで扱う 福祉施設営業,東京都 文京区,"月給23万6,000円～",8日前,リクナビNEXT
株式会社メディオテック,再生エネルギーサービスの営業 年間休日125日 幹部候補とし...,東京都 新宿区 新宿御苑前駅 徒歩4分,月給33万円～,13日前,エン転職
オーディオネットワークジャパン株式会社,ミュージックライセンスマネージャー／営業,東京都 渋谷区 渋谷駅 徒歩10分,"月給37万5,000円～42万5,000円",12日前,リクナビNEXT
株式会社ジャパンペットコミュニケーションズ,自社ブランド「Vet’s Labo」の営業アシスタント,東京都 世田谷区 成城学園前駅 徒歩3分,月給21万円～32万円,5日前,doda
ピーロート・ジャパン株式会社,未経験から始める! ワインの反響営業 転勤なし／完週休2日,東京都 港区,"月給22万8,000円～",6日前,リクナビNEXT
弘立倉庫株式会社,営業・事務 月給25万円／土日祝休／45歳までの方活躍中,東京都 葛飾区 亀有駅 徒歩20分,月給25万円～30万円,6日前,リクナビNEXT
ネット・トレイン・サービス株式会社,内勤営業,東京都 中央区,月給25万円～40万円,20時間前,エン転職
株式会社アルモア,営業職,東京都 葛飾区 柴又駅 徒歩1分,"月給29万5,000円～31万円",1日前,エン転職
日本シーアイシー技研株式会社,飛込み営業なし クリーンルーム内で使用する商品の販売営業,東京都 大田区 池上駅 徒歩15分,月給22万円～33万円,27日前,リクナビNEXT
株式会社FREE JOB,求人広告の営業推進・営業支援スタッフ,東京都 豊島区,月給22万円,15時間前,JobOffer
VT CUBE JAPAN株式会社,第二新卒も歓迎 人気韓国コスメの営業・販促,東京都 新宿区 曙橋駅 徒歩10分,"月給22万円～41万6,000円",26日前,リクナビNEXT
株式会社オウル,東京・群馬／人材サービスの提案営業 完全土日休み,東京都 新宿区 新宿駅 徒歩5分,月給28万円～,7日前,リクナビNEXT
株式会社Buff,セールスコンサルタント 日本の営業組織を強くする／営業顧問事...,東京都 渋谷区,年収400万円～600万円,5日前,doda
株式会社鈴木プラスチックス,有名キャラクターグッズの営業職,東京都 千代田区 半蔵門駅 徒歩2分,"月給24万5,000円～28万5,000円",1日前,株式会社鈴木プラスチックス
ing-Bwell株式会社,年間休日122日・土日祝休み 採用支援営業・営業企画,東京都 台東区 上野駅 徒歩5分,月給27万円,8時間前,リクナビNEXT
一般財団法人あんしん財団,中小企業向け福利厚生サービス提供 営業,東京都 新宿区,"月給26万5,000円～39万9,000円",8時間前,リクナビNEXT
豊榮印刷株式会社,有名化粧品パッケージの提案営業 月給26万円～／前職給考慮,東京都 文京区 茗荷谷駅 徒歩10分,月給26万円～,8日前,リクナビNEXT
共同流通株式会社,貸倉庫・工場の不動産営業／安定経営・賞与年3回 反響営業,東京都 中央区,月給28万円～45万円,1日前,リクナビNEXT
オーデリック株式会社,業界トップクラスの照明メーカーの「提案営業」 未経験歓迎,東京都 杉並区,"月給24万300円～27万5,000円",12日前,リクナビNEXT
株式会社山口陶器店,ノルマ・新規開拓なし 陶磁器・和食器の企画営業・提案販売,東京都 中央区 築地駅 徒歩5分,月給23万円～30万円,1日前,リクナビNEXT
ヤマト装備株式会社,未経験歓迎!一からスタートできる「ルート営業」 賞与年2回,東京都 杉並区 井荻駅 徒歩8分,月給24万円～35万円,8時間前,リクナビNEXT
アドプランナー株式会社,営業のオカンみたいにお節介な一般事務,東京都 新宿区 新宿御苑前駅 徒歩2分,"時給1,100円～",6日前,とらばーゆ
トータルクリエート株式会社,月給25万円以上+インセン 営業,東京都 千代田区 東京駅 徒歩10分,月給25万円～30万円,12日前,リクナビNEXT
株式会社エイトノット,反響営業,東京都 世田谷区 二子玉川駅,月給27万円～55万円,17時間前,エン転職
株式会社リクルートネット,法人営業,東京都 港区 六本木駅,月給25万円,24日前,日経転職版
田城建設株式会社,営業,東京都 板橋区,月給20万円～50万円,5日前,宅建Job
株式会社アークテック,コンサルタント営業,東京都 品川区 目黒駅 徒歩3分,年収400万円,3日前,求人＠インテリアデザイン
ユーアンドアールホテルマネジメント株式会社,反響営業 ユニオングループの安定基盤!20～30代活躍中,東京都 新宿区 大久保駅 徒歩4分,月給25万円～,14日前,リクナビNEXT
有限会社ビットブルー,リテール営業／BIT BLUE,東京都,"年収300万円～1,000万円",3日前,フォーピープル
株式会社アンフィス,不動産営業 30代活躍中,東京都 渋谷区 笹塚駅 徒歩5分,月給30万円～,7日前,リクナビNEXT
株式会社バンクレンタカー,営業部長候補,東京都,"年収750万円～1,000万円",24日前,日経転職版
株式会社FIELD,高率歩合で稼げる リピーター半数以上!投資用不動産の提案営業,東京都 新宿区,月給25万円～50万円,12日前,リクナビNEXT
株式会社ニコン・トリンブル,スマート農業の技術営業,東京都,年収600万円～800万円,25日前,日経転職版
外資系・人事ソフト／サービス,営業 スタッフ／Business Development M...,東京都,年収500万円～850万円,6時間前,Daijob.com
株式会社KANSHOKU,自分の舌と足でヒット商品を生み出す 企画・提案営業,東京都 江戸川区 一之江駅 徒歩18分,月給20万円～35万円,6日前,リクナビNEXT
岡田電気産業株式会社,営業業務,東京都 立川市,"月給17万3,000円～22万3,000円",5日前,Tジョブ Uターン・Iターンに特化した求人情報サイトの全国版!!
株式会社熊澤建装,未経験からチャンスを掴む「リフォーム営業」 残業月20h以内,東京都 世田谷区 千歳船橋駅 徒歩10分,月給23万円～30万円,21日前,リクナビNEXT
株式会社ミンナのシゴト 東京オフィス,営業 未経験OK! フルリモートワークが基本 残業なし 女性...,東京都 大田区,月給25万円～30万円,19日前,女の転職type
作新工業株式会社,開発営業 業界のリーディングカンパニーで世にない製品を,東京都 中央区 宝町駅 徒歩3分,月給21万円～28万円,6日前,マイナビ転職
株式会社バグジー,新規チームメンバー募集!経験を活かし収入UP!不動産売買営業,東京都 渋谷区 恵比寿駅 徒歩5分,月給25万円～45万円,8時間前,リクナビNEXT
菊池建設株式会社,不動産の企画開発営業 宅地建物取引士,東京都 西東京市 ひばりケ丘駅,年収450万円～750万円,4日前,マイナビ転職エージェントサーチ
株式会社キョウエイアドインターナショナル,企画営業 年間休日120日／土日祝休み／実働7.5h／残業ほ...,東京都 千代田区 霞ケ関駅,"月給19万9,000円～30万円",6日前,エン転職
株式会社NEXER,Webマーケティングの提案営業 土日祝休み・残業少なめ,東京都 豊島区 池袋駅 徒歩5分,月給30万円～,14日前,リクナビNEXT
株式会社加賀商会,OEM商品の法人営業・商品企画扱うのは鞄や袋物、雑貨等,東京都,月給25万円～50万円,5日前,リクナビNEXT
サポートワークス株式会社,広告代理店営業職,東京都 新宿区,年収300万円～900万円,6日前,かんたん応募
株式会社アビリティーニッケン,営業にチャレンジしたい方 ︎三軒茶屋,東京都 世田谷区 三軒茶屋駅 徒歩8分,"時給1,800円",3日前,エン派遣
パーソルテンプスタッフ株式会社 関東営業サポート...,法人営業のオシゴト,東京都 江東区 有明駅,年収310万円～380万円,11時間前,パーソルテンプスタッフ株式会社関東営業サポートオフィス
高砂食品株式会社,営業 年間休日121日 月給25万円以上,東京都 千代田区,月給25万円～,9日前,マイナビ転職
システムメトリックス株式会社,CADの法人営業 売上が3年で2.5倍!内勤営業からスタート,東京都 中央区,"月給23万3,000円～",5日前,リクナビNEXT
株式会社いなば園,メモリアルギフトのルート営業,東京都 足立区,月給24万円～,14日前,マイナビ転職
株式会社サカモト・アンド・パートナーズ,完全リモートワーク可 年間休日120日 営業事務／営業,東京都 新宿区 四谷三丁目駅 徒歩4分,年収320万円～,6日前,リクナビNEXT
株式会社大冷,東証一部上場食品メーカーの営業事務・物流管理,東京都 中央区 月島駅 徒歩3分,"月給21万円～28万5,000円",19日前,リクナビNEXT
サン・ユース株式会社,銀座支店 増員につき大募集 ゴルフ会員権の営業,東京都 豊島区 大塚駅 徒歩5分,月給46万円,8時間前,リクナビNEXT
株式会社フェローズ,成長企業で確実なスキルUPが叶う!ITソリューション営業,東京都 江東区 豊洲駅 徒歩1分,月給35万円～,6日前,リクナビNEXT
