パナソニック i-PRO センシングソリューショ...,営業推進 シニアスペシャリスト クラス,東京都 千代田区,月給32万円～45万円,12時間前,en ミドルの転職
SANEI株式会社,デザイン水栓などを扱う老舗企業／営業事務 土日祝休み,東京都 墨田区 錦糸町駅,"月給16万7,000円～21万円",8日前,リクナビNEXT
さくら住建株式会社,住宅建材の法人営業 年間休日112日／フレックス休暇で7連休可,東京都 葛飾区 青砥駅,月給30万円～,6日前,エン転職
株式会社上杉建築事務所,創立30年を越える建築設計事務所での一般事務・営業サポート,東京都 台東区 新御徒町駅 徒歩1分,月給25万円～,8時間前,リクナビNEXT
株式会社エヌテック,安定×信頼 上場企業グループでの提案営業 未経験歓迎,東京都 中央区 八丁堀駅 徒歩3分,月給21万円～,8日前,リクナビNEXT
Ex-Works株式会社,金属材料営業／ノルマ無／転勤なし／年休123日／リモートワー...,東京都 港区,月給27万円,15時間前,JobOffer
シェルストーン株式会社,飲食店でなくてはならない”食器”の営業・商品企画,東京都 世田谷区 等々力駅 徒歩7分,月給28万円～,13日前,リクナビNEXT
株式会社アールスクエア・アンド・カンパニー,Enablementコンサルタント 顧客の営業組織変革をリー...,東京都,年収600万円～900万円,8日前,en ミドルの転職
スノーシステムズ株式会社,若手活躍中 バックオフィスから会社を支える営業事務,東京都 千代田区 大手町駅 徒歩5分,"月給20万5,000円～",1日前,リクナビNEXT
アシマ株式会社,シェアリングデリバリーの法人営業／新規加盟店獲得営業／加盟店...,東京都 新宿区 新宿駅 徒歩5分,年収400万円～600万円,7日前,アシマ株式会社
株式会社TMJ 人材派遣担当,残業少×土日祝休 電気工事・施工の法人営業,東京都 港区 田町駅 徒歩7分,"時給1,450円",7日前,エン派遣
株式会社SKYSEA,用地仕入・営業 未経験でも安定収入、あなたのやる気を評価,東京都 新宿区,月給28万円～,27日前,リクナビNEXT
株式会社プラップ ジャパン,SaaS営業～PR業務DXツールの営業／業界初のサービス／東...,東京都 港区,年収400万円～700万円,41分前,doda
丸良興業有限会社,建設クレーン会社で顧客フォロー営業・未経験OK,東京都 品川区,"月給23万3,550円～28万円",1日前,丸良興業有限会社
株式会社ASIAN BRIDGE,入居相談員 法人営業・施設PRやご家族対応など営業のお仕事～...,東京都 中央区 茅場町駅 徒歩6分,月給25万円～40万円,公開していません,株式会社ASIAN BRIDGE
東越商事株式会社,保険代理店のルート営業・コンサルタント 残業ほぼ無／土日祝休,東京都 台東区 仲御徒町駅 徒歩2分,月給30万円～,5日前,リクナビNEXT
ダイセルミライズ株式会社,独自の商品で日本のモノづくりを支える 技術営業 年休122日,東京都 港区 品川駅,月給25万円～,公開していません,マイナビ転職
株式会社トラストライフ,保険営業／出社は月1回／インセン上限なし／飛び込みなし,東京都 千代田区 秋葉原駅 徒歩1分,"月給16万5,000円",8時間前,リクナビNEXT
インフォーマ マーケッツ ジャパン株式会社,大規模B2Bイベントの営業企画、出展企業誘致など 企画営業,東京都 千代田区 神田駅 徒歩3分,月給25万円～,21日前,リクナビNEXT
株式会社小久保工業所,生活用品の営業／弊社からの入社実績有・企業規模拡大に意欲的な...,東京都,年収350万円～450万円,6日前,Spring転職エージェント
ネスレ日本株式会社,家庭用食品の法人営業 創業105年超の世界トップクラス食品飲...,東京都 品川区 天王洲アイル駅 徒歩2分,月給25万円,6日前,エン転職
株式会社SUNVALLEY JAPAN,外資系 IT・デジタル家電 企画営業 中国語歓迎,東京都 中央区,月給25万円～30万円,27日前,ALA!中国
株式会社エー・アンド・ケー・コム,営業マネージャー,東京都 新宿区 新宿三丁目駅 徒歩3分,月給35万円～45万円,20時間前,エン転職
株式会社小泉,鉄鋼製品の国内外販売・輸出入取引 営業 中国語歓迎,東京都 千代田区,"月給22万8,000円～",27日前,ALA!中国
LOPS株式会社 油脂関連専門商社,業績堅調!油脂関連専門商社に年俸400～600万円!国内・海...,東京都 港区 虎ノ門駅 徒歩1分,年収400万円～600万円,25日前,日経転職版
株式会社TME Future,営業,東京都 八王子市 西八王子駅 徒歩1分,月給20万円,4日前,株式会社TME Future
ケービックス株式会社,提案営業 反響スタイル 賞与2回,東京都 中央区 勝どき駅 徒歩8分,"月給22万8,000円～",6日前,マイナビ転職
株式会社ホワイトハウス,独自商材の反響営業・販売,東京都 世田谷区 千歳船橋駅 徒歩12分,月給24万円～,4日前,かんたん応募
若越印刷株式会社,広告・印刷関連の営業／営業企画 未経験者歓迎,東京都 渋谷区 代々木駅 徒歩1分,月給20万円～35万円,15日前,リクナビNEXT
株式会社GAGA ILLUMI,未経験歓迎／研修充実／蓄電池・太陽光発電システム等の提案営業,東京都 中央区 東銀座駅 徒歩5分,月給20万円～,3日前,doda
タイガー株式会社,完全週休2日／土日祝休／ノルマ無し フロンガスのルート営業,東京都 港区 大門駅 徒歩1分,年収400万円～,1日前,リクナビNEXT
株式会社emiopulse,社員の90%が未経験 圧倒的な昇格スピード!営業・販促企画,東京都 中央区 東銀座駅 徒歩2分,月給35万円,13日前,リクナビNEXT
株式会社孫の手倶楽部,訪問マッサージを広める営業 未経験歓迎 月給25万 残業少ない,東京都 北区,月給25万円～35万円,1日前,女の転職type
HORIJUKU株式会社,「堀塾」を運営する当社でのコンサルティング営業 土日祝休,東京都 港区 六本木駅 徒歩2分,月給32万円～,23日前,リクナビNEXT
株式会社ヨコオデイリーフーズ,自分に合ったスタイルの働き方ができる! 営業,東京都 台東区 浅草駅,月給25万円～,14日前,リクナビNEXT
株式会社インバウンドテック,営業 ～将来の営業幹部社員／マザーズ上場～,東京都 新宿区 新宿御苑前駅,年収300万円～400万円,8日前,doda
株式会社大京穴吹不動産,売買仲介営業 年間休日128日／年収400～800万円／穏や...,東京都 渋谷区,年収400万円～800万円,2日前,en ミドルの転職
株式会社ケアネット,営業企画,東京都,年収501万円～700万円,9日前,Answers
株式会社求人ジャーナル コネクト,営業,東京都 墨田区                                                                                                                                    その他 (7),年収350万円～750万円,7日前,株式会社求人ジャーナル コネクト
ファミリーレンタリース株式会社,ノルマなしで未経験から始められる 提案営業 直行直帰OK,東京都 八王子市 八王子駅 徒歩16分,月給23万円～25万円,13日前,マイナビ転職
株式会社立花電子ソリューションズ,営業職／テレワーク推進中 第二創業期を迎える多彩なデバイスを...,東京都,年収600万円～799万円,6日前,en ミドルの転職
TSC株式会社,メーカー商社のルート営業,東京都 台東区 新御徒町駅 徒歩4分,月給25万円～35万円,9日前,マイナビ転職
フロンティア株式会社,営業職 インセン多数 平均年収473万円 土日祝休み ネイル...,東京都 渋谷区 恵比寿駅 徒歩5分,月給25万円～,15日前,女の転職type
ブリヂストンタイヤソリューションジャパン株式会社,法人営業 世界シェアトップクラスをあなたの地域で支える,東京都 千代田区 東京駅 徒歩7分,"月給21万6,000円～",2日前,エン転職
株式会社ヒロムラ産業,エアコンの営業 賞与平均年100万円超／残業月20H以下／国...,東京都 千代田区 秋葉原駅 徒歩8分,月給23万円～30万円,9日前,エン転職
株式会社CUBEリノベーション,OPENING!未経験OK 企画営業 完週休2日!完全反響型,東京都 足立区 竹ノ塚駅 バス6分,月給25万円～40万円,27日前,リクナビNEXT
株式会社美柳,法人営業 未経験から月給26万円以上 基本的に土日祝休／年間...,東京都 中野区 中野坂上駅 徒歩2分,"月給26万2,000円",9日前,エン転職
株式会社協栄情報,営業さんをサポートする縁の下の力持ち! 営業アシスタント 年...,東京都 中央区,月給23万円～,13日前,かんたん応募
三和電子サーキット株式会社,20～30代歓迎!主要得意先は上場企業! 営業 年間休日12...,東京都 大田区 大森駅 徒歩6分,"月給22万900円～26万7,500円",6日前,マイナビ転職
バリューコマース株式会社,コンサルティング営業／運用,東京都,年収450万円～787万円,19日前,Spring転職エージェント
株式会社アドバンテッジリスクマネジメント,総合営業,東京都 目黒区,年収400万円～800万円,24日前,日経転職版
ルートロニックジャパン株式会社,美容系医療機器営業,東京都,年収360万円～500万円,22日前,Answers
株式会社ワールドイン,「初めての事務」も大歓迎 事務・営業サポート 完全週休2日,東京都 渋谷区 渋谷駅 徒歩5分,月給20万円～25万円,8時間前,リクナビNEXT
株式会社ピーアール・デイリー,求人広告の代理店営業 パートナー企業様への販売支援業務,東京都 台東区,月給25万円～35万円,9日前,マイナビ転職
ヒノキ肌粧品首都圏販売株式会社,業界不問 年休120日 ロングセラーの商品を広める 営業,東京都 千代田区 麹町駅 徒歩2分,"月給23万2,475円～26万7,775円",20日前,リクナビNEXT
京急不動産株式会社,100%反響営業 定着率92.5%／完全週休2日／残業月20...,東京都 大田区 京急蒲田駅,"月給18万5,500円～",7日前,マイナビ転職
天翔ビルディング株式会社,レンタルオフィスの運営・営業,東京都 中央区 京橋駅 徒歩1分,月給25万円～27万円,4日前,リクナビNEXT
株式会社フィスタ,自由度の高い企画営業 自分で考え責任を持って行動できる方に,東京都 江東区,月給23万円～40万円,6日前,リクナビNEXT
NTTデータ先端技術株式会社,PFS0004 ソリューション提案営業,東京都 中央区,年収410万円～850万円,8日前,en ミドルの転職
双葉電線株式会社,土日祝休み／年間休日125日以上／既存顧客に対する電線の営業,東京都 大田区 流通センター駅 徒歩6分,月給22万700円～,13日前,リクナビNEXT
株式会社カウリス,営業職,東京都 千代田区 大手町駅 徒歩1分,"月給37万5,000円～50万円",19日前,日経転職版
明興双葉株式会社,ルート営業,東京都 中央区 京橋駅 徒歩1分,月給25万円,6日前,type
アトムリビンテック株式会社,ルート営業 明治創業の住宅金物メーカーでモノづくりに挑戦,東京都 台東区 入谷駅 徒歩1分,月給22万円～30万円,26日前,マイナビ転職
精巧株式会社,営業 取引先は大手アパレル 中心,東京都 墨田区 両国駅 徒歩8分,月給22万円～35万円,8日前,リクナビNEXT
株式会社Cifra Plus,OEM営業,東京都,公開していません,6時間前,クリーデンス
株式会社アクティヴァーチ・コンサルティング,設立間もないベンチャー企業で活躍!ITソリューション営業,東京都 港区 虎ノ門駅 徒歩1分,月給30万円～,19日前,リクナビNEXT
日本建総株式会社,完全週休2日制!未経験OK!飛び込みテレアポなし!反響営業,東京都,月給20万円～56万円,27日前,リクナビNEXT
株式会社YYKファースト,完全反響型 賃貸仲介営業 年間休日125日!残業ほぼなし,東京都 町田市 町田駅 徒歩3分,月給30万円～40万円,2日前,リクナビNEXT
ADEKAケミカルサプライ株式会社,化学品専門商社の営業 年間休日124日 賞与5.25ヶ月分,東京都 千代田区 水道橋駅 徒歩5分,"月給24万9,400円～",2日前,エン転職
株式会社ニド,業績好調により増員募集 圧倒的待遇の完全反響 法人営業,東京都 中野区 中野坂上駅 徒歩4分,月給28万円～34万円,13日前,リクナビNEXT
株式会社JM Ortho,ルート営業 昨年度賞与実績5.8ヶ月分!／残業月平均15時間,東京都 千代田区 御茶ノ水駅 徒歩1分,"月給23万1,000円～26万4,000円",2日前,エン転職
伊藤忠食糧株式会社,伊藤忠食糧株式会社、海外原料調達の営業職,東京都 港区,年収500万円～590万円,24日前,日経転職版
北信テレネックス株式会社,法人営業,東京都 港区 泉岳寺駅 徒歩1分,月給22万円～,4日前,U29JOB
一般財団法人東京大学出版会,書籍プロモーション業務／書籍販売営業全般,東京都 目黒区 駒場東大前駅 徒歩6分,"月給21万9,186円～54万6,446円",15日前,リクナビNEXT
株式会社Algoage,営業責任者 募集! DMMグループのAIスタートアップ企業,東京都,"年収1,000万円～1,300万円",8日前,en ミドルの転職
X-border Partners株式会社,営業職,東京都 中央区 銀座駅 徒歩5分,年収350万円～600万円,4日前,U29JOB
株式会社22世紀アート,提案営業 リモートワーク可 創業8年目連続成長中の出版社,東京都 中央区 浜町駅 徒歩4分,月給25万円～,13日前,マイナビ転職
四国紙販売株式会社,営業職 大王製紙パートナー企業 業界経験者歓迎します・残業2...,東京都 千代田区 神田駅,年収395万円～591万円,2日前,doda
英文表記:Hitachi Global Life...,業務用空調ソリューションのアカウント営業,東京都 港区,年収550万円～750万円,8日前,en ミドルの転職
エヌエスティ・グローバリスト株式会社,気配り&目配りがカギ! ICT総合商社のテキパキ営業事務,東京都 豊島区 池袋駅 徒歩3分,"月給19万5,000円～",27日前,リクナビNEXT
株式会社コネクション,ルート営業 月給35万5000円以上 社会貢献性の高い仕事,東京都 足立区 西新井駅,"月給35万5,000円～",15日前,リクナビNEXT
マイクロテクノロジー株式会社,モノづくりを支援する技術営業,東京都 台東区 上野駅 徒歩2分,"月給26万5,000円～",27日前,リクナビNEXT
株式会社マルマツ 営業部,浜松餃子のルート営業 フルリモート可 週休2日 社用車貸与,東京都,"月給28万6,000円～",5日前,リクナビNEXT
アスクプロ株式会社,新規営業職,東京都 新宿区 四谷三丁目駅,年収300万円～600万円,24日前,日経転職版
川上機工株式会社,未経験大歓迎!業務用機械の提案営業 賞与年4回 ノルマなし,東京都 中野区,月給20万円～35万円,20日前,リクナビNEXT
株式会社ジャストプランニング,"導入実績5,300店以上!自社サービスの提案営業 未経験歓迎",東京都 大田区 蒲田駅 徒歩7分,月給23万円～45万円,8日前,マイナビ転職
株式会社小森コーポレーション,印刷機械メーカー 中華圏担当海外営業 ビジネス中国語必須,東京都 墨田区,"月給20万5,700円～36万円",26日前,ALA!中国
株式会社エービーシーホーム,年収1000万円以上も可能!安定収入!住宅リフォームの営業,東京都 墨田区 曳舟駅 徒歩4分,月給27万円～,13日前,リクナビNEXT
株式会社中央賃貸管理,UR賃貸ショップでの営業 お部屋紹介 中国語大歓迎,東京都 新宿区,月給20万円～,公開していません,ALA!中国
株式会社キャステム,都市圏限定募集 希望勤務地配属 営業スタッフ 月給29.6万...,東京都 大田区,"月給29万6,000円～",1時間前,マイナビ転職
株式会社イーエムアイ,面白さ&やりがい100点!「営業・人材コーディネーター」,東京都 杉並区 高円寺駅 徒歩3分,月給20万円～25万円,8時間前,リクナビNEXT
日本CBL株式会社,英語力を活かし磨ける ルート営業 賞与実績5ヶ月分,東京都 豊島区 椎名町駅 徒歩6分,月給24万円～50万円,15日前,マイナビ転職
リライズホーム株式会社,完全反響営業／平均年収860万円／完全週休2日／年休120日,東京都 国分寺市 国分寺駅,月給30万円～50万円,21時間前,doda
株式会社杉田商工,法人営業、テレフォンオペレーター／マンション・ビル・工場・事...,東京都 八王子市 めじろ台駅 バス5分,月給20万円～30万円,6日前,バイトルNEXT
メタルテック株式会社,営業担当者,東京都 墨田区 錦糸町駅 徒歩10分,"月給5万9,000円",24日前,日経転職版
Sansan株式会社,事業企画部 営業推進グループ,東京都 渋谷区,年収490万円～728万円,5日前,【公式】ワーママ転職ならママリブラ
株式会社ナッシュ,企画営業 土日祝休 年休120日以上 未経験歓迎,東京都 渋谷区 初台駅 徒歩6分,月給25万円～,3日前,マイナビ転職
協栄化成株式会社,化成品の企画営業／既存顧客中心 製品開発やモノ作りの楽しさも,東京都 台東区 田原町駅 徒歩3分,"月給20万6,360円～",1日前,リクナビNEXT
株式会社アヴァンティスタッフ,米国最大手×不動産仲介会社Grでの営業アシスタント,東京都 港区 虎ノ門駅 徒歩1分,"時給1,700円",8時間前,ジョブチェキ！
株式会社全国赤帽,17時終業・設立30年以上の安定企業 運送業の営業,東京都 台東区 浅草橋駅 徒歩2分,月給25万円～40万円,27日前,リクナビNEXT
株式会社サンフィールド,週休3日 も選択可能 営業・販売,東京都 中央区 馬喰横山駅 徒歩3分,"月給27万円～34万8,400円",5日前,リクナビNEXT
株式会社フィエルテ,ソリューション提案営業～大企業CFO組織向け～,東京都 新宿区 新宿駅,年収450万円～700万円,24日前,日経転職版
株式会社レンタルのニッケン,機械レンタルの営業職,東京都 大田区                                                                                                                                    その他 (17),年収300万円～450万円,9日前,doda
株式会社関東マテリアル,建築資材の提案・販売を行うルート営業,東京都 町田市 南町田グランベリーパーク駅 徒歩15分,月給27万円～,6日前,リクナビNEXT
株式会社東京木工所,安定企業で新しいキャリアを! ルート営業 20代男性活躍中,東京都 渋谷区 恵比寿駅 徒歩3分,月給20万円～,1日前,マイナビ転職
株式会社インフォセック,リモートワーク中心 IT・セキュリティ経験を活かせる法人営業,東京都 港区 田町駅,月給30万円～,19日前,リクナビNEXT
株式会社ソーキ,営業アシスタント 土日祝完全休み／残業少なめ／服装自由,東京都 中央区 茅場町駅 徒歩4分,月給20万円～,5日前,マイナビ転職
明治ゴルフ株式会社,完全反響型営業 ゴルフ会員権のご案内 ゴルフ経験不問,東京都 新宿区 新宿駅 徒歩5分,月給30万円～43万円,26日前,リクナビNEXT
株式会社エスティード・ジャパン,「社員一人一人の個性を重視。成長を支援する会社」での営業,東京都 新宿区 新宿駅 徒歩5分,年収348万円～600万円,19日前,リクナビNEXT
株式会社プレニーズ,入社1年で新卒社員を育成するマネージャーに! 不動産営業,東京都 港区 大門駅 徒歩1分,"月給28万6,000円～",1日前,マイナビ転職
株式会社かんでんCSフォーラム,関西電力グループ／新チームの立ち上げ／現場管理職・営業,東京都 港区 新橋駅 徒歩6分,"月給27万5,000円",21日前,リクナビNEXT
ネクストリング株式会社,営業スタッフ,東京都 文京区,月給25万円,14時間前,JobOffer
株式会社ナビット,250万アクセスある助成金サイトの反響営業,東京都 千代田区 九段下駅 徒歩1分,年収370万円～600万円,8日前,マイナビ転職
株式会社シェアテック,リフォームアドバイザー 反響営業 営業未経験でも安定収入,東京都 調布市 京王多摩川駅 徒歩7分,"月給24万5,000円～",1日前,リクナビNEXT
株式会社ライフ&スマート,営業 未経験者のアシスタントでも月給30万円～のスタート 顧...,東京都 中央区 日本橋駅 徒歩2分,月給30万円,9日前,エン転職
株式会社ミヨシ,防災備蓄品を扱う 法人営業 年間休日124日／土日祝休み,東京都 品川区 天王洲アイル駅 徒歩5分,"月給21万5,000円～26万円",12日前,マイナビ転職
ミサワリフォーム株式会社,全国転勤なし プラン作りや施工管理も担う／リフォーム営業,東京都,"月給20万5,000円～37万円",2日前,リクナビNEXT
株式会社曙題工業,営業 企画,東京都 渋谷区 神泉駅 徒歩3分,"月給23万5,000円～",20時間前,Workin.jp
株式会社アシレ,経験者は前職給与保証 法人技術提案営業 社用車無料貸与有,東京都 町田市 南町田グランベリーパーク駅 車7分,"月給24万6,000円～",2日前,リクナビNEXT
株式会社寶亭・レッツ倶楽部 三軒茶屋,業界未経験 経験活かしてキャリアUP 月30万～施設長・営業,東京都 世田谷区 三軒茶屋駅 徒歩8分,"月給30万6,400円～",11日前,リクナビNEXT
自然電力株式会社,営業メンバー,東京都 文京区,年収400万円～650万円,5日前,【公式】ワーママ転職ならママリブラ
株式会社ワーカービー,紹介案件が中心／飛込なし セールスプロモーションの企画営業,東京都 目黒区 中目黒駅 徒歩7分,月給25万円～,6日前,リクナビNEXT
NECネッツエスアイ株式会社,WEB面接 21210 官庁向けソリューション営業,東京都 文京区,年収450万円～650万円,9日前,マイナビAGENT
株式会社成田産業マスク,営業 完全週休二日制 裁量の大きさが自慢,東京都 中央区,月給30万円～50万円,8日前,リクナビNEXT
東京都市開発株式会社,億単位の街づくりに企画から携われる! 不動産営業・企画開発,東京都 千代田区 永田町駅 徒歩2分,月給32万円～,1日前,リクナビNEXT
川光商事株式会社,白玉粉メーカーの提案営業 基本定時退社 東京限定募集,東京都 中央区 日本橋駅 徒歩2分,"月給24万7,000円～30万円",5日前,マイナビ転職
株式会社ザ・ヴィンテージハウス,コントラクト営業、プロダクトデザイナー,東京都 目黒区,月給25万円～,5日前,求人＠インテリアデザイン
株式会社ヨンキュウ,東京／営業職募集,東京都 中央区 築地駅,月給25万円～35万円,5日前,かんたん応募
株式会社日成ストマック・トーキョー,大手クライアント多数!既存顧客中心&ノルマなしの営業,東京都 江戸川区 葛西駅 徒歩25分,月給30万円～,7日前,リクナビNEXT
日本ピー・アイ株式会社,営業職／東証一部企業グループ／東京,東京都 新宿区,年収300万円～600万円,7時間前,建設転職ナビ
株式会社アガタ,営業サポート・事務・アプリ開発補助 土日休み,東京都 足立区 竹ノ塚駅 徒歩22分,"月給22万6,570円～",20日前,リクナビNEXT
テラドローン株式会社,リテンション営業,東京都 渋谷区 渋谷駅 徒歩10分,年収400万円～600万円,9日前,U29JOB
YQNLINKジャパン株式会社,国際物流フレートフォワーダー 法人営業／物流企画・管理／事務,東京都 中央区 新日本橋駅 徒歩1分,"月給27万5,000円～",7日前,リクナビNEXT
ソーラーフロンティア株式会社,国内営業,東京都 千代田区 有楽町駅 徒歩5分,年収400万円～600万円,6日前,U29JOB
株式会社シード,IPOを目指す成長企業!Webコンサル営業・デジタルマーケ,東京都 千代田区,月給27万円～,21日前,リクナビNEXT
株式会社Mirai Arc,不動産営業・仕入 不動産売買経験者 幹部候補 事業立上げ,東京都 港区 田町駅,月給30万円～70万円,5日前,リクナビNEXT
パネルサービス株式会社,防音パネル等のレンタル・販売 ルート営業,東京都 文京区 湯島駅 徒歩2分,月給26万円～30万円,6日前,リクナビNEXT
株式会社タイムチケット,営業企画マネージャー,東京都 港区 浜松町駅 徒歩6分,年収500万円～650万円,10日前,U29JOB
みのり運輸株式会社,業績好調 未経験OK 安定経営の運送会社 一般事務・営業事務,東京都 江戸川区,月給20万円～,7日前,リクナビNEXT
