カワイ電線商事株式会社,定時退社可能 電線・ケーブル専門メーカーのルート営業,東京都 渋谷区 渋谷駅 徒歩9分,"月給24万5,500円～",5日前,リクナビNEXT
アビトップ株式会社,水に関わる耐食資材の提案営業,東京都 台東区,月給20万円～25万円,27日前,リクナビNEXT
株式会社EDUWARD Press,雑誌の広告営業／自社で制作・出版 イチから一緒に考え作れる,東京都 町田市 町田駅 徒歩5分,月給25万円～,2日前,リクナビNEXT
株式会社勇和造園,営業・営業事務,東京都 杉並区 西永福駅 徒歩5分,月給22万円～28万円,2日前,ユメックスネット
株式会社アセットエステート,未経験歓迎!完全週休2日制 100%反響型 売買仲介営業,東京都 町田市,月給23万円～35万円,2日前,リクナビNEXT
株式会社STAYGOLD,ブランド品のバイヤー／買取営業未経験歓迎 残業少なめ,東京都 渋谷区 恵比寿駅 徒歩6分,"月給23万5,000円～",5日前,リクナビNEXT
株式会社ドリームゲート,創業60周年!ウィンター専門店スキー・スノボ販売・管理・営業,東京都 千代田区 淡路町駅 徒歩3分,月給20万円～40万円,5日前,リクナビNEXT
株式会社家具の大正堂,創業109年の歴史×抜群の知名度が強み! リフォーム営業,東京都 八王子市,月給25万円～,9日前,マイナビ転職
有限会社IBトランスポート,ドライバー／平均月収55万円～65万円 賞与年3回 入社祝い...,東京都 板橋区 西高島平駅 車9分,月給42万円～,2日前,エン転職
株式会社エニマリ,大手式場紹介サイトの法人営業職求人,東京都 港区 赤羽橋駅 徒歩3分,年収350万円～550万円,1日前,マイナビ転職エージェントサーチ
イナバインターナショナル株式会社,提案営業,東京都 渋谷区 恵比寿駅 徒歩1分,"月給22万8,000円～32万8,000円",12時間前,U29JOB
ディップ株式会社,企画・マーケティング、営業アシスタント新宿オフィス,東京都 新宿区 新宿駅 徒歩5分,"月給27万40円～31万4,000円",6日前,バイトルNEXT
株式会社ネオキャリア,営業 介護メディア／法人営業のご経験2年以上／土日祝休み:年...,東京都 新宿区,年収360万円～480万円,1日前,マイナビ転職エージェントサーチ
三友株式会社,音を奏でる 映像音響システムの営業法人営業経験者全員面接,東京都 品川区 五反田駅 徒歩5分,月給23万円～31万円,6日前,マイナビ転職
株式会社グッドライフビジネスサポート,個人向け営業,東京都 江戸川区 葛西駅 バス10分                                                                                                                                    その他 (11),"時給1,500円",2日前,シフトワークス
株式会社信明商事,世界と日本を繋ぐ食品商社の企画営業 残業ほぼなし 土日祝休み,東京都 江戸川区 西葛西駅 徒歩10分,月給25万円～28万円,6日前,リクナビNEXT
ナカヨ電子サービス株式会社,ITの未来を支えるルート営業 直行直帰OK／面接1回／土日祝...,東京都 港区 品川駅 徒歩10分,年収313万円～415万円,1日前,マイナビ転職エージェントサーチ
リーバイ・ストラウス ジャパン株式会社,卸営業,東京都 渋谷区 明治神宮前駅,公開していません,7日前,クリーデンス
センチュリー21ヒカリ企画,営業アシスタント,東京都 東大和市 桜街道駅 徒歩8分,月給22万円～,20時間前,エン転職
株式会社グリーンフォレスト,未経験歓迎!個人ノルマ無し・頑張った分稼げる／不動産仕入営業,東京都 新宿区 都庁前駅 徒歩5分,月給27万円～,14日前,リクナビNEXT
ASA久が原,入社祝金12万円／家賃7割負担 朝日新聞の配達・営業・集金,東京都 大田区 久が原駅 徒歩3分,"月給28万5,000円～",12日前,リクナビNEXT
下田工業株式会社,賞与年平均4.5ヶ月／大手メーカー向け商社営業・コンサル,東京都 品川区,月給25万円～37万円,7日前,リクナビNEXT
ティーシートレーディング株式会社,業界経験不問!未来の社会インフラの基盤を支える ルート営業,東京都 千代田区,"月給22万8,000円～",12日前,リクナビNEXT
株式会社ユダ,業務用清掃・衛生管理資材／ルート中心の営業,東京都 足立区 六町駅 徒歩10分,月給23万円～30万円,8日前,リクナビNEXT
株式会社プライムサーヴ,営業事務／リクルートの媒体を扱う広告代理店／残業ほぼ無／年休...,東京都 新宿区,年収230万円～250万円,13時間前,doda
株式会社LUX,カウンター営業 売買営業 事務スタッフ,東京都 立川市 立川駅 徒歩3分,月給25万円～40万円,7日前,はたらいく
株式会社リンクトゥモロー,"高時給2,750円!ほぼ在宅!大手通信会社にて法人営業",東京都 千代田区 溜池山王駅 徒歩2分,"時給2,750円",10日前,エン派遣
東京山手青果株式会社,青果の卸売営業・構内仕分作業 年間休日120日 中高年活躍中,東京都 中野区 東中野駅 徒歩8分,月給28万円～35万円,7日前,リクナビNEXT
株式会社ジュポンインターナショナル,自然派化粧品の代理店ルート営業募集,東京都 品川区,年収326万円～400万円,1日前,マイナビ転職エージェントサーチ
株式会社モイネットシステム,調剤薬局に欠かせないシステムを扱う 営業職 土日祝休み,東京都 豊島区,月給35万円,7時間前,リクナビNEXT
株式会社クルコム,第二新卒・未経験歓迎 SES営業にキャリアチェンジしたい方募集,東京都 台東区,年収400万円～500万円,5日前,リクルートエージェント
株式会社コムテック,通信工事会社の営業 お客様に寄り添うお仕事 飛び込みなし,東京都 足立区 竹ノ塚駅 徒歩10分,月給21万円～35万円,6日前,リクナビNEXT
株式会社Trys,企画提案営業,東京都 港区 赤坂駅 徒歩2分,月給23万円～27万円,6日前,株式会社Trys
株式会社エコ・グローバル,稼ぎたい方、必見です! 1件最大50万円の歩合あり 営業,東京都 板橋区,月給25万円～,6日前,リクナビNEXT
アントラス株式会社,既存顧客や大手SI企業との安定取引 営業,東京都 渋谷区 渋谷駅 徒歩7分,月給23万円～35万円,公開していません,マイナビ転職
株式会社紀伊國屋書店,営業／紀伊國屋書店 正社員中途採用,東京都 目黒区,"月給21万6,000円～",5日前,株式会社紀伊國屋書店
株式会社スマートエナジー,再生可能エネルギーの顧客満足を推進する 提案営業,東京都 中央区 京橋駅 徒歩3分,"月給22万8,800円～50万3,350円",12日前,マイナビ転職
ハイトスコーポレーション株式会社,京橋／営業所長候補 テラスハウス型賃貸住宅の企画提案営業,東京都,月給25万円～35万円,5日前,マイナビ転職エージェントサーチ
ヒューマンデジタルコンサルタンツ株式会社,ITコンサル営業 DXブームを追い風に組織拡大中／マネージャ...,東京都 新宿区 新宿御苑前駅,月給40万円～,7日前,en ミドルの転職
株式会社アースリボーン,独占販売 スマートウォッチ・アパレルブランドの卸売り営業,東京都 台東区 浅草橋駅 徒歩5分,月給28万円～38万円,26日前,リクナビNEXT
株式会社ウェブイット,企画営業,東京都 港区 赤坂駅 徒歩1分,月給28万円,5日前,リクナビNEXT
株式会社バンタン,生徒募集・営業マネージャー候補,東京都 渋谷区 代官山駅,公開していません,5日前,クリーデンス
株式会社グリップインターナショナル,営業職,東京都 渋谷区 恵比寿駅,公開していません,9日前,クリーデンス
株式会社レスターコミュニケーションズ,法人ソリューション営業 東証一部上場G,東京都 品川区,年収400万円～650万円,1日前,パソナキャリア
株式会社プルーセル,営業コンサルタント 幹部候補／インセンティブ有／リモート可／...,東京都 千代田区 大手町駅,年収400万円～800万円,5日前,doda
NSENSE株式会社,完全週休2日制&残業少なめ 映像認識技術の代理店・企画営業,東京都 港区 田町駅 徒歩9分,月給30万円～45万円,8日前,リクナビNEXT
株式会社リョウゼン,完全反響営業 リユース品の法人営業,東京都 品川区 大井競馬場前駅 徒歩2分,月給25万円～,8時間前,リクナビNEXT
株式会社コンフィデンス,営業コンサルティング／マネージャー候補,東京都 港区 赤坂見附駅 徒歩3分,年収564万円,24日前,日経転職版
高蔵建設株式会社,価値観を大切にする会社 改修工事の法人営業 未経験歓迎,東京都 新宿区 新宿駅 徒歩5分,月給28万円～,19日前,リクナビNEXT
株式会社ドゥ・ハウス,営業 東京／未経験OK／フレックス・リモート可／賞与年2回／...,東京都 港区,年収330万円～400万円,1日前,マイナビ転職エージェントサーチ
株式会社アルク,長期インターン 法人営業を0から学び、どの業界でも活躍できる...,東京都,"時給1,050円～",12日前,株式会社アルク
PayPay株式会社,営業戦略策定担当,東京都 港区 神谷町駅 徒歩4分,年収504万円～702万円,6日前,U29JOB
株式会社ウエディングパーク,web広告営業 2022年4月~5月入社,東京都,月給30万円～50万円,7日前,株式会社ウエディングパーク
株式会社アイフィスジャパン,ソリューション営業,東京都 千代田区,年収400万円～500万円,1時間前,ELITE Network.
エスパークマネジメント株式会社,研修充実の提案型営業企画 月給25万以上! 賞与年2回,東京都 渋谷区,月給25万円～,11日前,リクナビNEXT
株式会社日本HP,営業企画,東京都,年収600万円～900万円,8日前,日経転職版
京立電機株式会社,営業職,東京都 世田谷区 喜多見駅 徒歩10分,年収350万円～500万円,6時間前,U29JOB
株式会社博伸社,営業職 未経験者歓迎 飛び込み・ノルマなし 月給30万～,東京都 江東区 潮見駅 徒歩5分,月給30万円～,4日前,リクナビNEXT
NSSマーケティング株式会社,ソリューション営業 年収1200万円以上可能／上限なしのイン...,東京都 新宿区 西新宿駅 徒歩3分,月給24万円～,6日前,エン転職
小峰無線電機株式会社,未経験歓迎!高周波同軸コネクタなど電子部品の営業 女性活躍中,東京都 品川区,"月給19万9,000円～22万8,400円",8時間前,リクナビNEXT
株式会社平成建設,土地活用・建築営業,東京都 日野市,"月給25万5,000円～45万円",5日前,宅建Job
HITOWAフードサービス株式会社,給食サービスの法人営業 福利厚生充実 業界未経験歓迎,東京都 港区 六本木一丁目駅,月給27万円～35万円,13日前,マイナビ転職
KDDIまとめてオフィス株式会社,マーケティング 営業生産性向上に向けたデータ分析／ノー残業日...,東京都 新宿区 新宿駅 徒歩9分,"月給28万3,500円～",6日前,エン転職
株式会社コクエー,営業所での労務管理・工事現場管理,東京都 多摩市,月給27万円～35万円,2日前,リクナビNEXT
医療法人向けコンサルティング会社,病院向けコスト削減コンサルティング営業,東京都,年収400万円～700万円,3時間前,ELITE Network.
Parcel Pro Limited,国際物流コンサル・営業 世界最大級,東京都 港区 田町駅 徒歩10分,"月給31万3,000円～",21日前,リクナビNEXT
小林香料株式会社,法人営業,東京都 中央区 新日本橋駅 徒歩3分,"月給21万3,000円～",20時間前,エン転職
株式会社Surpass,営業職,東京都 品川区,年収312万円～330万円,1日前,マイナビ転職エージェントサーチ
株式会社奥田,月給26万以上!既存顧客中心!機能性フィルムなどの法人営業,東京都 台東区 浅草橋駅 徒歩5分,"月給26万7,220円～28万4,820円",8時間前,リクナビNEXT
Saratoga agency株式会社,未経験歓迎 月給30万円~ 反響営業 インセン充実 土日祝休,東京都 品川区 五反田駅 徒歩2分,月給30万円～,5日前,マイナビ転職
弁護士法人あまた法律事務所,転勤なし・年休126日 営業経験が活きる／営業事務・士業補助,東京都 文京区 本郷三丁目駅 徒歩1分,月給23万円～30万円,7日前,リクナビNEXT
株式会社サイバーパワー・ジャパン,反響営業 月給30万円‾／残業なし／年間休日120日,東京都 千代田区 飯田橋駅 徒歩5分,月給30万円～40万円,7日前,リクナビNEXT
グッドアース株式会社,北関東勤務!人気商材の提案営業 年休120日以上 土日祝休,東京都,月給23万円～,8時間前,リクナビNEXT
株式会社ベストラスト,不動産営業,東京都 千代田区 永田町駅,月給26万円～50万円,8日前,株式会社ベストラスト
株式会社USEN-NEXT HOLDINGS,自社SaaSサービスの新規提案営業,東京都,年収400万円～550万円,6日前,Spring転職エージェント
三國機械工業株式会社,営業部長候補 エンジニアリング機能を持つ老舗プラント機器商社,東京都,年収700万円～900万円,24日前,日経転職版
株式会社フジワラ,心地よい空間を提案する 提案営業 残業月20H・年休115日,東京都 中央区 馬喰横山駅 徒歩2分,"月給23万5,000円～",14日前,リクナビNEXT
渋谷不動産エージェント,高齢者向け住宅の紹介を行う 営業スタッフ 月給30万円,東京都 調布市 調布駅 徒歩1分,月給30万円,2日前,リクナビNEXT
株式会社SMBCヒューマン・キャリア,営業事務派遣,東京都 葛飾区 新小岩駅 徒歩18分,"時給1,600円～",10日前,エン派遣
株式会社レオン都市開発,営業サポート／残業ほぼなし／未経験から25万円スタート／駅か...,東京都 千代田区 有楽町駅 徒歩2分,月給23万円～,5日前,女の転職type
朝日ソーラー株式会社,オープニング募集 企画営業 施工スタッフ,東京都 八王子市 八王子駅 徒歩7分,月給34万円,10日前,はたらいく
株式会社Branding Engineer,SES法人営業,東京都 渋谷区,年収450万円～550万円,4日前,マイナビ転職エージェントサーチ
トリプルアール株式会社,自社製品で環境問題の解決に貢献 技術営業／賞与年2+決算賞与,東京都 足立区 綾瀬駅 徒歩12分,月給26万円～36万円,1日前,リクナビNEXT
株式会社新和製作所,ルート営業,東京都 豊島区 池袋駅 徒歩4分,月給25万円,18日前,株式会社新和製作所
株式会社データ・アプリケーション,営業本部第2営業グループ,東京都 千代田区 東京駅 徒歩4分,年収400万円～650万円,11日前,U29JOB
医療法人社団幸楽会,30代・40代活躍中／新規開拓ナシ／健康診断のルート営業,東京都 新宿区 新宿御苑前駅 徒歩1分,月給27万円～,21日前,リクナビNEXT
株式会社シマクリエイツ,広告・印刷関連の営業／営業企画イベント制作物案件が増加中,東京都 世田谷区 世田谷代田駅 徒歩10分,月給20万円～30万円,7日前,リクナビNEXT
株式会社アドネット,残業なし!石神井公園の広告代理店／反響営業・問い合わせ対応,東京都 練馬区 石神井公園駅,月給22万円～,5日前,リクナビNEXT
株式会社アクトブレーン,大人気アパレルブランドで海外営業事務,東京都 港区 表参道駅,"時給1,700円～1,800円",24日前,エン派遣
東京プロパンガス株式会社,ガス保守点検・営業 国家資格も取得可,東京都 八王子市 京王堀之内駅,"月給19万6,290円～26万9,300円",15日前,リクナビNEXT
株式会社夢テクノロジー,既存法人営業,東京都 千代田区 秋葉原駅 徒歩3分,年収350万円～600万円,9日前,U29JOB
株式会社リヴトラスト,22卒新卒採用営業職,東京都 港区,年収897万円,24日前,日経転職版
KTB株式会社,営業代行,東京都,月給30万円～150万円,15日前,かんたん応募
株式会社メディカル・コンシェルジュ,大手介護施設運営会社の営業事務派遣,東京都 千代田区 御茶ノ水駅 徒歩5分,"時給1,400円～1,600円",10日前,エン派遣
センチュリー21 株式会社ベストハウジング,30代活躍中 ノルマなし&未経験OK! 不動産賃貸仲介営業,東京都 新宿区 神楽坂駅 徒歩3分,月給25万円,13日前,リクナビNEXT
東港印刷株式会社,印刷営業／経験者・未経験者歓迎 完全週休2日制 年休115日,東京都 中央区 八丁堀駅 徒歩2分,月給20万円～50万円,26日前,リクナビNEXT
株式会社ザワード,競争力の高い商材を提案 専門商社の企画営業 年休120日,東京都 文京区 茗荷谷駅 徒歩1分,月給20万円～,14日前,リクナビNEXT
株式会社リクルートカーセンサー,営業企画・営業推進,東京都 台東区,年収500万円～600万円,5日前,リクルートエージェント
株式会社オルテナジー,イニシアチブをとって仕事に取り組む!法人営業・営業企画,東京都 立川市 柴崎体育館駅 徒歩3分,"月給31万3,980円～",7日前,リクナビNEXT
株式会社リブセンス,法人営業,東京都 港区 浜松町駅 徒歩4分,年収500万円～800万円,4日前,U29JOB
村田宝飾株式会社,宝飾品の営業／自分の声が新製品に繋がる事も!ルート営業中心 ...,東京都 台東区 御徒町駅,年収350万円～450万円,2日前,doda
株式会社ジョイフルまるやま,法人営業 店長候補,東京都 渋谷区 明治神宮前駅 徒歩2分,月給26万円～,2日前,とらばーゆ
株式会社プロティア,健康食品・化粧品OEMメーカーを支える企業の営業事務,東京都 渋谷区 渋谷駅 徒歩3分,月給22万円～,1日前,リクナビNEXT
大京警備保障株式会社,20～40歳活躍中!警備業の営業／ルート・内勤・警備サポート,東京都 新宿区 西新宿駅 徒歩5分,月給23万円～,19日前,リクナビNEXT
ゴールドスピアー株式会社,物流不動産の内勤電話営業事務,東京都 港区 表参道駅,月給19万円～,2日前,かんたん応募
株式会社新日本エネックス,次世代エネルギーの営業未経験歓迎 営業の平均年収645万円,東京都 杉並区,月給24万円～50万円,21日前,マイナビ転職
シチズン・システムズ株式会社,ヘルスケア・ウェルネス製品のメーカー営業,東京都 西東京市 田無駅 徒歩8分,"月給24万4,600円～34万9,400円",19日前,リクナビNEXT
東京石油株式会社,業界経験不問!既存取引先を中心に油製品を提案する 法人営業,東京都 千代田区 神保町駅 徒歩5分,"月給23万5,000円～38万円",15日前,リクナビNEXT
グローバルライフ株式会社,営業サポート事務,東京都 墨田区 錦糸町駅 徒歩1分,月給21万円～25万円,4日前,かんたん応募
株式会社カッシーナ・イクスシー,インテリアの住宅向け法人営業・店舗販売／世界的有名ブランド・...,東京都,年収340万円～500万円,10日前,Spring転職エージェント
東洋ワークセキュリティ株式会社,営業担当課長,東京都 新宿区 新宿三丁目駅 徒歩10分,月給30万円～,23日前,東洋ワークセキュリティ株式会社
株式会社GA technologies,賃貸営業,東京都 港区,月給23万円～,5日前,マイナビ転職エージェントサーチ
ティ・オーオー株式会社,総務・営業事務,東京都 中央区 浜町駅 徒歩2分,月給21万円～25万円,2日前,とらばーゆ
株式会社オーヤラックス,法人営業,東京都 千代田区 半蔵門駅 徒歩1分,年収320万円～380万円,1日前,マイナビ転職エージェントサーチ
wimo株式会社,"""あなたの暮らしをより快適に""自転車メーカーの営業土日祝休",東京都 千代田区 秋葉原駅 徒歩3分,月給22万円～35万円,26日前,マイナビ転職
三井共同建設コンサルタント株式会社,建設プロジェクトの営業 月給28万円～ 正社員登用あり,東京都 品川区,月給28万円～60万円,1時間前,マイナビ転職
株式会社プロビジョン,卸営業,東京都 港区 品川駅,公開していません,12日前,クリーデンス
株式会社データワイズ,「営業を科学する」位置情報マーケティングDX SaaS 営業...,東京都 港区 虎ノ門ヒルズ駅,"年収700万円～1,500万円",7日前,en ミドルの転職
株式会社クレアンスメアード,IT営業 企画から運用保守まで一貫フォロー 既存顧客メイン,東京都 千代田区 市ケ谷駅 徒歩5分,月給30万円～60万円,6日前,リクナビNEXT
株式会社ユピテル,ドライブレコーダーのルート営業 土日祝休 年休124日,東京都 港区 品川駅 徒歩6分,月給23万円～,5日前,リクナビNEXT
株式会社シーディアイ,営業職 ～ゴルフ関連設備等の提案型営業～,東京都 中央区,年収600万円～700万円,22時間前,リクルートエージェント
株式会社日本シナプス,業務請負・人材紹介コーディネート及び営業 未経験歓迎,東京都 渋谷区 代々木駅 徒歩5分,月給33万円～,13日前,リクナビNEXT
株式会社アゴラ・ステーション,月給45万円以上!経験を活かし働く:BPO提案営業・コンサル,東京都 台東区,月給45万円～,14日前,リクナビNEXT
日本航空電子工業株式会社,営業職,東京都 渋谷区 渋谷駅 徒歩12分,月給21万円～,2日前,マイナビ転職
株式会社インプレス,自社人気メディアの企画営業 年休120日以上,東京都 千代田区 神保町駅 徒歩1分,年収360万円～550万円,9日前,マイナビ転職
株式会社フーモア,広告営業,東京都 中央区 築地市場駅 徒歩5分,"月給24万5,000円～35万円",10時間前,ファミキャリ！
株式会社MSK,警備サービスの提案営業,東京都 墨田区                                                                                                                                    その他 (8),月給30万円～,2日前,type
国際自動車株式会社,タクシードライバー職～東京23区、武蔵野市、三鷹市を中心に営...,東京都 台東区,年収～525万円,5日前,マイナビ転職エージェントサーチ
名糖産業株式会社,医薬品・化粧品素材の営業 年休124日,東京都 府中市 北府中駅 徒歩10分,"月給21万6,050円～",12日前,マイナビ転職
株式会社RELIEF-紬ホーム,企画提案・営業 経験者応援,東京都 立川市,月給40万円～60万円,2日前,株式会社RELIEF-紬ホーム
野村産業株式会社,総合商社の企画営業 既存顧客の対応が中心! 研修制度充実,東京都 稲城市,"月給22万円～33万5,000円",26日前,リクナビNEXT
CJ Logistics Japan株式会社,外資系物流企業でフォワーディング営業,東京都 港区 新橋駅 徒歩6分,年収450万円～700万円,1日前,マイナビ転職エージェントサーチ
株式会社アイ・ステーション,内勤営業,東京都 文京区,月給25万円,14時間前,JobOffer
プライマル株式会社,縁の下の力持ち集まれ! 営業事務・一般事務 在宅勤務アリ,東京都 新宿区 西新宿駅 徒歩4分,月給26万円～32万円,1日前,リクナビNEXT
SCSK Minoriソリューションズ株式会社,年収400万円以上・豊洲駅より徒歩1分!東証一部上場グループ...,東京都 江東区,年収400万円～700万円,5日前,BABナビ
HMMジャパン株式会社,英語が活かせる!経験者大歓迎 輸出集荷営業・貿易実務,東京都 品川区 天王洲アイル駅 徒歩5分,"月給20万5,000円～40万円",8時間前,リクナビNEXT
株式会社アイビッグ,建設資材専門商社 営業職 年間の3分の1がお休み,東京都 台東区 浅草橋駅 徒歩5分,月給25万円～35万円,1日前,マイナビ転職
株式会社クランユナイツ,法人営業／成長中ベンチャー企業で経営支援業務,東京都 港区 大門駅 徒歩2分,月給25万円～50万円,8時間前,リクナビNEXT
オーラン株式会社,人材業界経験がある人ほど驚く。 営業・人材コーディネーター,東京都 目黒区 中目黒駅 徒歩5分,月給31万円～46万円,8時間前,リクナビNEXT
パナソニック産機システムズ株式会社,営業サポート フレックス勤務OK 年間休日127日 パナソニ...,東京都 墨田区 押上駅 徒歩2分,月給25万円～,13日前,エン転職
株式会社AI,女性／20～30代活躍中 ゼロから始める 不動産営業,東京都 渋谷区 北参道駅 徒歩5分,月給25万円,13日前,リクナビNEXT
