株式会社VISION,転勤なし 平均年収1000万以上 不動産営業／販売,東京都 渋谷区 渋谷駅,"月給28万5,000円",8時間前,リクナビNEXT
株式会社オカコー薬品,医薬品・健康食品・化粧品のルート営業,東京都 国立市 矢川駅 徒歩10分,月給24万円～35万円,11日前,株式会社オカコー薬品
株式会社ウィズ,真面目さや誠実さが評価される 保険のコンサルティング営業,東京都 杉並区 上井草駅,月給33万円～45万円,12日前,リクナビNEXT
BXカネシン株式会社,仙台・東京で募集 提案力が磨ける 建築金物メーカーの企画営業,東京都 葛飾区 新小岩駅 バス10分,"月給22万8,300円～27万6,200円",13日前,リクナビNEXT
株式会社東京出版サービス,ベストセラーの仕掛人 ルート営業 正社員登用あり,東京都 千代田区 水道橋駅 徒歩3分,月給21万円,12日前,リクナビNEXT
オリンピア工業株式会社,営業 環境・熱機器を通じ未来を築く!設立57年目の安定企業,東京都 立川市 立川駅 バス5分,月給22万円～,5日前,リクナビNEXT
株式会社プレコエムユニット,営業マネージャー候補,東京都 江東区 亀戸駅 徒歩8分                                                                                                                                    その他 (6),年収600万円～,1日前,株式会社プレコエムユニット
homula,営業／トレーナー／セールス・営業,東京都,年収360万円～600万円,14日前,FashionHR
株式会社ストアーズ社,未経験歓迎 イチから学べる 営業・企画・編集,東京都 中央区 東銀座駅 徒歩5分,月給22万円～,4日前,リクナビNEXT
株式会社マルチョウ,世界に誇れる日本の服づくりを一緒にしませんか? 企画営業,東京都 墨田区,月給28万円～35万円,5日前,リクナビNEXT
株式会社ベルシステム24スタボ採用センター,高時給で安定収入 服装自由!営業サポート,東京都 世田谷区 三軒茶屋駅 徒歩10分,"時給1,600円",17時間前,タウンワーク
大同電工株式会社,完全週休2日 &残業月約10h 仮設電源設備の営業,東京都 港区,月給25万円～40万円,8時間前,リクナビNEXT
マイシステム株式会社,不動産仲介営業,東京都 新宿区 新宿御苑前駅 徒歩1分,月給23万円～48万円,2日前,かんたん応募
株式会社キャセリーニ,卸営業／Casselini／CONTROL FREAK／LE...,東京都,年収250万円～400万円,3日前,フォーピープル
株式会社ウノトレーディング,食肉総合商社のルート営業 月給25万円以上 週休2日制,東京都 大田区 流通センター駅 徒歩1分,"月給25万6,000円～",7日前,マイナビ転職
smile株式会社,抗菌コーティング剤の営業及び施工スタッフ,東京都,月給20万円～,3日前,はたらいく
アルプス薬品工業株式会社,原薬メーカーの海外営業 年間休日123日,東京都 中央区 東日本橋駅 徒歩2分,"月給25万8,700円～30万9,800円",12日前,マイナビ転職
株式会社MOD,配属先選択OK 家電買取・販売・広告営業・ECサイト法人営業,東京都 港区 麻布十番駅,月給25万円～,8時間前,リクナビNEXT
大雄開発株式会社,一戸建て・マンション・店舗・事務所等の賃貸仲介営業,東京都 江東区 西大島駅 徒歩1分,月給23万円～27万円,6日前,リクナビNEXT
株式会社KINSHA,営業 業界経験不問!ゲーム開発に関われる! 20代活躍中,東京都 新宿区 新宿駅 徒歩10分,月給23万円～,6日前,リクナビNEXT
コスメテックスローランド株式会社,問屋営業,東京都 港区 六本木一丁目駅 徒歩2分,年収281万円～350万円,24日前,日経転職版
西邦工業株式会社,企画営業 自社開発の換気口等を資材商社に提案／9割が既存顧客,東京都 板橋区 東武練馬駅,月給22万円～,21日前,リクナビNEXT
株式会社竹宝商会,「文房具が好き」が仕事になる 法人営業 既存顧客中心,東京都 新宿区 高田馬場駅 徒歩3分,月給19万円～,20日前,リクナビNEXT
株式会社サンエイ企画,電車やバス・駅など交通広告の提案営業 未経験者歓迎,東京都 新宿区 四ツ谷駅 徒歩6分,月給21万円～25万円,9日前,マイナビ転職
写光オフィスパートナーズ株式会社,IT／OA機器のルート営業,東京都 台東区,"月給18万5,000円～",14日前,リクナビNEXT
株式会社リロパートナーズ,一部上場企業グループでのシニア／法人向け不動産営業,東京都 狛江市 狛江駅 徒歩5分,"月給25万1,000円～",2日前,リクナビNEXT
株式会社スミノエ,業界トップクラスのインテリアメーカーでのルート・企画営業,東京都 品川区,"月給20万円～26万1,600円",5日前,リクナビNEXT
中央ヂーゼル有限会社,既存顧客メイン ルート営業 完全週休2日／残業10h以内,東京都 江東区 住吉駅 徒歩10分,月給25万円～40万円,1時間前,マイナビ転職
株式会社平和医用商会,営業事務・経理 土日休の完全週休2日 医療業界で安定性抜群,東京都 文京区,月給20万円～30万円,21日前,リクナビNEXT
前田商事有限会社,若手活躍中 高ニーズ!既存顧客中心の営業 月給28万～,東京都 府中市 府中駅 徒歩6分,月給28万円～35万円,8日前,リクナビNEXT
株式会社日祥商会,企画営業 お風呂好きの先輩営業8名があなたを待ってます,東京都 練馬区 小竹向原駅 徒歩1分,月給19万円～25万円,6日前,リクナビNEXT
キングランメディケア株式会社,医療・福祉施設向けリース製品の営業,東京都 国分寺市,月給22万円～,2日前,リクナビNEXT
株式会社モノーロ,服飾雑貨の営業・商品企画 残業ゼロ 土日祝休み 年休120日,東京都 中央区 馬喰横山駅 徒歩7分,月給22万円～35万円,8日前,リクナビNEXT
サンヨーホームズ株式会社,土地活用・建築営業,東京都 千代田区,"年収400万円～1,000万円",5日前,宅建Job
株式会社CROWN,国内外に展開するインテリアブランドの法人営業 20代活躍中,東京都 港区 外苑前駅 徒歩5分,月給25万円～45万円,8日前,リクナビNEXT
株式会社ブリコラージュ,リテール営業／ブリコラージュ,東京都,"年収300万円～1,000万円",3日前,フォーピープル
基礎地盤コンサルタンツ株式会社,官庁・地方自治体、民間企業への企画営業,東京都 江東区,月給24万円～,2日前,リクナビNEXT
ケイ.イー.シー.株式会社,営業戦略コンサルタント,東京都 豊島区 池袋駅 徒歩10分,年収300万円～600万円,2日前,ケイ.イー.シー.株式会社
一菱製茶株式会社,緑茶やお菓子などのギフト商品を提案するルート営業 ノルマなし,東京都 大田区,"月給23万8,600円～",13日前,リクナビNEXT
株式会社i-Cue,ビジネス動画制作会社で 法人営業／オンライン営業,東京都 千代田区 市ケ谷駅 徒歩5分,年収400万円～,15日前,かんたん応募
株式会社飛馬日本,将来、ロングセラーや次世代ヒット商品を手掛ける 企画営業,東京都 墨田区 両国駅 徒歩5分,月給28万円,6日前,リクナビNEXT
信号電材株式会社,信号機の法人営業 昨年度賞与3.75ヶ月分／交通信号のシェア...,東京都 千代田区 飯田橋駅 徒歩10分,年収350万円～370万円,2日前,エン転職
株式会社アイデム中央営業所,求人業界での企画提案営業,東京都 千代田区 岩本町駅,"月給22万8,410円～28万3,920円",4日前,株式会社アイデム
株式会社アイデム武蔵野営業所,求人業界での企画提案営業,東京都 三鷹市 三鷹駅 徒歩7分,"月給22万8,410円～28万3,920円",4日前,株式会社アイデム
株式会社八海山,お酒の営業 土日祝休み／昨年賞与4.4ヶ月分,東京都 中央区 築地市場駅 徒歩4分,月給27万円～,6日前,エン転職
株式会社アド・イーグル,求人広告の代理店営業 未経験OK 完全週休2日制,東京都 文京区 湯島駅,月給23万円,10日前,はたらいく
株式会社クラス,営業事務,東京都 渋谷区 神泉駅 徒歩8分,"時給1,200円～1,400円",1日前,エン転職
株式会社ROBOT PAYMENT,2021年上場の先進IT企業 自社プロダクト営業,東京都 渋谷区 渋谷駅 徒歩8分,月給30万円～,12日前,リクナビNEXT
エレベーターコミュニケーションズ株式会社,日常の安全を支える保守・メンテナンスの法人営業,東京都 品川区,"月給24万9,900円～30万円",7日前,マイナビ転職
株式会社ジスコ,新しい時代を創る!デジタルサイネージの企画営業,東京都,月給38万円,27日前,リクナビNEXT
株式会社イーエスエス,年休125日 月給25万円超 安心・安全を守る製品の提案営業,東京都 文京区,月給25万円～,12日前,リクナビNEXT
株式会社ビューン,マンガ・雑誌読み放題サービス 代理店営業／企画営業 年休123,東京都 千代田区 小川町駅 徒歩3分,"月給28万5,854円～",1日前,マイナビ転職
兼弥産業株式会社,営業 完休2日 未経験歓迎 直近5年の定着率95%以上,東京都 目黒区,"月給20万6,000円～35万円",公開していません,エン転職
SEMITEC株式会社,営業アシスタント・営業 年間休日123日 在宅勤務有,東京都 墨田区 錦糸町駅 徒歩5分,月給18万円～,20日前,リクナビNEXT
サプティー株式会社,街で掲げられる屋外広告物を扱う 法人営業,東京都 中央区 小伝馬町駅 徒歩4分,"月給26万6,290円～39万4,916円",7日前,リクナビNEXT
株式会社フロムエーワーク,リクルーティングサポーター 法人営業 業界未経験歓迎,東京都 中野区 中野駅 徒歩8分,"月給23万4,406円～",5日前,リクナビNEXT
ログス株式会社,OEM／ODM営業,東京都,年収360万円～800万円,3日前,フォーピープル
プレミアアンチエイジング株式会社,卸営業,東京都 港区 虎ノ門駅,公開していません,9日前,クリーデンス
ベストサービス株式会社,急募／営業／ルート営業・反響営業,東京都 江戸川区,"月給23万円～29万5,000円",12時間前,ベストサービス株式会社
株式会社東新システム,自社開発!市場専用の販売管理システムの営業 働きやすさ,東京都 新宿区 四ツ谷駅 徒歩3分,月給28万円～,20日前,リクナビNEXT
AMBL株式会社,お客様の課題をヒアリング DXで解決 !営業支援派遣,東京都 千代田区 溜池山王駅,"時給2,000円",9日前,エン派遣
株式会社ドマーチェ,企画営業,東京都 渋谷区 原宿駅,公開していません,6時間前,クリーデンス
GMOコマース株式会社,LINE公式アカウントやWeb広告を活用した集客支援サービス...,東京都 渋谷区 渋谷駅 徒歩1分,月給30万円～,6日前,エン転職
株式会社日本広明社,営業未経験大歓迎 広告提案営業／電柱広告メイン 年休125日,東京都 千代田区,"月給23万5,000円～",5日前,リクナビNEXT
株式会社フォルモントホールディングス,未経験から始める法人営業 20～30代活躍中,東京都 青梅市,月給32万円～,13日前,リクナビNEXT
株式会社メディカルユーアンドエイ,病院向け 医療機器営業,東京都,年収350万円～550万円,21日前,Spring転職エージェント
株式会社ユビキタス,豊洲駅直結!在宅メインの営業アシスタント,東京都 江東区 豊洲駅,"時給1,600円",3日前,エン派遣
タキヒヨー株式会社,リテール営業／タキヒヨー,東京都,年収300万円～450万円,3日前,フォーピープル
株式会社朝日メディアネットワーク,各種セールスプロモーションの提案営業,東京都 立川市 立川駅 徒歩5分,"月給29万1,670円",8時間前,リクナビNEXT
株式会社SPRジャパン,人気の「サムライ」ブランドに携わる 化粧品の企画・提案営業,東京都 渋谷区 渋谷駅 徒歩6分,月給25万円～35万円,13日前,リクナビNEXT
株式会社三景,風呂敷や不織布などのルート営業 賞与4ヶ月分 未経験OK,東京都 新宿区 四ツ谷駅 徒歩7分,月給23万500円～28万円,2時間前,マイナビ転職
株式会社タープ不動産情報,不動産営業,東京都 文京区 本郷三丁目駅 徒歩2分,月給26万円～,1日前,リクナビNEXT
マニュライフ生命保険株式会社,ファイナンシャルプランナー／営業 土日休 20～30代活躍中,東京都 渋谷区,月給20万円～100万円,8時間前,リクナビNEXT
ビセラル株式会社,営業アシスタント 充実手当あり／残業月10時間以内／転勤なし,東京都 北区 赤羽駅,"月給18万3,000円～31万5,000円",5日前,エン転職
DCT株式会社,得意な分野を選んでキャリアUP 営業 未経験歓迎 完全週休2日,東京都 文京区 江戸川橋駅 徒歩3分,月給23万円～40万円,6日前,マイナビ転職
株式会社g-wic,企画営業,東京都 渋谷区,月給21万円～40万円,24日前,日経転職版
企業向けランチ弁当 シェ・マルコ,法人向け宅配弁当の新規営業,東京都 杉並区 荻窪駅,月給20万円～,1日前,企業向けランチ弁当 シェ・マルコ
株式会社アミクス,営業・販売 東京のスターティングメンバー募集 未経験歓迎,東京都 中央区,月給25万円～38万円,7日前,リクナビNEXT
株式会社アジアテック,高校英語レベルでOK!アジア諸国への海外営業・貿易事務,東京都 新宿区 高田馬場駅 徒歩5分,月給21万円～30万円,15日前,リクナビNEXT
株式会社デカルジャパン,印刷物の ルート営業 印刷・加工・検査梱包,東京都 八王子市 西八王子駅 徒歩10分,月給19万円～30万円,10日前,はたらいく
株式会社Myアセット,不動産仕入れ・販売営業 あなたの経験を当社で活かしませんか,東京都 中央区 日本橋駅 徒歩1分,月給25万円～50万円,15日前,リクナビNEXT
株式会社スウェーデンハウス,販売経験者活躍中 北欧生まれの注文住宅の営業 完全週休2日,東京都,月給22万円～,5日前,リクナビNEXT
スマートソーラー株式会社,太陽光発電事業の法人営業・代理店営業,東京都 中央区 日本橋駅 徒歩4分,年収400万円～800万円,24日前,日経転職版
ニッポンメンテナンスシステム株式会社,事業拡大の当社にチャンスあり 法人営業職／マネージャー候補,東京都 中央区 八丁堀駅 徒歩1分,月給24万円～,21日前,リクナビNEXT
株式会社不二商会,未経験歓迎 生活に欠かせない専門商社のルート営業,東京都 板橋区 西台駅 徒歩7分,月給26万円～35万円,24日前,マイナビ転職
株式会社鈴木酒販,企画営業,東京都 台東区 三ノ輪駅 徒歩2分,月給27万円,20日前,リクナビNEXT
株式会社アスティ,買取のルート営業,東京都 新宿区 新宿御苑前駅 徒歩5分,月給28万円～,1時間前,イーキャリア
株式会社アドバHRソリューションズ,採用と育成、個と組織のコンサル 企画営業,東京都 新宿区 新宿御苑前駅 徒歩4分,月給28万円,5日前,リクナビNEXT
株式会社レイケン,冷水循環装置などを手掛けるメーカーの営業企画 土日祝休み,東京都 中央区 茅場町駅 徒歩5分,"月給23万6,000円～",23日前,マイナビ転職
株式会社ケミカル同仁,安定ニーズ&将来性 営業経験が存分に活かせます! 企画営業,東京都 港区 大門駅,月給25万円～35万円,21日前,リクナビNEXT
株式会社デュアルタップグロウス,法人営業職,東京都 品川区,年収276万円～400万円,24日前,日経転職版
株式会社エーアイエス,業界のパイオニア&トップクラスの強み! 自社製品の提案営業,東京都 文京区 後楽園駅 徒歩7分,月給26万円～37万円,29日前,マイナビ転職
新和興業株式会社,70年以上の歴史を持つ安定企業 経験不問 営業事務,東京都 文京区 湯島駅 徒歩1分,"月給19万2,000円～19万9,000円",22日前,リクナビNEXT
株式会社ニッセイ,異業種・未経験歓迎! 都内ゼネコンへの提案営業 土日祝休み,東京都 千代田区 秋葉原駅 徒歩1分,月給26万円～42万円,15日前,リクナビNEXT
リスロン株式会社,ケミカル品メーカーの営業職,東京都 板橋区,年収400万円,5日前,リクナビNEXT
株式会社グラティア,リテール営業／グラティア,東京都,"年収300万円～1,000万円",3日前,フォーピープル
株式会社Media Theater,営業職からジョブチェンジ!／デジタルビジネス売上向上・新規事...,東京都 文京区 本郷三丁目駅 徒歩5分,"年収400万円～1,000万円",1時間前,かんたん応募
国際経営株式会社,未経験歓迎 今年創業50年の老舗企業での営業事務スタッフ,東京都 八王子市,"月給20万3,100円～25万6,700円",21日前,リクナビNEXT
株式会社クラフト・ハウス,ファッション雑貨の商品企画営業 今までの経験を生かせます,東京都 渋谷区 代々木駅 徒歩3分,月給25万円～35万円,2日前,マイナビ転職
丸井織物株式会社,新規事業推進リーダー／法人営業、新規事業開発、事業企画,東京都,"年収500万円～1,000万円",8日前,ほくりくFIT転職
株式会社東京海上日動パートナーズTOKIO,法人営業 残業ほぼなし／土日祝休み／年間休日120日／リモー...,東京都 港区 品川駅 徒歩10分,"月給29万1,000円～35万3,000円",6日前,エン転職
株式会社林間,法人営業 営業未経験歓迎／月給35万円～／実働7.5時間／土...,東京都 江戸川区 葛西駅 徒歩14分,月給35万円～,13日前,エン転職
柴屋株式会社,ファッション好き&第二新卒歓迎!テキスタイルの海外営業,東京都 渋谷区,"月給21万7,000円～33万2,000円",1日前,リクナビNEXT
株式会社ジェイシーエス,未経験から始める営業 土日祝休み／昇給チャンスは年2回／新規...,東京都 渋谷区 代々木駅 徒歩2分,月給22万円～,16日前,エン転職
株式会社ラクス,楽楽販売 法人営業,東京都 渋谷区,年収410万円～560万円,10日前,株式会社ラクス
株式会社ネクストビート,法人営業「キズナコネクト」担当,東京都 渋谷区 恵比寿駅 徒歩4分,年収510万円～840万円,2日前,マイナビ転職エージェントサーチ
京橋紙業株式会社,製紙の提案営業 残業月10h程度 賞与昨年実績5.7ヶ月,東京都 中央区 東日本橋駅 徒歩3分,月給21万830円～,1日前,リクナビNEXT
大和ハウスパーキング株式会社,企画営業 注目の駐車場業界で安定成長! 未経験OK,東京都 大田区,月給22万円～40万円,26日前,リクナビNEXT
株式会社ストリームライン,コンサルティング営業 入社時からフルリモートOK フレックス制,東京都 品川区 目黒駅 徒歩8分,年収450万円～800万円,16日前,女の転職type
株式会社クレストリッチ,未経験OK 高額インセン+未来の支店長候補 賃貸仲介営業,東京都 新宿区,月給25万円～,7日前,リクナビNEXT
和泉機械株式会社,建機レンタルの法人向け 営業職 月給25万円～ 転勤なし,東京都 台東区 浅草橋駅 徒歩3分,月給25万円～50万円,6日前,マイナビ転職
株式会社鳳陽社,商品の調達を行う 商社営業 土日祝休み 月給30万円～,東京都 千代田区 東京駅 徒歩1分,月給30万円～40万円,9日前,マイナビ転職
大手通信企業,ドコモ法人営業経験活かす ルート営業 @～2600円 ドコモ...,東京都 千代田区 飯田橋駅,"時給2,400円～",5日前,派遣のお仕事情報|BigAbility
株式会社丸善,未経験者歓迎!お菓子の箱を創るパッケージメーカーの企画営業,東京都 中央区 三越前駅 徒歩3分,"月給24万5,000円～",13日前,リクナビNEXT
株式会社プリンシプル,OEM営業生産,東京都 目黒区 中目黒駅,公開していません,1日前,クリーデンス
株式会社サンリブ,営業,東京都 大田区 武蔵新田駅 徒歩7分,月給25万円～35万円,15日前,ビルメン転職ナビ
株式会社セキュアソフト,セキュリティ営業,東京都 渋谷区 恵比寿駅 徒歩7分,年収400万円～800万円,5日前,女の転職type
株式会社木下抗菌サービス,経験不問!安定環境で働く 抗菌施工の営業・品質監理／施工監理,東京都 新宿区 西新宿駅,月給30万円～38万円,7日前,リクナビNEXT
株式会社ファーストディグリー,法人営業,東京都 品川区 五反田駅 徒歩7分,月給28万円～50万円,20時間前,エン転職
Ruijie Networks Japan株式会社,即戦力採用 営業 成果給実績300万円,東京都 中央区 新日本橋駅 徒歩1分,"年収400万円～1,000万円",4日前,マイナビ転職
鐘通株式会社,法人営業 70年の歴史を持つ老舗商社 手厚い福利厚生&年間休...,東京都 八王子市,月給29万円～31万円,9日前,エン転職
東光電線株式会社,ルート営業 創業70年の歴史と伝統ある会社で活躍 土日祝休,東京都 品川区 旗の台駅 徒歩8分,月給20万円～25万円,19日前,リクナビNEXT
株式会社セゾン保険サービス,コンサルティング営業／クレディセゾングループ／月残業10時間...,東京都 豊島区 東池袋駅 徒歩2分,"月給22万3,550円～",2日前,エン転職
株式会社アンドロード,法人営業,東京都 渋谷区 渋谷駅 徒歩10分,月給22万円～35万円,4日前,エン転職
日本ディクス株式会社,テレワーク週3日 重要顧客へシステム提案営業!時給2000円,東京都 新宿区 西新宿駅 徒歩3分,"時給2,000円～",3日前,エン派遣
サーベイサンプリングジャパン合同会社,英語力を生かす!外資系調査会社の法人営業・営業補助 土日祝休,東京都 中央区 茅場町駅 徒歩3分,月給25万円～50万円,5日前,リクナビNEXT
株式会社相模原木材センター,未経験者歓迎!相模原の安定企業でイチから学べる ルート営業,東京都 町田市 町田駅 車15分,"月給21万6,000円～",2日前,リクナビNEXT
エビス株式会社,自社ブランドの日用品のルート営業 創業120年以上の老舗日用...,東京都,年収470万円～670万円,6日前,Spring転職エージェント
株式会社エイブル,求人広告の企画・提案営業 完全土日祝休で月給24万円以上,東京都 千代田区 神田駅 徒歩2分,"月給18万2,858円",12日前,リクナビNEXT
株式会社遠山鐵工所,土日祝休／残業少なめ／転勤なし 水道インフラ製品のルート営業,東京都 北区 赤羽岩淵駅 徒歩5分,月給20万円～36万円,19日前,リクナビNEXT
株式会社テクノ大西,専門商社のルート営業 土日祝休み 残業月10時間程度,東京都 中央区 小伝馬町駅 徒歩3分,"月給21万4,000円～26万6,300円",14日前,マイナビ転職
株式会社日立システムズパワーサービス,エネルギー企業向けのコンサルティング営業,東京都 港区 浜松町駅 徒歩7分,月給23万円～30万円,6日前,エン転職
社会福祉法人東京リハビリ協会,利用者の活躍できる場を増やすための営業活動,東京都 立川市 立川駅 バス15分,"月給29万円～41万7,300円",8日前,リクナビNEXT
株式会社クラベ,大手企業向けのメーカー営業 設立80年超／未経験から育てる,東京都 大田区,月給21万円～40万円,14日前,リクナビNEXT
株式会社マッコイ,自社ブランド化粧品の営業 月給25万円以上 残業月12時間 ...,東京都 港区 御成門駅 徒歩5分,月給25万円～,6日前,エン転職
株式会社三友建設,既婚率約8割／完全週休2日制土日or水日 営業・営業企画,東京都,月給25万円～,5日前,リクナビNEXT
東罐ロジテック株式会社,未経験歓迎 飛び込みなしのルート営業,東京都 品川区 大崎駅,月給23万円～36万円,14日前,はたらいく
株式会社イノベーター,AI防犯カメラシステムの法人営業,東京都 渋谷区 代々木駅 徒歩2分,月給25万円～40万円,7日前,エン転職
ヨシリツ株式会社,知育玩具「LaQ」の営業 担当エリアへ直行直帰 未経験歓迎,東京都 小金井市,月給20万円～25万円,2日前,リクナビNEXT
マノック工業株式会社,既存顧客への提案営業 ノルマなし 英語を活かせる,東京都 千代田区 御茶ノ水駅 徒歩6分,"月給22万円～27万5,000円",5日前,マイナビ転職
株式会社スカウト,営業 転勤なし 土日祝休み 年間休日120日以上,東京都 新宿区 新宿駅 徒歩5分,"月給23万5,000円～",5日前,リクナビNEXT
